id,building_name,image_url,detail,access,address,created_at,updated_at,fee1,fee2,,,,,,,,,,,,,,,,,,,,,,,,,,,,,,,,,,,,,,,,,,,,,,,,,,,,,,,,,,,,,,,,,,,,,,,,,,,,
2747,宝屋旅館,/yad332171/?stayCount=1&roomCount=1&adultNum=2&stayDay=&stayYear=&stayMonth=&dateUndecided=1&distCd=01&roomCrack=200000&screenId=UWW1402&yadNo=332171&callbackHistFlg=1,答志島は鳥羽から船20分。“素材の美味しさを引き出すために手間暇おしまない”足を運ぶ価値有りの料理宿。活きのイイ魚貝を目の前で焼いて頂く「荒磯焼」は旬の会席＋舟盛りも付いた欲ばり満足なコース。,【アクセス】JR近鉄鳥羽駅から徒歩５分の佐田浜港から鳥羽市営定期船で２０分。和具港下船。,エリア ： 三重県 > 鳥羽,2016-03-28 02:37:08,2016-03-28 02:37:08,"￥11,000〜","（￥5,500〜/人）",,,,,,,,,,,,,,,,,,,,,,,,,,,,,,,,,,,,,,,,,,,,,,,,,,,,,,,,,,,,,,,,,,,,,,,,,,,,
2748,鳥羽国際ホテル　潮路亭,/yad333866/?stayCount=1&roomCount=1&adultNum=2&stayDay=&stayYear=&stayMonth=&dateUndecided=1&distCd=01&roomCrack=200000&screenId=UWW1402&yadNo=333866&callbackHistFlg=1,沁み入るような静寂に包まれた旅館。夕食は伊勢海老・鮑等の新鮮な海の幸を和モダン会席や鉄板焼にしてご用意します。真珠成分配合のパールオーロラ風呂や多種多様の効能がある温泉もあります。神宮まで20分,【アクセス】近鉄（JR)鳥羽駅タクシー３分。ホテルシャトルバス12：30〜18：00迄毎時00分・30分運行。,エリア ： 三重県 > 鳥羽,2016-03-28 02:37:07,2016-03-28 02:37:07,"￥30,000〜","（￥15,000〜/人）",,,,,,,,,,,,,,,,,,,,,,,,,,,,,,,,,,,,,,,,,,,,,,,,,,,,,,,,,,,,,,,,,,,,,,,,,,,,
2749,【風の島　菅島】ニューうず潮,/yad334308/?stayCount=1&roomCount=1&adultNum=2&stayDay=&stayYear=&stayMonth=&dateUndecided=1&distCd=01&roomCrack=200000&screenId=UWW1402&yadNo=334308&callbackHistFlg=1,白い灯台のある小島菅島素朴な海の生業(なりわい)が窓辺に広がる　離島の新鮮そのものの海の幸をぜひゆっくり堪能して！,【アクセス】伊勢二見鳥羽ライン〜鳥羽駅前佐田浜港から鳥羽市営定期船で〜菅島下船(13分),エリア ： 三重県 > 鳥羽,2016-03-28 02:37:08,2016-03-28 02:37:08,"￥20,000〜","（￥10,000〜/人）",,,,,,,,,,,,,,,,,,,,,,,,,,,,,,,,,,,,,,,,,,,,,,,,,,,,,,,,,,,,,,,,,,,,,,,,,,,,
2750,ペンション　ドルフィン,/yad334402/?stayCount=1&roomCount=1&adultNum=2&stayDay=&stayYear=&stayMonth=&dateUndecided=1&distCd=01&roomCrack=200000&screenId=UWW1402&yadNo=334402&callbackHistFlg=1,穏やかな鳥羽湾を眺望できるダイニングで、パン教室も開催するオーナーが毎日焼く、手作りパンの朝食が好評です。blog、twitter、FBに情報あります。,【アクセス】ＪＲ/近鉄鳥羽駅より車で８分・バスで２０分,エリア ： 三重県 > 鳥羽,2016-03-28 02:37:08,2016-03-28 02:37:08,"￥11,111〜","（￥5,555〜/人）",,,,,,,,,,,,,,,,,,,,,,,,,,,,,,,,,,,,,,,,,,,,,,,,,,,,,,,,,,,,,,,,,,,,,,,,,,,,
2751,湯快リゾート　温泉リゾートホテル　鳥羽彩朝楽,/yad335278/?stayCount=1&roomCount=1&adultNum=2&stayDay=&stayYear=&stayMonth=&dateUndecided=1&distCd=01&roomCrack=200000&screenId=UWW1402&yadNo=335278&callbackHistFlg=1,西方にはパワースポット「伊勢神宮」、東方に望む海岸はリアス式海岸、さまざまなマリンリゾートが楽しめます。飼育種類数日本一を誇る「鳥羽水族館」へも好アクセス、思い思いの旅をお楽しみ下さい！,【アクセス】近鉄鳥羽駅から車で約5分,エリア ： 三重県 > 鳥羽,2016-03-28 02:37:08,2016-03-28 02:37:08,"￥12,592〜","（￥6,296〜/人）",,,,,,,,,,,,,,,,,,,,,,,,,,,,,,,,,,,,,,,,,,,,,,,,,,,,,,,,,,,,,,,,,,,,,,,,,,,,
2752,浜辺の温泉宿　かめや,/yad336942/?stayCount=1&roomCount=1&adultNum=2&stayDay=&stayYear=&stayMonth=&dateUndecided=1&distCd=01&roomCrack=200000&screenId=UWW1402&yadNo=336942&callbackHistFlg=1,鳥羽・伊勢志摩が誇る新鮮な魚介類や松阪牛が味わえる料理口コミ４･８のお宿!目の前には安楽島海水浴場！海から昇る朝日は神秘的で絶景！伊勢神宮まで車で30分☆アットホームな田舎の温泉宿(^O^)／,【アクセス】近鉄、JR鳥羽駅より約５ｋお車で10分。送迎あり（要問い）,エリア ： 三重県 > 鳥羽,2016-03-28 02:37:08,2016-03-28 02:37:08,"￥12,000〜","（￥6,000〜/人）",,,,,,,,,,,,,,,,,,,,,,,,,,,,,,,,,,,,,,,,,,,,,,,,,,,,,,,,,,,,,,,,,,,,,,,,,,,,
2753,吉田屋　和光,/yad337583/?stayCount=1&roomCount=1&adultNum=2&stayDay=&stayYear=&stayMonth=&dateUndecided=1&distCd=01&roomCrack=200000&screenId=UWW1402&yadNo=337583&callbackHistFlg=1,鳥羽駅より徒歩5分の高台に建つ老舗旅館！和造の落ち着いた雰囲気の宿。鳥羽の観光はもちろん伊勢志摩の旅の足場にもぴったり。リーズナブルに利用できる素泊まり専門のお宿です。,【アクセス】鳥羽駅（ＪＲ側）徒歩5分　伊勢自動車道伊勢西Ｉ.Ｃより約20分,エリア ： 三重県 > 鳥羽,2016-03-28 02:37:08,2016-03-28 02:37:08,"￥8,000〜","（￥4,000〜/人）",,,,,,,,,,,,,,,,,,,,,,,,,,,,,,,,,,,,,,,,,,,,,,,,,,,,,,,,,,,,,,,,,,,,,,,,,,,,
2754,ホテル　アルティア鳥羽,/yad338206/?stayCount=1&roomCount=1&adultNum=2&stayDay=&stayYear=&stayMonth=&dateUndecided=1&distCd=01&roomCrack=200000&screenId=UWW1402&yadNo=338206&callbackHistFlg=1,紺碧の海を見下ろす高台にある、お洒落なリゾートホテル。本格エステも体験でき、優雅な気分に浸れる。鳥羽湾の島々を見下ろしながら温泉でゆったり、お肌もすべすべ。新鮮な海の幸もたっぷり楽しんで！,【アクセス】鳥羽駅から車で約１０分,エリア ： 三重県 > 鳥羽,2016-03-28 02:37:07,2016-03-28 02:37:07,"￥15,000〜","（￥7,500〜/人）",,,,,,,,,,,,,,,,,,,,,,,,,,,,,,,,,,,,,,,,,,,,,,,,,,,,,,,,,,,,,,,,,,,,,,,,,,,,
2755,【風の島　菅島】船で行く旅の宿　別館まつむら,/yad340148/?stayCount=1&roomCount=1&adultNum=2&stayDay=&stayYear=&stayMonth=&dateUndecided=1&distCd=01&roomCrack=200000&screenId=UWW1402&yadNo=340148&callbackHistFlg=1,"海を渡りどこか懐かしい風景に出会える。釣りに,夏は海水浴と島の大自然を体験でき宿では我が家のようにゆったりと。料理は≪街のお店では味わえない≫菅島の海幸をメインにした海鮮料理がいただけます。",【アクセス】伊勢IC〜伊勢二見鳥羽ライン〜鳥羽:佐田浜港から市営定期船で１３分〜菅島(片道大５００円小２５０円),エリア ： 三重県 > 鳥羽,2016-03-28 02:37:08,2016-03-28 02:37:08,"￥18,518〜","（￥9,259〜/人）",,,,,,,,,,,,,,,,,,,,,,,,,,,,,,,,,,,,,,,,,,,,,,,,,,,,,,,,,,,,,,,,,,,,,,,,,,,,
2756,海上料亭　海楽園,/yad341780/?stayCount=1&roomCount=1&adultNum=2&stayDay=&stayYear=&stayMonth=&dateUndecided=1&distCd=01&roomCrack=200000&screenId=UWW1402&yadNo=341780&callbackHistFlg=1,海上にせりだして建ち、窓を開ければ心地よい波音と景勝三ツ島が目の前！１階客室では釣りも楽しめるよ。海水温泉は貸切もＯＫ！夕食はお部屋でゆっくり伊勢志摩産の魚介類を堪能♪,【アクセス】近鉄鳥羽駅よりタクシー５分。１５時以降送迎あり。,エリア ： 三重県 > 鳥羽,2016-03-28 02:37:07,2016-03-28 02:37:07,"￥20,000〜","（￥10,000〜/人）",,,,,,,,,,,,,,,,,,,,,,,,,,,,,,,,,,,,,,,,,,,,,,,,,,,,,,,,,,,,,,,,,,,,,,,,,,,,
2757,味覚の宿　定洋(ていよう),/yad344107/?stayCount=1&roomCount=1&adultNum=2&stayDay=&stayYear=&stayMonth=&dateUndecided=1&distCd=01&roomCrack=200000&screenId=UWW1402&yadNo=344107&callbackHistFlg=1,海に生きる男のロマンを秘めた答志島。【朝夕お部屋食】で女性グループやカップルにも好評です★地元で浜揚げされた伊勢えび、鯛、アワビなど、鮮度抜群の天然素材にこだわりをもつ料理自慢の宿,【アクセス】伊勢道伊勢IC〜伊勢二見鳥羽ライン〜鳥羽駅前佐田浜港から鳥羽市営定期船で〜和具港下船(20分),エリア ： 三重県 > 鳥羽,2016-03-28 02:37:08,2016-03-28 02:37:08,"￥14,000〜","（￥7,000〜/人）",,,,,,,,,,,,,,,,,,,,,,,,,,,,,,,,,,,,,,,,,,,,,,,,,,,,,,,,,,,,,,,,,,,,,,,,,,,,
2758,波音の宿　中村屋,/yad346259/?stayCount=1&roomCount=1&adultNum=2&stayDay=&stayYear=&stayMonth=&dateUndecided=1&distCd=01&roomCrack=200000&screenId=UWW1402&yadNo=346259&callbackHistFlg=1,【伊勢志摩の台所☆答志島】中村屋だから食べられる新鮮魚介♪もちろん嬉しい全室オーシャンビュー♪☆大好評☆島内バスツアーでは答志島の歴史・生活・風習などをガイドさせていただきます。,【アクセス】伊勢道伊勢IC〜伊勢二見鳥羽ライン〜鳥羽駅前佐田浜港から鳥羽市営定期船で〜和具港下船(20分),エリア ： 三重県 > 鳥羽,2016-03-28 02:37:08,2016-03-28 02:37:08,"￥24,000〜","（￥12,000〜/人）",,,,,,,,,,,,,,,,,,,,,,,,,,,,,,,,,,,,,,,,,,,,,,,,,,,,,,,,,,,,,,,,,,,,,,,,,,,,
2759,鳥羽小浜温泉　ホテル浜離宮,/yad353538/?stayCount=1&roomCount=1&adultNum=2&stayDay=&stayYear=&stayMonth=&dateUndecided=1&distCd=01&roomCrack=200000&screenId=UWW1402&yadNo=353538&callbackHistFlg=1,オーシャンビューとはまさにこのこと！鳥羽・小浜湾の海上に浮かぶように建つ温泉宿。伊勢志摩でももっとも高温の療養高温泉は自家源泉で露天風呂・貸切露天風呂・大浴場で楽しめます。,【アクセス】電車：近鉄・ＪＲ鳥羽駅より徒歩６分　車：伊勢ＩＣより伊勢二見鳥羽ライン経由約１０分,エリア ： 三重県 > 鳥羽,2016-03-28 02:37:08,2016-03-28 02:37:08,"￥14,814〜","（￥7,407〜/人）",,,,,,,,,,,,,,,,,,,,,,,,,,,,,,,,,,,,,,,,,,,,,,,,,,,,,,,,,,,,,,,,,,,,,,,,,,,,
2760,日常から少し遠くへ・・　懐古ロマンの宿　季さら,/yad359266/?stayCount=1&roomCount=1&adultNum=2&stayDay=&stayYear=&stayMonth=&dateUndecided=1&distCd=01&roomCrack=200000&screenId=UWW1402&yadNo=359266&callbackHistFlg=1,2012年4月17日別邸オープン！伊勢神宮参拝と、おかげ横丁散策に便利な鳥羽の温泉旅館です。赤ちゃん、女性に優しい露天風呂付き離れのお宿。大正ロマン調の和モダンなしつらえと空間をお楽しみ下さい,【アクセス】JR・近鉄鳥羽駅から車約６分,エリア ： 三重県 > 鳥羽,2016-03-28 02:37:08,2016-03-28 02:37:08,"￥58,666〜","（￥29,332〜/人）",,,,,,,,,,,,,,,,,,,,,,,,,,,,,,,,,,,,,,,,,,,,,,,,,,,,,,,,,,,,,,,,,,,,,,,,,,,,
2761,潮風の宿　やま七,/yad359721/?stayCount=1&roomCount=1&adultNum=2&stayDay=&stayYear=&stayMonth=&dateUndecided=1&distCd=01&roomCrack=200000&screenId=UWW1402&yadNo=359721&callbackHistFlg=1,海の見える露天風呂と新鮮海の幸がお出迎え♪★海ほたる★迷路のような路地★今が旬のカキ★食べて遊んで一日島人、島の案内人の旦那＆女将が案内するプチガイドプランが人気♪島の温もりに触れる旅。,【アクセス】伊勢道伊勢IC〜伊勢二見鳥羽ライン〜鳥羽駅前佐田浜港から鳥羽市営定期船で〜和具港下船(20分),エリア ： 三重県 > 鳥羽,2016-03-28 02:37:08,2016-03-28 02:37:08,"￥10,000〜","（￥5,000〜/人）",,,,,,,,,,,,,,,,,,,,,,,,,,,,,,,,,,,,,,,,,,,,,,,,,,,,,,,,,,,,,,,,,,,,,,,,,,,,
2762,鳥羽の宿　錦屋旅館,/yad390152/?stayCount=1&roomCount=1&adultNum=2&stayDay=&stayYear=&stayMonth=&dateUndecided=1&distCd=01&roomCrack=200000&screenId=UWW1402&yadNo=390152&callbackHistFlg=1,便利な立地♪近鉄・中之郷駅−徒歩1分。鳥羽水族館−徒歩2分。フェリー乗り場−徒歩3分。ミキモト真珠島−徒歩10分。◎チェックイン前・チェックアウト後の【荷物預かり】【駐車場利用】もOK！,【アクセス】近鉄・中之郷駅徒歩1分,エリア ： 三重県 > 鳥羽,2016-03-28 02:37:08,2016-03-28 02:37:08,"￥10,000〜","（￥5,000〜/人）",,,,,,,,,,,,,,,,,,,,,,,,,,,,,,,,,,,,,,,,,,,,,,,,,,,,,,,,,,,,,,,,,,,,,,,,,,,,
2763,海の幸とやすらぎの宿　海月,/yad390521/?stayCount=1&roomCount=1&adultNum=2&stayDay=&stayYear=&stayMonth=&dateUndecided=1&distCd=01&roomCrack=200000&screenId=UWW1402&yadNo=390521&callbackHistFlg=1,伊勢志摩の「春」「夏」「秋」「冬」の素材にこだわったお料理が自慢の老舗宿。この宿のあのお料理が食べたいと集うリピーターも多い。自然や海女の精神文化を楽しめるオプションツアーも豊富にそろう。,【アクセス】ＪＲ・近鉄鳥羽駅下車、南口徒歩５分,エリア ： 三重県 > 鳥羽,2016-03-28 02:37:08,2016-03-28 02:37:08,"￥11,111〜","（￥5,555〜/人）",,,,,,,,,,,,,,,,,,,,,,,,,,,,,,,,,,,,,,,,,,,,,,,,,,,,,,,,,,,,,,,,,,,,,,,,,,,,
2764,胡蝶蘭,/yad393660/?stayCount=1&roomCount=1&adultNum=2&stayDay=&stayYear=&stayMonth=&dateUndecided=1&distCd=01&roomCrack=200000&screenId=UWW1402&yadNo=393660&callbackHistFlg=1,「四季の海景が美しい」スペシャルプラン・目玉企画・早割２０・鳥羽の日・お肉の日・宿泊日5/5〜6/30まで伊勢志摩サミット大感謝祭が始まりお得企画が目白押し。鳥羽駅〜車で５分・伊勢神宮まで車で２５分,【アクセス】ＪＲ・近鉄鳥羽駅よりお車で５分（送迎は事前予約要）伊勢IC〜伊勢二見鳥羽ライン経由で２５分。,エリア ： 三重県 > 鳥羽,2016-03-28 02:37:08,2016-03-28 02:37:08,"￥14,000〜","（￥7,000〜/人）",,,,,,,,,,,,,,,,,,,,,,,,,,,,,,,,,,,,,,,,,,,,,,,,,,,,,,,,,,,,,,,,,,,,,,,,,,,,
2765,山幸園 やまこうえん,/yad395515/?stayCount=1&roomCount=1&adultNum=2&stayDay=&stayYear=&stayMonth=&dateUndecided=1&distCd=01&roomCrack=200000&screenId=UWW1402&yadNo=395515&callbackHistFlg=1,四季折々の海の幸が揚がる答志島。新鮮な素材を惜しげもなくたっぷりといただける豪華舟盛は圧巻。海の幸が波も穏やか、海水を使ったプールもあるサンシャインビーチが目の前で、海水浴にも便利。,【アクセス】伊勢自動車道伊勢IC〜伊勢二見鳥羽ライン〜鳥羽駅前佐田浜港第一駐車場市営定期船〜答志和具港（20分）,エリア ： 三重県 > 鳥羽,2016-03-28 02:37:08,2016-03-28 02:37:08,"￥6,296〜","（￥3,148〜/人）",,,,,,,,,,,,,,,,,,,,,,,,,,,,,,,,,,,,,,,,,,,,,,,,,,,,,,,,,,,,,,,,,,,,,,,,,,,,
2766,ウィスタリアンライフクラブ鳥羽,/yad399576/?stayCount=1&roomCount=1&adultNum=2&stayDay=&stayYear=&stayMonth=&dateUndecided=1&distCd=01&roomCrack=200000&screenId=UWW1402&yadNo=399576&callbackHistFlg=1,真珠のふるさと鳥羽は、伊勢・志摩国立公園の中枢、その美しい風光と温暖な気候に恵まれ、緑と海にかこまれたシーサイドリゾートホテルです。,【アクセス】JR参宮線・近鉄鳥羽線鳥羽駅より、タクシー約１２分,エリア ： 三重県 > 鳥羽,2016-03-28 02:37:08,2016-03-28 02:37:08,"￥7,870〜","（￥3,935〜/人）",,,,,,,,,,,,,,,,,,,,,,,,,,,,,,,,,,,,,,,,,,,,,,,,,,,,,,,,,,,,,,,,,,,,,,,,,,,,
2767,サンビーチ鳥羽,/yad399969/?stayCount=1&roomCount=1&adultNum=2&stayDay=&stayYear=&stayMonth=&dateUndecided=1&distCd=01&roomCrack=200000&screenId=UWW1402&yadNo=399969&callbackHistFlg=1,当館は一面に広がる海と緑に囲まれた心安らぐ旅館です。日本初のpH12強アルカリ性ミネラル風呂プライベートビーチ。当館には専用桟橋がございますので、自家用船でお越し頂く事も可能です。,【アクセス】鳥羽より自家用船で約１０分,エリア ： 三重県 > 鳥羽,2016-03-28 02:37:08,2016-03-28 02:37:08,"￥12,037〜","（￥6,018〜/人）",,,,,,,,,,,,,,,,,,,,,,,,,,,,,,,,,,,,,,,,,,,,,,,,,,,,,,,,,,,,,,,,,,,,,,,,,,,,
2768,津都ホテル,/yad309994/?stayCount=1&roomCount=1&adultNum=2&stayDay=&stayYear=&stayMonth=&dateUndecided=1&distCd=01&roomCrack=200000&screenId=UWW1402&yadNo=309994&callbackHistFlg=1,県中心部に位置。大阪、名古屋にも便利な距離で、ビジネスはもちろん伊勢神宮を始め、県内外観光地への拠点としても最適です！津の文化や歴史に触れる津城跡、観音寺、偕楽公園と県立美術館めぐりにも好立地,【アクセス】ＪＲ、近鉄津駅東口下車、路線バスで10分三重会館前停留所下車、徒歩1分。国道23号線沿い,エリア ： 三重県 > 津,2016-03-28 02:37:07,2016-03-28 02:37:07,"￥7,962〜","（￥3,981〜/人）",,,,,,,,,,,,,,,,,,,,,,,,,,,,,,,,,,,,,,,,,,,,,,,,,,,,,,,,,,,,,,,,,,,,,,,,,,,,
2769,ホテルキャッスルイン津,/yad317369/?stayCount=1&roomCount=1&adultNum=2&stayDay=&stayYear=&stayMonth=&dateUndecided=1&distCd=01&roomCrack=200000&screenId=UWW1402&yadNo=317369&callbackHistFlg=1,セントレアへの海上アクセス港も目のまえ。ビジネスにレジャーに絶好のロケーション。,【アクセス】近鉄・ＪＲ　津駅よりバスで１５分,エリア ： 三重県 > 津,2016-03-28 02:37:07,2016-03-28 02:37:07,"￥6,481〜","（￥3,240〜/人）",,,,,,,,,,,,,,,,,,,,,,,,,,,,,,,,,,,,,,,,,,,,,,,,,,,,,,,,,,,,,,,,,,,,,,,,,,,,
2770,ホテル　ザ・グランコート津西,/yad321692/?stayCount=1&roomCount=1&adultNum=2&stayDay=&stayYear=&stayMonth=&dateUndecided=1&distCd=01&roomCrack=200000&screenId=UWW1402&yadNo=321692&callbackHistFlg=1,津駅西口から徒歩５分の好立地！特別な時間を彩る上質の空間。１Ｆにcafeを併設！コインランドリーや多目的室（１時間２５００円）もございます。,【アクセス】ＪＲ・近鉄　津駅西口より徒歩約５分／伊勢自動車道　津ＩＣよりお車で約１０分,エリア ： 三重県 > 津,2016-03-28 02:37:07,2016-03-28 02:37:07,"￥6,666〜","（￥3,333〜/人）",,,,,,,,,,,,,,,,,,,,,,,,,,,,,,,,,,,,,,,,,,,,,,,,,,,,,,,,,,,,,,,,,,,,,,,,,,,,
2771,磨洞温泉　涼風荘,/yad330930/?stayCount=1&roomCount=1&adultNum=2&stayDay=&stayYear=&stayMonth=&dateUndecided=1&distCd=01&roomCrack=200000&screenId=UWW1402&yadNo=330930&callbackHistFlg=1,江戸時代より磨き砂産地で有名な半田。今はその洞窟に座敷を設け、伊勢湾の幸、名産松阪肉等、地物を楽しめる。青山高原の恵みたっぷりのでつるつる温泉でお肌美人の湯。珍しさから有名人も多い。,【アクセス】最寄駅より送迎バスあります(要予約)送迎はPM15:00〜PM20:00当日駅より電話下さい時間外はタクシー１０分,エリア ： 三重県 > 津,2016-03-28 02:37:07,2016-03-28 02:37:07,"￥12,400〜","（￥6,200〜/人）",,,,,,,,,,,,,,,,,,,,,,,,,,,,,,,,,,,,,,,,,,,,,,,,,,,,,,,,,,,,,,,,,,,,,,,,,,,,
2772,ホテルグリーンパーク津,/yad358764/?stayCount=1&roomCount=1&adultNum=2&stayDay=&stayYear=&stayMonth=&dateUndecided=1&distCd=01&roomCrack=200000&screenId=UWW1402&yadNo=358764&callbackHistFlg=1,海側ルームには、快眠をサポートするシモンズベッド設置。家族向けコンセプトルーム゜つ・な・ぐ゜は、ミキハウス子育て総研の「ウェルカムベビーの宿」の認定を取得♪出張にも家族旅行にも最適なホテル！,【アクセス】ＪＲ・近鉄「津駅」東出口より徒歩１分。アスト津ビル１階にフロント。津ＩＣより車で約１５分。,エリア ： 三重県 > 津,2016-03-28 02:37:07,2016-03-28 02:37:07,"￥7,407〜","（￥3,703〜/人）",,,,,,,,,,,,,,,,,,,,,,,,,,,,,,,,,,,,,,,,,,,,,,,,,,,,,,,,,,,,,,,,,,,,,,,,,,,,
2773,ビジネスホテル三徳,/yad384895/?stayCount=1&roomCount=1&adultNum=2&stayDay=&stayYear=&stayMonth=&dateUndecided=1&distCd=01&roomCrack=200000&screenId=UWW1402&yadNo=384895&callbackHistFlg=1,【２０１５年１２月★エアコン＆内装を新調】国道２３号線沿い。近鉄/JR津駅から徒歩８分。お車なら鈴鹿まで３０分、四日市・伊勢まで６０分。ホテル裏手に平面駐車場があります（普通車無料！大型車ＯＫ）,【アクセス】近鉄・JR「津」駅より徒歩約８分。伊勢自動車道「津IC」よりお車で約15分。,エリア ： 三重県 > 津,2016-03-28 02:37:07,2016-03-28 02:37:07,"￥5,925〜","（￥2,962〜/人）",,,,,,,,,,,,,,,,,,,,,,,,,,,,,,,,,,,,,,,,,,,,,,,,,,,,,,,,,,,,,,,,,,,,,,,,,,,,
2774,天然温泉　けやきの湯　ドーミーイン津,/yad390063/?stayCount=1&roomCount=1&adultNum=2&stayDay=&stayYear=&stayMonth=&dateUndecided=1&distCd=01&roomCrack=200000&screenId=UWW1402&yadNo=390063&callbackHistFlg=1,≪ホテルスペック２００９年８月≫※当館では、快適にお過ごし頂けますように下記寝具をご用意しております■布団：羽毛　枕：羽毛（標準）■数量限定貸出用枕：竹炭・そば殻・低反発・ひのきチップ,【アクセス】ＪＲ・近鉄・伊勢鉄道津駅、東口より徒歩１分。,エリア ： 三重県 > 津,2016-03-28 02:37:07,2016-03-28 02:37:07,"￥7,407〜","（￥3,703〜/人）",,,,,,,,,,,,,,,,,,,,,,,,,,,,,,,,,,,,,,,,,,,,,,,,,,,,,,,,,,,,,,,,,,,,,,,,,,,,
2775,ホテルルートイン津,/yad397929/?stayCount=1&roomCount=1&adultNum=2&stayDay=&stayYear=&stayMonth=&dateUndecided=1&distCd=01&roomCrack=200000&screenId=UWW1402&yadNo=397929&callbackHistFlg=1,津市中心部に立地し、交通手段がとても便利。鈴鹿サーキット、志摩スペイン村や参宮への拠点にもご利用ください。３０品目の和洋食無料朝食バイキング付き、活性石無料人工温泉が好評です。☆駐車場も無料☆,【アクセス】伊勢自動車道・津ICより車で約10分　近鉄名古屋線/JR紀勢線/伊勢鉄道伊勢線津駅より徒歩約6分，車で約2分,エリア ： 三重県 > 津,2016-03-28 02:37:07,2016-03-28 02:37:07,"￥9,212〜","（￥4,606〜/人）",,,,,,,,,,,,,,,,,,,,,,,,,,,,,,,,,,,,,,,,,,,,,,,,,,,,,,,,,,,,,,,,,,,,,,,,,,,,
2776,三交イン津駅前,/yad398705/?stayCount=1&roomCount=1&adultNum=2&stayDay=&stayYear=&stayMonth=&dateUndecided=1&distCd=01&roomCrack=200000&screenId=UWW1402&yadNo=398705&callbackHistFlg=1,【2015年11月5日(木)開業】近鉄・ＪＲ津駅東口より徒歩１分、三重県の行政の中心である県庁所在地、津市に誕生。,【アクセス】ＪＲ・近鉄“津駅”東口より徒歩にて約１分,エリア ： 三重県 > 津,2016-03-28 02:37:07,2016-03-28 02:37:07,"￥6,851〜","（￥3,425〜/人）",,,,,,,,,,,,,,,,,,,,,,,,,,,,,,,,,,,,,,,,,,,,,,,,,,,,,,,,,,,,,,,,,,,,,,,,,,,,
2777,ホテルエコノ津駅前,/yad399603/?stayCount=1&roomCount=1&adultNum=2&stayDay=&stayYear=&stayMonth=&dateUndecided=1&distCd=01&roomCrack=200000&screenId=UWW1402&yadNo=399603&callbackHistFlg=1,JR・近鉄津駅より徒歩3分。コンビニ徒歩2分。無料朝食・ウェルカムコーヒーなどサービスも充実♪地上波デジタル放送対応液晶テレビ・折り重ね枕・無線ＬＡＮネット接続無料など快適な客室です★,【アクセス】東出口改札を出て、ロータリーの地下道を通り抜け、銀行左側の路地へ右折し、約８０ｍ先右手が当ホテル,エリア ： 三重県 > 津,2016-03-28 02:37:07,2016-03-28 02:37:07,"￥6,296〜","（￥3,148〜/人）",,,,,,,,,,,,,,,,,,,,,,,,,,,,,,,,,,,,,,,,,,,,,,,,,,,,,,,,,,,,,,,,,,,,,,,,,,,,
2778,ネットワークリゾートなんせい,/yad336523/?stayCount=1&roomCount=1&adultNum=2&stayDay=&stayYear=&stayMonth=&dateUndecided=1&distCd=01&roomCrack=200000&screenId=UWW1402&yadNo=336523&callbackHistFlg=1,専用デッキテラス、冷暖房、TV完備の快適トレーラーハウスでアウトドア満喫。プライバシーも守れてアクティビティも豊富だからカップルでもグループでも家族でも絶対に楽しめる。,【アクセス】伊勢自動車道玉城ICで降りて、サニーロード、国道260号経由40分。,エリア ： 三重県 > 南勢,2016-03-28 02:37:08,2016-03-28 02:37:08,"￥10,500〜","（￥5,250〜/人）",,,,,,,,,,,,,,,,,,,,,,,,,,,,,,,,,,,,,,,,,,,,,,,,,,,,,,,,,,,,,,,,,,,,,,,,,,,,
2779,大作旅館,/yad308188/?stayCount=1&roomCount=1&adultNum=2&stayDay=&stayYear=&stayMonth=&dateUndecided=1&distCd=01&roomCrack=200000&screenId=UWW1402&yadNo=308188&callbackHistFlg=1,伊勢志摩の奥座敷、南伊勢町で1年を通して旬の天然魚介類を味わえます。,【アクセス】伊勢自動車道、玉城ICより伊勢南島線に入り南伊勢町道方まで車で25分,エリア ： 三重県 > 南勢,2016-03-28 02:37:08,2016-03-28 02:37:08,"￥7,407〜","（￥3,703〜/人）",,,,,,,,,,,,,,,,,,,,,,,,,,,,,,,,,,,,,,,,,,,,,,,,,,,,,,,,,,,,,,,,,,,,,,,,,,,,
2780,寿し友旅館,/yad314803/?stayCount=1&roomCount=1&adultNum=2&stayDay=&stayYear=&stayMonth=&dateUndecided=1&distCd=01&roomCrack=200000&screenId=UWW1402&yadNo=314803&callbackHistFlg=1,地元で獲れた新鮮な魚介類を調理します。また古和浦は釣りのメッカで、船釣り、海上釣掘り、いかだ釣り、磯釣りなどには最適です。神前や方座浦も近く、釣りの手配も可能★,【アクセス】伊勢自動車道勢和多気JCから尾鷲方面へ、紀勢大内山IC下車、南伊勢町方面へ１５分,エリア ： 三重県 > 南勢,2016-03-28 02:37:08,2016-03-28 02:37:08,"￥7,777〜","（￥3,888〜/人）",,,,,,,,,,,,,,,,,,,,,,,,,,,,,,,,,,,,,,,,,,,,,,,,,,,,,,,,,,,,,,,,,,,,,,,,,,,,
