id,building_name,image_url,detail,access,address,created_at,updated_at,fee1,fee2,,,,,,,,,,,,,,,,,,,,,,,,,,,,,,,,,,,,,,,,,,,,,,,,,,,,,,,,,,,,,,,,,,,,,,,,,,,,
7102,白馬パウダ−ロッジ,/yad362704/?stayCount=1&roomCount=1&adultNum=2&stayDay=&stayYear=&stayMonth=&dateUndecided=1&distCd=01&roomCrack=200000&screenId=UWW1402&yadNo=362704&callbackHistFlg=1,白馬連邦を見渡す広い庭とウッドデッキでリラックス、大型キッチンを自由に使用できる素泊り格安宿。夏は登山、MTB、冬はスキーやスノボ、温泉へアクセス良好。プライベートならコテージ･貸別荘も有り。,【アクセス】ＪＲ白馬駅下車、長距離バス終点ターミナル八方下車、どちらも徒歩15分。（予約送迎有）,エリア ： 長野県 > 白馬村,2016-03-28 00:46:15,2016-03-28 00:46:15,"￥7,407〜",（￥-/室）,,,,,,,,,,,,,,,,,,,,,,,,,,,,,,,,,,,,,,,,,,,,,,,,,,,,,,,,,,,,,,,,,,,,,,,,,,,,
7103,モン・シャレ・コパン,/yad363108/?stayCount=1&roomCount=1&adultNum=2&stayDay=&stayYear=&stayMonth=&dateUndecided=1&distCd=01&roomCrack=200000&screenId=UWW1402&yadNo=363108&callbackHistFlg=1,　リフトの目の前、六角形の外観。唐松造りの安らぎ。信州の幸と日本海の幸を活かした食事、キメの細かい心遣い。ホテル並みのバストイレ付の設備を備えた心温まる山荘風のペンション。,【アクセス】　JR大糸線　白馬駅　R148白馬　長野道豊科IC　上信越道長野IC　北陸道糸井川IC,エリア ： 長野県 > 白馬村,2016-03-28 00:46:15,2016-03-28 00:46:15,"￥15,740〜","（￥7,870〜/人）",,,,,,,,,,,,,,,,,,,,,,,,,,,,,,,,,,,,,,,,,,,,,,,,,,,,,,,,,,,,,,,,,,,,,,,,,,,,
7104,ルポゼ白馬,/yad363712/?stayCount=1&roomCount=1&adultNum=2&stayDay=&stayYear=&stayMonth=&dateUndecided=1&distCd=01&roomCrack=200000&screenId=UWW1402&yadNo=363712&callbackHistFlg=1,大きな丸太を使ったログのお部屋から望む白馬三山の景色が自慢。併設のレストランでいただく本格イタリアンが好評です。,【アクセス】関越道経由長野IC車で約1時間、中央道安曇野ICから車で約1時間、JR大糸線白馬駅から車で5分,エリア ： 長野県 > 白馬村,2016-03-28 00:46:15,2016-03-28 00:46:15,"￥11,111〜","（￥5,555〜/人）",,,,,,,,,,,,,,,,,,,,,,,,,,,,,,,,,,,,,,,,,,,,,,,,,,,,,,,,,,,,,,,,,,,,,,,,,,,,
7105,ＷＡＧＡＹＡ,/yad363725/?stayCount=1&roomCount=1&adultNum=2&stayDay=&stayYear=&stayMonth=&dateUndecided=1&distCd=01&roomCrack=200000&screenId=UWW1402&yadNo=363725&callbackHistFlg=1,２０１３年１２月ＯＰＥＮ。ご家族、ご友人たちと白馬の大自然にたつ第二の我が家ですごす贅沢な時間をご提供します。２ベッドルームのモダンなコテージです。窓から八方尾根が見えます。,【アクセス】白馬駅より車で5分,エリア ： 長野県 > 白馬村,2016-03-28 00:46:15,2016-03-28 00:46:15,"￥79,629〜",（￥-/室）,,,,,,,,,,,,,,,,,,,,,,,,,,,,,,,,,,,,,,,,,,,,,,,,,,,,,,,,,,,,,,,,,,,,,,,,,,,,
7106,ギャラリー＆ペンション　野いちご,/yad364245/?stayCount=1&roomCount=1&adultNum=2&stayDay=&stayYear=&stayMonth=&dateUndecided=1&distCd=01&roomCrack=200000&screenId=UWW1402&yadNo=364245&callbackHistFlg=1,和田野の森の小さなペンション。八方尾根咲花ゲレンデには徒歩約3分。色鉛筆画が織成す落ち着いた雰囲気のダイニングでゆっくりとした時間をお過ごし下さい。,【アクセス】ＪＲ白馬駅より車で8分。八方松電バスターミナルより車で4分。,エリア ： 長野県 > 白馬村,2016-03-28 00:46:15,2016-03-28 00:46:15,"￥12,037〜","（￥6,018〜/人）",,,,,,,,,,,,,,,,,,,,,,,,,,,,,,,,,,,,,,,,,,,,,,,,,,,,,,,,,,,,,,,,,,,,,,,,,,,,
7107,セントラルイン白馬,/yad364613/?stayCount=1&roomCount=1&adultNum=2&stayDay=&stayYear=&stayMonth=&dateUndecided=1&distCd=01&roomCrack=200000&screenId=UWW1402&yadNo=364613&callbackHistFlg=1,白馬八方バスターミナルから徒歩5分！八方尾根スキー場（名木山ゲレンデ）まで徒歩6分！、好立地な旅館です。夕食は、季節の食材を使ったお料理をご用意！,【アクセス】八方バスターミナル徒歩5分　JR白馬駅車で5分（タクシー利用）　長野道あずみ野・上信越道長野各ICから60分,エリア ： 長野県 > 白馬村,2016-03-28 00:46:15,2016-03-28 00:46:15,"￥15,000〜","（￥7,500〜/人）",,,,,,,,,,,,,,,,,,,,,,,,,,,,,,,,,,,,,,,,,,,,,,,,,,,,,,,,,,,,,,,,,,,,,,,,,,,,
7108,ペンション　クック,/yad365768/?stayCount=1&roomCount=1&adultNum=2&stayDay=&stayYear=&stayMonth=&dateUndecided=1&distCd=01&roomCrack=200000&screenId=UWW1402&yadNo=365768&callbackHistFlg=1,白馬村五竜、４７スキー場共にアクセス可能。24時間入浴可。夜は産地直送の生鮮魚と地物の素材を生かした手作りフルコース。朝は、国産小麦と自家製天然酵母の手作りパンと特製ジャムがおかわり自由！,【アクセス】大糸線　神城駅／白馬駅より車で１０分／安曇野ＩＣより車で１時間,エリア ： 長野県 > 白馬村,2016-03-28 00:46:15,2016-03-28 00:46:15,"￥21,851〜","（￥10,925〜/人）",,,,,,,,,,,,,,,,,,,,,,,,,,,,,,,,,,,,,,,,,,,,,,,,,,,,,,,,,,,,,,,,,,,,,,,,,,,,
7109,あらや旅館,/yad366120/?stayCount=1&roomCount=1&adultNum=2&stayDay=&stayYear=&stayMonth=&dateUndecided=1&distCd=01&roomCrack=200000&screenId=UWW1402&yadNo=366120&callbackHistFlg=1,新鮮な自家製の野菜、米、味噌、お漬物で懐かしい素朴なおふくろの味と、真心であなたを感動させてくれる宿,【アクセス】ＪＲ大糸線白馬駅下車、車で約５分。高速長野自動車道豊科ＩＣ下車、車で６０分,エリア ： 長野県 > 白馬村,2016-03-28 00:46:15,2016-03-28 00:46:15,"￥7,407〜","（￥3,703〜/人）",,,,,,,,,,,,,,,,,,,,,,,,,,,,,,,,,,,,,,,,,,,,,,,,,,,,,,,,,,,,,,,,,,,,,,,,,,,,
7110,Ｐａｌｓ　Ｉｎｎ　雷鳥,/yad366795/?stayCount=1&roomCount=1&adultNum=2&stayDay=&stayYear=&stayMonth=&dateUndecided=1&distCd=01&roomCrack=200000&screenId=UWW1402&yadNo=366795&callbackHistFlg=1,広い館内でのびのびと。約40畳の多目的室では、武道、ダンススタジオ等として使用可能です。ファミリーから、学生サークル、合宿など、団体様まで白馬とパルズイン雷鳥をお楽しみ下さい！,【アクセス】長野自動車道安曇野ICより50分、上信越道長野ICより50分,エリア ： 長野県 > 白馬村,2016-03-28 00:46:15,2016-03-28 00:46:15,"￥9,814〜","（￥4,907〜/人）",,,,,,,,,,,,,,,,,,,,,,,,,,,,,,,,,,,,,,,,,,,,,,,,,,,,,,,,,,,,,,,,,,,,,,,,,,,,
7111,エターナル　フレーム,/yad367327/?stayCount=1&roomCount=1&adultNum=2&stayDay=&stayYear=&stayMonth=&dateUndecided=1&distCd=01&roomCrack=200000&screenId=UWW1402&yadNo=367327&callbackHistFlg=1,昨年はご予約が集中しお部屋をお取りできなかったお客様にはご迷惑をお掛けし大変申し訳ございませんでした。今年は宿泊日数に上限を設定させて頂き1組でも多くのお客様にご利用頂きたいと思っております。,【アクセス】長野道豊科ＩＣより約60分、ＪＲ大糸線白馬駅よりタクシー5分,エリア ： 長野県 > 白馬村,2016-03-28 00:46:15,2016-03-28 00:46:15,"￥9,074〜","（￥4,537〜/人）",,,,,,,,,,,,,,,,,,,,,,,,,,,,,,,,,,,,,,,,,,,,,,,,,,,,,,,,,,,,,,,,,,,,,,,,,,,,
7112,ペンション　麓,/yad368898/?stayCount=1&roomCount=1&adultNum=2&stayDay=&stayYear=&stayMonth=&dateUndecided=1&distCd=01&roomCrack=200000&screenId=UWW1402&yadNo=368898&callbackHistFlg=1,　雄大な北アルプスの麓白馬みそら野で山小屋風のペンション。年間を通して一人旅や家族連れなどいつでも大歓迎。オープン以来オーナ夫妻のおもてなしは自然流。心が温かくなる宿。,【アクセス】大糸線白馬駅から車で５〜７分中央高速道豊科インターより６０分、北陸道糸魚川インターより６０分,エリア ： 長野県 > 白馬村,2016-03-28 00:46:15,2016-03-28 00:46:15,"￥7,407〜","（￥3,703〜/人）",,,,,,,,,,,,,,,,,,,,,,,,,,,,,,,,,,,,,,,,,,,,,,,,,,,,,,,,,,,,,,,,,,,,,,,,,,,,
7113,リバーサイドやまや,/yad370587/?stayCount=1&roomCount=1&adultNum=2&stayDay=&stayYear=&stayMonth=&dateUndecided=1&distCd=01&roomCrack=200000&screenId=UWW1402&yadNo=370587&callbackHistFlg=1,お食事は、大自然で育った自家製米に季節野菜は自家農園で収穫した無農薬野菜を使用しています。女将手作りのデザートも並ぶおもてなしの味をお楽しみください。,【アクセス】中央道安曇野IC又は上信越道長野ICより車50分。最寄りの駅　神城駅より徒歩５分,エリア ： 長野県 > 白馬村,2016-03-28 00:46:15,2016-03-28 00:46:15,"￥7,222〜","（￥3,611〜/人）",,,,,,,,,,,,,,,,,,,,,,,,,,,,,,,,,,,,,,,,,,,,,,,,,,,,,,,,,,,,,,,,,,,,,,,,,,,,
7114,カンパーニュ白馬,/yad370894/?stayCount=1&roomCount=1&adultNum=2&stayDay=&stayYear=&stayMonth=&dateUndecided=1&distCd=01&roomCrack=200000&screenId=UWW1402&yadNo=370894&callbackHistFlg=1,Hakuba47まで車2分、白馬五竜まで車10分と「白馬スキー」に最適！ログハウス・メゾネットタイプ・本格フィンランドサウナ付・温泉付・暖炉付・ペット可など選べる10棟のコテージを家族や仲間と楽しもう♪,【アクセス】ＪＲ白馬駅より車10分。Hakuba47スキー場500m手前、国道148号コメリを左約1km直進,エリア ： 長野県 > 白馬村,2016-03-28 00:46:15,2016-03-28 00:46:15,"￥12,962〜",（￥-/室）,,,,,,,,,,,,,,,,,,,,,,,,,,,,,,,,,,,,,,,,,,,,,,,,,,,,,,,,,,,,,,,,,,,,,,,,,,,,
7115,カナディアンヴィレッジ,/yad371104/?stayCount=1&roomCount=1&adultNum=2&stayDay=&stayYear=&stayMonth=&dateUndecided=1&distCd=01&roomCrack=200000&screenId=UWW1402&yadNo=371104&callbackHistFlg=1,グループ・団体・一人でも気軽に泊まれるお手軽ロッジ。ペットも大型犬から小型犬まで一緒にお部屋で過ごせる嬉しい宿。素泊まり、朝食付、2食付から自由に選択ＯＫ。相部屋で一人から宿泊ＯＫ。,【アクセス】Ｒ148から1分冬でも楽々のアクセスです,エリア ： 長野県 > 白馬村,2016-03-28 00:46:15,2016-03-28 00:46:15,"￥12,962〜","（￥6,481〜/人）",,,,,,,,,,,,,,,,,,,,,,,,,,,,,,,,,,,,,,,,,,,,,,,,,,,,,,,,,,,,,,,,,,,,,,,,,,,,
7116,ホテルオークフォレスト,/yad373279/?stayCount=1&roomCount=1&adultNum=2&stayDay=&stayYear=&stayMonth=&dateUndecided=1&distCd=01&roomCrack=200000&screenId=UWW1402&yadNo=373279&callbackHistFlg=1,2012年にオープンしてから皆様に支えられて2周年を迎える事が出来ました。これからも皆様にご満足して頂けるよう心がけてまいります。地場の食材を使ったお料理と天然温泉が自慢のホテル,【アクセス】長野道安曇野ICより国道１４８号線で40分,エリア ： 長野県 > 白馬村,2016-03-28 00:46:15,2016-03-28 00:46:15,"￥14,000〜","（￥7,000〜/人）",,,,,,,,,,,,,,,,,,,,,,,,,,,,,,,,,,,,,,,,,,,,,,,,,,,,,,,,,,,,,,,,,,,,,,,,,,,,
7117,きすげ荘,/yad375493/?stayCount=1&roomCount=1&adultNum=2&stayDay=&stayYear=&stayMonth=&dateUndecided=1&distCd=01&roomCrack=200000&screenId=UWW1402&yadNo=375493&callbackHistFlg=1,白馬村みねかたにある民宿です。白馬みねかたスキー場まで歩いて5分！ご希望によりそば打ち体験も可能です。ご家族やグループで遊びにいらっしゃいませんか？ミニ体育館付,【アクセス】ＪＲ大糸線白馬駅下車、車で約１５分。高速長野自動車道豊科ＩＣ下車、車で６０分,エリア ： 長野県 > 白馬村,2016-03-28 00:46:15,2016-03-28 00:46:15,"￥3,666〜","（￥1,833〜/人）",,,,,,,,,,,,,,,,,,,,,,,,,,,,,,,,,,,,,,,,,,,,,,,,,,,,,,,,,,,,,,,,,,,,,,,,,,,,
7118,グレイシャーホテル,/yad376424/?stayCount=1&roomCount=1&adultNum=2&stayDay=&stayYear=&stayMonth=&dateUndecided=1&distCd=01&roomCrack=200000&screenId=UWW1402&yadNo=376424&callbackHistFlg=1,白馬山麓。全室バス、トイレ、TV、電話付。お一人の方やご家族連れの方もお気軽にご利用頂いています。自然散策、スキーやスノーシューの出発点。,【アクセス】上信越道長野ＩＣからオリンピック道路６０分、長野道豊科ＩＣからパノラマロード６０分。,エリア ： 長野県 > 白馬村,2016-03-28 00:46:15,2016-03-28 00:46:15,"￥13,000〜","（￥6,500〜/人）",,,,,,,,,,,,,,,,,,,,,,,,,,,,,,,,,,,,,,,,,,,,,,,,,,,,,,,,,,,,,,,,,,,,,,,,,,,,
7119,信州白馬八方温泉　しろうま荘,/yad377164/?stayCount=1&roomCount=1&adultNum=2&stayDay=&stayYear=&stayMonth=&dateUndecided=1&distCd=01&roomCrack=200000&screenId=UWW1402&yadNo=377164&callbackHistFlg=1,雄大な北アルプスを望む広い窓のお部屋と、アルカリ泉豊富でこじんまりとした天然温泉で寛げる美しいデザインの老舗温泉宿。郷土色豊かな旬の手料理のおもてなしも大好評。,【アクセス】八方尾根スキー場まで徒歩5分、バスターミナルまで徒歩2分、各所へのアクセス便利な好立地です。,エリア ： 長野県 > 白馬村,2016-03-28 00:46:15,2016-03-28 00:46:15,"￥14,444〜","（￥7,222〜/人）",,,,,,,,,,,,,,,,,,,,,,,,,,,,,,,,,,,,,,,,,,,,,,,,,,,,,,,,,,,,,,,,,,,,,,,,,,,,
7120,白馬　寛ぎの宿　ＴＡＴＩＮ（タタン）,/yad378728/?stayCount=1&roomCount=1&adultNum=2&stayDay=&stayYear=&stayMonth=&dateUndecided=1&distCd=01&roomCrack=200000&screenId=UWW1402&yadNo=378728&callbackHistFlg=1,2010年秋オープン。昭和40年代のユースホステルのように、人との繋がりを大切にした宿を目指しています。登山やスキー、スケッチや散歩、一日山を観るのもよし。雨の日は雨を聴くのもよし。素泊プラン限定。,【アクセス】エコーランド通りを西へ直進、ペンションハッピーベルさんの角を右折、森川珈琲さんを左折、５０ｍ右手,エリア ： 長野県 > 白馬村,2016-03-28 00:46:15,2016-03-28 00:46:15,"￥7,407〜","（￥3,703〜/人）",,,,,,,,,,,,,,,,,,,,,,,,,,,,,,,,,,,,,,,,,,,,,,,,,,,,,,,,,,,,,,,,,,,,,,,,,,,,
7121,白馬五竜ペンション　くるみ,/yad378944/?stayCount=1&roomCount=1&adultNum=2&stayDay=&stayYear=&stayMonth=&dateUndecided=1&distCd=01&roomCrack=200000&screenId=UWW1402&yadNo=378944&callbackHistFlg=1,白馬五竜の森に佇むアットホームで小さなペンション『くるみ』♪白馬五竜＆Hakuba47の麓。自慢の「伊仏創作料理」とリーズナブルなご宿泊料金。豊富なお得プランが満載です！！,【アクセス】安曇野ＩＣ・長野ＩＣ・糸魚川ＩＣよりそれぞれ約６０分。五竜バス停・ＪＲ神城駅よりそれぞれ徒歩約１０分,エリア ： 長野県 > 白馬村,2016-03-28 00:46:15,2016-03-28 00:46:15,"￥7,407〜","（￥3,703〜/人）",,,,,,,,,,,,,,,,,,,,,,,,,,,,,,,,,,,,,,,,,,,,,,,,,,,,,,,,,,,,,,,,,,,,,,,,,,,,
7122,ホテル・ラ・モンターニュ・フルハタ,/yad379736/?stayCount=1&roomCount=1&adultNum=2&stayDay=&stayYear=&stayMonth=&dateUndecided=1&distCd=01&roomCrack=200000&screenId=UWW1402&yadNo=379736&callbackHistFlg=1,夕日や朝日に輝く北アルプスを眺めながら、白馬産無農薬食材をたっぷり使ったお食事をどうぞ。広さ850,,エリア ： 長野県 > 白馬村,2016-03-28 00:46:15,2016-03-28 00:46:15,"￥10,000〜","（￥5,000〜/人）",,,,,,,,,,,,,,,,,,,,,,,,,,,,,,,,,,,,,,,,,,,,,,,,,,,,,,,,,,,,,,,,,,,,,,,,,,,,
7123,ゲレンデサイド　プチホテルロンド−ル,/yad380468/?stayCount=1&roomCount=1&adultNum=2&stayDay=&stayYear=&stayMonth=&dateUndecided=1&distCd=01&roomCrack=200000&screenId=UWW1402&yadNo=380468&callbackHistFlg=1,八方尾根名木山、目の前がゲレンデなので滑ってリフトへ行けます（１２月後半から３月終わりまでの冬季期間のみ）。八方尾根温泉源泉かけながし温泉です。オールシーズンオリジナルベーカリを営業中。,【アクセス】ＪＲ大糸線白馬駅下車、車で１０分徒歩３０分。高速長野自動車道豊科ＩＣ下車、車６０分。,エリア ： 長野県 > 白馬村,2016-03-28 00:46:15,2016-03-28 00:46:15,"￥13,000〜","（￥6,500〜/人）",,,,,,,,,,,,,,,,,,,,,,,,,,,,,,,,,,,,,,,,,,,,,,,,,,,,,,,,,,,,,,,,,,,,,,,,,,,,
7124,フェニックス　シャレー　<コテージ>,/yad382920/?stayCount=1&roomCount=1&adultNum=2&stayDay=&stayYear=&stayMonth=&dateUndecided=1&distCd=01&roomCrack=200000&screenId=UWW1402&yadNo=382920&callbackHistFlg=1,ワンランク上の新感覚デザイナーズシャレー（貸別荘）です。おすすめはシェフがお部屋にデリバリーする【食事付きプラン】☆イタリアンのコースやBBQなどホテル品質の本格派！アウトドア体験の手配もOK♪,【アクセス】JR大糸線白馬駅下車、タクシーで５分,エリア ： 長野県 > 白馬村,2016-03-28 00:46:15,2016-03-28 00:46:15,"￥46,296〜",（￥-/室）,,,,,,,,,,,,,,,,,,,,,,,,,,,,,,,,,,,,,,,,,,,,,,,,,,,,,,,,,,,,,,,,,,,,,,,,,,,,
7125,プチホテル　グラスハウス,/yad385198/?stayCount=1&roomCount=1&adultNum=2&stayDay=&stayYear=&stayMonth=&dateUndecided=1&distCd=01&roomCrack=200000&screenId=UWW1402&yadNo=385198&callbackHistFlg=1,北アルプスを望む360度、四季折々の景観を楽しみながら、思う存分川遊びや雪遊びをしてみませんか？苦手な食材等のご要望も承っております。リピーターに愛されるワンちゃんとの優しい時間をご満喫下さい。,【アクセス】国道148号線岩岳方面へ,エリア ： 長野県 > 白馬村,2016-03-28 00:46:15,2016-03-28 00:46:15,"￥18,148〜","（￥9,074〜/人）",,,,,,,,,,,,,,,,,,,,,,,,,,,,,,,,,,,,,,,,,,,,,,,,,,,,,,,,,,,,,,,,,,,,,,,,,,,,
7126,白馬　ホテルパイプのけむり,/yad385364/?stayCount=1&roomCount=1&adultNum=2&stayDay=&stayYear=&stayMonth=&dateUndecided=1&distCd=01&roomCrack=200000&screenId=UWW1402&yadNo=385364&callbackHistFlg=1,八方尾根スキー場白樺ゲレンデ前の便利なホテル。格安な料金で朝、夕食べ放題のバイキング！大浴場・露天風呂完備。平日なら駐車場・更衣室もチェックイン前・アウト後もご利用ＯＫ♪お一人様もお気軽に,【アクセス】中央道経由長野道安曇野インターから50,エリア ： 長野県 > 白馬村,2016-03-28 00:46:15,2016-03-28 00:46:15,"￥9,777〜","（￥4,888〜/人）",,,,,,,,,,,,,,,,,,,,,,,,,,,,,,,,,,,,,,,,,,,,,,,,,,,,,,,,,,,,,,,,,,,,,,,,,,,,
7127,コハルリゾートホテルアンドスイート,/yad386603/?stayCount=1&roomCount=1&adultNum=2&stayDay=&stayYear=&stayMonth=&dateUndecided=1&distCd=01&roomCrack=200000&screenId=UWW1402&yadNo=386603&callbackHistFlg=1,コハルは上品でモダンなインテリアが特徴の全室キッチン、バストイレ付のアパートメントタイプタイプのホテル。夏はアウトドアアクティビティ、秋は紅葉、冬は八方尾根スキー場まで徒歩１分。,【アクセス】八方バスターミナルよりお車にて５分。,エリア ： 長野県 > 白馬村,2016-03-28 00:46:15,2016-03-28 00:46:15,"￥10,648〜",（￥-/室）,,,,,,,,,,,,,,,,,,,,,,,,,,,,,,,,,,,,,,,,,,,,,,,,,,,,,,,,,,,,,,,,,,,,,,,,,,,,
7128,ホテル　グレース白馬,/yad387354/?stayCount=1&roomCount=1&adultNum=2&stayDay=&stayYear=&stayMonth=&dateUndecided=1&distCd=01&roomCrack=200000&screenId=UWW1402&yadNo=387354&callbackHistFlg=1,八方尾根ゴンドラまで徒歩5分。名木山ゲレンデまで徒歩2分。勿論レンタルスキーも有り！白馬八方温泉露天が自慢。地元食材を使った板前が作る和食膳を楽しめる。スキー、トレッキング、温泉巡りの拠点に！,【アクセス】 八方バスターミナル下車(徒歩３分)　ＪＲ白馬駅より車で５分,エリア ： 長野県 > 白馬村,2016-03-28 00:46:46,2016-03-28 00:46:46,"￥9,166〜","（￥4,583〜/人）",,,,,,,,,,,,,,,,,,,,,,,,,,,,,,,,,,,,,,,,,,,,,,,,,,,,,,,,,,,,,,,,,,,,,,,,,,,,
7129,ペンション　カルナージュ,/yad390124/?stayCount=1&roomCount=1&adultNum=2&stayDay=&stayYear=&stayMonth=&dateUndecided=1&distCd=01&roomCrack=200000&screenId=UWW1402&yadNo=390124&callbackHistFlg=1,信州牛、信州サーモン、白馬豚、信州ハーブ鶏に、契約農家の高原野菜など、白馬の旅行にふさわしい食事があります。白馬の中心エコーランドのランドマーク『ペンションカルナージュ』で便利な白馬旅を！,【アクセス】長野道豊科、上信越道長野各ＩＣより１時間。長野駅よりバス１時間。ＪＲ大糸線白馬駅より無料送迎５分。,エリア ： 長野県 > 白馬村,2016-03-28 00:46:15,2016-03-28 00:46:15,"￥10,000〜","（￥5,000〜/人）",,,,,,,,,,,,,,,,,,,,,,,,,,,,,,,,,,,,,,,,,,,,,,,,,,,,,,,,,,,,,,,,,,,,,,,,,,,,
7130,ペンションランドポイント,/yad391780/?stayCount=1&roomCount=1&adultNum=2&stayDay=&stayYear=&stayMonth=&dateUndecided=1&distCd=01&roomCrack=200000&screenId=UWW1402&yadNo=391780&callbackHistFlg=1,お箸で食べて頂ける気取らない洋食メニューと冬はお鍋をご用意。２４ｈ入浴可能な広いお風呂が大好評。プレイルームにマンガ本を取り揃えており、お子様にも大人気♪室内にすべり台とブランコもあります!!,【アクセス】JR白馬駅、八方バスターミナルまで送迎あり。長野道・豊科IC、上信越道・長野ICより車約60分。,エリア ： 長野県 > 白馬村,2016-03-28 00:46:15,2016-03-28 00:46:15,"￥5,000〜","（￥2,500〜/人）",,,,,,,,,,,,,,,,,,,,,,,,,,,,,,,,,,,,,,,,,,,,,,,,,,,,,,,,,,,,,,,,,,,,,,,,,,,,
7131,ロッジやまき,/yad394292/?stayCount=1&roomCount=1&adultNum=2&stayDay=&stayYear=&stayMonth=&dateUndecided=1&distCd=01&roomCrack=200000&screenId=UWW1402&yadNo=394292&callbackHistFlg=1,リピーターの多い宿として知られるロッジやまき。リーズナブルな料金設定で、グループやファミリーに人気。おもてなしの家族料理を自家製米で。白馬岩岳スキー場至近。＊お手洗いが洋式になりました＊,【アクセス】お車：豊科ＩＣ／長野ＩＣより約６０分、電車：白馬駅／信濃森上下車、高速バス：白馬八方降車,エリア ： 長野県 > 白馬村,2016-03-28 00:46:15,2016-03-28 00:46:15,"￥8,333〜","（￥4,166〜/人）",,,,,,,,,,,,,,,,,,,,,,,,,,,,,,,,,,,,,,,,,,,,,,,,,,,,,,,,,,,,,,,,,,,,,,,,,,,,
7132,ペンション野風増,/yad396790/?stayCount=1&roomCount=1&adultNum=2&stayDay=&stayYear=&stayMonth=&dateUndecided=1&distCd=01&roomCrack=200000&screenId=UWW1402&yadNo=396790&callbackHistFlg=1,気兼ねなく、ゆっくり寛げて、食事はとにかくおいしい物をお腹いっぱい食べてもらうことを考え、お客様のご希望を出来る限り叶えることをモットーにしている、とってもアットホームな宿です。,【アクセス】JR大糸線白馬駅より無料送迎で５分。安曇野・長野・糸魚川、各ICより車で約６０分。,エリア ： 長野県 > 白馬村,2016-03-28 00:46:15,2016-03-28 00:46:15,"￥8,333〜","（￥4,166〜/人）",,,,,,,,,,,,,,,,,,,,,,,,,,,,,,,,,,,,,,,,,,,,,,,,,,,,,,,,,,,,,,,,,,,,,,,,,,,,
7133,コミュニティハウス　チロリアン,/yad396933/?stayCount=1&roomCount=1&adultNum=2&stayDay=&stayYear=&stayMonth=&dateUndecided=1&distCd=01&roomCrack=200000&screenId=UWW1402&yadNo=396933&callbackHistFlg=1,白馬岩岳スキー場のラインリフトのホント！真横の宿で、スキー場へのアクセスが便利。「安い！」と評判の宿泊料で、料理も「満足！」「美味しい！」と結構巷（ちまた）では評判なんです,【アクセス】ＪＲ大糸線白馬駅下車、車で約１０分。高速長野自動車道豊科ＩＣ下車、車で６０分,エリア ： 長野県 > 白馬村,2016-03-28 00:46:15,2016-03-28 00:46:15,"￥8,333〜","（￥4,166〜/人）",,,,,,,,,,,,,,,,,,,,,,,,,,,,,,,,,,,,,,,,,,,,,,,,,,,,,,,,,,,,,,,,,,,,,,,,,,,,
7134,白馬エコーホテル,/yad398700/?stayCount=1&roomCount=1&adultNum=2&stayDay=&stayYear=&stayMonth=&dateUndecided=1&distCd=01&roomCrack=200000&screenId=UWW1402&yadNo=398700&callbackHistFlg=1,エコーランドの中心の好立地。最大５ベッドルーム／３バスルーム１１名様ご利用までアレンジできる白馬には珍しいコンドミニアムタイプのお部屋がおすすめ。夏も！冬も！気ままに白馬を楽しもう♪,【アクセス】JR白馬駅車10分　八方バスターミナル車5分,エリア ： 長野県 > 白馬村,2016-03-28 00:46:15,2016-03-28 00:46:15,"￥27,777〜",（￥-/室）,,,,,,,,,,,,,,,,,,,,,,,,,,,,,,,,,,,,,,,,,,,,,,,,,,,,,,,,,,,,,,,,,,,,,,,,,,,,
