id,building_name,image_url,detail,access,address,created_at,updated_at,fee1,fee2,,,,,,,,,,,,,,,,,,,,,,,,,,,,,,,,,,,,,,,,,,,,,,,,,,,,,,,,,,,,,,,,,,,,,,,,,,,,
6123,つるや隠宅,/yad326951/?stayCount=1&roomCount=1&adultNum=2&stayDay=&stayYear=&stayMonth=&dateUndecided=1&distCd=01&roomCrack=200000&screenId=UWW1402&yadNo=326951&callbackHistFlg=1,湯平温泉の石畳沿いにある家族で営むアットホームな小さなお宿。太っ腹女将の作る豊後牛メインのボリュームある手作りの山里料理が自慢。清流沿いの半露天、館内の岩風呂は無料で貸切利用可！,【アクセス】大分道湯布院ICから車で20分,エリア ： 大分県 > 湯布院・湯平,2016-03-28 01:19:40,2016-03-28 01:19:40,"￥10,185〜","（￥5,092〜/人）",,,,,,,,,,,,,,,,,,,,,,,,,,,,,,,,,,,,,,,,,,,,,,,,,,,,,,,,,,,,,,,,,,,,,,,,,,,,
6124,湯布院かほりの郷　はな村,/yad328454/?stayCount=1&roomCount=1&adultNum=2&stayDay=&stayYear=&stayMonth=&dateUndecided=1&distCd=01&roomCrack=200000&screenId=UWW1402&yadNo=328454&callbackHistFlg=1,湯布院の中心「湯の坪街道」に建つ、女性に大人気のはな村です。細やかな創作料理や肌がつるつるになる温泉に浸かって、楽しいひと時をおすごしください。敷地内は静かで緑であふれていて快適です。,【アクセス】JR久大本線由布院駅より徒歩10分、タクシー2分。大分自動車道湯布院ICより車で5分。,エリア ： 大分県 > 湯布院・湯平,2016-03-28 01:19:40,2016-03-28 01:19:40,"￥20,277〜","（￥10,138〜/人）",,,,,,,,,,,,,,,,,,,,,,,,,,,,,,,,,,,,,,,,,,,,,,,,,,,,,,,,,,,,,,,,,,,,,,,,,,,,
6125,感動とやすらぎの宿　東匠庵,/yad331264/?stayCount=1&roomCount=1&adultNum=2&stayDay=&stayYear=&stayMonth=&dateUndecided=1&distCd=01&roomCrack=200000&screenId=UWW1402&yadNo=331264&callbackHistFlg=1,どのお部屋からも望める美しい由布岳はまさに絶景で訪れる人を魅了して離しません。気の向くままに湯に浸かり、贅を尽くした懐石料理を味わう。そんな優雅で贅沢なひとときを存分にお楽しみください。,【アクセス】湯布院ＩＣから車で６分,エリア ： 大分県 > 湯布院・湯平,2016-03-28 01:19:40,2016-03-28 01:19:40,"￥40,000〜","（￥20,000〜/人）",,,,,,,,,,,,,,,,,,,,,,,,,,,,,,,,,,,,,,,,,,,,,,,,,,,,,,,,,,,,,,,,,,,,,,,,,,,,
6126,湯布院別荘　四季彩ホテル,/yad331600/?stayCount=1&roomCount=1&adultNum=2&stayDay=&stayYear=&stayMonth=&dateUndecided=1&distCd=01&roomCrack=200000&screenId=UWW1402&yadNo=331600&callbackHistFlg=1,全室、35,,エリア ： 大分県 > 湯布院・湯平,2016-03-28 01:19:40,2016-03-28 01:19:40,"￥17,592〜","（￥8,796〜/人）",,,,,,,,,,,,,,,,,,,,,,,,,,,,,,,,,,,,,,,,,,,,,,,,,,,,,,,,,,,,,,,,,,,,,,,,,,,,
6127,ログハウス トムソーヤ,/yad332213/?stayCount=1&roomCount=1&adultNum=2&stayDay=&stayYear=&stayMonth=&dateUndecided=1&distCd=01&roomCrack=200000&screenId=UWW1402&yadNo=332213&callbackHistFlg=1,迫力ある太い丸太のログハウスは、非日常の空間。まるで森の中にいるような心地よさと、完全装備のキッチンはリピーター続出です。おおぜいで、二人っきりで。未体験の一日をお楽しみください。,【アクセス】JR由布院駅・大分自動車道湯布院インターより車・タクシーで5分。駅、インターまで無料送迎あり。,エリア ： 大分県 > 湯布院・湯平,2016-03-28 01:19:40,2016-03-28 01:19:40,"￥13,888〜","（￥6,944〜/人）",,,,,,,,,,,,,,,,,,,,,,,,,,,,,,,,,,,,,,,,,,,,,,,,,,,,,,,,,,,,,,,,,,,,,,,,,,,,
6128,由布院温泉　楓の小舎,/yad332520/?stayCount=1&roomCount=1&adultNum=2&stayDay=&stayYear=&stayMonth=&dateUndecided=1&distCd=01&roomCrack=200000&screenId=UWW1402&yadNo=332520&callbackHistFlg=1,由布院駅より車で５分。由布岳の麓に佇む隠れ宿。露天風呂・岩盤浴完備の離れや特別室に快適にお過ごしいただけるお一人様用客室もございます。お部屋でいただく地元食材を使った料理はすべて手作りの拘り。,【アクセス】湯布院ＩＣより車で８分。由布院駅よりタクシーで５分。,エリア ： 大分県 > 湯布院・湯平,2016-03-28 01:19:40,2016-03-28 01:19:40,"￥36,000〜","（￥18,000〜/人）",,,,,,,,,,,,,,,,,,,,,,,,,,,,,,,,,,,,,,,,,,,,,,,,,,,,,,,,,,,,,,,,,,,,,,,,,,,,
6129,由布岳を身近に感じる -柚富の郷　彩岳館-,/yad334081/?stayCount=1&roomCount=1&adultNum=2&stayDay=&stayYear=&stayMonth=&dateUndecided=1&distCd=01&roomCrack=200000&screenId=UWW1402&yadNo=334081&callbackHistFlg=1,大きな露天風呂からはもちろん、レストランや由布岳側客室からも雄大な由布岳を楽しめます。温泉を上ればからだに優しく美味しいお料理の数々。贅沢な由布院での素敵な夜をお楽しみください。,【アクセス】JR由布院駅から車で５分。大分自動車道湯布院I.Cから車で13分。,エリア ： 大分県 > 湯布院・湯平,2016-03-28 01:19:40,2016-03-28 01:19:40,"￥22,000〜","（￥11,000〜/人）",,,,,,,,,,,,,,,,,,,,,,,,,,,,,,,,,,,,,,,,,,,,,,,,,,,,,,,,,,,,,,,,,,,,,,,,,,,,
6130,湯平温泉　旅館　坂本屋,/yad335420/?stayCount=1&roomCount=1&adultNum=2&stayDay=&stayYear=&stayMonth=&dateUndecided=1&distCd=01&roomCrack=200000&screenId=UWW1402&yadNo=335420&callbackHistFlg=1,時間がゆっくり流れる温泉情緒の漂う湯平温泉にあるお宿。Ｈ19年に改装した外観及び客室と心尽くしの手料理、素朴なおもてなしと川沿いの貸切の温泉を堪能。,【アクセス】ＪＲ久大線湯平駅よりはタクシーで６分、大分自動車道湯布院ＩＣより車で２０分,エリア ： 大分県 > 湯布院・湯平,2016-03-28 01:19:40,2016-03-28 01:19:40,"￥16,000〜","（￥8,000〜/人）",,,,,,,,,,,,,,,,,,,,,,,,,,,,,,,,,,,,,,,,,,,,,,,,,,,,,,,,,,,,,,,,,,,,,,,,,,,,
6131,御宿　仙壽,/yad336816/?stayCount=1&roomCount=1&adultNum=2&stayDay=&stayYear=&stayMonth=&dateUndecided=1&distCd=01&roomCrack=200000&screenId=UWW1402&yadNo=336816&callbackHistFlg=1,湯布院盆地の街中から少し離れた場所にある静かな宿。３室離れの客室には専用の露天風呂つきで24時間入浴できる掛け流しの天然温泉。また夕食は部屋出しで回りに気兼ねなく自分達だけの空間を楽しめます。,【アクセス】湯布院ICより車約５分　由布院駅より徒歩１０〜１５分,エリア ： 大分県 > 湯布院・湯平,2016-03-28 01:19:40,2016-03-28 01:19:40,"￥28,277〜","（￥14,138〜/人）",,,,,,,,,,,,,,,,,,,,,,,,,,,,,,,,,,,,,,,,,,,,,,,,,,,,,,,,,,,,,,,,,,,,,,,,,,,,
6132,ゆふいん温泉　御宿　一禅,/yad338208/?stayCount=1&roomCount=1&adultNum=2&stayDay=&stayYear=&stayMonth=&dateUndecided=1&distCd=01&roomCrack=200000&screenId=UWW1402&yadNo=338208&callbackHistFlg=1,透明から乳白色、刺青色と変化するとろりとした肌触りのいい美人湯が大好評！板長の技が光る彩り鮮やかな絶品！京風懐石料理と無垢の天然木が優しい日本建築の伝統美の客室でやすらぎのひと時を。,【アクセス】JRゆふいん駅より車で5分。大分自動車道湯布院ICより車で10分。,エリア ： 大分県 > 湯布院・湯平,2016-03-28 01:19:40,2016-03-28 01:19:40,"￥40,000〜","（￥20,000〜/人）",,,,,,,,,,,,,,,,,,,,,,,,,,,,,,,,,,,,,,,,,,,,,,,,,,,,,,,,,,,,,,,,,,,,,,,,,,,,
6133,日の春旅館,/yad340740/?stayCount=1&roomCount=1&adultNum=2&stayDay=&stayYear=&stayMonth=&dateUndecided=1&distCd=01&roomCrack=200000&screenId=UWW1402&yadNo=340740&callbackHistFlg=1,[貸切風呂無料・露天大浴場有]ここでしか味わえない玉砂利敷きの露天風呂に浸かり、九州・大分の地物食材を使用した季節の懐石に舌鼓〜由布院駅徒歩15分・湯の坪街道（メイン通り）至近の静かな宿。,【アクセス】JR由布院駅から徒歩15分、車で5分。高速湯布院インターから車で10分。,エリア ： 大分県 > 湯布院・湯平,2016-03-28 01:19:40,2016-03-28 01:19:40,"￥36,000〜","（￥18,000〜/人）",,,,,,,,,,,,,,,,,,,,,,,,,,,,,,,,,,,,,,,,,,,,,,,,,,,,,,,,,,,,,,,,,,,,,,,,,,,,
6134,御宿　ゆふいん亭,/yad343728/?stayCount=1&roomCount=1&adultNum=2&stayDay=&stayYear=&stayMonth=&dateUndecided=1&distCd=01&roomCrack=200000&screenId=UWW1402&yadNo=343728&callbackHistFlg=1,■すべて離れ形式の温泉付き客室でお寛ぎ下さい。■湯上りの無料ビールサーバーのサービス★湯布院で売れた宿３年連続　第１位★じゃらんネット（０６、０７、０８年度）０９年度３位★,【アクセス】由布院駅よりタクシーで５分。由布院ＩＣより車で１０分。,エリア ： 大分県 > 湯布院・湯平,2016-03-28 01:19:40,2016-03-28 01:19:40,"￥29,592〜","（￥14,796〜/人）",,,,,,,,,,,,,,,,,,,,,,,,,,,,,,,,,,,,,,,,,,,,,,,,,,,,,,,,,,,,,,,,,,,,,,,,,,,,
6135,湯らり　六妙,/yad345269/?stayCount=1&roomCount=1&adultNum=2&stayDay=&stayYear=&stayMonth=&dateUndecided=1&distCd=01&roomCrack=200000&screenId=UWW1402&yadNo=345269&callbackHistFlg=1,JR由布院駅から徒歩約8分の好立地に佇み湯布院散策の拠点に最適です。お食事は付いておりませんが、お近くのお食事処をご紹介できます。お持ち込みも可能です。,【アクセス】大分道湯布院出口より5分。ＪＲ由布院駅より徒歩8分。大分空港より直通バスで55分、駅より徒歩8分。,エリア ： 大分県 > 湯布院・湯平,2016-03-28 01:19:40,2016-03-28 01:19:40,"￥24,814〜","（￥12,407〜/人）",,,,,,,,,,,,,,,,,,,,,,,,,,,,,,,,,,,,,,,,,,,,,,,,,,,,,,,,,,,,,,,,,,,,,,,,,,,,
6136,由布院温泉　ゆふいん山水館,/yad358734/?stayCount=1&roomCount=1&adultNum=2&stayDay=&stayYear=&stayMonth=&dateUndecided=1&distCd=01&roomCrack=200000&screenId=UWW1402&yadNo=358734&callbackHistFlg=1,■当館は2011年に創業100周年を迎えました。由布岳を望む絶景露天風呂は必見！「Theおおいたブランド」等の地産食材、地ビール醸造レストランなど“由布院の恵み”に心から癒されるおもてなしの湯宿。,【アクセス】ＪＲ由布院駅より徒歩約8分。大分自動車道湯布院ＩＣより車で約１５分。,エリア ： 大分県 > 湯布院・湯平,2016-03-28 01:19:40,2016-03-28 01:19:40,"￥16,296〜","（￥8,148〜/人）",,,,,,,,,,,,,,,,,,,,,,,,,,,,,,,,,,,,,,,,,,,,,,,,,,,,,,,,,,,,,,,,,,,,,,,,,,,,
6137,湯布ゆらら山荘,/yad360143/?stayCount=1&roomCount=1&adultNum=2&stayDay=&stayYear=&stayMonth=&dateUndecided=1&distCd=01&roomCrack=200000&screenId=UWW1402&yadNo=360143&callbackHistFlg=1,九州屈指の高級別荘地にある美肌温泉付き一戸建て別荘。お部屋から望む山々の四季折々の景色は心を癒してくれます。アクセスも良く、お部屋も広いので大人数も受け入れ可。10名様以上の団体は割引制度あり！,【アクセス】湯布院I・Cを出て、最初の信号を直進し、道の駅湯布院を左に見ながら次の信号を左折、約100Mで右手に入る。,エリア ： 大分県 > 湯布院・湯平,2016-03-28 01:19:40,2016-03-28 01:19:40,"￥18,518〜","（￥9,259〜/人）",,,,,,,,,,,,,,,,,,,,,,,,,,,,,,,,,,,,,,,,,,,,,,,,,,,,,,,,,,,,,,,,,,,,,,,,,,,,
6138,貸別荘　湯布院ヴィラハウスＨ,/yad366676/?stayCount=1&roomCount=1&adultNum=2&stayDay=&stayYear=&stayMonth=&dateUndecided=1&distCd=01&roomCrack=200000&screenId=UWW1402&yadNo=366676&callbackHistFlg=1,湯布院川上地区にある別荘です。大き目の天然岩風呂が人気。テラスではバーベキューも間網です。食事はついておりませんが台所がございますので自炊することができます。,【アクセス】ＪＲ久大本線由布院駅よりお車約10分,エリア ： 大分県 > 湯布院・湯平,2016-03-28 01:19:40,2016-03-28 01:19:40,"￥15,925〜","（￥7,962〜/人）",,,,,,,,,,,,,,,,,,,,,,,,,,,,,,,,,,,,,,,,,,,,,,,,,,,,,,,,,,,,,,,,,,,,,,,,,,,,
6139,吉祥開運亭　無尽蔵,/yad373242/?stayCount=1&roomCount=1&adultNum=2&stayDay=&stayYear=&stayMonth=&dateUndecided=1&distCd=01&roomCrack=200000&screenId=UWW1402&yadNo=373242&callbackHistFlg=1,■全4室共、趣きの違う客室で源泉掛け流しの温泉を愉しめる。母屋中央には巨大な暖炉がそびえ立つ。湯の坪街道沿いに位置するが奥まった隠れ家のような空間と華のある料理「モダン美食懐石」を堪能できる！,【アクセス】JR久大本線由布院駅下車、出口正面の由布観通りを金鱗湖方面へ徒歩15分。湯の坪街道沿い。,エリア ： 大分県 > 湯布院・湯平,2016-03-28 01:19:40,2016-03-28 01:19:40,"￥20,000〜","（￥10,000〜/人）",,,,,,,,,,,,,,,,,,,,,,,,,,,,,,,,,,,,,,,,,,,,,,,,,,,,,,,,,,,,,,,,,,,,,,,,,,,,
6140,蓮輪,/yad373325/?stayCount=1&roomCount=1&adultNum=2&stayDay=&stayYear=&stayMonth=&dateUndecided=1&distCd=01&roomCrack=200000&screenId=UWW1402&yadNo=373325&callbackHistFlg=1,高級すっぽん料理が、なんと一泊二食付10900円〜。スタミナ満点で美容にも良いと言われるスッポンを味わったら、24時間入浴可能な貸切露天で更なる美肌づくりを！直営の養殖場があるから味わえる贅沢。,【アクセス】JR由布院駅より徒歩8分、車で3分。湯布院ICより車で15分。,エリア ： 大分県 > 湯布院・湯平,2016-03-28 01:19:40,2016-03-28 01:19:40,"￥12,962〜","（￥6,481〜/人）",,,,,,,,,,,,,,,,,,,,,,,,,,,,,,,,,,,,,,,,,,,,,,,,,,,,,,,,,,,,,,,,,,,,,,,,,,,,
6141,由布院温泉 金鱗湖散策に最適の宿 ダビデの館,/yad373935/?stayCount=1&roomCount=1&adultNum=2&stayDay=&stayYear=&stayMonth=&dateUndecided=1&distCd=01&roomCrack=200000&screenId=UWW1402&yadNo=373935&callbackHistFlg=1,湯布院観光に訪れるお客様との一期一会を大事にしています。源泉かけ流しの温泉と、金鱗湖へのアクセスがいいので湯布院観光を存分にお楽しみください。,【アクセス】ＪＲ湯布院駅から車で５分、徒歩２５分。湯布院ＩＣから車で８分。金鱗湖まで徒歩１分。,エリア ： 大分県 > 湯布院・湯平,2016-03-28 01:19:40,2016-03-28 01:19:40,"￥8,000〜","（￥4,000〜/人）",,,,,,,,,,,,,,,,,,,,,,,,,,,,,,,,,,,,,,,,,,,,,,,,,,,,,,,,,,,,,,,,,,,,,,,,,,,,
6142,ゆふいん椿,/yad374432/?stayCount=1&roomCount=1&adultNum=2&stayDay=&stayYear=&stayMonth=&dateUndecided=1&distCd=01&roomCrack=200000&screenId=UWW1402&yadNo=374432&callbackHistFlg=1,全室離れ・2間つづきのお部屋、由布岳一望の温泉旅館、循環加水無しの100％源泉の展望・貸切風呂、大分の旬の食材を使った料理をご堪能ください。,【アクセス】湯布院インターチェンジ（大分自動車道）より車で３分　　ＪＲ由布院駅よりタクシーで７分,エリア ： 大分県 > 湯布院・湯平,2016-03-28 01:19:40,2016-03-28 01:19:40,"￥34,000〜","（￥17,000〜/人）",,,,,,,,,,,,,,,,,,,,,,,,,,,,,,,,,,,,,,,,,,,,,,,,,,,,,,,,,,,,,,,,,,,,,,,,,,,,
6143,猫ちゃんおもてなしの宿    オーベルゼ    レ・ボー,/yad375550/?stayCount=1&roomCount=1&adultNum=2&stayDay=&stayYear=&stayMonth=&dateUndecided=1&distCd=01&roomCrack=200000&screenId=UWW1402&yadNo=375550&callbackHistFlg=1,★ネコちゃんSTAYが面白い！猫ちゃんと10倍湯布院を楽しもう♪『ココは湯布院のパラダイス♪』★人懐っこい猫ちゃん6匹が添い寝しちゃうかも！？楽しい猫ちゃんSTAYをお楽しみ下さいニャー♪(ΦωΦ),【アクセス】★湯布院I..Cより、お車で１分☆ゆふいん道の駅から徒歩７分程でーす♪Facebookページも毎日更新中(*^_^*),エリア ： 大分県 > 湯布院・湯平,2016-03-28 01:19:40,2016-03-28 01:19:40,"￥30,000〜","（￥15,000〜/人）",,,,,,,,,,,,,,,,,,,,,,,,,,,,,,,,,,,,,,,,,,,,,,,,,,,,,,,,,,,,,,,,,,,,,,,,,,,,
6144,貸別荘　湯布院ウッディハウスＦ,/yad382655/?stayCount=1&roomCount=1&adultNum=2&stayDay=&stayYear=&stayMonth=&dateUndecided=1&distCd=01&roomCrack=200000&screenId=UWW1402&yadNo=382655&callbackHistFlg=1,湯布院観光に最適な立地で、ペットと一緒にご宿泊可能です。タープテント利用により雨の日でもバーベキューができ、また台所がございますの自炊することも可能です。,【アクセス】JR久大本線由布院駅よりお車で約１０分,エリア ： 大分県 > 湯布院・湯平,2016-03-28 01:19:40,2016-03-28 01:19:40,"￥16,111〜","（￥8,055〜/人）",,,,,,,,,,,,,,,,,,,,,,,,,,,,,,,,,,,,,,,,,,,,,,,,,,,,,,,,,,,,,,,,,,,,,,,,,,,,
6145,山下湖ロッジ,/yad383584/?stayCount=1&roomCount=1&adultNum=2&stayDay=&stayYear=&stayMonth=&dateUndecided=1&distCd=01&roomCrack=200000&screenId=UWW1402&yadNo=383584&callbackHistFlg=1,湯布院・九重の観光や登山にも最適。隣室のない戸建のロッジ(コテージ）は、お子さんの大はしゃぎやあかちゃんの夜泣きだって心配いりません。家族で。職場の仲間で。新しい旅の選択肢が広がります。,【アクセス】湯布院ICより車で20分。水分峠より、やまなみハイウエーを進み7キロ。山下湖ロッジへの看板から2分,エリア ： 大分県 > 湯布院・湯平,2016-03-28 01:19:40,2016-03-28 01:19:40,"￥15,740〜","（￥7,870〜/人）",,,,,,,,,,,,,,,,,,,,,,,,,,,,,,,,,,,,,,,,,,,,,,,,,,,,,,,,,,,,,,,,,,,,,,,,,,,,
6146,湯布院　昔懐かしい純木造日本旅館　由布院温泉　山荘 田名加,/yad383856/?stayCount=1&roomCount=1&adultNum=2&stayDay=&stayYear=&stayMonth=&dateUndecided=1&distCd=01&roomCrack=200000&screenId=UWW1402&yadNo=383856&callbackHistFlg=1,由布院にある全7室のこじんまり宿。食事は「菜の花」と名づけられた広間でいただく。木造りの廊下や階段はキシキシと音をたて、厠は部屋の外に設けられている。そんな少し昔の日本のように、を大切にした宿,【アクセス】JR由布院駅下車徒歩15分。大分自動車道より車で10分。,エリア ： 大分県 > 湯布院・湯平,2016-03-28 01:19:40,2016-03-28 01:19:40,"￥11,111〜","（￥5,555〜/人）",,,,,,,,,,,,,,,,,,,,,,,,,,,,,,,,,,,,,,,,,,,,,,,,,,,,,,,,,,,,,,,,,,,,,,,,,,,,
6147,ゆふいん時遊館,/yad385293/?stayCount=1&roomCount=1&adultNum=2&stayDay=&stayYear=&stayMonth=&dateUndecided=1&distCd=01&roomCrack=200000&screenId=UWW1402&yadNo=385293&callbackHistFlg=1,南由布駅横１５００坪の敷地に佇み由布岳を正面に望み、ワイン専用ぶどう園や自家製の田んぼ、畑が広がるのどかな風景に包まれた１日３組様限定の宿。緩やかに流れていく時が癒してくれます。,【アクセス】１：ＪＲ南由布駅より徒歩3分。２：湯布院ＩＣより約５分。３：ＪＲ由布院駅より車で約６分。,エリア ： 大分県 > 湯布院・湯平,2016-03-28 01:19:40,2016-03-28 01:19:40,"￥34,000〜","（￥17,000〜/人）",,,,,,,,,,,,,,,,,,,,,,,,,,,,,,,,,,,,,,,,,,,,,,,,,,,,,,,,,,,,,,,,,,,,,,,,,,,,
6148,ペットと泊まれる一組限定離れ宿　山荘　花暢,/yad393379/?stayCount=1&roomCount=1&adultNum=2&stayDay=&stayYear=&stayMonth=&dateUndecided=1&distCd=01&roomCrack=200000&screenId=UWW1402&yadNo=393379&callbackHistFlg=1,【ワンちゃんと宿泊する楽しさ・嬉しさ、そして感動を伝えたい！】周りを気にせずワンちゃんと過ごすには最適♪広いお庭も魅力！料理はお部屋食で、専用の内湯の温泉…贅沢な時間をお過ごし下さい♪,【アクセス】◆由布院駅よりお車で6分程でございます。,エリア ： 大分県 > 湯布院・湯平,2016-03-28 01:19:40,2016-03-28 01:19:40,"￥40,277〜","（￥20,138〜/人）",,,,,,,,,,,,,,,,,,,,,,,,,,,,,,,,,,,,,,,,,,,,,,,,,,,,,,,,,,,,,,,,,,,,,,,,,,,,
6149,あーでん庵,/yad394516/?stayCount=1&roomCount=1&adultNum=2&stayDay=&stayYear=&stayMonth=&dateUndecided=1&distCd=01&roomCrack=200000&screenId=UWW1402&yadNo=394516&callbackHistFlg=1,ゆふいん盆地の西側に位置し、静かな別荘地にあります。二階ベッドルームからの朝の風景は格別です。フロントは隣接する「あーでん」（喫茶店)です。ご到着の際はあーでんへお越しください。,【アクセス】由布院駅よりタクシーで約7分、大分道湯布院IC約5分、徒歩25分,エリア ： 大分県 > 湯布院・湯平,2016-03-28 01:19:40,2016-03-28 01:19:40,"￥9,259〜","（￥4,629〜/人）",,,,,,,,,,,,,,,,,,,,,,,,,,,,,,,,,,,,,,,,,,,,,,,,,,,,,,,,,,,,,,,,,,,,,,,,,,,,
6150,ゆふいん庄屋の館,/yad395408/?stayCount=1&roomCount=1&adultNum=2&stayDay=&stayYear=&stayMonth=&dateUndecided=1&distCd=01&roomCrack=200000&screenId=UWW1402&yadNo=395408&callbackHistFlg=1,【温泉大大好き】【自分家の別宅感覚で貸切ってゆっくり過ごしたい！】そんな方におすすめですっ！ブルーになる良質の温泉を保有し、温泉保養地の原点に立返った『温泉のある別宅』感覚の施設です,【アクセス】◆ＪＲ久大本線　由布院駅よりお車にて４分◆大分自動車道湯布院ＩＣから県道２１６号線約６ｋｍ約８分,エリア ： 大分県 > 湯布院・湯平,2016-03-28 01:19:40,2016-03-28 01:19:40,"￥28,000〜","（￥14,000〜/人）",,,,,,,,,,,,,,,,,,,,,,,,,,,,,,,,,,,,,,,,,,,,,,,,,,,,,,,,,,,,,,,,,,,,,,,,,,,,
6151,お宿　有楽,/yad398280/?stayCount=1&roomCount=1&adultNum=2&stayDay=&stayYear=&stayMonth=&dateUndecided=1&distCd=01&roomCrack=200000&screenId=UWW1402&yadNo=398280&callbackHistFlg=1,母家と離れ全10室のおもてなし宿です｡お食事は朝夕客室にて豊後の美味を最大限に生かし、既製品は一切使用していない本格懐石料理を堪能できます。一期一会の温かいおもてなしと真心の味をご満喫下さい。,【アクセス】由布院駅より徒歩10分,エリア ： 大分県 > 湯布院・湯平,2016-03-28 01:19:40,2016-03-28 01:19:40,"￥17,592〜","（￥8,796〜/人）",,,,,,,,,,,,,,,,,,,,,,,,,,,,,,,,,,,,,,,,,,,,,,,,,,,,,,,,,,,,,,,,,,,,,,,,,,,,
6152,湯布院山荘　吾亦紅,/yad398805/?stayCount=1&roomCount=1&adultNum=2&stayDay=&stayYear=&stayMonth=&dateUndecided=1&distCd=01&roomCrack=200000&screenId=UWW1402&yadNo=398805&callbackHistFlg=1,由布岳と湯布院盆地を見渡す高台に、源泉１００％で檜と岩の露天風呂付き！ペットも泊まれる離れの宿★泊まって見たい宿　九州で総合1位になりました。★・全室マッサージチェア付き・朝霧の見える宿。,【アクセス】湯布院インターから車で１５分。湯布院駅からタクシーで５分です。,エリア ： 大分県 > 湯布院・湯平,2016-03-28 01:19:40,2016-03-28 01:19:40,"￥44,000〜","（￥22,000〜/人）",,,,,,,,,,,,,,,,,,,,,,,,,,,,,,,,,,,,,,,,,,,,,,,,,,,,,,,,,,,,,,,,,,,,,,,,,,,,
6153,朝霧と渓谷を望む　ひびきの郷　お宿　あさもや,/yad318842/?stayCount=1&roomCount=1&adultNum=2&stayDay=&stayYear=&stayMonth=&dateUndecided=1&distCd=01&roomCrack=200000&screenId=UWW1402&yadNo=318842&callbackHistFlg=1,旅の愉しみ。ひびきの郷で感じて下さい。心からのおもてなし。『美味い』とほころぶ笑顔に出会い、美味しい梅酒でほっこり気分。「お宿あさもや」は複合施設で、梅酒工場や温泉施設を併設しております,【アクセス】高速日田インターから約25分　JR日田駅・日田バスセンターから約20分（無料送迎有り）,エリア ： 大分県 > 日田・天ヶ瀬,2016-03-28 01:19:40,2016-03-28 01:19:40,"￥16,666〜","（￥8,333〜/人）",,,,,,,,,,,,,,,,,,,,,,,,,,,,,,,,,,,,,,,,,,,,,,,,,,,,,,,,,,,,,,,,,,,,,,,,,,,,
6154,水郷日田の絶景宿　ひなの里　山陽館,/yad318954/?stayCount=1&roomCount=1&adultNum=2&stayDay=&stayYear=&stayMonth=&dateUndecided=1&distCd=01&roomCrack=200000&screenId=UWW1402&yadNo=318954&callbackHistFlg=1,　水郷日田におしゃれで可愛い「水上レストラン」が登場！ゆるやかな三隈川に浮かんだ水上レストランで、日田の旬材に舌鼓。,【アクセス】ＪＲ久大線日田駅より徒歩１０分。日田ＩＣからは車で５分,エリア ： 大分県 > 日田・天ヶ瀬,2016-03-28 01:19:40,2016-03-28 01:19:40,"￥12,037〜","（￥6,018〜/人）",,,,,,,,,,,,,,,,,,,,,,,,,,,,,,,,,,,,,,,,,,,,,,,,,,,,,,,,,,,,,,,,,,,,,,,,,,,,
6155,山荘　天水,/yad346540/?stayCount=1&roomCount=1&adultNum=2&stayDay=&stayYear=&stayMonth=&dateUndecided=1&distCd=01&roomCrack=200000&screenId=UWW1402&yadNo=346540&callbackHistFlg=1,天領日田の奥座敷、天ケ瀬温泉の山間に佇む一軒宿｡広大な敷地に広がる自然の中で時間を忘れただただ【湯､香､食､和､癒】を味わう。それが天水での過ごし方です｡,"【アクセス】･九州大分自動車道：天瀬高塚I,Cから天水まで車で約20分〜30分（フォトギャラリーにて交通案内掲載中！）",エリア ： 大分県 > 日田・天ヶ瀬,2016-03-28 01:19:40,2016-03-28 01:19:40,"￥39,814〜","（￥19,907〜/人）",,,,,,,,,,,,,,,,,,,,,,,,,,,,,,,,,,,,,,,,,,,,,,,,,,,,,,,,,,,,,,,,,,,,,,,,,,,,
