id,building_name,image_url,detail,access,address,created_at,updated_at,fee1,fee2,,,,,,,,,,,,,,,,,,,,,,,,,,,,,,,,,,,,,,,,,,,,,,,,,,,,,,,,,,,,,,,,,,,,,,,,,,,,
7951,アパホテル＜銀座　宝町＞,/yad301277/?stayCount=1&roomCount=1&adultNum=2&stayDay=&stayYear=&stayMonth=&dateUndecided=1&distCd=01&roomCrack=200000&screenId=UWW1402&yadNo=301277&callbackHistFlg=1,平成25年新築！浅草線「宝町駅」A1出口徒歩1分、銀座線「京橋駅」徒歩3分！東京駅徒歩約10分！羽田空港は乗換なし！秋葉原、築地、東京ビッグサイト、東京ディズニーリゾート(R)にも好アクセス♪,【アクセス】都営地下鉄浅草線「宝町駅」A1出口から徒歩1分、東京メトロ銀座線「京橋駅」徒歩3分、「東京駅」徒歩10分！,エリア ： 東京都 > 東京・神田・日本橋,2016-03-28 04:17:58,2016-03-28 04:17:58,"￥6,481〜","（￥3,240〜/人）",,,,,,,,,,,,,,,,,,,,,,,,,,,,,,,,,,,,,,,,,,,,,,,,,,,,,,,,,,,,,,,,,,,,,,,,,,,,
7952,アパホテル＜秋葉原駅前＞,/yad304438/?stayCount=1&roomCount=1&adultNum=2&stayDay=&stayYear=&stayMonth=&dateUndecided=1&distCd=01&roomCrack=200000&screenId=UWW1402&yadNo=304438&callbackHistFlg=1,全館、全室Wi-Fi接続無料★東京駅・上野駅2駅5分、銀座、築地、有楽町、新橋、浜松町、品川、新宿、池袋各駅すべて乗り換えなしのアクセス抜群!！ディズニーＲ、ビックサイト、各地へも便利です。,【アクセス】■ＪＲ山手線・京浜東北線・総武線「秋葉原駅」昭和通り口徒歩１分■東京メトロ日比谷線1番出口徒歩1分■,エリア ： 東京都 > 東京・神田・日本橋,2016-03-28 04:17:58,2016-03-28 04:17:58,"￥6,018〜","（￥3,009〜/人）",,,,,,,,,,,,,,,,,,,,,,,,,,,,,,,,,,,,,,,,,,,,,,,,,,,,,,,,,,,,,,,,,,,,,,,,,,,,
7953,ＫＫＲホテル東京（国家公務員共済組合連合会東京共済会館）,/yad305158/?stayCount=1&roomCount=1&adultNum=2&stayDay=&stayYear=&stayMonth=&dateUndecided=1&distCd=01&roomCrack=200000&screenId=UWW1402&yadNo=305158&callbackHistFlg=1,ＫＫＲ宿泊施設は国家公務員共済組合連合会が組合員等の利用を目的として運営しています。組合員等の方は、チェックインの際に組合員証等をご提示ください。,【アクセス】地下鉄東西線竹橋駅3b出口直結。東京駅からは丸の内北口よりタクシーでワンメーター。大手町駅より徒歩7分,エリア ： 東京都 > 東京・神田・日本橋,2016-03-28 04:17:58,2016-03-28 04:17:58,"￥9,074〜","（￥4,537〜/人）",,,,,,,,,,,,,,,,,,,,,,,,,,,,,,,,,,,,,,,,,,,,,,,,,,,,,,,,,,,,,,,,,,,,,,,,,,,,
7954,センターホテル東京,/yad307547/?stayCount=1&roomCount=1&adultNum=2&stayDay=&stayYear=&stayMonth=&dateUndecided=1&distCd=01&roomCrack=200000&screenId=UWW1402&yadNo=307547&callbackHistFlg=1,ビジネスの中心地・日本橋兜町に位置するホテル。銀座・六本木・恵比寿・渋谷などのプレイスポットも地下鉄１本で東京旅行の拠点に格好のロケーション！遊びのプランも多彩に広がるね！,【アクセス】JR東京駅八重洲北口より徒歩約10分。東京メトロ茅場町駅より徒歩約3分。,エリア ： 東京都 > 東京・神田・日本橋,2016-03-28 04:17:58,2016-03-28 04:17:58,"￥5,833〜","（￥2,916〜/人）",,,,,,,,,,,,,,,,,,,,,,,,,,,,,,,,,,,,,,,,,,,,,,,,,,,,,,,,,,,,,,,,,,,,,,,,,,,,
7955,ホテル日本橋サイボー,/yad310952/?stayCount=1&roomCount=1&adultNum=2&stayDay=&stayYear=&stayMonth=&dateUndecided=1&distCd=01&roomCrack=200000&screenId=UWW1402&yadNo=310952&callbackHistFlg=1,日本橋「人形町駅」徒歩2分、コンビニ30秒の好立地。人形町駅は羽田空港から直通運転最短32分で到着。銀座、品川、上野、浅草など都内主要駅へ好アクセス。約25種類の選べる無料アメニティをご用意♪,【アクセス】地下鉄日比谷、浅草線「人形町」A5出口を背にし右手に進み徒歩2分。車「箱崎」より約5分。,エリア ： 東京都 > 東京・神田・日本橋,2016-03-28 04:17:58,2016-03-28 04:17:58,"￥6,925〜","（￥3,462〜/人）",,,,,,,,,,,,,,,,,,,,,,,,,,,,,,,,,,,,,,,,,,,,,,,,,,,,,,,,,,,,,,,,,,,,,,,,,,,,
7956,西鉄イン日本橋,/yad313506/?stayCount=1&roomCount=1&adultNum=2&stayDay=&stayYear=&stayMonth=&dateUndecided=1&distCd=01&roomCrack=200000&screenId=UWW1402&yadNo=313506&callbackHistFlg=1,羽田空港から最寄人形町駅まで京急線直通４０分！全室Wi-Fi接続が無料です（LAN接続も可）。焼きたてクロワッサンやおにぎり等和洋楽しめる無料朝食付き♪前金制の為、スムーズなチェックアウトが可能です。,【アクセス】都営地下鉄浅草線・東京メトロ日比谷線「人形町駅」下車、Ａ５出口から地上へ出て右方向へ徒歩約３分。,エリア ： 東京都 > 東京・神田・日本橋,2016-03-28 04:17:58,2016-03-28 04:17:58,"￥6,851〜","（￥3,425〜/人）",,,,,,,,,,,,,,,,,,,,,,,,,,,,,,,,,,,,,,,,,,,,,,,,,,,,,,,,,,,,,,,,,,,,,,,,,,,,
7957,ホテルマイステイズ神田,/yad315615/?stayCount=1&roomCount=1&adultNum=2&stayDay=&stayYear=&stayMonth=&dateUndecided=1&distCd=01&roomCrack=200000&screenId=UWW1402&yadNo=315615&callbackHistFlg=1,☆全室無料Wi-Fi完備☆神田駅ほか新日本橋駅・岩本町駅など5駅が徒歩圏内！ミニキッチン付きのお部屋もありビジネスにもレジャーにも最適！無料の女性用アメニティ、コーヒー・紅茶もございます☆,【アクセス】ＪＲ・地下鉄「神田駅」南口徒歩6分／ＪＲ「新日本橋駅」8番出口徒歩3分／地下鉄「岩本町駅」A5出口徒歩6分,エリア ： 東京都 > 東京・神田・日本橋,2016-03-28 04:17:58,2016-03-28 04:17:58,"￥5,296〜","（￥2,648〜/人）",,,,,,,,,,,,,,,,,,,,,,,,,,,,,,,,,,,,,,,,,,,,,,,,,,,,,,,,,,,,,,,,,,,,,,,,,,,,
7958,スマイルホテル東京日本橋,/yad316512/?stayCount=1&roomCount=1&adultNum=2&stayDay=&stayYear=&stayMonth=&dateUndecided=1&distCd=01&roomCrack=200000&screenId=UWW1402&yadNo=316512&callbackHistFlg=1,２０１１年１月全客室リニューアル完了♪☆全米ホテルベッドシェアＮＯ．１「サータ」社のポケットコイルマットレス採用♪☆全室空気加湿清浄機完備♪,【アクセス】JR東京駅からタクシーで5分。地下鉄日比谷線・東西線茅場町駅1番・5番出口から徒歩１分。TDRへも２５分。,エリア ： 東京都 > 東京・神田・日本橋,2016-03-28 04:17:58,2016-03-28 04:17:58,"￥4,444〜","（￥2,222〜/人）",,,,,,,,,,,,,,,,,,,,,,,,,,,,,,,,,,,,,,,,,,,,,,,,,,,,,,,,,,,,,,,,,,,,,,,,,,,,
7959,相鉄フレッサイン日本橋茅場町,/yad316888/?stayCount=1&roomCount=1&adultNum=2&stayDay=&stayYear=&stayMonth=&dateUndecided=1&distCd=01&roomCrack=200000&screenId=UWW1402&yadNo=316888&callbackHistFlg=1,茅場町駅より徒歩１分、日本橋駅より５分の好立地！都内各所へアクセス良好！安全性に優れた免震構造。無料朝食焼き立てのパンとお飲物のセット！充実のフリーアメニティーやレディースポーチプレゼント！,【アクセス】◎東京メトロ東西線・日比谷線『茅場町駅』７番出口徒歩１分◎都営浅草線『日本橋駅』Ｄ２番出口徒歩５分,エリア ： 東京都 > 東京・神田・日本橋,2016-03-28 04:17:58,2016-03-28 04:17:58,"￥5,092〜","（￥2,546〜/人）",,,,,,,,,,,,,,,,,,,,,,,,,,,,,,,,,,,,,,,,,,,,,,,,,,,,,,,,,,,,,,,,,,,,,,,,,,,,
7960,スマイルホテル日本橋三越前（旧「鴨川イン日本橋」）,/yad322056/?stayCount=1&roomCount=1&adultNum=2&stayDay=&stayYear=&stayMonth=&dateUndecided=1&distCd=01&roomCrack=200000&screenId=UWW1402&yadNo=322056&callbackHistFlg=1,東京メトロ銀座線&半蔵門線三越前駅から徒歩2分。JR新日本橋駅から徒歩5分!セミダブルのゆったりベッド&インターネット接続全室完備!寛ぎの空間と充実したサービスでお客様の宿泊をサポート致します。,【アクセス】東京メトロ三越前駅・JR新日本橋駅Ａ１又はＡ４出口より徒歩２分。東京駅八重洲口徒歩20分、タクシー５分。,エリア ： 東京都 > 東京・神田・日本橋,2016-03-28 04:17:58,2016-03-28 04:17:58,"￥5,000〜","（￥2,500〜/人）",,,,,,,,,,,,,,,,,,,,,,,,,,,,,,,,,,,,,,,,,,,,,,,,,,,,,,,,,,,,,,,,,,,,,,,,,,,,
7961,アパホテル＜人形町駅北＞,/yad323155/?stayCount=1&roomCount=1&adultNum=2&stayDay=&stayYear=&stayMonth=&dateUndecided=1&distCd=01&roomCrack=200000&screenId=UWW1402&yadNo=323155&callbackHistFlg=1,舞浜駅、水道橋駅へ乗換1回！浅草、銀座、渋谷、六本木駅をはじめT-CAT、羽田空港にも好アクセス！徒歩圏内に4駅5路線があり利便性に優れ、直前予約にも対応、一人旅にもおすすめ！朝食バイキングも大人気！,【アクセス】東京メトロ日比谷線・都営地下鉄浅草線「人形町駅」A4出口より徒歩2分,エリア ： 東京都 > 東京・神田・日本橋,2016-03-28 04:17:58,2016-03-28 04:17:58,"￥5,555〜","（￥2,777〜/人）",,,,,,,,,,,,,,,,,,,,,,,,,,,,,,,,,,,,,,,,,,,,,,,,,,,,,,,,,,,,,,,,,,,,,,,,,,,,
7962,グランドセントラルホテル,/yad323236/?stayCount=1&roomCount=1&adultNum=2&stayDay=&stayYear=&stayMonth=&dateUndecided=1&distCd=01&roomCrack=200000&screenId=UWW1402&yadNo=323236&callbackHistFlg=1,神田駅以外に丸ノ内線の淡路町駅・新宿線の小川町駅迄４分。パス・シャワートイレ・イオンドライヤー付。有線無線ＬＡＮネット接続無料、２２型液晶テレビ。,【アクセス】東京駅隣りのJR神田駅より徒歩３、４分。銀座線（神田）、丸ノ内線（淡路町）からも徒歩４分以内。,エリア ： 東京都 > 東京・神田・日本橋,2016-03-28 04:17:58,2016-03-28 04:17:58,"￥6,944〜",（￥-/室）,,,,,,,,,,,,,,,,,,,,,,,,,,,,,,,,,,,,,,,,,,,,,,,,,,,,,,,,,,,,,,,,,,,,,,,,,,,,
7963,相鉄フレッサイン日本橋人形町,/yad327271/?stayCount=1&roomCount=1&adultNum=2&stayDay=&stayYear=&stayMonth=&dateUndecided=1&distCd=01&roomCrack=200000&screenId=UWW1402&yadNo=327271&callbackHistFlg=1,ビジネスに加えて、明治座、水天宮、甘酒横丁、日本橋への観光、ショッピングの拠点としてもご利用頂けるスタイリッシュなホテル。ご満足とご安心をお約束するワンランク上の「快適空間」が誕生しました。,【アクセス】日比谷線人形町駅から徒歩3分。都営浅草線人形町駅から徒歩5分。半蔵門線水天宮前駅から徒歩3分。,エリア ： 東京都 > 東京・神田・日本橋,2016-03-28 04:17:58,2016-03-28 04:17:58,"￥7,222〜","（￥3,611〜/人）",,,,,,,,,,,,,,,,,,,,,,,,,,,,,,,,,,,,,,,,,,,,,,,,,,,,,,,,,,,,,,,,,,,,,,,,,,,,
7964,ニューセントラルホテル,/yad328995/?stayCount=1&roomCount=1&adultNum=2&stayDay=&stayYear=&stayMonth=&dateUndecided=1&distCd=01&roomCrack=200000&screenId=UWW1402&yadNo=328995&callbackHistFlg=1,東京駅より1駅、地下鉄丸ノ内線・新宿線からも徒歩2分というアクセス。お台場・臨海副都心などのプレイスポットにも近く、観光やビジネスにも安心して利用できる。サウナ付大浴場やコインランドリーあり。,【アクセス】東京駅より1駅。アクセス便利なJR神田駅西口から徒歩２分。,エリア ： 東京都 > 東京・神田・日本橋,2016-03-28 04:17:58,2016-03-28 04:17:58,"￥8,148〜","（￥4,074〜/人）",,,,,,,,,,,,,,,,,,,,,,,,,,,,,,,,,,,,,,,,,,,,,,,,,,,,,,,,,,,,,,,,,,,,,,,,,,,,
7965,秋葉原ワシントンホテル,/yad332677/?stayCount=1&roomCount=1&adultNum=2&stayDay=&stayYear=&stayMonth=&dateUndecided=1&distCd=01&roomCrack=200000&screenId=UWW1402&yadNo=332677&callbackHistFlg=1,秋葉原らしい地域密着ホテル。声優卵のモーニングコールや鉄道ルームも好評！ＪＲ山手線・総武線・京浜東北線やつくばエクスプレス、地下鉄日比谷線・銀座線・新宿線も使えて便利♪　朝食は和洋バイキング。,【アクセス】JR秋葉原駅中央改札口徒歩約1分、東京メトロ日比谷線秋葉原駅徒歩2分、都営新宿線岩本町駅徒歩約3分。,エリア ： 東京都 > 東京・神田・日本橋,2016-03-28 04:17:58,2016-03-28 04:17:58,"￥11,296〜","（￥5,648〜/人）",,,,,,,,,,,,,,,,,,,,,,,,,,,,,,,,,,,,,,,,,,,,,,,,,,,,,,,,,,,,,,,,,,,,,,,,,,,,
7966,ホテル龍名館東京,/yad335356/?stayCount=1&roomCount=1&adultNum=2&stayDay=&stayYear=&stayMonth=&dateUndecided=1&distCd=01&roomCrack=200000&screenId=UWW1402&yadNo=335356&callbackHistFlg=1,ＪＲ東京駅八重洲北口より３分。ご多忙なビジネスシーン、観光の拠点に。創業百余年の歴史を伝える新しい形の「ホテル龍名館東京」で寛ぎのひとときを・・・。,【アクセス】ＪＲ東京駅八重洲北口より徒歩３分。東京メトロ日本橋駅Ａ３出口より１分。,エリア ： 東京都 > 東京・神田・日本橋,2016-03-28 04:17:58,2016-03-28 04:17:58,"￥14,907〜","（￥7,453〜/人）",,,,,,,,,,,,,,,,,,,,,,,,,,,,,,,,,,,,,,,,,,,,,,,,,,,,,,,,,,,,,,,,,,,,,,,,,,,,
7967,京王プレッソイン茅場町,/yad335944/?stayCount=1&roomCount=1&adultNum=2&stayDay=&stayYear=&stayMonth=&dateUndecided=1&distCd=01&roomCrack=200000&screenId=UWW1402&yadNo=335944&callbackHistFlg=1,地下鉄茅場町駅より徒歩1分。Ｔ−ＣＡＴまで徒歩１０分で成田＆羽田空港までも便利。舞浜まで２５分☆女性も安心＆満足♪東京都内アクセス抜群なのでビジネス＆観光拠点に！館内1階にコンビニあり。,【アクセス】地下鉄日比谷線・東西線　茅場町7番出口徒歩1分/東京駅車で5分/東京シティエアターミナル徒歩6分,エリア ： 東京都 > 東京・神田・日本橋,2016-03-28 04:17:58,2016-03-28 04:17:58,"￥6,944〜","（￥3,472〜/人）",,,,,,,,,,,,,,,,,,,,,,,,,,,,,,,,,,,,,,,,,,,,,,,,,,,,,,,,,,,,,,,,,,,,,,,,,,,,
7968,ヴィラフォンテーヌ日本橋箱崎,/yad341680/?stayCount=1&roomCount=1&adultNum=2&stayDay=&stayYear=&stayMonth=&dateUndecided=1&distCd=01&roomCrack=200000&screenId=UWW1402&yadNo=341680&callbackHistFlg=1,半蔵門線水天宮前駅から徒歩1分！渋谷・六本木・銀座・秋葉原・浅草・TDR・スカイツリーへのアクセス便利。空港へはT-CATからリムジンバスで♪幅140cmのゆったりベッド。朝食は嬉しい無料♪♪全客室WIFI有,【アクセス】地下鉄半蔵門線水天宮前駅2番出口より徒歩1分。地下鉄日比谷線人形町A2出口より徒歩7分。,エリア ： 東京都 > 東京・神田・日本橋,2016-03-28 04:17:58,2016-03-28 04:17:58,"￥5,740〜","（￥2,870〜/人）",,,,,,,,,,,,,,,,,,,,,,,,,,,,,,,,,,,,,,,,,,,,,,,,,,,,,,,,,,,,,,,,,,,,,,,,,,,,
7969,セントラルホテル,/yad343067/?stayCount=1&roomCount=1&adultNum=2&stayDay=&stayYear=&stayMonth=&dateUndecided=1&distCd=01&roomCrack=200000&screenId=UWW1402&yadNo=343067&callbackHistFlg=1,東京駅から1駅。絶好のアクセスは、ビジネスマンには何よりだ。また臨海副都心や東京ドームなどのプレイスポットにも近く観光や旅行、ショッピングの活動拠点として、どこに行くにもアクセスよく便利だ。,【アクセス】電車／JR山の手線神田駅下車、西口より徒歩1分車／首都高速〜神田橋ＩＣ〜神田駅方面5分,エリア ： 東京都 > 東京・神田・日本橋,2016-03-28 04:17:58,2016-03-28 04:17:58,"￥6,944〜","（￥3,472〜/人）",,,,,,,,,,,,,,,,,,,,,,,,,,,,,,,,,,,,,,,,,,,,,,,,,,,,,,,,,,,,,,,,,,,,,,,,,,,,
7970,Ｒ＆Ｂホテル東日本橋,/yad343948/?stayCount=1&roomCount=1&adultNum=2&stayDay=&stayYear=&stayMonth=&dateUndecided=1&distCd=01&roomCrack=200000&screenId=UWW1402&yadNo=343948&callbackHistFlg=1,ビジネス・観光に便利な立地！東京スカイツリー・秋葉原・東京ドーム・浅草・東京ディズニーランドアクセス抜群★清潔で機能的なお部屋とあつあつ焼きたてパンの朝食サービス付き！,【アクセス】地下鉄都営浅草線　東日本橋駅Ｂ３出口より徒歩約３分,エリア ： 東京都 > 東京・神田・日本橋,2016-03-28 04:17:58,2016-03-28 04:17:58,"￥6,611〜","（￥3,305〜/人）",,,,,,,,,,,,,,,,,,,,,,,,,,,,,,,,,,,,,,,,,,,,,,,,,,,,,,,,,,,,,,,,,,,,,,,,,,,,
7971,ホテルニュータウン秋葉原,/yad345285/?stayCount=1&roomCount=1&adultNum=2&stayDay=&stayYear=&stayMonth=&dateUndecided=1&distCd=01&roomCrack=200000&screenId=UWW1402&yadNo=345285&callbackHistFlg=1,秋葉原駅昭和通改札口から信号を渡って１分の好立地。全室シングルベッドですが１室２名様までの利用も可能。あなたの「アキバマイルーム」として、お二人の「シェアリングスペース」としてご活用ください。,【アクセス】ＪＲ・日比谷線秋葉原駅昭和通り改札口より信号を渡って三菱東京ＵＦＪ銀行の線路沿いから歩いて１分！,エリア ： 東京都 > 東京・神田・日本橋,2016-03-28 04:17:58,2016-03-28 04:17:58,"￥6,296〜","（￥3,148〜/人）",,,,,,,,,,,,,,,,,,,,,,,,,,,,,,,,,,,,,,,,,,,,,,,,,,,,,,,,,,,,,,,,,,,,,,,,,,,,
7972,パールホテル八重洲,/yad345627/?stayCount=1&roomCount=1&adultNum=2&stayDay=&stayYear=&stayMonth=&dateUndecided=1&distCd=01&roomCrack=200000&screenId=UWW1402&yadNo=345627&callbackHistFlg=1,全室12平米以上のゆったりとした間取りで、和風モダンを基調とし洗練された客室には20インチ液晶TVやシモンズのベッドなどを配置。全室高速インターネット対応可能で全館活水器を使い体にも優しい。,【アクセス】東京駅八重洲北口改札口より徒歩５分　　電話番号03-3246-8080　　東京メトロ日本橋駅A１出口から徒歩０分,エリア ： 東京都 > 東京・神田・日本橋,2016-03-28 04:17:58,2016-03-28 04:17:58,"￥8,888〜","（￥4,444〜/人）",,,,,,,,,,,,,,,,,,,,,,,,,,,,,,,,,,,,,,,,,,,,,,,,,,,,,,,,,,,,,,,,,,,,,,,,,,,,
7973,ホテルかずさや,/yad361698/?stayCount=1&roomCount=1&adultNum=2&stayDay=&stayYear=&stayMonth=&dateUndecided=1&distCd=01&roomCrack=200000&screenId=UWW1402&yadNo=361698&callbackHistFlg=1,地下鉄三越前駅・小伝馬町〜5分、東京駅からタクシーで5分、都内のどこに行くにも便利です！東京スカイツリーも東京メトロ半蔵門線で13分（三越前駅→押上駅）ビジネス＆観光に最適！各階無線ネット無料,【アクセス】JR総武横須賀快速線・新日本橋駅徒歩1分。JR山手線・神田駅徒歩5分。銀座線・三越前駅徒歩5分。,エリア ： 東京都 > 東京・神田・日本橋,2016-03-28 04:17:58,2016-03-28 04:17:58,"￥7,250〜","（￥3,625〜/人）",,,,,,,,,,,,,,,,,,,,,,,,,,,,,,,,,,,,,,,,,,,,,,,,,,,,,,,,,,,,,,,,,,,,,,,,,,,,
7974,八重洲ターミナルホテル,/yad363798/?stayCount=1&roomCount=1&adultNum=2&stayDay=&stayYear=&stayMonth=&dateUndecided=1&distCd=01&roomCrack=200000&screenId=UWW1402&yadNo=363798&callbackHistFlg=1,東京駅徒歩３分。自然の素材である石、木、葉などをモチーフにした、こだわりの空間。癒しとくつろぎをテーマにした心地良い空間が様々なシーンを演出。チェックイン午後１時、チェックアウト午前１１時。,【アクセス】ＪＲ東京駅八重洲北口より徒歩３分。地下鉄日本橋駅より徒歩３分。,エリア ： 東京都 > 東京・神田・日本橋,2016-03-28 04:17:58,2016-03-28 04:17:58,"￥9,074〜","（￥4,537〜/人）",,,,,,,,,,,,,,,,,,,,,,,,,,,,,,,,,,,,,,,,,,,,,,,,,,,,,,,,,,,,,,,,,,,,,,,,,,,,
7975,ヴィラフォンテーヌ日本橋三越前,/yad363851/?stayCount=1&roomCount=1&adultNum=2&stayDay=&stayYear=&stayMonth=&dateUndecided=1&distCd=01&roomCrack=200000&screenId=UWW1402&yadNo=363851&callbackHistFlg=1,"交通の要所,東京の中心“日本橋”観光には最適な都内各地（銀座･秋葉原･浅草）へ好アクセス！朝食は無料サービス。洗練された大人のホテル,ヴィラフォンテーヌ日本橋三越前へ是非一度お越し下さい。",【アクセス】三越前駅（半蔵門線B6/銀座線A5）から徒歩5分／人形町駅（日比谷線・浅草線）A5から徒歩7分,エリア ： 東京都 > 東京・神田・日本橋,2016-03-28 04:17:58,2016-03-28 04:17:58,"￥6,018〜","（￥3,009〜/人）",,,,,,,,,,,,,,,,,,,,,,,,,,,,,,,,,,,,,,,,,,,,,,,,,,,,,,,,,,,,,,,,,,,,,,,,,,,,
7976,ヴィラフォンテーヌ大手町,/yad365524/?stayCount=1&roomCount=1&adultNum=2&stayDay=&stayYear=&stayMonth=&dateUndecided=1&distCd=01&roomCrack=200000&screenId=UWW1402&yadNo=365524&callbackHistFlg=1,ＪＲ神田駅、地下鉄大手町駅より徒歩5分（至近出口)。東京駅からも徒歩圏内で都内各所へのアクセス抜群！音楽をモチーフにした客室は大人気。パン・サラダ・コーヒーを主とした朝食の無料サービス！,【アクセス】ＪＲ神田駅西口より徒歩5分・地下鉄大手町駅A2番出口より徒歩5分,エリア ： 東京都 > 東京・神田・日本橋,2016-03-28 04:17:58,2016-03-28 04:17:58,"￥8,518〜","（￥4,259〜/人）",,,,,,,,,,,,,,,,,,,,,,,,,,,,,,,,,,,,,,,,,,,,,,,,,,,,,,,,,,,,,,,,,,,,,,,,,,,,
7977,ホテルリブマックス日本橋箱崎,/yad375166/?stayCount=1&roomCount=1&adultNum=2&stayDay=&stayYear=&stayMonth=&dateUndecided=1&distCd=01&roomCrack=200000&screenId=UWW1402&yadNo=375166&callbackHistFlg=1,2015年新築♪半蔵門線・日比谷線・浅草線利用可能。滞在中は門限なし・出入りは自由♪鍵は持ち歩き不要なデジタルロックを採用。Ｔ−ＣＡＴまで徒歩5分。羽田まで約30分・成田まで約60分,【アクセス】東京メトロ半蔵門線　水天宮前駅　2番出口　直進　徒歩3分,エリア ： 東京都 > 東京・神田・日本橋,2016-03-28 04:17:58,2016-03-28 04:17:58,￥1〜,（￥1〜/人）,,,,,,,,,,,,,,,,,,,,,,,,,,,,,,,,,,,,,,,,,,,,,,,,,,,,,,,,,,,,,,,,,,,,,,,,,,,,
7978,グリッズホステルラウンジ東京日本橋イースト,/yad376493/?stayCount=1&roomCount=1&adultNum=2&stayDay=&stayYear=&stayMonth=&dateUndecided=1&distCd=01&roomCrack=200000&screenId=UWW1402&yadNo=376493&callbackHistFlg=1,モダンなデザインと最新の設備を取り入れた女性にも安心の清潔・おしゃれなデザイナーズカプセルホステル◆全館禁煙◆フロント24時間対応◆日本武道館、東京ドーム、東京ディズニーリゾートにも好アクセス！,【アクセス】新宿線　馬喰横山駅のA3出口から徒歩2分／浅草線　東日本橋駅のB2出口から徒歩2分／JR馬喰町駅から徒歩6分,エリア ： 東京都 > 東京・神田・日本橋,2016-03-28 04:17:58,2016-03-28 04:17:58,"￥18,518〜","（￥9,259〜/人）",,,,,,,,,,,,,,,,,,,,,,,,,,,,,,,,,,,,,,,,,,,,,,,,,,,,,,,,,,,,,,,,,,,,,,,,,,,,
7979,アパホテル＜日本橋浜町駅南＞,/yad377400/?stayCount=1&roomCount=1&adultNum=2&stayDay=&stayYear=&stayMonth=&dateUndecided=1&distCd=01&roomCrack=200000&screenId=UWW1402&yadNo=377400&callbackHistFlg=1,隅田川沿いに立地★4つの地下鉄駅が徒歩圏内で新宿、渋谷まで乗換無し！スカイツリー、東京ドーム、武道館も電車1本！東京シティ･エアターミナル(T-CAT)は徒歩9分！羽田空港、成田空港までリムジンバスあり,【アクセス】浜町駅から徒歩で6分森下駅・水天宮前駅は徒歩で9分人形町駅も徒歩圏内。車なら箱崎JCT(浜町出口)近く！,エリア ： 東京都 > 東京・神田・日本橋,2016-03-28 04:17:58,2016-03-28 04:17:58,"￥5,000〜","（￥2,500〜/人）",,,,,,,,,,,,,,,,,,,,,,,,,,,,,,,,,,,,,,,,,,,,,,,,,,,,,,,,,,,,,,,,,,,,,,,,,,,,
7980,コンフォートホテル東京神田,/yad377665/?stayCount=1&roomCount=1&adultNum=2&stayDay=&stayYear=&stayMonth=&dateUndecided=1&distCd=01&roomCrack=200000&screenId=UWW1402&yadNo=377665&callbackHistFlg=1,■JR神田駅、地下鉄「岩本町」駅にも近く、都内主要スポットへアクセス良好♪■Wi-Fi接続無料■24時迄挽きたてコーヒー無料■種類豊富な無料朝食■世界30カ国に展開、信頼のホテルブランド,【アクセス】JR山手線「神田」駅東口より徒歩約４分。都営新宿線「岩本町」駅A１番出口より徒歩約３分,エリア ： 東京都 > 東京・神田・日本橋,2016-03-28 04:17:58,2016-03-28 04:17:58,"￥7,222〜","（￥3,611〜/人）",,,,,,,,,,,,,,,,,,,,,,,,,,,,,,,,,,,,,,,,,,,,,,,,,,,,,,,,,,,,,,,,,,,,,,,,,,,,
7981,スーパーホテルＬｏｈａｓ東京駅八重洲中央口 八重桜の湯,/yad379411/?stayCount=1&roomCount=1&adultNum=2&stayDay=&stayYear=&stayMonth=&dateUndecided=1&distCd=01&roomCrack=200000&screenId=UWW1402&yadNo=379411&callbackHistFlg=1,【好立地＆好条件】,,エリア ： 東京都 > 東京・神田・日本橋,2016-03-28 04:17:58,2016-03-28 04:17:58,"￥12,962〜","（￥6,481〜/人）",,,,,,,,,,,,,,,,,,,,,,,,,,,,,,,,,,,,,,,,,,,,,,,,,,,,,,,,,,,,,,,,,,,,,,,,,,,,
