id,building_name,image_url,detail,access,address,created_at,updated_at,fee1,fee2,,,,,,,,,,,,,,,,,,,,,,,,,,,,,,,,,,,,,,,,,,,,,,,,,,,,,,,,,,,,,,,,,,,,,,,,,,,,
1096,恵の湯　神の郷温泉,/yad359285/?stayCount=1&roomCount=1&adultNum=2&stayDay=&stayYear=&stayMonth=&dateUndecided=1&distCd=01&roomCrack=200000&screenId=UWW1402&yadNo=359285&callbackHistFlg=1,北霧島の裾野、杉木立に囲まれた静かな佇まい。温泉は全て源泉掛け流しで飲用も可能。ご宿泊は本館、離れよりお選びいただけます。夕食は地元の旬の食材をつかった郷土料理をご用意致しております。,【アクセス】ＪＲ吉都線小林駅下車、タクシーで１０分。宮崎自動車道小林ＩＣより車で１０分。,エリア ： 宮崎県 > えびの・都城,2016-03-28 01:19:12,2016-03-28 01:19:12,"￥12,870〜","（￥6,435〜/人）",,,,,,,,,,,,,,,,,,,,,,,,,,,,,,,,,,,,,,,,,,,,,,,,,,,,,,,,,,,,,,,,,,,,,,,,,,,,
1097,ベッセルホテル都城,/yad364257/?stayCount=1&roomCount=1&adultNum=2&stayDay=&stayYear=&stayMonth=&dateUndecided=1&distCd=01&roomCrack=200000&screenId=UWW1402&yadNo=364257&callbackHistFlg=1,リーズナブルな料金で広い客室に全室クィーンサイズ(150cm幅)のベッドを設置。朝食、ネット接続、平面駐車場が無料。都城ICから4kmで、18歳以下のお子様は添い寝無料と、ビジネスにも・家族旅行にも最適！,【アクセス】「都城IC」から４Km,エリア ： 宮崎県 > えびの・都城,2016-03-28 01:19:12,2016-03-28 01:19:12,"￥5,185〜","（￥2,592〜/人）",,,,,,,,,,,,,,,,,,,,,,,,,,,,,,,,,,,,,,,,,,,,,,,,,,,,,,,,,,,,,,,,,,,,,,,,,,,,
1098,九州山河料理　極楽温泉　匠の宿,/yad375184/?stayCount=1&roomCount=1&adultNum=2&stayDay=&stayYear=&stayMonth=&dateUndecided=1&distCd=01&roomCrack=200000&screenId=UWW1402&yadNo=375184&callbackHistFlg=1,極楽温泉　匠の宿は、高千穂の峰(霧島連山)の麓に佇む、昔の懐かしさを思わせる宿です。,【アクセス】ＪＲ高原駅／宮崎自動車道高原,エリア ： 宮崎県 > えびの・都城,2016-03-28 01:19:12,2016-03-28 01:19:12,"￥12,407〜","（￥6,203〜/人）",,,,,,,,,,,,,,,,,,,,,,,,,,,,,,,,,,,,,,,,,,,,,,,,,,,,,,,,,,,,,,,,,,,,,,,,,,,,
1099,HOTEL AZ 宮崎延岡店,/yad338048/?stayCount=1&roomCount=1&adultNum=2&stayDay=&stayYear=&stayMonth=&dateUndecided=1&distCd=01&roomCrack=200000&screenId=UWW1402&yadNo=338048&callbackHistFlg=1,お客様のニーズに合わせたリーズナブルなビジネスホテルです☆彡無料駐車場・コインランドリー・１００円ショップ・バイキング形式の居酒屋など、あると便利な施設が揃っております♪♪,【アクセス】延岡道路　延岡ＪＣＴより車で18分,エリア ： 宮崎県 > 延岡,2016-03-28 01:19:12,2016-03-28 01:19:12,"￥7,000〜","（￥3,500〜/人）",,,,,,,,,,,,,,,,,,,,,,,,,,,,,,,,,,,,,,,,,,,,,,,,,,,,,,,,,,,,,,,,,,,,,,,,,,,,
1100,ＥＴＯランド,/yad301392/?stayCount=1&roomCount=1&adultNum=2&stayDay=&stayYear=&stayMonth=&dateUndecided=1&distCd=01&roomCrack=200000&screenId=UWW1402&yadNo=301392&callbackHistFlg=1,お子様から大人までみんなが楽しめる♪遊具で遊んだり、景色を眺めたり展望風呂で癒されたり…。自然の中で思い思いの時間をお過ごしいただけます。ご夕食の延岡発祥「チキン南蛮」も好評です☆,【アクセス】ＪＲ延岡駅から車で５０分,エリア ： 宮崎県 > 延岡,2016-03-28 01:19:12,2016-03-28 01:19:12,"￥7,222〜","（￥3,611〜/人）",,,,,,,,,,,,,,,,,,,,,,,,,,,,,,,,,,,,,,,,,,,,,,,,,,,,,,,,,,,,,,,,,,,,,,,,,,,,
1101,ホテルメリージュ延岡,/yad310885/?stayCount=1&roomCount=1&adultNum=2&stayDay=&stayYear=&stayMonth=&dateUndecided=1&distCd=01&roomCrack=200000&screenId=UWW1402&yadNo=310885&callbackHistFlg=1,延岡市の中心地（歓楽街へ徒歩３分）清流・五ヶ瀬河畔に位置した最高のロケーション。人が出会い人が集う、人に優しいハートビル法適合シティホテルです。全館『Wi-Fi』無料！！,【アクセス】国道10号線・延岡大橋北詰、昭和町交差点を２１８号線に入り高千穂方面へ。約２分,エリア ： 宮崎県 > 延岡,2016-03-28 01:19:12,2016-03-28 01:19:12,"￥6,000〜","（￥3,000〜/人）",,,,,,,,,,,,,,,,,,,,,,,,,,,,,,,,,,,,,,,,,,,,,,,,,,,,,,,,,,,,,,,,,,,,,,,,,,,,
1102,延岡ロイヤルホテル（ＫＯＳＣＯＩＮＮグループ）,/yad338965/?stayCount=1&roomCount=1&adultNum=2&stayDay=&stayYear=&stayMonth=&dateUndecided=1&distCd=01&roomCrack=200000&screenId=UWW1402&yadNo=338965&callbackHistFlg=1,平成28年1月15日よりKOSCOINNグループとしてリニューアルオープン致しました!!朝食無料サービス・全室無線LAN完備！！シャンプーバーや無料ティーサーバーも設置して、お客様をお待ち致しております！！,【アクセス】JR延岡駅より徒歩10分。,エリア ： 宮崎県 > 延岡,2016-03-28 01:19:12,2016-03-28 01:19:12,"￥3,685〜","（￥1,842〜/人）",,,,,,,,,,,,,,,,,,,,,,,,,,,,,,,,,,,,,,,,,,,,,,,,,,,,,,,,,,,,,,,,,,,,,,,,,,,,
1103,シティホテルプラザ延岡,/yad341023/?stayCount=1&roomCount=1&adultNum=2&stayDay=&stayYear=&stayMonth=&dateUndecided=1&distCd=01&roomCrack=200000&screenId=UWW1402&yadNo=341023&callbackHistFlg=1,ＪＲ延岡駅の改札口をでてすぐ左側！ビジネスにレジャーにおすすめです。都会派感覚の近代的で清潔な建物が女性にも大好評のビジネスホテルです！★全１８６室★インターネット無料接続★Wi-Fi対応★,【アクセス】ＪＲ延岡駅下車徒歩１分。九州自動車〜御船ＩＣ〜国道４４５号線〜２１８号線で車で２時間３０分。,エリア ： 宮崎県 > 延岡,2016-03-28 01:19:12,2016-03-28 01:19:12,"￥5,555〜","（￥2,777〜/人）",,,,,,,,,,,,,,,,,,,,,,,,,,,,,,,,,,,,,,,,,,,,,,,,,,,,,,,,,,,,,,,,,,,,,,,,,,,,
1104,プラザホテル延岡リーヴァ,/yad353510/?stayCount=1&roomCount=1&adultNum=2&stayDay=&stayYear=&stayMonth=&dateUndecided=1&distCd=01&roomCrack=200000&screenId=UWW1402&yadNo=353510&callbackHistFlg=1,全館WI-FI完備。プラグインハイブリット車、電気自動車用充電スタンド完備。シャンプーＢＡＲを始め、入浴剤・無料アメニティも充実！漫画コーナー・レンタルサイクル有りの都市型ホテルです。,【アクセス】JR日豊本線延岡駅下車徒歩１２分。延岡駅より路線バス乗車５分宮崎交通中央通二丁目バス停下車徒歩２分。,エリア ： 宮崎県 > 延岡,2016-03-28 01:19:12,2016-03-28 01:19:12,"￥4,629〜","（￥2,314〜/人）",,,,,,,,,,,,,,,,,,,,,,,,,,,,,,,,,,,,,,,,,,,,,,,,,,,,,,,,,,,,,,,,,,,,,,,,,,,,
1105,ビジネスホテルフクハラ(KOSCOINNグループ),/yad359176/?stayCount=1&roomCount=1&adultNum=2&stayDay=&stayYear=&stayMonth=&dateUndecided=1&distCd=01&roomCrack=200000&screenId=UWW1402&yadNo=359176&callbackHistFlg=1,ホテルフクハラではお得なプランを多数掲載しております♪AM6:30〜AM9:00まで朝食無料バイキングサービス実施しています(･∀･)★,【アクセス】ＪＲ延岡駅より船倉方面へ、徒歩で10分。車で約5分。,エリア ： 宮崎県 > 延岡,2016-03-28 01:19:12,2016-03-28 01:19:12,"￥4,611〜","（￥2,305〜/人）",,,,,,,,,,,,,,,,,,,,,,,,,,,,,,,,,,,,,,,,,,,,,,,,,,,,,,,,,,,,,,,,,,,,,,,,,,,,
1106,ビジネスホテルくどう,/yad363974/?stayCount=1&roomCount=1&adultNum=2&stayDay=&stayYear=&stayMonth=&dateUndecided=1&distCd=01&roomCrack=200000&screenId=UWW1402&yadNo=363974&callbackHistFlg=1,◆コンビニまで徒歩一分以内◆◆駐車場無料(台数制限あり)◆,【アクセス】JR日豊本線(佐伯‐鹿児島中央)延岡駅改札を出て、県道16号線を渡り、南へ200mほど。徒歩3分。,エリア ： 宮崎県 > 延岡,2016-03-28 01:19:12,2016-03-28 01:19:12,"￥4,351〜","（￥2,175〜/人）",,,,,,,,,,,,,,,,,,,,,,,,,,,,,,,,,,,,,,,,,,,,,,,,,,,,,,,,,,,,,,,,,,,,,,,,,,,,
1107,延岡第一ホテル,/yad371991/?stayCount=1&roomCount=1&adultNum=2&stayDay=&stayYear=&stayMonth=&dateUndecided=1&distCd=01&roomCrack=200000&screenId=UWW1402&yadNo=371991&callbackHistFlg=1,4月1日より料金大幅値下げします。シングル2食付４．５００円、素泊り３．０００円。屋上には大浴場があります（男性専用、金、土、日曜日は休むことがあります）。クレジット不可,【アクセス】宮崎インターより120分、高千穂より60分、大分より120分,エリア ： 宮崎県 > 延岡,2016-03-28 01:19:12,2016-03-28 01:19:12,"￥4,629〜",（￥-/室）,,,,,,,,,,,,,,,,,,,,,,,,,,,,,,,,,,,,,,,,,,,,,,,,,,,,,,,,,,,,,,,,,,,,,,,,,,,,
1108,ホテルルートイン延岡駅前,/yad376296/?stayCount=1&roomCount=1&adultNum=2&stayDay=&stayYear=&stayMonth=&dateUndecided=1&distCd=01&roomCrack=200000&screenId=UWW1402&yadNo=376296&callbackHistFlg=1,延岡駅前すぐ！◆大浴場有◆バイキング朝食無料サービス◆全室無料LAN･26型TV･VOD完備◆コインランドリー有◆WAON･ID支払可◆コンビニすぐ！◆団体様応相談◆延岡で１番新しいホテルです。,【アクセス】JR日豊本線　延岡駅より約80m徒歩1分／延岡バスセンターより約80m徒歩1分,エリア ： 宮崎県 > 延岡,2016-03-28 01:19:12,2016-03-28 01:19:12,"￥8,333〜","（￥4,166〜/人）",,,,,,,,,,,,,,,,,,,,,,,,,,,,,,,,,,,,,,,,,,,,,,,,,,,,,,,,,,,,,,,,,,,,,,,,,,,,
1109,ビジネスホテル東洋,/yad376319/?stayCount=1&roomCount=1&adultNum=2&stayDay=&stayYear=&stayMonth=&dateUndecided=1&distCd=01&roomCrack=200000&screenId=UWW1402&yadNo=376319&callbackHistFlg=1,延岡市の中心地に位置し、飲食店街と市役所まで１００ｍ！宮崎→大分を結ぶ、延岡ＩＣまで車５分！ビジネスにも観光にもアクセス最高です。飲食店街からの距離が安眠をお約束します。,【アクセス】延岡ＩＣから５分、延岡市役所から東へ１００メートのＮＴＴ延岡の前です。８階建のグリーンの建物です。,エリア ： 宮崎県 > 延岡,2016-03-28 01:19:12,2016-03-28 01:19:12,"￥6,944〜",（￥-/室）,,,,,,,,,,,,,,,,,,,,,,,,,,,,,,,,,,,,,,,,,,,,,,,,,,,,,,,,,,,,,,,,,,,,,,,,,,,,
1110,ＫＥＮＲＯＫＵＥＮ　ＩＮＮ,/yad377105/?stayCount=1&roomCount=1&adultNum=2&stayDay=&stayYear=&stayMonth=&dateUndecided=1&distCd=01&roomCrack=200000&screenId=UWW1402&yadNo=377105&callbackHistFlg=1,"鞄ひとつで楽ちんステイ〜♪ウィークリーマンションのようにお使い頂けます。２食付4,740円〜",【アクセス】JR日豊本線延岡駅下車　徒歩３分,エリア ： 宮崎県 > 延岡,2016-03-28 01:19:12,2016-03-28 01:19:12,"￥5,925〜","（￥2,962〜/人）",,,,,,,,,,,,,,,,,,,,,,,,,,,,,,,,,,,,,,,,,,,,,,,,,,,,,,,,,,,,,,,,,,,,,,,,,,,,
1111,延岡アーバンホテル,/yad379542/?stayCount=1&roomCount=1&adultNum=2&stayDay=&stayYear=&stayMonth=&dateUndecided=1&distCd=01&roomCrack=200000&screenId=UWW1402&yadNo=379542&callbackHistFlg=1,★全館Ｗｉ-Ｆｉ対応　★３２型ＴＶ導入(ツインは４０型）　★ＢＳ受信　延岡市の中心地！飲食店街に隣接！立地最高です！※この度、延岡アーバンホテルは「適マーク」を交付されました※,【アクセス】延岡駅から車で5分,エリア ： 宮崎県 > 延岡,2016-03-28 01:19:12,2016-03-28 01:19:12,"￥6,388〜","（￥3,194〜/人）",,,,,,,,,,,,,,,,,,,,,,,,,,,,,,,,,,,,,,,,,,,,,,,,,,,,,,,,,,,,,,,,,,,,,,,,,,,,
1112,駐車場無料　駅正面に位置するホテル　ビジネスホテル延岡,/yad393745/?stayCount=1&roomCount=1&adultNum=2&stayDay=&stayYear=&stayMonth=&dateUndecided=1&distCd=01&roomCrack=200000&screenId=UWW1402&yadNo=393745&callbackHistFlg=1,とってもアットホーム！土日や連休も値上げなしの365日同料金。東九州でのビジネス、観光の拠点にぜひご利用下さい♪★インターネット接続無料（無線LAN）★ウォシュレット完備　★駐車場無料,【アクセス】ＪＲ日豊本線延岡駅から徒歩１分以内。宮崎交通「延岡バスセンター」目の前,エリア ： 宮崎県 > 延岡,2016-03-28 01:19:12,2016-03-28 01:19:12,"￥4,629〜","（￥2,314〜/人）",,,,,,,,,,,,,,,,,,,,,,,,,,,,,,,,,,,,,,,,,,,,,,,,,,,,,,,,,,,,,,,,,,,,,,,,,,,,
1113,旅館兼六園,/yad394002/?stayCount=1&roomCount=1&adultNum=2&stayDay=&stayYear=&stayMonth=&dateUndecided=1&distCd=01&roomCrack=200000&screenId=UWW1402&yadNo=394002&callbackHistFlg=1,延岡駅から徒歩3分。サウナ付の個性あふれる観音風呂で汗を流し、新鮮な海の幸のお食事で風呂上がりの一杯を！ビジネス滞在や合宿に便利で、毎日食事メニューが変わる。周辺の観光スポットも充実している。,【アクセス】日豊本線延岡駅より徒歩3分。道路アクセス至便。駐車場は無料で、４ｔトラック・マイクロバスも可。,エリア ： 宮崎県 > 延岡,2016-03-28 01:19:12,2016-03-28 01:19:12,"￥6,851〜","（￥3,425〜/人）",,,,,,,,,,,,,,,,,,,,,,,,,,,,,,,,,,,,,,,,,,,,,,,,,,,,,,,,,,,,,,,,,,,,,,,,,,,,
1114,リッチモンドホテル宮崎駅前,/yad300572/?stayCount=1&roomCount=1&adultNum=2&stayDay=&stayYear=&stayMonth=&dateUndecided=1&distCd=01&roomCrack=200000&screenId=UWW1402&yadNo=300572&callbackHistFlg=1,宮崎駅東口より徒歩２分の好立地！隣にコンビニエンスストアあり！広い客室に明るい照明と大型机を完備◆お部屋でより寛げるアメニティをプレゼント◆Wi-Fi全室無料◆朝食の和洋食バイキングリニューアル☆,【アクセス】JR宮崎駅東口より徒歩２分、宮崎空港よりJRで10分、宮崎自動車道宮崎ICより車で約15分,エリア ： 宮崎県 > 宮崎・青島・シーガイア,2016-03-28 01:19:12,2016-03-28 01:19:12,"￥7,407〜","（￥3,703〜/人）",,,,,,,,,,,,,,,,,,,,,,,,,,,,,,,,,,,,,,,,,,,,,,,,,,,,,,,,,,,,,,,,,,,,,,,,,,,,
1115,『子宝・安産の宿』地蔵庵,/yad305475/?stayCount=1&roomCount=1&adultNum=2&stayDay=&stayYear=&stayMonth=&dateUndecided=1&distCd=01&roomCrack=200000&screenId=UWW1402&yadNo=305475&callbackHistFlg=1,『子宝・安産の宿』１日６組限定。ｐＨ＝９.３のトロトロの美人湯を貸切で。お喜びの声新着トピックスにて紹介中♪安産子宝祈願にぜひお越しくださいませ。ご夕食付きプランが復活しました☆,【アクセス】宮崎自動車道宮崎ＩＣより国道２２０号線約１０ｋｍ約１２分→さらに県道３７７号線約３ｋｍ約３分。,エリア ： 宮崎県 > 宮崎・青島・シーガイア,2016-03-28 01:19:12,2016-03-28 01:19:12,"￥16,111〜","（￥8,055〜/人）",,,,,,,,,,,,,,,,,,,,,,,,,,,,,,,,,,,,,,,,,,,,,,,,,,,,,,,,,,,,,,,,,,,,,,,,,,,,
1116,ビジネス宮崎ロイヤルホテル,/yad308434/?stayCount=1&roomCount=1&adultNum=2&stayDay=&stayYear=&stayMonth=&dateUndecided=1&distCd=01&roomCrack=200000&screenId=UWW1402&yadNo=308434&callbackHistFlg=1,シングルルームは全てダブルベッド使用（ツインのシングルユースになる場合が御座います）駐車場無料※大型車可要予約（有料）モーニングコーヒーセルフサービスコンビニ、スーパー徒歩で1〜2分,【アクセス】日豊線宮崎駅西口から南へ徒歩で10分。,エリア ： 宮崎県 > 宮崎・青島・シーガイア,2016-03-28 01:19:12,2016-03-28 01:19:12,"￥5,194〜","（￥2,597〜/人）",,,,,,,,,,,,,,,,,,,,,,,,,,,,,,,,,,,,,,,,,,,,,,,,,,,,,,,,,,,,,,,,,,,,,,,,,,,,
1117,青島水光苑ホテル,/yad310608/?stayCount=1&roomCount=1&adultNum=2&stayDay=&stayYear=&stayMonth=&dateUndecided=1&distCd=01&roomCrack=200000&screenId=UWW1402&yadNo=310608&callbackHistFlg=1,＜政府登録＞　新鮮な魚介類が評判！地獲れの旨い魚とキレイな空気に癒される味自慢の宿・魚介類は天然物のみ使用。リーズナブルな宿泊料金で、休前日も平日と同料金！！,【アクセス】宮崎ICから車で10分,エリア ： 宮崎県 > 宮崎・青島・シーガイア,2016-03-28 01:19:12,2016-03-28 01:19:12,"￥8,333〜","（￥4,166〜/人）",,,,,,,,,,,,,,,,,,,,,,,,,,,,,,,,,,,,,,,,,,,,,,,,,,,,,,,,,,,,,,,,,,,,,,,,,,,,
1118,ガーデンテラス宮崎　ホテル＆リゾート,/yad314454/?stayCount=1&roomCount=1&adultNum=2&stayDay=&stayYear=&stayMonth=&dateUndecided=1&distCd=01&roomCrack=200000&screenId=UWW1402&yadNo=314454&callbackHistFlg=1,駅からほど近い立地からは想像がつかない程の静寂の中に佇むラグジュアリーホテル。世界的建築家・隈研吾氏によりデザインされた周囲の環境と風景に調和した空間。,【アクセス】宮崎駅から徒歩8分。宮崎空港/宮崎ＩＣから車で約20分。,エリア ： 宮崎県 > 宮崎・青島・シーガイア,2016-03-28 01:19:12,2016-03-28 01:19:12,"￥22,685〜","（￥11,342〜/人）",,,,,,,,,,,,,,,,,,,,,,,,,,,,,,,,,,,,,,,,,,,,,,,,,,,,,,,,,,,,,,,,,,,,,,,,,,,,
1119,ホテル　金住,/yad337229/?stayCount=1&roomCount=1&adultNum=2&stayDay=&stayYear=&stayMonth=&dateUndecided=1&distCd=01&roomCrack=200000&screenId=UWW1402&yadNo=337229&callbackHistFlg=1,大淀川河畔に位置する当館は、市の中心部にも近く何かと便利な立地にあります。美肌効果で好評の温泉や、地物にこだわりを持ったお料理とおもてなしの心を忘れずに思い出に残る旅行の一躍を担えれば…,【アクセス】宮崎駅〜車で5分　宮崎空港〜車で15分　宮崎IC〜車で15分　宮崎港〜車で10分,エリア ： 宮崎県 > 宮崎・青島・シーガイア,2016-03-28 01:19:12,2016-03-28 01:19:12,"￥8,333〜","（￥4,166〜/人）",,,,,,,,,,,,,,,,,,,,,,,,,,,,,,,,,,,,,,,,,,,,,,,,,,,,,,,,,,,,,,,,,,,,,,,,,,,,
1120,ビジネスホテル林荘,/yad349692/?stayCount=1&roomCount=1&adultNum=2&stayDay=&stayYear=&stayMonth=&dateUndecided=1&distCd=01&roomCrack=200000&screenId=UWW1402&yadNo=349692&callbackHistFlg=1,宮崎市の繁華街の中心に位置しており、低料金で充実した設備、客室も清潔感を心がけております。もちろん当ホテルの駐車場は無料にてご案内致しております(普通車)1.5トン以上別途700円(要予約)。,【アクセス】宮崎駅よりタクシーにて4分/宮崎空港よりお車で15分/宮崎ICよりお車で13分,エリア ： 宮崎県 > 宮崎・青島・シーガイア,2016-03-28 01:19:12,2016-03-28 01:19:12,"￥5,000〜","（￥2,500〜/人）",,,,,,,,,,,,,,,,,,,,,,,,,,,,,,,,,,,,,,,,,,,,,,,,,,,,,,,,,,,,,,,,,,,,,,,,,,,,
1121,酒泉の杜 綾陽亭,/yad357168/?stayCount=1&roomCount=1&adultNum=2&stayDay=&stayYear=&stayMonth=&dateUndecided=1&distCd=01&roomCrack=200000&screenId=UWW1402&yadNo=357168&callbackHistFlg=1,【蔵元】ならでは！様々なお酒の試飲ができ、お酒付きプランも豊富。自然の恵みを贅沢に取り入れた料理長自慢の会席料理と専用檜風呂をお楽しみください。第36回プロが選ぶ100選土産物施設部門第２位！,【アクセス】宮崎駅より車で４０分。宮崎空港より車で６０分。九州自動車道「小林ＩＣ」より６０分。,エリア ： 宮崎県 > 宮崎・青島・シーガイア,2016-03-28 01:19:12,2016-03-28 01:19:12,"￥32,000〜","（￥16,000〜/人）",,,,,,,,,,,,,,,,,,,,,,,,,,,,,,,,,,,,,,,,,,,,,,,,,,,,,,,,,,,,,,,,,,,,,,,,,,,,
1122,ビジネスホテルスイセン,/yad377964/?stayCount=1&roomCount=1&adultNum=2&stayDay=&stayYear=&stayMonth=&dateUndecided=1&distCd=01&roomCrack=200000&screenId=UWW1402&yadNo=377964&callbackHistFlg=1,宮崎県庁、宮崎市役所へ徒歩圏内。繁華街へも徒歩5分程。気軽に利用できるのが魅力。ベッドはゆったりサイズのセミダブルベッドを使用。,【アクセス】宮崎空港から車で約２０分・宮崎駅から車で約５分・県庁から徒歩約１０分,エリア ： 宮崎県 > 宮崎・青島・シーガイア,2016-03-28 01:19:12,2016-03-28 01:19:12,"￥5,500〜",（￥-/室）,,,,,,,,,,,,,,,,,,,,,,,,,,,,,,,,,,,,,,,,,,,,,,,,,,,,,,,,,,,,,,,,,,,,,,,,,,,,
1123,えぷろん亭,/yad386170/?stayCount=1&roomCount=1&adultNum=2&stayDay=&stayYear=&stayMonth=&dateUndecided=1&distCd=01&roomCrack=200000&screenId=UWW1402&yadNo=386170&callbackHistFlg=1,日南海岸ドライブコース！国道220号線沿いに佇む全3室の小さな宿。太平洋を眼下に見下ろす部屋で潮香と波音を聞きながら、のんびりとした時間を―。新鮮な魚介類と海から昇る日の出は格別です♪,【アクセス】ＪＲ日南線　小内海駅より南へ徒歩１５分／バスの場合、宮崎交通「洋香園」より徒歩２分,エリア ： 宮崎県 > 宮崎・青島・シーガイア,2016-03-28 01:19:12,2016-03-28 01:19:12,"￥10,000〜","（￥5,000〜/人）",,,,,,,,,,,,,,,,,,,,,,,,,,,,,,,,,,,,,,,,,,,,,,,,,,,,,,,,,,,,,,,,,,,,,,,,,,,,
1124,宮崎グリーンホテル,/yad398510/?stayCount=1&roomCount=1&adultNum=2&stayDay=&stayYear=&stayMonth=&dateUndecided=1&distCd=01&roomCrack=200000&screenId=UWW1402&yadNo=398510&callbackHistFlg=1,『サービスや特典が良く、スタッフさんの対応も丁寧！』（クチコミより）コンビニ・飲食店も近く、フリードリンクにシャンプーバー、漫画・Wifiなど充実のサービス♪ぽかぽか♪ウキウキ♪宮崎へＧＯ！　,【アクセス】宮崎ＩＣから15分　　宮崎西ＩＣから10分　　宮崎空港から20分　　ＪＲ宮崎駅から5分　（全て車の場合）,エリア ： 宮崎県 > 宮崎・青島・シーガイア,2016-03-28 01:19:12,2016-03-28 01:19:12,"￥3,611〜","（￥1,805〜/人）",,,,,,,,,,,,,,,,,,,,,,,,,,,,,,,,,,,,,,,,,,,,,,,,,,,,,,,,,,,,,,,,,,,,,,,,,,,,
1125,宮崎観光ホテル,/yad300515/?stayCount=1&roomCount=1&adultNum=2&stayDay=&stayYear=&stayMonth=&dateUndecided=1&distCd=01&roomCrack=200000&screenId=UWW1402&yadNo=300515&callbackHistFlg=1,60周年の感謝を込めて★じゃらん限定のお得な素泊まりプランが登場！館内には和食・フレンチ・イタリアン・中華・鉄板焼きなどレストランも充実。館内の「たまゆらの湯」温泉は宿泊者は無料で利用できます♪,【アクセス】宮崎空港より車で１５分。ＪＲ宮崎駅より車で５分。（バス停）橘通１丁目で下車、徒歩10分,エリア ： 宮崎県 > 宮崎・青島・シーガイア,2016-03-28 01:19:12,2016-03-28 01:19:12,"￥10,000〜","（￥5,000〜/人）",,,,,,,,,,,,,,,,,,,,,,,,,,,,,,,,,,,,,,,,,,,,,,,,,,,,,,,,,,,,,,,,,,,,,,,,,,,,
1126,スーパーホテル宮崎,/yad309436/?stayCount=1&roomCount=1&adultNum=2&stayDay=&stayYear=&stayMonth=&dateUndecided=1&distCd=01&roomCrack=200000&screenId=UWW1402&yadNo=309436&callbackHistFlg=1,出張はもちろんのことレジャーに最適♪宮崎空港から車で約２０分♪宮崎一の繁華街【ニシタチ】にも近く好立地♪◎全室ゆったりダブルサイズのベッドでリラックスして、南国をご堪能くださいませ♪,【アクセス】宮崎空港より車で約２０分。宮崎駅からは車で約５分。橘通にあり、県庁、繁華街、コンビニに近く立地◎,エリア ： 宮崎県 > 宮崎・青島・シーガイア,2016-03-28 01:19:12,2016-03-28 01:19:12,"￥4,444〜","（￥2,222〜/人）",,,,,,,,,,,,,,,,,,,,,,,,,,,,,,,,,,,,,,,,,,,,,,,,,,,,,,,,,,,,,,,,,,,,,,,,,,,,
1127,民宿ｉｎｎ　みやざき　湯楽庵,/yad309761/?stayCount=1&roomCount=1&adultNum=2&stayDay=&stayYear=&stayMonth=&dateUndecided=1&distCd=01&roomCrack=200000&screenId=UWW1402&yadNo=309761&callbackHistFlg=1,大淀川河畔に位置するたった８室の隠れ宿■全室ひのき風呂がついたエキゾチックな和風民宿■沖縄西表島で民宿を営んでいた店主夫婦の沖縄料理＆関西の味＆九州宮崎の新鮮食材のコラボをお楽しみください。,【アクセス】宮崎IC・JR日豊本線宮崎駅・宮崎空港・宮崎港フェリーターミナルより車で10分圏内,エリア ： 宮崎県 > 宮崎・青島・シーガイア,2016-03-28 01:19:12,2016-03-28 01:19:12,"￥8,333〜","（￥4,166〜/人）",,,,,,,,,,,,,,,,,,,,,,,,,,,,,,,,,,,,,,,,,,,,,,,,,,,,,,,,,,,,,,,,,,,,,,,,,,,,
1128,青島天然温泉 ルートイングランティアあおしま太陽閣,/yad309928/?stayCount=1&roomCount=1&adultNum=2&stayDay=&stayYear=&stayMonth=&dateUndecided=1&distCd=01&roomCrack=200000&screenId=UWW1402&yadNo=309928&callbackHistFlg=1,観光名所『青島』の高台に建ち、展望レストランと「美人の湯」で知られる青島天然温泉（露天風呂）が自慢◆Wi-Fi完備◆宴会場・会議室･テニスコート・漫画コーナー・コインランドリーあり◆団体様応相談,【アクセス】宮崎空港から車で１３分。子供の国駅から徒歩１5分。宮崎自動車道…宮崎ＩＣから日南方面へ１５分。,エリア ： 宮崎県 > 宮崎・青島・シーガイア,2016-03-28 01:19:12,2016-03-28 01:19:12,"￥8,194〜","（￥4,097〜/人）",,,,,,,,,,,,,,,,,,,,,,,,,,,,,,,,,,,,,,,,,,,,,,,,,,,,,,,,,,,,,,,,,,,,,,,,,,,,
