id,building_name,image_url,detail,access,address,created_at,updated_at,fee1,fee2,,,,,,,,,,,,,,,,,,,,,,,,,,,,,,,,,,,,,,,,,,,,,,,,,,,,,,,,,,,,,,,,,,,,,,,,,,,,
7622,コンラッド東京,/yad349621/?stayCount=1&roomCount=1&adultNum=2&stayDay=&stayYear=&stayMonth=&dateUndecided=1&distCd=01&roomCrack=200000&screenId=UWW1402&yadNo=349621&callbackHistFlg=1,銀座から徒歩圏内に位置する「コンラッド東京」。客室はスタンダードルームでも広々の48,,エリア ： 東京都 > お台場・汐留・竹芝,2016-03-28 04:17:58,2016-03-28 04:17:58,"￥46,920〜","（￥23,460〜/人）",,,,,,,,,,,,,,,,,,,,,,,,,,,,,,,,,,,,,,,,,,,,,,,,,,,,,,,,,,,,,,,,,,,,,,,,,,,,
7623,ヒルトン東京お台場,/yad311218/?stayCount=1&roomCount=1&adultNum=2&stayDay=&stayYear=&stayMonth=&dateUndecided=1&distCd=01&roomCrack=200000&screenId=UWW1402&yadNo=311218&callbackHistFlg=1,羽田空港からバスで約20分、銀座・品川までも30分圏内、東京ビッグサイトも近くとビジネスにも最適。TDRへはホテル発「グッドネイバーバス」が無料運行！プライベートバルコニーからの夜景は必見！,【アクセス】ゆりかもめ台場駅直結。りんかい線東京テレポート駅下車徒歩約10分（無料バス「東京ベイシャトル」あり）。,エリア ： 東京都 > お台場・汐留・竹芝,2016-03-28 04:17:58,2016-03-28 04:17:58,"￥21,279〜","（￥10,639〜/人）",,,,,,,,,,,,,,,,,,,,,,,,,,,,,,,,,,,,,,,,,,,,,,,,,,,,,,,,,,,,,,,,,,,,,,,,,,,,
7624,ベイサイドホテルアジュール竹芝,/yad317787/?stayCount=1&roomCount=1&adultNum=2&stayDay=&stayYear=&stayMonth=&dateUndecided=1&distCd=01&roomCrack=200000&screenId=UWW1402&yadNo=317787&callbackHistFlg=1,ﾚｲﾝﾎﾞｰﾌﾞﾘｯｼﾞからお台場まで雄大な景観に圧倒されるお部屋からの眺望も宝石箱を思わせるような夜景がご覧頂けます館内には3つのﾚｽﾄﾗﾝがあり､素晴しいﾛｹｰｼｮﾝでお愉しみ頂けます,【アクセス】JR山手線・京浜東北線浜松町駅より竹芝方向へ徒歩７分。新交通ゆりかもめ竹芝駅より１分。,エリア ： 東京都 > お台場・汐留・竹芝,2016-03-28 04:17:58,2016-03-28 04:17:58,"￥7,222〜","（￥3,611〜/人）",,,,,,,,,,,,,,,,,,,,,,,,,,,,,,,,,,,,,,,,,,,,,,,,,,,,,,,,,,,,,,,,,,,,,,,,,,,,
7625,お台場　大江戸温泉物語,/yad319550/?stayCount=1&roomCount=1&adultNum=2&stayDay=&stayYear=&stayMonth=&dateUndecided=1&distCd=01&roomCrack=200000&screenId=UWW1402&yadNo=319550&callbackHistFlg=1,日帰りから、宿泊まで、お客様が楽しめる癒しのアミューズメント地下１４００メートルから湧く湯量たっぷりの源泉「大江戸温泉」など十四種類のお風呂を堪能。足湯で浴衣姿の語らいもまた小粋。,【アクセス】新交通ゆりかもめ「テレコムセンター」駅より徒歩2分,エリア ： 東京都 > お台場・汐留・竹芝,2016-03-28 04:17:58,2016-03-28 04:17:58,"￥17,000〜",（￥-/室）,,,,,,,,,,,,,,,,,,,,,,,,,,,,,,,,,,,,,,,,,,,,,,,,,,,,,,,,,,,,,,,,,,,,,,,,,,,,
7626,パークホテル東京,/yad345712/?stayCount=1&roomCount=1&adultNum=2&stayDay=&stayYear=&stayMonth=&dateUndecided=1&distCd=01&roomCrack=200000&screenId=UWW1402&yadNo=345712&callbackHistFlg=1,日本の美意識を体感できるアートを取り入れたホテル◆JR・地下鉄「新橋」駅徒歩7分、ゆりかもめ「汐留」駅直結◆銀座や築地へも徒歩圏内、羽田・成田空港までのリムジンバス有◆全室26階以上＆WiFi無料！,【アクセス】JR「新橋」駅徒歩7分、新交通ゆりかもめ「汐留」駅直結、都営大江戸線「汐留」駅直結,エリア ： 東京都 > お台場・汐留・竹芝,2016-03-28 04:17:58,2016-03-28 04:17:58,"￥16,203〜","（￥8,101〜/人）",,,,,,,,,,,,,,,,,,,,,,,,,,,,,,,,,,,,,,,,,,,,,,,,,,,,,,,,,,,,,,,,,,,,,,,,,,,,
7627,ホテルサンルート有明,/yad350291/?stayCount=1&roomCount=1&adultNum=2&stayDay=&stayYear=&stayMonth=&dateUndecided=1&distCd=01&roomCrack=200000&screenId=UWW1402&yadNo=350291&callbackHistFlg=1,りんかい線国際展示場駅から徒歩3分。ホテルから東京ビッグサイトまで徒歩5分。舞浜までのTDRグッドネイバーバスが無料。羽田・成田空港からリムジンバス運行中。渋谷、新宿、池袋、新橋まで乗換なし。,【アクセス】りんかい線国際展示場駅、ゆりかもめ国際展示場正門駅からともに徒歩3分。首都高湾岸線有明ランプより3分。,エリア ： 東京都 > お台場・汐留・竹芝,2016-03-28 04:17:58,2016-03-28 04:17:58,"￥5,555〜","（￥2,777〜/人）",,,,,,,,,,,,,,,,,,,,,,,,,,,,,,,,,,,,,,,,,,,,,,,,,,,,,,,,,,,,,,,,,,,,,,,,,,,,
7628,ホテル グランパシフィック LE DAIBA,/yad397480/?stayCount=1&roomCount=1&adultNum=2&stayDay=&stayYear=&stayMonth=&dateUndecided=1&distCd=01&roomCrack=200000&screenId=UWW1402&yadNo=397480&callbackHistFlg=1,羽田空港からバスで約20分、銀座・新橋へは「ゆりかもめ」で約15分、ＴＤＲへは「グッドネイバーホテル・シャトル」の無料送迎もある。また、東京ビッグサイトも近くとレジャー・ビジネスに便利なホテル。,【アクセス】ゆりかもめ台場駅直結。りんかい線東京テレポート駅下車徒歩約10分（無料バス「東京ベイシャトル」あり）。,エリア ： 東京都 > お台場・汐留・竹芝,2016-03-28 04:17:58,2016-03-28 04:17:58,"￥10,185〜","（￥5,092〜/人）",,,,,,,,,,,,,,,,,,,,,,,,,,,,,,,,,,,,,,,,,,,,,,,,,,,,,,,,,,,,,,,,,,,,,,,,,,,,
7629,水道橋グランドホテル,/yad307812/?stayCount=1&roomCount=1&adultNum=2&stayDay=&stayYear=&stayMonth=&dateUndecided=1&distCd=01&roomCrack=200000&screenId=UWW1402&yadNo=307812&callbackHistFlg=1,ホテル周辺は江戸時代の名残のある文京の地。東京ドーム・ラクーアが目の前にあり、最寄り５つの駅まで徒歩５分以内と交通至便。ビジネス・レジャーに最適。１０階和室貴賓室松園では宿泊と食事が出来る。,【アクセス】地下鉄水道橋駅徒歩1分・後楽園駅徒歩3分・春日駅徒歩5分。JR水道橋駅徒歩5分,エリア ： 東京都 > お茶の水・湯島・本郷,2016-03-28 04:17:58,2016-03-28 04:17:58,"￥13,000〜","（￥6,500〜/人）",,,,,,,,,,,,,,,,,,,,,,,,,,,,,,,,,,,,,,,,,,,,,,,,,,,,,,,,,,,,,,,,,,,,,,,,,,,,
7630,お茶の水　ホテルジュラク,/yad323160/?stayCount=1&roomCount=1&adultNum=2&stayDay=&stayYear=&stayMonth=&dateUndecided=1&distCd=01&roomCrack=200000&screenId=UWW1402&yadNo=323160&callbackHistFlg=1,JR御茶ノ水駅徒歩2分、秋葉原徒歩6分とアクセス抜群。なによりおススメはクチコミでも絶賛の「あけびの実」自然派ビュッフェ朝食！ディナービュッフェはその場で握るお寿司や揚げたて天ぷらが大人気です♪,【アクセス】JR中央線、総武線「御茶ノ水駅」下車聖橋口、地下鉄千代田線「新御茶ノ水駅」B２出口より徒歩２分,エリア ： 東京都 > お茶の水・湯島・本郷,2016-03-28 04:17:58,2016-03-28 04:17:58,"￥10,000〜","（￥5,000〜/人）",,,,,,,,,,,,,,,,,,,,,,,,,,,,,,,,,,,,,,,,,,,,,,,,,,,,,,,,,,,,,,,,,,,,,,,,,,,,
7631,サクラホテル神保町,/yad324447/?stayCount=1&roomCount=1&adultNum=2&stayDay=&stayYear=&stayMonth=&dateUndecided=1&distCd=01&roomCrack=200000&screenId=UWW1402&yadNo=324447&callbackHistFlg=1,世界有数の書店街、神保町にあるホテル。東西線、半蔵門線、新宿線の地下鉄3線が利用可能。東京ドームや日本武道館も徒歩圏内！ビジネスや観光はもちろん、野球観戦やコンサートでお越しの方もどうぞ！,【アクセス】神保町駅A1出口を左方向へ専大前交差点を左折し、ファミリーマートを過ぎたら再び左折。徒歩1分,エリア ： 東京都 > お茶の水・湯島・本郷,2016-03-28 04:17:58,2016-03-28 04:17:58,"￥7,712〜",（￥-/室）,,,,,,,,,,,,,,,,,,,,,,,,,,,,,,,,,,,,,,,,,,,,,,,,,,,,,,,,,,,,,,,,,,,,,,,,,,,,
7632,ザ・ビーお茶の水（the b ochanomizu）,/yad327354/?stayCount=1&roomCount=1&adultNum=2&stayDay=&stayYear=&stayMonth=&dateUndecided=1&distCd=01&roomCrack=200000&screenId=UWW1402&yadNo=327354&callbackHistFlg=1,閑静なエリアにあり、女性お1人でも安心してご宿泊できるスタイリッシュなホテルです。秋葉原、丸ノ内、東京ドームまでも近く、ビジネス、レジャー問わず幅広くご利用いただけます。,【アクセス】地下鉄淡路町駅・小川町駅A5出口徒歩1分。地下鉄新御茶ノ水駅B3出口徒歩3分。ＪＲ御茶ノ水駅聖橋口徒歩6分,エリア ： 東京都 > お茶の水・湯島・本郷,2016-03-28 04:17:58,2016-03-28 04:17:58,"￥7,407〜","（￥3,703〜/人）",,,,,,,,,,,,,,,,,,,,,,,,,,,,,,,,,,,,,,,,,,,,,,,,,,,,,,,,,,,,,,,,,,,,,,,,,,,,
7633,お茶の水イン,/yad328108/?stayCount=1&roomCount=1&adultNum=2&stayDay=&stayYear=&stayMonth=&dateUndecided=1&distCd=01&roomCrack=200000&screenId=UWW1402&yadNo=328108&callbackHistFlg=1,【外壁及び防水工事のお知らせ】★工事期間　2016年2月29日(月)〜2016年4月28日(木)詳しくはプラン詳細をご確認下さい。　　東京のほぼ中央に位置し東京ドームは徒歩圏、舞浜へは35分,【アクセス】JR御茶ノ水駅聖橋口、地下鉄丸ノ内線御茶ノ水駅、千代田線新御茶ノ水駅いずれも聖橋を渡って徒歩3分。,エリア ： 東京都 > お茶の水・湯島・本郷,2016-03-28 04:17:58,2016-03-28 04:17:58,"￥6,759〜","（￥3,379〜/人）",,,,,,,,,,,,,,,,,,,,,,,,,,,,,,,,,,,,,,,,,,,,,,,,,,,,,,,,,,,,,,,,,,,,,,,,,,,,
7634,お茶の水セントヒルズホテル,/yad329365/?stayCount=1&roomCount=1&adultNum=2&stayDay=&stayYear=&stayMonth=&dateUndecided=1&distCd=01&roomCrack=200000&screenId=UWW1402&yadNo=329365&callbackHistFlg=1,お茶の水なら交通便利。2015年7月全館改装工事完了。客室からインターネットに有線LANとWi-Fi接続無料！焼きたてパンとコーヒー、オレンジジュースの朝食無料。東京消防庁優良防火対象物認定！,"【アクセス】JR中央,総武線・地下鉄丸ノ内線御茶ノ水駅、地下鉄千代田線新御茶ノ水駅、地下鉄銀座線末広町駅〜徒歩５分",エリア ： 東京都 > お茶の水・湯島・本郷,2016-03-28 04:17:58,2016-03-28 04:17:58,"￥12,500〜","（￥6,250〜/人）",,,,,,,,,,,,,,,,,,,,,,,,,,,,,,,,,,,,,,,,,,,,,,,,,,,,,,,,,,,,,,,,,,,,,,,,,,,,
7635,リッチモンドホテル東京水道橋,/yad332210/?stayCount=1&roomCount=1&adultNum=2&stayDay=&stayYear=&stayMonth=&dateUndecided=1&distCd=01&roomCrack=200000&screenId=UWW1402&yadNo=332210&callbackHistFlg=1,リッチモンドホテルズ新規オープン♪ビジネスにもレジャーにも好立地！東京ドームへ徒歩２分！地下鉄３路線/水道橋・後楽園・春日駅から徒歩５分、ＪＲ水道橋駅から８分。,【アクセス】地下鉄水道橋・後楽園・春日駅から徒歩５分、JR水道橋駅から徒歩8分、ドン・キホーテ後楽園店の上,エリア ： 東京都 > お茶の水・湯島・本郷,2016-03-28 04:17:58,2016-03-28 04:17:58,"￥8,796〜","（￥4,398〜/人）",,,,,,,,,,,,,,,,,,,,,,,,,,,,,,,,,,,,,,,,,,,,,,,,,,,,,,,,,,,,,,,,,,,,,,,,,,,,
7636,すえひろの湯　ドーミーイン秋葉原,/yad333285/?stayCount=1&roomCount=1&adultNum=2&stayDay=&stayYear=&stayMonth=&dateUndecided=1&distCd=01&roomCrack=200000&screenId=UWW1402&yadNo=333285&callbackHistFlg=1,■ドーミーイン秋葉原リニューアルオススメスペック■【1】全客室シモンズベッド完備　【2】レストラン全面リニューアル　和食、洋食から選べるプレートに【3】秋葉原にツインルームがいよいよ登場,【アクセス】JR秋葉原駅より徒歩5分。東京メトロ銀座線末広町駅より徒歩1分。,エリア ： 東京都 > お茶の水・湯島・本郷,2016-03-28 04:17:58,2016-03-28 04:17:58,"￥9,250〜","（￥4,625〜/人）",,,,,,,,,,,,,,,,,,,,,,,,,,,,,,,,,,,,,,,,,,,,,,,,,,,,,,,,,,,,,,,,,,,,,,,,,,,,
7637,相鉄フレッサイン　御茶ノ水神保町,/yad333672/?stayCount=1&roomCount=1&adultNum=2&stayDay=&stayYear=&stayMonth=&dateUndecided=1&distCd=01&roomCrack=200000&screenId=UWW1402&yadNo=333672&callbackHistFlg=1,Wi-Fi全室無料♪加湿機能付空気清浄機を全室設置♪神保町駅　徒歩3分、御茶ノ水駅　徒歩8分の好立地♪女性には嬉しい化粧水、乳液、洗顔付き♪非接触型ICカードキーで万全のセキュリティの快適空間♪,【アクセス】神保町駅より徒歩3分！御茶ノ水駅より徒歩8分！,エリア ： 東京都 > お茶の水・湯島・本郷,2016-03-28 04:17:58,2016-03-28 04:17:58,"￥7,407〜","（￥3,703〜/人）",,,,,,,,,,,,,,,,,,,,,,,,,,,,,,,,,,,,,,,,,,,,,,,,,,,,,,,,,,,,,,,,,,,,,,,,,,,,
7638,フォーレスト本郷,/yad369560/?stayCount=1&roomCount=1&adultNum=2&stayDay=&stayYear=&stayMonth=&dateUndecided=1&distCd=01&roomCrack=200000&screenId=UWW1402&yadNo=369560&callbackHistFlg=1,東京大学の正門からすぐ。東京メトロ東大前駅・本郷三丁目駅より徒歩圏内。新宿・東京・池袋へは30分以内。シングルは18,,エリア ： 東京都 > お茶の水・湯島・本郷,2016-03-28 04:17:58,2016-03-28 04:17:58,"￥10,648〜","（￥5,324〜/人）",,,,,,,,,,,,,,,,,,,,,,,,,,,,,,,,,,,,,,,,,,,,,,,,,,,,,,,,,,,,,,,,,,,,,,,,,,,,
7639,鳳明館　本館・台町別館,/yad392496/?stayCount=1&roomCount=1&adultNum=2&stayDay=&stayYear=&stayMonth=&dateUndecided=1&distCd=01&roomCrack=200000&screenId=UWW1402&yadNo=392496&callbackHistFlg=1,都内とは思えない庭のある閑静な純和風旅館の台町別館と有形文化財の本館。そんな非日常を御用意しております。,【アクセス】東京駅から地下鉄丸の内線で７分本郷三丁目駅から本郷通りを東京大学方面に徒歩１０分,エリア ： 東京都 > お茶の水・湯島・本郷,2016-03-28 04:17:58,2016-03-28 04:17:58,"￥12,037〜","（￥6,018〜/人）",,,,,,,,,,,,,,,,,,,,,,,,,,,,,,,,,,,,,,,,,,,,,,,,,,,,,,,,,,,,,,,,,,,,,,,,,,,,
7640,お茶の水ホテル　昇龍館,/yad393600/?stayCount=1&roomCount=1&adultNum=2&stayDay=&stayYear=&stayMonth=&dateUndecided=1&distCd=01&roomCrack=200000&screenId=UWW1402&yadNo=393600&callbackHistFlg=1,JRの他、地下鉄5路線の駅まで徒歩5分。武道館や秋葉原、東京ドーム、神保町本屋街も徒歩圏内。洋室の他、和室、露天風呂付客室もあり、観光にも最適！大浴場、サウナ（男性のみ）あり。,【アクセス】JR御茶ノ水駅の他、地下鉄半蔵門線、丸の内線、千代田線、都営新宿線、三田線の駅まで徒歩5分。,エリア ： 東京都 > お茶の水・湯島・本郷,2016-03-28 04:17:58,2016-03-28 04:17:58,"￥9,000〜","（￥4,500〜/人）",,,,,,,,,,,,,,,,,,,,,,,,,,,,,,,,,,,,,,,,,,,,,,,,,,,,,,,,,,,,,,,,,,,,,,,,,,,,
7641,伊豆大島　ホテル＆リゾート　マシオ,/yad304260/?stayCount=1&roomCount=1&adultNum=2&stayDay=&stayYear=&stayMonth=&dateUndecided=1&distCd=01&roomCrack=200000&screenId=UWW1402&yadNo=304260&callbackHistFlg=1,眼下に広がる黒潮の大海原、生い茂る緑の香り、木々のざわめき。鳥たちの歌声に耳をかたむけ、風に触れる。つかの間、ゆるやかに心と体をときほぐし、静かな時をおすごしください。五感をときはなして,【アクセス】大島元町港より車で約５分、岡田港より車で２０分、大島空港より車で１５分,エリア ： 東京都 > 伊豆七島・小笠原,2016-03-28 04:17:59,2016-03-28 04:17:59,"￥28,000〜","（￥14,000〜/人）",,,,,,,,,,,,,,,,,,,,,,,,,,,,,,,,,,,,,,,,,,,,,,,,,,,,,,,,,,,,,,,,,,,,,,,,,,,,
7642,八丈島パークホテル,/yad310816/?stayCount=1&roomCount=1&adultNum=2&stayDay=&stayYear=&stayMonth=&dateUndecided=1&distCd=01&roomCrack=200000&screenId=UWW1402&yadNo=310816&callbackHistFlg=1,◆羽田空港から飛行機で１時間以内のアイランド◆初めて島旅行される方を全力でサポートします！オーナーお手製の島内マップがあるからこそ八丈島の１泊目は、パークホテルへぜひお越しください。,【アクセス】【送迎あり】八丈島空港：車で約6分／底土港：車で約12分,エリア ： 東京都 > 伊豆七島・小笠原,2016-03-28 04:17:59,2016-03-28 04:17:59,"￥10,450〜","（￥5,225〜/人）",,,,,,,,,,,,,,,,,,,,,,,,,,,,,,,,,,,,,,,,,,,,,,,,,,,,,,,,,,,,,,,,,,,,,,,,,,,,
7643,ペンション　ブルーマーリン,/yad311688/?stayCount=1&roomCount=1&adultNum=2&stayDay=&stayYear=&stayMonth=&dateUndecided=1&distCd=01&roomCrack=200000&screenId=UWW1402&yadNo=311688&callbackHistFlg=1,ブルーマーリンは海辺に近く、一帯は緑濃い亜熱帯植物に囲まれた静かな環境。海水浴、ダイビング、釣り、ハイキング、温泉、史跡巡りと遊びを満喫の後はペンションディナーでお楽しみください。,【アクセス】羽田空港よりエアーニッポン又は竹芝桟橋より東海汽船,エリア ： 東京都 > 伊豆七島・小笠原,2016-03-28 04:17:59,2016-03-28 04:17:59,"￥9,629〜","（￥4,814〜/人）",,,,,,,,,,,,,,,,,,,,,,,,,,,,,,,,,,,,,,,,,,,,,,,,,,,,,,,,,,,,,,,,,,,,,,,,,,,,
7644,八丈ビューホテル,/yad311834/?stayCount=1&roomCount=1&adultNum=2&stayDay=&stayYear=&stayMonth=&dateUndecided=1&distCd=01&roomCrack=200000&screenId=UWW1402&yadNo=311834&callbackHistFlg=1,高台のラウンジから太平洋と満天の星空を眺め、釣り、ダイビング、トレッキング、名勝の滝や水平線に沈む夕陽と、見所盛りだくさん！屋外スポーツ施設も充実した常春の温か〜い島に、おじゃりやれ〜,【アクセス】八丈島空港より車５分。八丈島底土港より車１５分。バス「ビューホテル下」下車徒歩５分。,エリア ： 東京都 > 伊豆七島・小笠原,2016-03-28 04:17:59,2016-03-28 04:17:59,"￥10,000〜","（￥5,000〜/人）",,,,,,,,,,,,,,,,,,,,,,,,,,,,,,,,,,,,,,,,,,,,,,,,,,,,,,,,,,,,,,,,,,,,,,,,,,,,
7645,ホテル赤門,/yad314895/?stayCount=1&roomCount=1&adultNum=2&stayDay=&stayYear=&stayMonth=&dateUndecided=1&distCd=01&roomCrack=200000&screenId=UWW1402&yadNo=314895&callbackHistFlg=1,大島の海の玄関、元町港より徒歩1分の所に位置し絶好のロケーションが展開するホテル。豊かな緑と小動物達のささやきをバッググラウンドに、青い海原を通う観光船と勇壮な三原山が望めるよ。,【アクセス】元町港より徒歩1分　大島空港より車で１０分　岡田港より車で１５分　無料送迎あり,エリア ： 東京都 > 伊豆七島・小笠原,2016-03-28 04:17:59,2016-03-28 04:17:59,"￥16,666〜","（￥8,333〜/人）",,,,,,,,,,,,,,,,,,,,,,,,,,,,,,,,,,,,,,,,,,,,,,,,,,,,,,,,,,,,,,,,,,,,,,,,,,,,
7646,ロッジ　オーシャン,/yad318643/?stayCount=1&roomCount=1&adultNum=2&stayDay=&stayYear=&stayMonth=&dateUndecided=1&distCd=01&roomCrack=200000&screenId=UWW1402&yadNo=318643&callbackHistFlg=1,海水浴場・港（底土港に徒歩５分、）空港に車で７分。飲食街も徒歩圏の立地。ビジネスや観光に最適！洗濯機も共用スペースに設け思い思いの宿泊応援！宿と空港・港間の無料送迎あり(要予約制),【アクセス】アクセスは羽田発ANA定期便133〜166人乗り（1日3便・羽田⇒八丈）就航・海路は大型客船1日1便東京発,エリア ： 東京都 > 伊豆七島・小笠原,2016-03-28 04:17:59,2016-03-28 04:17:59,"￥7,222〜","（￥3,611〜/人）",,,,,,,,,,,,,,,,,,,,,,,,,,,,,,,,,,,,,,,,,,,,,,,,,,,,,,,,,,,,,,,,,,,,,,,,,,,,
7647,ホテル　リード・アズーロ,/yad328226/?stayCount=1&roomCount=1&adultNum=2&stayDay=&stayYear=&stayMonth=&dateUndecided=1&distCd=01&roomCrack=200000&screenId=UWW1402&yadNo=328226&callbackHistFlg=1,空港・底土港から車で7分。お部屋は和風モダンな洋室と和室をご用意。眼前に広がる八丈の海と島の食材を使った洋食が自慢の島内唯一の海岸隣接リゾート！2013年12月に本館客室改装しました。,【アクセス】八丈島空港・底土港から車で7分。,エリア ： 東京都 > 伊豆七島・小笠原,2016-03-28 04:17:59,2016-03-28 04:17:59,"￥9,000〜","（￥4,500〜/人）",,,,,,,,,,,,,,,,,,,,,,,,,,,,,,,,,,,,,,,,,,,,,,,,,,,,,,,,,,,,,,,,,,,,,,,,,,,,
7648,天然温泉の宿　ホテル白岩,/yad328548/?stayCount=1&roomCount=1&adultNum=2&stayDay=&stayYear=&stayMonth=&dateUndecided=1&distCd=01&roomCrack=200000&screenId=UWW1402&yadNo=328548&callbackHistFlg=1,大島の中心地元町にあり、島内観光には好都合。島の恵みが味わえるヘルシー料理も◎。大浴場や露天風呂は、1986年の三原山大噴火の際に噴出した、少し塩辛い温泉。お肌がスベスベになると評判です。,【アクセス】東海汽船、大島元町港より徒歩８分、岡田港より車で１５分、大島空港より車で７分。,エリア ： 東京都 > 伊豆七島・小笠原,2016-03-28 04:17:59,2016-03-28 04:17:59,"￥13,000〜","（￥6,500〜/人）",,,,,,,,,,,,,,,,,,,,,,,,,,,,,,,,,,,,,,,,,,,,,,,,,,,,,,,,,,,,,,,,,,,,,,,,,,,,
7649,でんハウス,/yad328614/?stayCount=1&roomCount=1&adultNum=2&stayDay=&stayYear=&stayMonth=&dateUndecided=1&distCd=01&roomCrack=200000&screenId=UWW1402&yadNo=328614&callbackHistFlg=1,でんハウスは、祖父母が愛着を持って暮らしていた民家をマシオ・リゾートがリノベーションし快適な設備とリラックスできる空間に整え、ご自分のスタイルでステイできる１組限定貸切の宿です。,【アクセス】大島元町港より車で約３分、岡田港より車で１５分、大島空港より車で１０分,エリア ： 東京都 > 伊豆七島・小笠原,2016-03-28 04:17:59,2016-03-28 04:17:59,"￥23,333〜",（￥-/室）,,,,,,,,,,,,,,,,,,,,,,,,,,,,,,,,,,,,,,,,,,,,,,,,,,,,,,,,,,,,,,,,,,,,,,,,,,,,
7650,リードパークリゾート八丈島,/yad342149/?stayCount=1&roomCount=1&adultNum=2&stayDay=&stayYear=&stayMonth=&dateUndecided=1&distCd=01&roomCrack=200000&screenId=UWW1402&yadNo=342149&callbackHistFlg=1,2015年夏、ホテルリード・アズーロの姉妹館として改装オープンしました！八丈島空港よりお車にて約８分駐車場:有り　３０台　無料　予約不要,【アクセス】八丈島空港よりお車にて約８分,エリア ： 東京都 > 伊豆七島・小笠原,2016-03-28 04:17:59,2016-03-28 04:17:59,"￥9,000〜","（￥4,500〜/人）",,,,,,,,,,,,,,,,,,,,,,,,,,,,,,,,,,,,,,,,,,,,,,,,,,,,,,,,,,,,,,,,,,,,,,,,,,,,
7651,シェルトーン＜八丈島＞,/yad351601/?stayCount=1&roomCount=1&adultNum=2&stayDay=&stayYear=&stayMonth=&dateUndecided=1&distCd=01&roomCrack=200000&screenId=UWW1402&yadNo=351601&callbackHistFlg=1,■全室バストイレ付＆WiFi完備■底土港が目の前＆空港からは車で5分■メインビーチ「底土海水浴場」まで徒歩3分■飲食店やスーパーが徒歩圏内で楽々■目の前の美しい海とゆっくり流れる島時間を満喫,【アクセス】■八丈島空港から車で5分　■底土港より徒歩1分,エリア ： 東京都 > 伊豆七島・小笠原,2016-03-28 04:17:59,2016-03-28 04:17:59,"￥10,000〜","（￥5,000〜/人）",,,,,,,,,,,,,,,,,,,,,,,,,,,,,,,,,,,,,,,,,,,,,,,,,,,,,,,,,,,,,,,,,,,,,,,,,,,,
7652,国民宿舎　サンマリーナ,/yad361922/?stayCount=1&roomCount=1&adultNum=2&stayDay=&stayYear=&stayMonth=&dateUndecided=1&distCd=01&roomCrack=200000&screenId=UWW1402&yadNo=361922&callbackHistFlg=1,底土港より徒歩5分。海水浴場前の好立地。客室は無線LAN接続OK!2Fテラスからは、朝は日の出、夜は漁火が眺められるよ。お食事は、八丈島産の魚や野菜の素材を生かした郷土料理で島を満喫。,【アクセス】八丈島空港より車で７分。東海汽船底土港より徒歩5分。,エリア ： 東京都 > 伊豆七島・小笠原,2016-03-28 04:17:59,2016-03-28 04:17:59,"￥10,200〜","（￥5,100〜/人）",,,,,,,,,,,,,,,,,,,,,,,,,,,,,,,,,,,,,,,,,,,,,,,,,,,,,,,,,,,,,,,,,,,,,,,,,,,,
7653,スナッパー,/yad363580/?stayCount=1&roomCount=1&adultNum=2&stayDay=&stayYear=&stayMonth=&dateUndecided=1&distCd=01&roomCrack=200000&screenId=UWW1402&yadNo=363580&callbackHistFlg=1,野鳥観察に最適！部屋からも天然記念物アカコッコやカラスバトを観察。ダイビングプログラム、観光、自然ガイドも常時開催。観光のお客様の他にお仕事のお客様も歓迎です。,【アクセス】三池港より15分、三宅島空港より15分、錆が浜港より25分、三ノ輪バス停より徒歩５分,エリア ： 東京都 > 伊豆七島・小笠原,2016-03-28 04:17:59,2016-03-28 04:17:59,"￥8,703〜","（￥4,351〜/人）",,,,,,,,,,,,,,,,,,,,,,,,,,,,,,,,,,,,,,,,,,,,,,,,,,,,,,,,,,,,,,,,,,,,,,,,,,,,
