id,building_name,image_url,detail,access,address,created_at,updated_at,fee1,fee2,,,,,,,,,,,,,,,,,,,,,,,,,,,,,,,,,,,,,,,,,,,,,,,,,,,,,,,,,,,,,,,,,,,,,,,,,,,,
7818,東急ステイ新橋,/yad331968/?stayCount=1&roomCount=1&adultNum=2&stayDay=&stayYear=&stayMonth=&dateUndecided=1&distCd=01&roomCrack=200000&screenId=UWW1402&yadNo=331968&callbackHistFlg=1,全室に高速インターネット回線完備・Wi-Fi利用可能（無料）！東京タワー・スカイツリーなど都内各所へも便利な立地です。洗濯乾燥機付きの客室もあるのでビジネスに観光に幅広くご利用いただけ便利♪,【アクセス】ＪＲ新橋駅烏森口より徒歩にて約５分。,エリア ： 東京都 > 新橋・芝,2016-03-28 04:17:58,2016-03-28 04:17:58,"￥10,185〜","（￥5,092〜/人）",,,,,,,,,,,,,,,,,,,,,,,,,,,,,,,,,,,,,,,,,,,,,,,,,,,,,,,,,,,,,,,,,,,,,,,,,,,,
7819,芝パークホテル,/yad335009/?stayCount=1&roomCount=1&adultNum=2&stayDay=&stayYear=&stayMonth=&dateUndecided=1&distCd=01&roomCrack=200000&screenId=UWW1402&yadNo=335009&callbackHistFlg=1,◆JR浜松町駅から徒歩7分◆羽田・成田空港までのリムジンバス有◆東京タワーまで徒歩10分、東京スカイツリーまで都営浅草線で1本乗り換えなし◆地下駐車場は40台収容可能でレジャー・ビジネスに便利なホテル,【アクセス】JR・東京モノレール浜松町駅北口から徒歩8分、都営地下鉄三田線御成門駅から徒歩2分,エリア ： 東京都 > 新橋・芝,2016-03-28 04:17:58,2016-03-28 04:17:58,"￥12,500〜","（￥6,250〜/人）",,,,,,,,,,,,,,,,,,,,,,,,,,,,,,,,,,,,,,,,,,,,,,,,,,,,,,,,,,,,,,,,,,,,,,,,,,,,
7820,日比谷シティホテル,/yad340166/?stayCount=1&roomCount=1&adultNum=2&stayDay=&stayYear=&stayMonth=&dateUndecided=1&distCd=01&roomCrack=200000&screenId=UWW1402&yadNo=340166&callbackHistFlg=1,虎ノ門ヒルズまで徒歩５分♪近所にコンビニ、日比谷通り沿いにあり東京タワーや銀座・汐留・お台場等どこへ行くにも絶好の立地。観光やビジネスに最適♪レストランも同時オープン♪,【アクセス】JR新橋駅烏森口より徒歩6分。都営三田線内幸町A3出口より徒歩3分,エリア ： 東京都 > 新橋・芝,2016-03-28 04:17:58,2016-03-28 04:17:58,"￥9,074〜","（￥4,537〜/人）",,,,,,,,,,,,,,,,,,,,,,,,,,,,,,,,,,,,,,,,,,,,,,,,,,,,,,,,,,,,,,,,,,,,,,,,,,,,
7821,ＴＨＥ　ＨＯＴＥＬ　ＳＨＩＮＢＡＳＨＩ,/yad366992/?stayCount=1&roomCount=1&adultNum=2&stayDay=&stayYear=&stayMonth=&dateUndecided=1&distCd=01&roomCrack=200000&screenId=UWW1402&yadNo=366992&callbackHistFlg=1,JR線・都営浅草線新橋駅から徒歩3分、東京メトロ銀座線新橋駅から徒歩5分、ゆりかもめ汐留駅から徒歩３分きめ細やかなおもてなしと快適な空間で心地よい時間を演出ビジネスや観光の拠点として最適,【アクセス】JR線・都営浅草線新橋駅から徒歩3分、ゆりかもめ汐留駅から徒歩３分、東京メトロ銀座線新橋駅から徒歩5分,エリア ： 東京都 > 新橋・芝,2016-03-28 04:17:58,2016-03-28 04:17:58,"￥6,000〜","（￥3,000〜/人）",,,,,,,,,,,,,,,,,,,,,,,,,,,,,,,,,,,,,,,,,,,,,,,,,,,,,,,,,,,,,,,,,,,,,,,,,,,,
7822,アパホテル＜新橋御成門＞,/yad370646/?stayCount=1&roomCount=1&adultNum=2&stayDay=&stayYear=&stayMonth=&dateUndecided=1&distCd=01&roomCrack=200000&screenId=UWW1402&yadNo=370646&callbackHistFlg=1,【新橋駅】【浜松町駅】【御成門駅】【大門駅】【汐留駅】・全駅徒歩10分圏内!■東京駅、国際フォーラム（有楽町駅）、ビックサイト、お台場、汐留(ゆりかもめ)、東京ドーム（三田線水道橋）、好アクセス！,【アクセス】ＪＲ新橋駅より徒歩9分、都営地下鉄三田線御成門駅より徒歩4分、都営地下鉄大門駅から徒歩7分,エリア ： 東京都 > 新橋・芝,2016-03-28 04:17:58,2016-03-28 04:17:58,"￥5,092〜","（￥2,546〜/人）",,,,,,,,,,,,,,,,,,,,,,,,,,,,,,,,,,,,,,,,,,,,,,,,,,,,,,,,,,,,,,,,,,,,,,,,,,,,
7823,芝大門ホテル,/yad375599/?stayCount=1&roomCount=1&adultNum=2&stayDay=&stayYear=&stayMonth=&dateUndecided=1&distCd=01&roomCrack=200000&screenId=UWW1402&yadNo=375599&callbackHistFlg=1,誠実なおもてなしと安心できるくつろぎの空間をご提供します。港区芝公園・・・歴史と新名所に囲まれた街の一角にあり、長年皆様に親しまれてきたホテルです。芝増上寺・東京タワーが徒歩圏内！,【アクセス】JR・東京モノレール浜松町駅北口より徒歩6分/都営浅草線・大江戸線大門駅Ａ６出口より徒歩1分,エリア ： 東京都 > 新橋・芝,2016-03-28 04:17:58,2016-03-28 04:17:58,"￥7,000〜","（￥3,500〜/人）",,,,,,,,,,,,,,,,,,,,,,,,,,,,,,,,,,,,,,,,,,,,,,,,,,,,,,,,,,,,,,,,,,,,,,,,,,,,
7824,三交インＧｒａｎｄｅ東京浜松町,/yad376874/?stayCount=1&roomCount=1&adultNum=2&stayDay=&stayYear=&stayMonth=&dateUndecided=1&distCd=01&roomCrack=200000&screenId=UWW1402&yadNo=376874&callbackHistFlg=1,２０１４年夏・ＮＥＷ　ＯＰＥＮ！羽田空港へアクセス◎ＪＲ浜松町駅より徒歩３分。全室バス・トイレ・洗面台独立の快適空間♪,【アクセス】JR・東京モノレール浜松町駅南口より徒歩約3分。都営大江戸線・浅草線A3出口より徒歩4分。,エリア ： 東京都 > 新橋・芝,2016-03-28 04:17:58,2016-03-28 04:17:58,"￥9,444〜","（￥4,722〜/人）",,,,,,,,,,,,,,,,,,,,,,,,,,,,,,,,,,,,,,,,,,,,,,,,,,,,,,,,,,,,,,,,,,,,,,,,,,,,
7825,ホテルリブマックス新橋,/yad378694/?stayCount=1&roomCount=1&adultNum=2&stayDay=&stayYear=&stayMonth=&dateUndecided=1&distCd=01&roomCrack=200000&screenId=UWW1402&yadNo=378694&callbackHistFlg=1,ＪＲ「新橋駅」徒歩8分・都営三田線「御成門駅」徒歩4分・都営大江戸線「大門駅」徒歩7分にあり。「東京」「新宿」などの主要エリアはもちろん、ゆりかもめ利用で「お台場」へもアクセスが良く便利な立地。,【アクセス】JR「新橋駅」徒歩8分♪都営三田線「御成門駅」徒歩4分♪都営大江戸線「大門駅」徒歩7分♪,エリア ： 東京都 > 新橋・芝,2016-03-28 04:17:58,2016-03-28 04:17:58,￥1〜,（￥1〜/人）,,,,,,,,,,,,,,,,,,,,,,,,,,,,,,,,,,,,,,,,,,,,,,,,,,,,,,,,,,,,,,,,,,,,,,,,,,,,
7826,ザ・プリンス パークタワー東京,/yad380035/?stayCount=1&roomCount=1&adultNum=2&stayDay=&stayYear=&stayMonth=&dateUndecided=1&distCd=01&roomCrack=200000&screenId=UWW1402&yadNo=380035&callbackHistFlg=1,東京駅や六本木へのアクセス良好。緑に囲まれた都内のオアシスのようなホテルでくつろぎのひと時を。テーマパークのある舞浜へは約30分。記念日や結婚記念日などのご宿泊におすすめです。,【アクセス】地下鉄大江戸線赤羽橋駅から徒歩2分/地下鉄三田線芝公園駅から徒歩3分/JR線浜松町駅から徒歩12分,エリア ： 東京都 > 新橋・芝,2016-03-28 04:17:58,2016-03-28 04:17:58,"￥21,851〜","（￥10,925〜/人）",,,,,,,,,,,,,,,,,,,,,,,,,,,,,,,,,,,,,,,,,,,,,,,,,,,,,,,,,,,,,,,,,,,,,,,,,,,,
7827,アネックスチェックイン新橋,/yad390014/?stayCount=1&roomCount=1&adultNum=2&stayDay=&stayYear=&stayMonth=&dateUndecided=1&distCd=01&roomCrack=200000&screenId=UWW1402&yadNo=390014&callbackHistFlg=1,JR新橋駅烏森口から徒歩3分。ホテルチェックイングループのひとつです。お客様の声を第一に、お客様の望むホテルを目指しています。★朝食は全プランサービスでご用意しております。★,【アクセス】JR新橋駅烏森口から徒歩3分,エリア ： 東京都 > 新橋・芝,2016-03-28 04:17:58,2016-03-28 04:17:58,"￥8,712〜","（￥4,356〜/人）",,,,,,,,,,,,,,,,,,,,,,,,,,,,,,,,,,,,,,,,,,,,,,,,,,,,,,,,,,,,,,,,,,,,,,,,,,,,
7828,ホテルヴィンテージ新宿,/yad304851/?stayCount=1&roomCount=1&adultNum=2&stayDay=&stayYear=&stayMonth=&dateUndecided=1&distCd=01&roomCrack=200000&screenId=UWW1402&yadNo=304851&callbackHistFlg=1,インターナショナルな街・新宿の中心部に位置する、全１９４室のくつろぎ空間。フロントは２４時間対応地デジ２６インチ液晶ワイドテレビ全室高速インタ−ネット接続対応（パソコンはご持参下さい）,【アクセス】ＪＲ新宿駅東口より徒歩10分、西武新宿駅北口より徒歩2分、東京メトロ副都心線東新宿駅A１より徒歩6分,エリア ： 東京都 > 新宿,2016-03-28 04:17:59,2016-03-28 04:17:59,"￥9,300〜","（￥4,650〜/人）",,,,,,,,,,,,,,,,,,,,,,,,,,,,,,,,,,,,,,,,,,,,,,,,,,,,,,,,,,,,,,,,,,,,,,,,,,,,
7829,新宿サンパークホテル,/yad308930/?stayCount=1&roomCount=1&adultNum=2&stayDay=&stayYear=&stayMonth=&dateUndecided=1&distCd=01&roomCrack=200000&screenId=UWW1402&yadNo=308930&callbackHistFlg=1,◆◇◆◇2013年10月2日リニューアルオープン!!!◆◇◆◇全客室内改装致しました♪ベッドはシモンズ社製で、快適な睡眠をサポート致します!!新しく禁煙フロアを設けました！,【アクセス】JR大久保駅より徒歩5分、JR新大久保駅より徒歩7分・新宿駅より車で１０分から１５分,エリア ： 東京都 > 新宿,2016-03-28 04:17:59,2016-03-28 04:17:59,"￥8,333〜","（￥4,166〜/人）",,,,,,,,,,,,,,,,,,,,,,,,,,,,,,,,,,,,,,,,,,,,,,,,,,,,,,,,,,,,,,,,,,,,,,,,,,,,
7830,City Hotel N.U.T.S,/yad316768/?stayCount=1&roomCount=1&adultNum=2&stayDay=&stayYear=&stayMonth=&dateUndecided=1&distCd=01&roomCrack=200000&screenId=UWW1402&yadNo=316768&callbackHistFlg=1,新宿御苑前駅より徒歩２分、６Ｆフロアリニューアル、ホテルで有名デザイナーのグラフィックアートをご覧ください。新宿伊勢丹や新宿御苑などは徒歩圏内の場所にあります。,【アクセス】新宿御苑前駅下車→1番出口→サブウェイの先30ｍ徒歩→新宿第一郵便局の角を右折、１つ目の角を左折。,エリア ： 東京都 > 新宿,2016-03-28 04:17:59,2016-03-28 04:17:59,"￥10,740〜","（￥5,370〜/人）",,,,,,,,,,,,,,,,,,,,,,,,,,,,,,,,,,,,,,,,,,,,,,,,,,,,,,,,,,,,,,,,,,,,,,,,,,,,
7831,ホテルサンルート東新宿,/yad318247/?stayCount=1&roomCount=1&adultNum=2&stayDay=&stayYear=&stayMonth=&dateUndecided=1&distCd=01&roomCrack=200000&screenId=UWW1402&yadNo=318247&callbackHistFlg=1,大江戸線・副都心線「東新宿駅」Ｂ２出口隣。「新宿歌舞伎町」の近くに位置し、ビジネス・観光の拠点に最適。人気のシモンズベッド・ロフテー快眠枕を全室に完備。カップルのリーズナブルなお泊まりにも◎♪,【アクセス】都営大江戸線・メトロ副都心線「東新宿駅」Ｂ２出口すぐ横,エリア ： 東京都 > 新宿,2016-03-28 04:17:59,2016-03-28 04:17:59,"￥6,481〜","（￥3,240〜/人）",,,,,,,,,,,,,,,,,,,,,,,,,,,,,,,,,,,,,,,,,,,,,,,,,,,,,,,,,,,,,,,,,,,,,,,,,,,,
7832,セントラルホテル東京,/yad319842/?stayCount=1&roomCount=1&adultNum=2&stayDay=&stayYear=&stayMonth=&dateUndecided=1&distCd=01&roomCrack=200000&screenId=UWW1402&yadNo=319842&callbackHistFlg=1,ナチュラルカラーでコーディネイトされた客室は、豊潤な安らぎにつつまれます。JR新宿駅より徒歩１分と絶好のロケーションにあり、ビジネスにレジャーにショッピングにも最適な拠点となります。,【アクセス】JR新宿駅中央東口より徒歩１分,エリア ： 東京都 > 新宿,2016-03-28 04:17:59,2016-03-28 04:17:59,"￥13,407〜","（￥6,703〜/人）",,,,,,,,,,,,,,,,,,,,,,,,,,,,,,,,,,,,,,,,,,,,,,,,,,,,,,,,,,,,,,,,,,,,,,,,,,,,
7833,ホテルサンルート高田馬場,/yad334165/?stayCount=1&roomCount=1&adultNum=2&stayDay=&stayYear=&stayMonth=&dateUndecided=1&distCd=01&roomCrack=200000&screenId=UWW1402&yadNo=334165&callbackHistFlg=1,ビジネス・観光の拠点に最適です。,【アクセス】JR高田馬場駅下車早稲田口より徒歩1分、東京メトロ東西線高田馬場駅下車3番出口より徒歩1分。,エリア ： 東京都 > 新宿,2016-03-28 04:17:59,2016-03-28 04:17:59,"￥8,518〜","（￥4,259〜/人）",,,,,,,,,,,,,,,,,,,,,,,,,,,,,,,,,,,,,,,,,,,,,,,,,,,,,,,,,,,,,,,,,,,,,,,,,,,,
7834,新宿ワシントンホテル（本館）　,/yad336266/?stayCount=1&roomCount=1&adultNum=2&stayDay=&stayYear=&stayMonth=&dateUndecided=1&distCd=01&roomCrack=200000&screenId=UWW1402&yadNo=336266&callbackHistFlg=1,,,エリア ： 東京都 > 新宿,2016-03-28 04:17:59,2016-03-28 04:17:59,"￥12,962〜","（￥6,481〜/人）",,,,,,,,,,,,,,,,,,,,,,,,,,,,,,,,,,,,,,,,,,,,,,,,,,,,,,,,,,,,,,,,,,,,,,,,,,,,
7835,サクラホテル幡ヶ谷,/yad338104/?stayCount=1&roomCount=1&adultNum=2&stayDay=&stayYear=&stayMonth=&dateUndecided=1&distCd=01&roomCrack=200000&screenId=UWW1402&yadNo=338104&callbackHistFlg=1,新宿から最寄りの幡ヶ谷駅まで京王新線でわずか2駅。最寄駅からは徒歩1分。フロントは24時間営業していますので女性1人でも御心配無く宿泊可能。女性用アメニティも有ります。全室洋室無線LAN完備。,【アクセス】甲州街道を新宿から八王子方面に向かい幡ヶ谷駅前で左折、３０Ｍ先を右折右手すぐ,エリア ： 東京都 > 新宿,2016-03-28 04:17:59,2016-03-28 04:17:59,"￥10,370〜",（￥-/室）,,,,,,,,,,,,,,,,,,,,,,,,,,,,,,,,,,,,,,,,,,,,,,,,,,,,,,,,,,,,,,,,,,,,,,,,,,,,
7836,Ｈｏｔｅｌ　ＥＭＰＩＲＥ　ｉｎ　ＳＨｉｎｊｕｋｕ,/yad339836/?stayCount=1&roomCount=1&adultNum=2&stayDay=&stayYear=&stayMonth=&dateUndecided=1&distCd=01&roomCrack=200000&screenId=UWW1402&yadNo=339836&callbackHistFlg=1,新宿駅より15分、新大久保駅３分でアクセス便利。客室はのんびり安らげる雰囲気。女性の一人利用も安心、交番からの紹介有り。韓流ショップ豊富。チックイン前やチックイン後のお荷物をお預かり出来ます,【アクセス】新宿駅より15分、山手線新大久保駅３分、大久保駅１分,エリア ： 東京都 > 新宿,2016-03-28 04:17:59,2016-03-28 04:17:59,"￥6,296〜",（￥-/室）,,,,,,,,,,,,,,,,,,,,,,,,,,,,,,,,,,,,,,,,,,,,,,,,,,,,,,,,,,,,,,,,,,,,,,,,,,,,
7837,Ｓｏｐｈｉｅａｒｔｈ　Ｈｏｓｔｅｌ,/yad346394/?stayCount=1&roomCount=1&adultNum=2&stayDay=&stayYear=&stayMonth=&dateUndecided=1&distCd=01&roomCrack=200000&screenId=UWW1402&yadNo=346394&callbackHistFlg=1,ソフィアスホステルは新宿駅から徒歩12分、新大久保駅から徒歩5分、東新宿駅から徒歩3分の大久保小学校のすぐ傍に位置して、交通便利性が優れてる若い方らの旅行者及びビジネスマンーに適合な宿泊所です。,【アクセス】大久保通りと職安通りの間にある大久保小学校のすぐ傍であります。,エリア ： 東京都 > 新宿,2016-03-28 04:17:59,2016-03-28 04:17:59,"￥5,000〜",（￥-/室）,,,,,,,,,,,,,,,,,,,,,,,,,,,,,,,,,,,,,,,,,,,,,,,,,,,,,,,,,,,,,,,,,,,,,,,,,,,,
7838,新大久保国際ホテル,/yad352922/?stayCount=1&roomCount=1&adultNum=2&stayDay=&stayYear=&stayMonth=&dateUndecided=1&distCd=01&roomCrack=200000&screenId=UWW1402&yadNo=352922&callbackHistFlg=1,賑やかな街とはガラリ変わって静かなお部屋と清潔なベッド。充実した共有スペースでは、遊びの余韻を楽しめます。短期〜長期滞在までお客様の幅広いニーズにお応えします。韓流ファンの女性、大歓迎です♪,【アクセス】新大久保駅改札をでて右通り沿いセブンイレブンを右折。東洋鍼灸専門学校を左折。次の角を右折し100,エリア ： 東京都 > 新宿,2016-03-28 04:17:59,2016-03-28 04:17:59,"￥8,796〜",（￥-/室）,,,,,,,,,,,,,,,,,,,,,,,,,,,,,,,,,,,,,,,,,,,,,,,,,,,,,,,,,,,,,,,,,,,,,,,,,,,,
7839,Best Hotel,/yad356665/?stayCount=1&roomCount=1&adultNum=2&stayDay=&stayYear=&stayMonth=&dateUndecided=1&distCd=01&roomCrack=200000&screenId=UWW1402&yadNo=356665&callbackHistFlg=1,駅や繁華街に近く、ビジネス・観光の拠点に最適！お部屋は静かでのんびり安らげるスペースです！チックイン前やチックイン後のお荷物をお預かり出来ます。新宿駅より徒歩12分。新大久保駅より徒歩5分,【アクセス】新宿より徒歩12分。西武新宿より徒歩8分。JR新大久保駅下車より徒歩5分。JR大久保駅下車より徒歩6分,エリア ： 東京都 > 新宿,2016-03-28 04:17:59,2016-03-28 04:17:59,"￥7,407〜","（￥3,703〜/人）",,,,,,,,,,,,,,,,,,,,,,,,,,,,,,,,,,,,,,,,,,,,,,,,,,,,,,,,,,,,,,,,,,,,,,,,,,,,
7840,ヴィアイン新宿,/yad359830/?stayCount=1&roomCount=1&adultNum=2&stayDay=&stayYear=&stayMonth=&dateUndecided=1&distCd=01&roomCrack=200000&screenId=UWW1402&yadNo=359830&callbackHistFlg=1,新宿三丁目駅C7出口よりから徒歩3分、JR新宿駅(東口)からは徒歩9分とは思えない、新宿御苑・花園神社等にほど近い緑あふれる閑静な場所です。◆朝焼きパン等がある無料の軽朝食もご利用下さい！◆,【アクセス】東京メトロ丸ノ内線・副都心線、都営新宿線　新宿三丁目駅C7出口より徒歩3〜4分,エリア ： 東京都 > 新宿,2016-03-28 04:17:59,2016-03-28 04:17:59,"￥7,685〜","（￥3,842〜/人）",,,,,,,,,,,,,,,,,,,,,,,,,,,,,,,,,,,,,,,,,,,,,,,,,,,,,,,,,,,,,,,,,,,,,,,,,,,,
7841,ビジネスホテルノーブル,/yad370194/?stayCount=1&roomCount=1&adultNum=2&stayDay=&stayYear=&stayMonth=&dateUndecided=1&distCd=01&roomCrack=200000&screenId=UWW1402&yadNo=370194&callbackHistFlg=1,便利な立地条件のもと、ゆったりとおくつろぎ下さい。近辺には、スーパー・コンビニもあり便利です。出張、ビジネス、観光・・・あらゆるニーズにお応えします！,【アクセス】JR新宿駅より京王新線で５分、幡ヶ谷駅で下車、徒歩２分,エリア ： 東京都 > 新宿,2016-03-28 04:17:59,2016-03-28 04:17:59,"￥8,800〜",（￥-/室）,,,,,,,,,,,,,,,,,,,,,,,,,,,,,,,,,,,,,,,,,,,,,,,,,,,,,,,,,,,,,,,,,,,,,,,,,,,,
7842,ヒルトン東京,/yad375177/?stayCount=1&roomCount=1&adultNum=2&stayDay=&stayYear=&stayMonth=&dateUndecided=1&distCd=01&roomCrack=200000&screenId=UWW1402&yadNo=375177&callbackHistFlg=1,★全室インターネット接続無料★新宿西口からはシャトルバス(無料)が運行！宿泊者全員フィットネス・プールが無料でご利用いただけます。高層階部屋からは新宿摩天楼のきらめく夜景が一望♪,【アクセス】丸ノ内線「西新宿駅」（C8出口）から徒歩2分、都営大江戸線「都庁前駅」から徒歩3分。,エリア ： 東京都 > 新宿,2016-03-28 04:17:59,2016-03-28 04:17:59,"￥30,274〜","（￥15,137〜/人）",,,,,,,,,,,,,,,,,,,,,,,,,,,,,,,,,,,,,,,,,,,,,,,,,,,,,,,,,,,,,,,,,,,,,,,,,,,,
7843,ハイアット リージェンシー 東京,/yad376515/?stayCount=1&roomCount=1&adultNum=2&stayDay=&stayYear=&stayMonth=&dateUndecided=1&distCd=01&roomCrack=200000&screenId=UWW1402&yadNo=376515&callbackHistFlg=1,お客様ひとりひとりにご満足いただけるようレストラン、スパ＆フィットネスなどの施設も充実。ホテル敷地内にコンビニエンスストア「セブン−イレブン」(24H)もあり！,【アクセス】JR新宿駅西口より徒歩9分。丸ノ内線西新宿駅より徒歩4分。大江戸線都庁前駅Ａ７出口より徒歩1分｡,エリア ： 東京都 > 新宿,2016-03-28 04:17:59,2016-03-28 04:17:59,"￥26,400〜","（￥13,200〜/人）",,,,,,,,,,,,,,,,,,,,,,,,,,,,,,,,,,,,,,,,,,,,,,,,,,,,,,,,,,,,,,,,,,,,,,,,,,,,
7844,全理連 代々木の宿（旧　全理連宿泊部）,/yad387698/?stayCount=1&roomCount=1&adultNum=2&stayDay=&stayYear=&stayMonth=&dateUndecided=1&distCd=01&roomCrack=200000&screenId=UWW1402&yadNo=387698&callbackHistFlg=1,,,エリア ： 東京都 > 新宿,2016-03-28 04:17:59,2016-03-28 04:17:59,"￥10,000〜","（￥5,000〜/人）",,,,,,,,,,,,,,,,,,,,,,,,,,,,,,,,,,,,,,,,,,,,,,,,,,,,,,,,,,,,,,,,,,,,,,,,,,,,
7845,ＣＩＴＹ　ＨＯＴＥＬ　ＧＯＬＤ,/yad390302/?stayCount=1&roomCount=1&adultNum=2&stayDay=&stayYear=&stayMonth=&dateUndecided=1&distCd=01&roomCrack=200000&screenId=UWW1402&yadNo=390302&callbackHistFlg=1,新大久保駅より徒歩７分。新宿までもすぐにアクセス出来ます。３０年以上経営している安心したシティホテルです。新大久保の中心にありビジネス・観光にも最適！（日本語のみの対応にさせて頂きます。）,【アクセス】JR山手線「新大久保駅」より徒歩７分　地下鉄「東新宿駅」より徒歩７分　総武線「大久保駅」より徒歩１０分,エリア ： 東京都 > 新宿,2016-03-28 04:17:59,2016-03-28 04:17:59,"￥7,037〜",（￥-/室）,,,,,,,,,,,,,,,,,,,,,,,,,,,,,,,,,,,,,,,,,,,,,,,,,,,,,,,,,,,,,,,,,,,,,,,,,,,,
7846,外苑ホテル,/yad399309/?stayCount=1&roomCount=1&adultNum=2&stayDay=&stayYear=&stayMonth=&dateUndecided=1&distCd=01&roomCrack=200000&screenId=UWW1402&yadNo=399309&callbackHistFlg=1,ＪＲ信濃町駅徒歩７分、神宮球場徒歩１０分。慶応病院の近く。女性一人でも安心！の静かな環境でリラックスしてお休み下さい。近隣にスポーツ施設有♪昭和の香りする、どこかなつかしいホテルです。,【アクセス】東京都新宿区大京町１３番地６号,エリア ： 東京都 > 新宿,2016-03-28 04:17:59,2016-03-28 04:17:59,"￥11,379〜","（￥5,689〜/人）",,,,,,,,,,,,,,,,,,,,,,,,,,,,,,,,,,,,,,,,,,,,,,,,,,,,,,,,,,,,,,,,,,,,,,,,,,,,
7847,二子玉川エクセルホテル東急,/yad304764/?stayCount=1&roomCount=1&adultNum=2&stayDay=&stayYear=&stayMonth=&dateUndecided=1&distCd=01&roomCrack=200000&screenId=UWW1402&yadNo=304764&callbackHistFlg=1,多くの客室では、天井まで広がる大窓から富士山や多摩川などの豊かな自然が織り成す美しい関東平野を眼下に見晴らすことが出来き、都会の喧騒から離れ、ゆったりとした時間をお楽しみ頂けます。,【アクセス】東急田園都市線　二子玉川駅から徒歩約５分,エリア ： 東京都 > 世田谷,2016-03-28 04:17:59,2016-03-28 04:17:59,"￥13,240〜","（￥6,620〜/人）",,,,,,,,,,,,,,,,,,,,,,,,,,,,,,,,,,,,,,,,,,,,,,,,,,,,,,,,,,,,,,,,,,,,,,,,,,,,
7848,ザ・ビー三軒茶屋（the b sangenjaya）,/yad323781/?stayCount=1&roomCount=1&adultNum=2&stayDay=&stayYear=&stayMonth=&dateUndecided=1&distCd=01&roomCrack=200000&screenId=UWW1402&yadNo=323781&callbackHistFlg=1,女性お1人様でも安心してご宿泊できるデザイナーズホテルとしてもご好評いただいており、滞在型のビジネスや旅行の拠点として、最適な利便性をご提供いたします。,【アクセス】電車／渋谷駅から東急田園都市線（半蔵門線乗入）三軒茶屋駅北口歩2分,エリア ： 東京都 > 世田谷,2016-03-28 04:17:59,2016-03-28 04:17:59,"￥10,185〜","（￥5,092〜/人）",,,,,,,,,,,,,,,,,,,,,,,,,,,,,,,,,,,,,,,,,,,,,,,,,,,,,,,,,,,,,,,,,,,,,,,,,,,,
7849,東急ステイ用賀,/yad376499/?stayCount=1&roomCount=1&adultNum=2&stayDay=&stayYear=&stayMonth=&dateUndecided=1&distCd=01&roomCrack=200000&screenId=UWW1402&yadNo=376499&callbackHistFlg=1,寛ぎの演出と充実の機能を兼ねそろえたリラックスして滞在できる。緑豊かな用賀に馴染み、誰もが気取らずに自然体でくつろげる空間へリニューアル。生まれ変わった東急ステイ用賀をお愉しみください。,【アクセス】東急田園都市線用賀駅から徒歩1分,エリア ： 東京都 > 世田谷,2016-03-28 04:17:59,2016-03-28 04:17:59,"￥9,629〜","（￥4,814〜/人）",,,,,,,,,,,,,,,,,,,,,,,,,,,,,,,,,,,,,,,,,,,,,,,,,,,,,,,,,,,,,,,,,,,,,,,,,,,,
7850,島根イン青山,/yad332631/?stayCount=1&roomCount=1&adultNum=2&stayDay=&stayYear=&stayMonth=&dateUndecided=1&distCd=01&roomCrack=200000&screenId=UWW1402&yadNo=332631&callbackHistFlg=1,下記の期間、工事を実施させていただきます。工事期間中は、騒音や塗料による臭気などが発生する場合がございます。◎工事期間　2015年12月1日〜2016年6月下旬※詳細は宿泊プランにてご確認下さい。,【アクセス】渋谷駅から都営バス約5分　青山学院中等部前　下車徒歩2分　表参道駅から徒歩約12分,エリア ： 東京都 > 青山,2016-03-28 04:17:58,2016-03-28 04:17:58,"￥10,462〜",（￥-/室）,,,,,,,,,,,,,,,,,,,,,,,,,,,,,,,,,,,,,,,,,,,,,,,,,,,,,,,,,,,,,,,,,,,,,,,,,,,,
7851,東急ステイ青山プレミア,/yad381958/?stayCount=1&roomCount=1&adultNum=2&stayDay=&stayYear=&stayMonth=&dateUndecided=1&distCd=01&roomCrack=200000&screenId=UWW1402&yadNo=381958&callbackHistFlg=1,【外苑前駅徒歩２分♪】全客室１４階以上で、素晴らしい東京の眺望が楽しめる。都心でありながら喧騒を離れた、品格ある街、青山にて、ビジネスにもレジャーにも極上なステイを！,【アクセス】銀座線外苑前駅1a出口から徒歩２分。表参道駅まで徒歩８分。,エリア ： 東京都 > 青山,2016-03-28 04:17:58,2016-03-28 04:17:58,"￥13,611〜","（￥6,805〜/人）",,,,,,,,,,,,,,,,,,,,,,,,,,,,,,,,,,,,,,,,,,,,,,,,,,,,,,,,,,,,,,,,,,,,,,,,,,,,
