id,building_name,image_url,detail,access,address,created_at,updated_at,fee1,fee2,,,,,,,,,,,,,,,,,,,,,,,,,,,,,,,,,,,,,,,,,,,,,,,,,,,,,,,,,,,,,,,,,,,,,,,,,,,,
6594,ホテルブエナビスタ　松本,/yad324555/?stayCount=1&roomCount=1&adultNum=2&stayDay=&stayYear=&stayMonth=&dateUndecided=1&distCd=01&roomCrack=200000&screenId=UWW1402&yadNo=324555&callbackHistFlg=1,松本駅からシャトルバスで２分！また徒歩でも７分の好立地。口コミサイトでも評判の和洋中のレストランやバーを備えたシティホテル。全室高速ＬＡＮ接続・Ｗi-Ｆi＆２４時間対応専用駐車場など設備も充実。,【アクセス】ＪＲ松本駅より徒歩7分。長野自動車道松本インターより15分。コンビニ徒歩2分,エリア ： 長野県 > 松本駅周辺,2016-03-28 00:46:15,2016-03-28 00:46:15,"￥11,666〜","（￥5,833〜/人）",,,,,,,,,,,,,,,,,,,,,,,,,,,,,,,,,,,,,,,,,,,,,,,,,,,,,,,,,,,,,,,,,,,,,,,,,,,,
6595,リッチモンドホテル松本,/yad327177/?stayCount=1&roomCount=1&adultNum=2&stayDay=&stayYear=&stayMonth=&dateUndecided=1&distCd=01&roomCrack=200000&screenId=UWW1402&yadNo=327177&callbackHistFlg=1,信州・松本への旅行、出張ビジネスを応援！インターネット・Wi-Fi全室無料◎松本駅より徒歩４分・繁華街に立地、松本城や市内観光、お食事、コンビニも徒歩圏内♪2014年12月26日リニューアルオープン！,【アクセス】ＪＲ松本駅（お城口→公園通りパルコ方面へ）徒歩４分・中央道松本インター車１５分（ホテルまで1本道）,エリア ： 長野県 > 松本駅周辺,2016-03-28 00:46:15,2016-03-28 00:46:15,"￥6,481〜","（￥3,240〜/人）",,,,,,,,,,,,,,,,,,,,,,,,,,,,,,,,,,,,,,,,,,,,,,,,,,,,,,,,,,,,,,,,,,,,,,,,,,,,
6596,松本駅から徒歩１分！朝食無料サービスが大好評！エースイン松本,/yad328935/?stayCount=1&roomCount=1&adultNum=2&stayDay=&stayYear=&stayMonth=&dateUndecided=1&distCd=01&roomCrack=200000&screenId=UWW1402&yadNo=328935&callbackHistFlg=1,絶好のロケーションはビジネスや観光の拠点に最適！松本での滞在を、よりアクティブに過ごせます。朝食無料サービスが大好評です♪「ホテルブエナビスタ」の焼き立てパンをお召し上がりください！,【アクセス】電車/JR松本駅お城口(東口)より徒歩1分。車/長野道松本ICより15分。バス/松本バスターミナルより徒歩1分。,エリア ： 長野県 > 松本駅周辺,2016-03-28 00:46:15,2016-03-28 00:46:15,"￥5,648〜","（￥2,824〜/人）",,,,,,,,,,,,,,,,,,,,,,,,,,,,,,,,,,,,,,,,,,,,,,,,,,,,,,,,,,,,,,,,,,,,,,,,,,,,
6597,ホテルルートインコート南松本,/yad331684/?stayCount=1&roomCount=1&adultNum=2&stayDay=&stayYear=&stayMonth=&dateUndecided=1&distCd=01&roomCrack=200000&screenId=UWW1402&yadNo=331684&callbackHistFlg=1,☆2012年7月に全室リニューアル完了☆JR南松本駅より車で3分　無料駐車場･男女別大浴場完備！松本市内への観光・ビジネスに最適です。安曇野・上高地方面への観光拠点としてもご利用下さい。,【アクセス】★JR南松本駅より車で3分　★中央高速道路、塩尻北IC・松本インターチェンジから車で10分　無料駐車場完備,エリア ： 長野県 > 松本駅周辺,2016-03-28 00:46:15,2016-03-28 00:46:15,"￥11,203〜","（￥5,601〜/人）",,,,,,,,,,,,,,,,,,,,,,,,,,,,,,,,,,,,,,,,,,,,,,,,,,,,,,,,,,,,,,,,,,,,,,,,,,,,
6598,民芸旅館　深志荘,/yad332750/?stayCount=1&roomCount=1&adultNum=2&stayDay=&stayYear=&stayMonth=&dateUndecided=1&distCd=01&roomCrack=200000&screenId=UWW1402&yadNo=332750&callbackHistFlg=1,食事へのこだわりが当館のこだわり。食材はほとんど長野県産、熟練された職人が丹精こめて作りあげます。「豪勢かつ低料金」と地元客にも人気！朝食は和洋バイキング【最終チェックインは22：00までです】,【アクセス】松本駅よりタクシーで8分、松本ICより国道19号線を塩尻方面へ車で15分。松本空港からタクシーで20分。,エリア ： 長野県 > 松本駅周辺,2016-03-28 00:46:15,2016-03-28 00:46:15,"￥11,203〜","（￥5,601〜/人）",,,,,,,,,,,,,,,,,,,,,,,,,,,,,,,,,,,,,,,,,,,,,,,,,,,,,,,,,,,,,,,,,,,,,,,,,,,,
6599,手づくり朝食と大浴場が人気！松本ツーリストホテル,/yad332977/?stayCount=1&roomCount=1&adultNum=2&stayDay=&stayYear=&stayMonth=&dateUndecided=1&distCd=01&roomCrack=200000&screenId=UWW1402&yadNo=332977&callbackHistFlg=1,全館Wi-Fi★地区じゃらんnet朝食口コミＮo.1（26年12月1日現在）★戸隠の高波動湧水入り大浴場(男女入替制)★松本駅徒歩6分★車100台★松本城まで徒歩15分★徒歩2分のジム★漫画コーナー★夕食ぱんぷきん,【アクセス】ＪＲ松本駅下車徒歩約５分強（約６００Ｍ）、長野自動車道松本ＩＣより車で１５分,エリア ： 長野県 > 松本駅周辺,2016-03-28 00:46:15,2016-03-28 00:46:15,"￥2,222〜","（￥1,111〜/人）",,,,,,,,,,,,,,,,,,,,,,,,,,,,,,,,,,,,,,,,,,,,,,,,,,,,,,,,,,,,,,,,,,,,,,,,,,,,
6600,ホテルマツモト　よろづや,/yad334269/?stayCount=1&roomCount=1&adultNum=2&stayDay=&stayYear=&stayMonth=&dateUndecided=1&distCd=01&roomCrack=200000&screenId=UWW1402&yadNo=334269&callbackHistFlg=1,★★松本駅・繁華街から徒歩5分の利便性と女鳥羽川沿いの静かで安らぎを備えた好環境★★一部客室から松本城や雄大な山々を望むこともできます♪和室もあるためビジネスだけでなくレジャーにもどうぞ♪,【アクセス】JR松本駅正面口下車徒歩５分。長野道松本ICより約１０分。,エリア ： 長野県 > 松本駅周辺,2016-03-28 00:46:15,2016-03-28 00:46:15,"￥5,000〜","（￥2,500〜/人）",,,,,,,,,,,,,,,,,,,,,,,,,,,,,,,,,,,,,,,,,,,,,,,,,,,,,,,,,,,,,,,,,,,,,,,,,,,,
6601,旅館　松風,/yad334350/?stayCount=1&roomCount=1&adultNum=2&stayDay=&stayYear=&stayMonth=&dateUndecided=1&distCd=01&roomCrack=200000&screenId=UWW1402&yadNo=334350&callbackHistFlg=1,静かな環境で全室くつろげる畳のお部屋です。長期滞在・ご家族やお仲間でお気軽に。人数・料金割引もご相談ください。送迎は無料ですが不可能な場合もあります。,【アクセス】ＪＲ　松本駅より徒歩にて１０分／中央自動車道松本ＩＣより車にて１５分,エリア ： 長野県 > 松本駅周辺,2016-03-28 00:46:15,2016-03-28 00:46:15,"￥3,703〜","（￥1,851〜/人）",,,,,,,,,,,,,,,,,,,,,,,,,,,,,,,,,,,,,,,,,,,,,,,,,,,,,,,,,,,,,,,,,,,,,,,,,,,,
6602,北欧デザイナーズホテル　松本ウエルトンホテル,/yad334596/?stayCount=1&roomCount=1&adultNum=2&stayDay=&stayYear=&stayMonth=&dateUndecided=1&distCd=01&roomCrack=200000&screenId=UWW1402&yadNo=334596&callbackHistFlg=1,松本駅から徒歩9分！全てのプランにパンと飲み物の簡単な無料朝食付き！無線LAN対応♪シングル全室140ｃｍ幅のダブルベッド採用。人気の日帰り温泉まで徒歩5分♪随時入出庫可能な駐車場有り！,【アクセス】JR松本駅アルプス口より徒歩約9分　長野自動車道松本ICより松本駅方面へ車で約5分,エリア ： 長野県 > 松本駅周辺,2016-03-28 00:46:15,2016-03-28 00:46:15,"￥1,337〜",（￥668〜/人）,,,,,,,,,,,,,,,,,,,,,,,,,,,,,,,,,,,,,,,,,,,,,,,,,,,,,,,,,,,,,,,,,,,,,,,,,,,,
6603,ニューホテル若葉,/yad336984/?stayCount=1&roomCount=1&adultNum=2&stayDay=&stayYear=&stayMonth=&dateUndecided=1&distCd=01&roomCrack=200000&screenId=UWW1402&yadNo=336984&callbackHistFlg=1,松本城・浅間温泉⇒車で5分。信州大学/病院・松本文化会館⇒徒歩5分。“地元産野菜を使った健康志向、つくりたて朝食”！,【アクセス】松本駅前通りを東へ直進、秀峰学校信号・交差点を左折し直進。やまびこ道路沿い（バス路線沿い）、車で8分,エリア ： 長野県 > 松本駅周辺,2016-03-28 00:46:15,2016-03-28 00:46:15,"￥8,148〜","（￥4,074〜/人）",,,,,,,,,,,,,,,,,,,,,,,,,,,,,,,,,,,,,,,,,,,,,,,,,,,,,,,,,,,,,,,,,,,,,,,,,,,,
6604,ホテル大手,/yad337805/?stayCount=1&roomCount=1&adultNum=2&stayDay=&stayYear=&stayMonth=&dateUndecided=1&distCd=01&roomCrack=200000&screenId=UWW1402&yadNo=337805&callbackHistFlg=1,松本駅より徒歩5分、松本城まで徒歩15分、ビジネス・観光どちらにも便利な好立地♪さらにコンビにも目の前にあります！シングルルームの2人利用も出来、お得に泊まりたい方にもお勧め★,【アクセス】ＪＲ松本駅お城口（東口）〜徒歩5分（セブンイレブン正面）,エリア ： 長野県 > 松本駅周辺,2016-03-28 00:46:15,2016-03-28 00:46:15,"￥4,166〜",（￥-/室）,,,,,,,,,,,,,,,,,,,,,,,,,,,,,,,,,,,,,,,,,,,,,,,,,,,,,,,,,,,,,,,,,,,,,,,,,,,,
6605,天然温泉　梓の湯　ドーミーイン松本,/yad354005/?stayCount=1&roomCount=1&adultNum=2&stayDay=&stayYear=&stayMonth=&dateUndecided=1&distCd=01&roomCrack=200000&screenId=UWW1402&yadNo=354005&callbackHistFlg=1,ホテルスペック開業年…2007年7月大浴場…サウナ・露天風呂付、男女別天然温泉大浴場完備。特徴…松本駅から徒歩すぐの好立地。ビジネスやレジャーの拠点に最適。,【アクセス】JR松本駅お城口（東口）より駅前大通沿い徒歩５分（約３００m.）。松本ICから車で１５分,エリア ： 長野県 > 松本駅周辺,2016-03-28 00:46:15,2016-03-28 00:46:15,"￥9,250〜","（￥4,625〜/人）",,,,,,,,,,,,,,,,,,,,,,,,,,,,,,,,,,,,,,,,,,,,,,,,,,,,,,,,,,,,,,,,,,,,,,,,,,,,
6606,松本駅から一番近い大浴場のある　ホテルニューステーション,/yad355656/?stayCount=1&roomCount=1&adultNum=2&stayDay=&stayYear=&stayMonth=&dateUndecided=1&distCd=01&roomCrack=200000&screenId=UWW1402&yadNo=355656&callbackHistFlg=1,【ポカポカ炭酸温浴大浴場】【美味しい！ヘルシー♪和食中心の大人気朝食】皆様の「旅の思い出」に残るようなおもてなしの宿を目指します★【アパパートナーホテルズ加盟店】アパポイントの付与が可能です！,【アクセス】JR松本駅より左手並び４件目。徒歩１分。長野道松本ＩＣより、約１０分。,エリア ： 長野県 > 松本駅周辺,2016-03-28 00:46:15,2016-03-28 00:46:15,"￥5,370〜","（￥2,685〜/人）",,,,,,,,,,,,,,,,,,,,,,,,,,,,,,,,,,,,,,,,,,,,,,,,,,,,,,,,,,,,,,,,,,,,,,,,,,,,
6607,スーパーホテル松本天然温泉,/yad359901/?stayCount=1&roomCount=1&adultNum=2&stayDay=&stayYear=&stayMonth=&dateUndecided=1&distCd=01&roomCrack=200000&screenId=UWW1402&yadNo=359901&callbackHistFlg=1,市内へアクセス抜群！駐車場完備！★全プラン無料健康朝食付。朝食お客様満足度４.２点以上↑ご当地料理有！天然温泉「諏訪の湯」(男女入替制)「小さな温泉、大きな効能！」ごゆっくりお寛ぎ下さい★,【アクセス】JR「松本」駅東口（お城口）より徒歩約8分,エリア ： 長野県 > 松本駅周辺,2016-03-28 00:46:15,2016-03-28 00:46:15,"￥5,518〜","（￥2,759〜/人）",,,,,,,,,,,,,,,,,,,,,,,,,,,,,,,,,,,,,,,,,,,,,,,,,,,,,,,,,,,,,,,,,,,,,,,,,,,,
6608,東横イン松本駅前本町,/yad361176/?stayCount=1&roomCount=1&adultNum=2&stayDay=&stayYear=&stayMonth=&dateUndecided=1&distCd=01&roomCrack=200000&screenId=UWW1402&yadNo=361176&callbackHistFlg=1,繁華街にありながら静かな環境でおくつろぎいただけます。無料朝食サービスで朝一番の元気も満タンに！！12月から3月は冬期料金となり更にお得にお泊りいただけます。,【アクセス】JR松本駅から徒歩6分、中央道松本インターから車で１０分,エリア ： 長野県 > 松本駅周辺,2016-03-28 00:46:15,2016-03-28 00:46:15,"￥7,300〜","（￥3,650〜/人）",,,,,,,,,,,,,,,,,,,,,,,,,,,,,,,,,,,,,,,,,,,,,,,,,,,,,,,,,,,,,,,,,,,,,,,,,,,,
6609,松茸山荘　,/yad361480/?stayCount=1&roomCount=1&adultNum=2&stayDay=&stayYear=&stayMonth=&dateUndecided=1&distCd=01&roomCrack=200000&screenId=UWW1402&yadNo=361480&callbackHistFlg=1,一年中愉しめる松茸の秘密は保存方法にあり！香りをそのままに、満喫していただけます。四季折々の彩り豊かな料理も人気。,【アクセス】長野道・豊科ICより国道143号線経由で約20分、無料駐車場完備。JR松本駅よりタクシー利用で約25分。,エリア ： 長野県 > 松本駅周辺,2016-03-28 00:46:15,2016-03-28 00:46:15,"￥10,277〜","（￥5,138〜/人）",,,,,,,,,,,,,,,,,,,,,,,,,,,,,,,,,,,,,,,,,,,,,,,,,,,,,,,,,,,,,,,,,,,,,,,,,,,,
6610,ホテルトレンド松本,/yad363928/?stayCount=1&roomCount=1&adultNum=2&stayDay=&stayYear=&stayMonth=&dateUndecided=1&distCd=01&roomCrack=200000&screenId=UWW1402&yadNo=363928&callbackHistFlg=1,ビジネス＆観光に最適！松本駅徒歩５分♪松本城徒歩１０分☆Wi-Fi完備しました！コンビニ１分、朝食無料サービス、駐車場無料☆、松本中心市街地徒歩圏内、全室洗浄機付きトイレ（ウォシュレット）,【アクセス】■電車でのアクセス：ＪＲ松本駅お城口より徒歩５分　■車でのアクセス：長野自動車道・松本ＩＣより１０分,エリア ： 長野県 > 松本駅周辺,2016-03-28 00:46:15,2016-03-28 00:46:15,"￥1,574〜",（￥787〜/人）,,,,,,,,,,,,,,,,,,,,,,,,,,,,,,,,,,,,,,,,,,,,,,,,,,,,,,,,,,,,,,,,,,,,,,,,,,,,
6611,スーパーホテル松本駅前,/yad365412/?stayCount=1&roomCount=1&adultNum=2&stayDay=&stayYear=&stayMonth=&dateUndecided=1&distCd=01&roomCrack=200000&screenId=UWW1402&yadNo=365412&callbackHistFlg=1,★松本駅から徒歩3分！松本城･中町通り･なわて通りまで徒歩圏内♪飲食店が立ち並ぶ繁華街すぐの好立地★全室健康イオン水･無料WIFI･空気清浄機･ナノケアドライヤー完備、無料のバイキング朝食付き！,【アクセス】JR松本駅･ﾊﾞｽﾀｰﾐﾅﾙまで徒歩3分/松本城まで徒歩15分/松本インター車で15分/松本空港まで車で30分,エリア ： 長野県 > 松本駅周辺,2016-03-28 00:46:15,2016-03-28 00:46:15,"￥5,537〜","（￥2,768〜/人）",,,,,,,,,,,,,,,,,,,,,,,,,,,,,,,,,,,,,,,,,,,,,,,,,,,,,,,,,,,,,,,,,,,,,,,,,,,,
6612,スマイルホテル松本,/yad366843/?stayCount=1&roomCount=1&adultNum=2&stayDay=&stayYear=&stayMonth=&dateUndecided=1&distCd=01&roomCrack=200000&screenId=UWW1402&yadNo=366843&callbackHistFlg=1,松本市内で平面駐車場120台を備え長野各地の観光にも便利。浅間温泉や美ヶ原温泉までも車で15分で日帰り入浴も楽しめる。朝食はパンと飲み物を無料サービス。リーズナブルなお値段で快適な旅を。,【アクセス】JR松本駅からお車で約５分、徒歩約15分　松本ICからはお車で約10分,エリア ： 長野県 > 松本駅周辺,2016-03-28 00:46:15,2016-03-28 00:46:15,"￥3,796〜","（￥1,898〜/人）",,,,,,,,,,,,,,,,,,,,,,,,,,,,,,,,,,,,,,,,,,,,,,,,,,,,,,,,,,,,,,,,,,,,,,,,,,,,
6613,旅館ほしな,/yad372326/?stayCount=1&roomCount=1&adultNum=2&stayDay=&stayYear=&stayMonth=&dateUndecided=1&distCd=01&roomCrack=200000&screenId=UWW1402&yadNo=372326&callbackHistFlg=1,北アルプスの峰々を正面に仰ぎ、眼下には松本平を一望し、信州の自然を存分に満喫できる素晴らしい環境。また、周辺には名湯・史跡等があり歴史と文化の香りがいっぱい,【アクセス】長野自動車道松本インターより松本駅方面へ車で１５分。松本駅下車、タクシーで８分,エリア ： 長野県 > 松本駅周辺,2016-03-28 00:46:15,2016-03-28 00:46:15,"￥7,370〜","（￥3,685〜/人）",,,,,,,,,,,,,,,,,,,,,,,,,,,,,,,,,,,,,,,,,,,,,,,,,,,,,,,,,,,,,,,,,,,,,,,,,,,,
6614,オーベルジュ　銀のテラス,/yad380144/?stayCount=1&roomCount=1&adultNum=2&stayDay=&stayYear=&stayMonth=&dateUndecided=1&distCd=01&roomCrack=200000&screenId=UWW1402&yadNo=380144&callbackHistFlg=1,私たちの理想とするおもてなしを実現するためにご用意したお部屋は３つ。信州・松本平を眼下に、北アルプスの山々を望む、小高い丘のオーベルジュ・銀のテラス,【アクセス】長野自動車道松本インターより松本駅方面へ車で１５分。並柳小前信号付近に案内あり,エリア ： 長野県 > 松本駅周辺,2016-03-28 00:46:15,2016-03-28 00:46:15,"￥27,000〜","（￥13,500〜/人）",,,,,,,,,,,,,,,,,,,,,,,,,,,,,,,,,,,,,,,,,,,,,,,,,,,,,,,,,,,,,,,,,,,,,,,,,,,,
6615,松本駅から1番近い ホテル飯田屋,/yad387552/?stayCount=1&roomCount=1&adultNum=2&stayDay=&stayYear=&stayMonth=&dateUndecided=1&distCd=01&roomCrack=200000&screenId=UWW1402&yadNo=387552&callbackHistFlg=1,JR松本駅お城口(東口)目の前、左ななめ前方★一番左の信号をお渡りください。チェックイン15時・チェックアウト11時。門限なし。宿泊特典：レンタサイクル♪松本城割引入場券♪など。,【アクセス】ＪＲ松本駅お城口（東口）を出て、一番左の信号を渡った目の前。松本ICより松本駅方面へ車約10分。,エリア ： 長野県 > 松本駅周辺,2016-03-28 00:46:15,2016-03-28 00:46:15,"￥5,259〜","（￥2,629〜/人）",,,,,,,,,,,,,,,,,,,,,,,,,,,,,,,,,,,,,,,,,,,,,,,,,,,,,,,,,,,,,,,,,,,,,,,,,,,,
6616,ホテル末広,/yad390680/?stayCount=1&roomCount=1&adultNum=2&stayDay=&stayYear=&stayMonth=&dateUndecided=1&distCd=01&roomCrack=200000&screenId=UWW1402&yadNo=390680&callbackHistFlg=1,静かでくつろぎの宿。松本城、信州大学病院、体育館まで、車で５分です。美術品や骨董品が数多く並ぶ温泉宿。松本城割引券あります。多家族での宴会や合宿、ゼミ等にも。無料モーニングコーヒーもどうぞ。,【アクセス】車/松本駅より1０分　電車/JR松本駅下車横田経由浅間温泉行きバス　横田下車徒歩３分,エリア ： 長野県 > 松本駅周辺,2016-03-28 00:46:15,2016-03-28 00:46:15,"￥7,222〜","（￥3,611〜/人）",,,,,,,,,,,,,,,,,,,,,,,,,,,,,,,,,,,,,,,,,,,,,,,,,,,,,,,,,,,,,,,,,,,,,,,,,,,,
6617,松本ホテル花月,/yad398800/?stayCount=1&roomCount=1&adultNum=2&stayDay=&stayYear=&stayMonth=&dateUndecided=1&distCd=01&roomCrack=200000&screenId=UWW1402&yadNo=398800&callbackHistFlg=1,松本ホテル花月は、「民藝フィロソフィ　松本の日常の記憶」をコンセプトに新しく生まれ変わります。民藝の街・松本に根付く「他力美」の精神に学び、素朴で普段使いができるホテルとして生まれ変わります。,【アクセス】JR篠ノ井線松本駅下車徒歩15分、長野自動車道松本インターより10分。,エリア ： 長野県 > 松本駅周辺,2016-03-28 00:46:15,2016-03-28 00:46:15,"￥15,277〜","（￥7,638〜/人）",,,,,,,,,,,,,,,,,,,,,,,,,,,,,,,,,,,,,,,,,,,,,,,,,,,,,,,,,,,,,,,,,,,,,,,,,,,,
6618,上高地ルミエスタホテル（旧 上高地清水屋ホテル),/yad305666/?stayCount=1&roomCount=1&adultNum=2&stayDay=&stayYear=&stayMonth=&dateUndecided=1&distCd=01&roomCrack=200000&screenId=UWW1402&yadNo=305666&callbackHistFlg=1,2014年4月、上高地清水屋ホテルは、上高地ルミエスタホテルとしてグランドリニューアルオープン。源泉かけ流し温泉と上高地フレンチ・・あたたかいサービス、やさしい温泉、おいしいお食事をご堪能ください,【アクセス】松本から電車・バスで1時間50分、お車・バス乗り換えで1時間30分程の場所になります。,エリア ： 長野県 > 上高地,2016-03-28 00:46:15,2016-03-28 00:46:15,"￥48,000〜","（￥24,000〜/人）",,,,,,,,,,,,,,,,,,,,,,,,,,,,,,,,,,,,,,,,,,,,,,,,,,,,,,,,,,,,,,,,,,,,,,,,,,,,
6619,上高地　朝焼けの宿　明神館,/yad311799/?stayCount=1&roomCount=1&adultNum=2&stayDay=&stayYear=&stayMonth=&dateUndecided=1&distCd=01&roomCrack=200000&screenId=UWW1402&yadNo=311799&callbackHistFlg=1,大自然の明神。明神岳＝穂高岳の朝焼け。池の朝もや小鳥の声周囲の花畑。充実した備品。観光や山小屋と異なるユニークな宿。女性の１名個室可。電話受可。１０名以上は電話。１６時頃入館。営業４月ー１１月,【アクセス】上高地までおいで下さい。上高地バス停から河童橋渡らず、４０分の遊歩道の終点。上高地は送迎禁止地域,エリア ： 長野県 > 上高地,2016-03-28 00:46:15,2016-03-28 00:46:15,"￥17,592〜","（￥8,796〜/人）",,,,,,,,,,,,,,,,,,,,,,,,,,,,,,,,,,,,,,,,,,,,,,,,,,,,,,,,,,,,,,,,,,,,,,,,,,,,
6620,大正池畔の唯一の宿　上高地　大正池ホテル,/yad316889/?stayCount=1&roomCount=1&adultNum=2&stayDay=&stayYear=&stayMonth=&dateUndecided=1&distCd=01&roomCrack=200000&screenId=UWW1402&yadNo=316889&callbackHistFlg=1,河童橋までバスで10分、徒歩なら60分と上高地を散策するにはちょうど良い立地。館内のレストランからは季節ごとに表情を変える大正池を一望できる。明け方や夕暮れ時の大正池の写真撮影にも最適。,【アクセス】JR松本駅より松本電鉄上高地線「新島々駅」下車、バスかタクシー,エリア ： 長野県 > 上高地,2016-03-28 00:46:15,2016-03-28 00:46:15,"￥22,000〜","（￥11,000〜/人）",,,,,,,,,,,,,,,,,,,,,,,,,,,,,,,,,,,,,,,,,,,,,,,,,,,,,,,,,,,,,,,,,,,,,,,,,,,,
6621,上高地温泉ホテル,/yad374796/?stayCount=1&roomCount=1&adultNum=2&stayDay=&stayYear=&stayMonth=&dateUndecided=1&distCd=01&roomCrack=200000&screenId=UWW1402&yadNo=374796&callbackHistFlg=1,100％天然温泉の露天や樽風呂から焼岳を望み至福の時を。館内にはアルプスを描いたたギャラリーや四季の上高地のスライド上映等で安らぎの空間を提供。ウェストン碑も近く梓川の清流沿いの散策も最適。,【アクセス】JR松本駅より松本電鉄上高地線「新島々駅」下車、バスかタクシー(マイカー規制あり),エリア ： 長野県 > 上高地,2016-03-28 00:46:15,2016-03-28 00:46:15,"￥38,000〜","（￥19,000〜/人）",,,,,,,,,,,,,,,,,,,,,,,,,,,,,,,,,,,,,,,,,,,,,,,,,,,,,,,,,,,,,,,,,,,,,,,,,,,,
6622,諏訪湖ホテル 上諏訪温泉随一の諏訪湖眺望の宿,/yad311000/?stayCount=1&roomCount=1&adultNum=2&stayDay=&stayYear=&stayMonth=&dateUndecided=1&distCd=01&roomCrack=200000&screenId=UWW1402&yadNo=311000&callbackHistFlg=1,諏訪湖のほとりに建ち、お部屋からの眺めは上諏訪温泉地随一のロケーションを誇ります。国賓の方々をお迎えした伝統と格調を持ち、真心込めたサービスで皆様をお迎えいたします,【アクセス】中央自動車道諏訪ICから諏訪湖方面へ車10分。JR中央線上諏訪駅下車、徒歩8分。,エリア ： 長野県 > 上諏訪・下諏訪・岡谷・霧ヶ峰・美ヶ原高原,2016-03-28 00:46:15,2016-03-28 00:46:15,"￥17,000〜","（￥8,500〜/人）",,,,,,,,,,,,,,,,,,,,,,,,,,,,,,,,,,,,,,,,,,,,,,,,,,,,,,,,,,,,,,,,,,,,,,,,,,,,
6623,チサンイン諏訪インター,/yad312313/?stayCount=1&roomCount=1&adultNum=2&stayDay=&stayYear=&stayMonth=&dateUndecided=1&distCd=01&roomCrack=200000&screenId=UWW1402&yadNo=312313&callbackHistFlg=1,お手軽な料金で快適なご滞在をお約束♪諏訪湖畔・ビーナスライン・白樺湖・蓼科などの人気観光地へは車でのアクセスが便利。周辺には飲食店多数あり。無料平面駐車場完備、大型車は事前にお問合せください。,【アクセス】中央自動車道を諏訪インターを出てすぐ左折　諏訪バイパスを1分　飯島交差点マクドナルド様の隣,エリア ： 長野県 > 上諏訪・下諏訪・岡谷・霧ヶ峰・美ヶ原高原,2016-03-28 00:46:15,2016-03-28 00:46:15,"￥5,833〜","（￥2,916〜/人）",,,,,,,,,,,,,,,,,,,,,,,,,,,,,,,,,,,,,,,,,,,,,,,,,,,,,,,,,,,,,,,,,,,,,,,,,,,,
6624,神秘なる諏訪湖に心癒される宿　上諏訪温泉　しんゆ（親湯）,/yad303381/?stayCount=1&roomCount=1&adultNum=2&stayDay=&stayYear=&stayMonth=&dateUndecided=1&distCd=01&roomCrack=200000&screenId=UWW1402&yadNo=303381&callbackHistFlg=1,今なら平日貸切露天無料サービス中！朝夕個室食、地産地消の創作和会席、全室改装選べるお部屋、諏訪大社四社無料参拝バス、ヒーリングアート、諏訪湖目の前、自家源泉、2011年OPEN癒やしの温泉宿,【アクセス】車：中央道諏訪ICより約１５分/電車：JR上諏訪駅下車徒歩約１５分（駅送迎あり）/毎日諏訪大社バス運行中,エリア ： 長野県 > 上諏訪・下諏訪・岡谷・霧ヶ峰・美ヶ原高原,2016-03-28 00:46:15,2016-03-28 00:46:15,"￥10,000〜","（￥5,000〜/人）",,,,,,,,,,,,,,,,,,,,,,,,,,,,,,,,,,,,,,,,,,,,,,,,,,,,,,,,,,,,,,,,,,,,,,,,,,,,
