id,building_name,image_url,detail,access,address,created_at,updated_at,fee1,fee2,,,,,,,,,,,,,,,,,,,,,,,,,,,,,,,,,,,,,,,,,,,,,,,,,,,,,,,,,,,,,,,,,,,,,,,,,,,,
1008,山神温泉 湯乃元館,/yad310765/?stayCount=1&roomCount=1&adultNum=2&stayDay=&stayYear=&stayMonth=&dateUndecided=1&distCd=01&roomCrack=200000&screenId=UWW1402&yadNo=310765&callbackHistFlg=1,薬師如来が湯のありかを教えたという伝説の残る天然温泉（加温）。四季の移ろいを望む大浴場、客室ではかけ流しの湯を満喫できる。お食事は美濃焼きの器とお料理のハーモニーを楽しめる。,【アクセス】電車:JR土岐市駅下車、東濃鉄道バス20分山神温泉口下車3分。車:土岐南多治見IC下車、県道66号瑞浪方面へ,エリア ： 岐阜県 > 多治見・土岐・加茂・可児,2016-03-28 02:37:20,2016-03-28 02:37:20,"￥33,333〜","（￥16,666〜/人）",,,,,,,,,,,,,,,,,,,,,,,,,,,,,,,,,,,,,,,,,,,,,,,,,,,,,,,,,,,,,,,,,,,,,,,,,,,,
1009,オースタット国際ホテル多治見（BBHホテルグループ）,/yad317704/?stayCount=1&roomCount=1&adultNum=2&stayDay=&stayYear=&stayMonth=&dateUndecided=1&distCd=01&roomCrack=200000&screenId=UWW1402&yadNo=317704&callbackHistFlg=1,中央道多治見インターから車で５分。駐車場無料。シングル１９平米・ツイン２８平米のお部屋でごゆっくりおくつろぎ下さいませ。全国約90店舗展開中のBBHホテルグループ！,【アクセス】ＪＲ中央線多治見駅より徒歩10分,エリア ： 岐阜県 > 多治見・土岐・加茂・可児,2016-03-28 02:37:20,2016-03-28 02:37:20,"￥7,559〜","（￥3,779〜/人）",,,,,,,,,,,,,,,,,,,,,,,,,,,,,,,,,,,,,,,,,,,,,,,,,,,,,,,,,,,,,,,,,,,,,,,,,,,,
1010,了山　,/yad318520/?stayCount=1&roomCount=1&adultNum=2&stayDay=&stayYear=&stayMonth=&dateUndecided=1&distCd=01&roomCrack=200000&screenId=UWW1402&yadNo=318520&callbackHistFlg=1,５０００坪の敷地内を流れる清流可児川沿いに立ち、露天風呂付客室に創作和食、岩盤浴やエステ、オープンカフェで極上のひとときお過ごしくださいませ。,【アクセス】JR土岐市駅下車、タクシーで15分,エリア ： 岐阜県 > 多治見・土岐・加茂・可児,2016-03-28 02:37:20,2016-03-28 02:37:20,"￥36,000〜","（￥18,000〜/人）",,,,,,,,,,,,,,,,,,,,,,,,,,,,,,,,,,,,,,,,,,,,,,,,,,,,,,,,,,,,,,,,,,,,,,,,,,,,
1011,シティホテル美濃加茂,/yad319014/?stayCount=1&roomCount=1&adultNum=2&stayDay=&stayYear=&stayMonth=&dateUndecided=1&distCd=01&roomCrack=200000&screenId=UWW1402&yadNo=319014&callbackHistFlg=1,関・郡上方面へは長良川鉄道、下呂・高山方面へはＪＲでアクセス便利。犬山・大口方面も車で便利な立地です。,【アクセス】ＪＲ美濃太田駅南口正面,エリア ： 岐阜県 > 多治見・土岐・加茂・可児,2016-03-28 02:37:20,2016-03-28 02:37:20,"￥7,777〜","（￥3,888〜/人）",,,,,,,,,,,,,,,,,,,,,,,,,,,,,,,,,,,,,,,,,,,,,,,,,,,,,,,,,,,,,,,,,,,,,,,,,,,,
1012,多治見天然温泉 ホテルルートイン多治見インター,/yad322204/?stayCount=1&roomCount=1&adultNum=2&stayDay=&stayYear=&stayMonth=&dateUndecided=1&distCd=01&roomCrack=200000&screenId=UWW1402&yadNo=322204&callbackHistFlg=1,☆多治見で唯一“天然温泉”の大浴場完備！ビジネスからレジャーまで快適にお過ごしいただけます。☆Wi-Fi対応！無料駐車場完備！中央自動車道「多治見インター」まで約1分と朝のお出掛けにも最適です。,【アクセス】中央高速道：多治見インターの目の前、車で1分／JR中央線多治見駅より車で7分,エリア ： 岐阜県 > 多治見・土岐・加茂・可児,2016-03-28 02:37:20,2016-03-28 02:37:20,"￥8,333〜","（￥4,166〜/人）",,,,,,,,,,,,,,,,,,,,,,,,,,,,,,,,,,,,,,,,,,,,,,,,,,,,,,,,,,,,,,,,,,,,,,,,,,,,
1013,ホテルルートイン土岐,/yad327197/?stayCount=1&roomCount=1&adultNum=2&stayDay=&stayYear=&stayMonth=&dateUndecided=1&distCd=01&roomCrack=200000&screenId=UWW1402&yadNo=327197&callbackHistFlg=1,土岐ICから車で3分･土岐市駅から徒歩7分とアクセス良好【無料駐車場完備◆ラジウム人工温泉大浴場完備◆全室無料WiFi◆加湿機能付空気清浄機完備◆無料バイキング朝食】旅の疲れを癒してお寛ぎ下さい。,【アクセス】中央自動車道　土岐ICより　車で約5分／JR中央線　土岐駅より徒歩約7分,エリア ： 岐阜県 > 多治見・土岐・加茂・可児,2016-03-28 02:37:20,2016-03-28 02:37:20,"￥8,703〜","（￥4,351〜/人）",,,,,,,,,,,,,,,,,,,,,,,,,,,,,,,,,,,,,,,,,,,,,,,,,,,,,,,,,,,,,,,,,,,,,,,,,,,,
1014,ファミリーロッジ旅籠屋・土岐店,/yad327660/?stayCount=1&roomCount=1&adultNum=2&stayDay=&stayYear=&stayMonth=&dateUndecided=1&distCd=01&roomCrack=200000&screenId=UWW1402&yadNo=327660&callbackHistFlg=1,広い客室にクイーンサイズベッド２台を配置した人気のロードサイドホテル。朝軽食・WiFi＆ネット接続・駐車場いずれも無料。コインランドリーあり。ご家族、カップルやグループ、ビジネスにも最適。,【アクセス】中央自動車道土岐ICからR21を右折、２００ｍ先左手が当館,エリア ： 岐阜県 > 多治見・土岐・加茂・可児,2016-03-28 02:37:20,2016-03-28 02:37:20,"￥8,300〜","（￥4,150〜/人）",,,,,,,,,,,,,,,,,,,,,,,,,,,,,,,,,,,,,,,,,,,,,,,,,,,,,,,,,,,,,,,,,,,,,,,,,,,,
1015,パークホテル可児,/yad330496/?stayCount=1&roomCount=1&adultNum=2&stayDay=&stayYear=&stayMonth=&dateUndecided=1&distCd=01&roomCrack=200000&screenId=UWW1402&yadNo=330496&callbackHistFlg=1,清潔な客室、静かな環境、温かなサービスでお迎え致します。シングル全室にセミダブルサービスベッド使用、全室インターネット接続無料！,【アクセス】名鉄広見線「新可児」駅徒歩約8分、太多線「可児駅」より徒歩8分,エリア ： 岐阜県 > 多治見・土岐・加茂・可児,2016-03-28 02:37:20,2016-03-28 02:37:20,"￥8,314〜","（￥4,157〜/人）",,,,,,,,,,,,,,,,,,,,,,,,,,,,,,,,,,,,,,,,,,,,,,,,,,,,,,,,,,,,,,,,,,,,,,,,,,,,
1016,ホテルルートイン美濃加茂,/yad332643/?stayCount=1&roomCount=1&adultNum=2&stayDay=&stayYear=&stayMonth=&dateUndecided=1&distCd=01&roomCrack=200000&screenId=UWW1402&yadNo=332643&callbackHistFlg=1,☆★☆ご旅行・出張にぜひ利用下さい☆★☆朝食無料・ネットWi-Fi有♪　駅前で名古屋方面・関方面・犬山方面へもアクセス抜群！　駐車場無料完備（バイクもＯＫ）是非この機会にお越し下さいませ！,【アクセス】JR美濃太田駅下車すぐ／中央自動車道多治見ICより30分／東海環状線美濃加茂IC10分,エリア ： 岐阜県 > 多治見・土岐・加茂・可児,2016-03-28 02:37:20,2016-03-28 02:37:20,"￥8,009〜","（￥4,004〜/人）",,,,,,,,,,,,,,,,,,,,,,,,,,,,,,,,,,,,,,,,,,,,,,,,,,,,,,,,,,,,,,,,,,,,,,,,,,,,
1017,ホテル多治見ヒルズ　リバーサイド店（BBHホテルグループ）,/yad334854/?stayCount=1&roomCount=1&adultNum=2&stayDay=&stayYear=&stayMonth=&dateUndecided=1&distCd=01&roomCrack=200000&screenId=UWW1402&yadNo=334854&callbackHistFlg=1,ビジネスに観光に便利な立地。駐車場無料。全国約90店舗展開中のBBHホテルグループ！,【アクセス】多治見インターから車で５分！川沿いにたたずむ多治見ヒルズリバーサイド店です,エリア ： 岐阜県 > 多治見・土岐・加茂・可児,2016-03-28 02:37:20,2016-03-28 02:37:20,"￥7,407〜","（￥3,703〜/人）",,,,,,,,,,,,,,,,,,,,,,,,,,,,,,,,,,,,,,,,,,,,,,,,,,,,,,,,,,,,,,,,,,,,,,,,,,,,
1018,ホテルシンセリティ,/yad353593/?stayCount=1&roomCount=1&adultNum=2&stayDay=&stayYear=&stayMonth=&dateUndecided=1&distCd=01&roomCrack=200000&screenId=UWW1402&yadNo=353593&callbackHistFlg=1,ＪＲ可児駅・名鉄新可児駅から徒歩6分、可児市役所まで徒歩２分の好立地。朝食無料サービス、無線ＬＡＮ（無料）ＯＫ！無料セルフランドリールーム完備で長期滞在の方にも便利でおススメ！,【アクセス】ＪＲ可児駅・名鉄新可児駅より徒歩約6分、東海環状/可児御嵩ＩＣより約7分、中央/多治見ICより約25分,エリア ： 岐阜県 > 多治見・土岐・加茂・可児,2016-03-28 02:37:20,2016-03-28 02:37:20,"￥8,333〜","（￥4,166〜/人）",,,,,,,,,,,,,,,,,,,,,,,,,,,,,,,,,,,,,,,,,,,,,,,,,,,,,,,,,,,,,,,,,,,,,,,,,,,,
1019,成田屋,/yad374336/?stayCount=1&roomCount=1&adultNum=2&stayDay=&stayYear=&stayMonth=&dateUndecided=1&distCd=01&roomCrack=200000&screenId=UWW1402&yadNo=374336&callbackHistFlg=1,四季を感じる料理が自慢！主人自ら釣る鮮度抜群の鮎、あまご、山菜、きのこ、粟、蜂の子など白川ならではの味覚を是非ご堪能ください。木の香漂う鉱泉のお風呂（白川温泉）で旅の疲れを癒してください。,【アクセス】ＪＲ高山線白川口駅から徒歩で６分/東海環状自動車道　美濃加茂ＩＣより約30分,エリア ： 岐阜県 > 多治見・土岐・加茂・可児,2016-03-28 02:37:20,2016-03-28 02:37:20,"￥9,259〜","（￥4,629〜/人）",,,,,,,,,,,,,,,,,,,,,,,,,,,,,,,,,,,,,,,,,,,,,,,,,,,,,,,,,,,,,,,,,,,,,,,,,,,,
1020,ホテルトーノー（KOSCOINNグループ）,/yad378524/?stayCount=1&roomCount=1&adultNum=2&stayDay=&stayYear=&stayMonth=&dateUndecided=1&distCd=01&roomCrack=200000&screenId=UWW1402&yadNo=378524&callbackHistFlg=1,朝食無料サービス付。コーヒーのドリンクサービスをご用意しております。全室32型VODテレビ設置。全室インターネット（有線LAN）がご利用頂けます。フロントは24時間対応しております。,【アクセス】JR中多治見駅（南口）より徒歩１分！お車でお越しの場合、多治見ICから8分となっております。,エリア ： 岐阜県 > 多治見・土岐・加茂・可児,2016-03-28 02:37:20,2016-03-28 02:37:20,"￥5,722〜","（￥2,861〜/人）",,,,,,,,,,,,,,,,,,,,,,,,,,,,,,,,,,,,,,,,,,,,,,,,,,,,,,,,,,,,,,,,,,,,,,,,,,,,
1021,ホテル多治見ヒルズ　マイルーム店（BBHホテルグループ）,/yad379530/?stayCount=1&roomCount=1&adultNum=2&stayDay=&stayYear=&stayMonth=&dateUndecided=1&distCd=01&roomCrack=200000&screenId=UWW1402&yadNo=379530&callbackHistFlg=1,多治見ICより5分、国道19号線沿いに立地。無料駐車場は40台（先着順）。全室ダブルサイズベッドで個別空調。バス・トイレ独立型のゆとりのお部屋。全国約90店舗展開中のBBHホテルグループ！,【アクセス】土岐方面から名古屋方面へ向井い国道１９号線沿いのサークルＫすぐ裏側,エリア ： 岐阜県 > 多治見・土岐・加茂・可児,2016-03-28 02:37:20,2016-03-28 02:37:20,"￥7,388〜","（￥3,694〜/人）",,,,,,,,,,,,,,,,,,,,,,,,,,,,,,,,,,,,,,,,,,,,,,,,,,,,,,,,,,,,,,,,,,,,,,,,,,,,
1022,ビジネス旅館　栄屋,/yad380352/?stayCount=1&roomCount=1&adultNum=2&stayDay=&stayYear=&stayMonth=&dateUndecided=1&distCd=01&roomCrack=200000&screenId=UWW1402&yadNo=380352&callbackHistFlg=1,【ＪＲ美濃太田駅より歩５分】【美濃加茂ＩＣより車10分】周辺の幹線道路からもアクセスが良いので、お仕事や観光に大変便利。和室＆ジェットバスでゆっくり過ごせます。長期滞在・スポーツ合宿も歓迎！,【アクセス】電車⇒ＪＲ美濃太田駅徒歩５分　車⇒美濃加茂ＩＩＣ10分　小牧ＩＣ30分　可児御嵩ＩＣ15分,エリア ： 岐阜県 > 多治見・土岐・加茂・可児,2016-03-28 02:37:20,2016-03-28 02:37:20,"￥9,000〜","（￥4,500〜/人）",,,,,,,,,,,,,,,,,,,,,,,,,,,,,,,,,,,,,,,,,,,,,,,,,,,,,,,,,,,,,,,,,,,,,,,,,,,,
1023,料理旅館牧ヶ洞,/yad382884/?stayCount=1&roomCount=1&adultNum=2&stayDay=&stayYear=&stayMonth=&dateUndecided=1&distCd=01&roomCrack=200000&screenId=UWW1402&yadNo=382884&callbackHistFlg=1,下呂温泉の南に位置、飛騨川を見おろす高台にある料理旅館です。旬の川魚料理を中心に、美濃白川の山川の恵みをご用意。展望風呂からの町並みも自慢です。合宿にもお勧めのテニスコート等の設備もあり。,【アクセス】JR高山本線白川口駅からお車で約5分／中央自動車道恵那ICから約45分,エリア ： 岐阜県 > 多治見・土岐・加茂・可児,2016-03-28 02:37:20,2016-03-28 02:37:20,"￥10,000〜","（￥5,000〜/人）",,,,,,,,,,,,,,,,,,,,,,,,,,,,,,,,,,,,,,,,,,,,,,,,,,,,,,,,,,,,,,,,,,,,,,,,,,,,
1024,ビジネスホテル土岐,/yad383152/?stayCount=1&roomCount=1&adultNum=2&stayDay=&stayYear=&stayMonth=&dateUndecided=1&distCd=01&roomCrack=200000&screenId=UWW1402&yadNo=383152&callbackHistFlg=1,土岐市駅まで徒歩３分と好立地ながら、格安で宿泊できる♪★チェックアウト時に、美濃焼の陶器を無料でプレゼント♪フロントスタッフに申しつけ下さい♪★周辺はとても静かで、部屋も全室広々♪,【アクセス】土岐市駅より徒歩３分　中央自動車道、土岐ＩＣより約５分♪土岐プレミアムアウトレットより車で約１０分,エリア ： 岐阜県 > 多治見・土岐・加茂・可児,2016-03-28 02:37:20,2016-03-28 02:37:20,"￥8,796〜","（￥4,398〜/人）",,,,,,,,,,,,,,,,,,,,,,,,,,,,,,,,,,,,,,,,,,,,,,,,,,,,,,,,,,,,,,,,,,,,,,,,,,,,
1025,美濃加茂ステーションホテル,/yad392290/?stayCount=1&roomCount=1&adultNum=2&stayDay=&stayYear=&stayMonth=&dateUndecided=1&distCd=01&roomCrack=200000&screenId=UWW1402&yadNo=392290&callbackHistFlg=1,駅から徒歩２分と近く、客室は十分な広さがあり、空気清浄器を全室完備。インターネット無料（有線ＬＡＮ）・Ｗｉ−Ｆｉ無料と設備も充実！長期のお泊りも大歓迎。,【アクセス】ＪＲ高山本線美濃太田駅南口より徒歩２分、東海環状自動車道美濃加茂ＩＣより車で１０分,エリア ： 岐阜県 > 多治見・土岐・加茂・可児,2016-03-28 02:37:20,2016-03-28 02:37:20,"￥9,259〜",（￥-/室）,,,,,,,,,,,,,,,,,,,,,,,,,,,,,,,,,,,,,,,,,,,,,,,,,,,,,,,,,,,,,,,,,,,,,,,,,,,,
1026,田中屋旅館,/yad392422/?stayCount=1&roomCount=1&adultNum=2&stayDay=&stayYear=&stayMonth=&dateUndecided=1&distCd=01&roomCrack=200000&screenId=UWW1402&yadNo=392422&callbackHistFlg=1,近くには岐阜県の名所の一つ、隠居山観音（三十三観音）巡りもあり、季節によって渓流釣りや蛍が見れる川もあり季節毎の楽しみがあります。自然がある静かな旅館でのんびりお過ごしくださいませ。,【アクセス】JR白川口駅よりお車にて約15分,エリア ： 岐阜県 > 多治見・土岐・加茂・可児,2016-03-28 02:37:20,2016-03-28 02:37:20,"￥10,000〜","（￥5,000〜/人）",,,,,,,,,,,,,,,,,,,,,,,,,,,,,,,,,,,,,,,,,,,,,,,,,,,,,,,,,,,,,,,,,,,,,,,,,,,,
1027,ウィークリー翔ノーザンバレー多治見,/yad394820/?stayCount=1&roomCount=1&adultNum=2&stayDay=&stayYear=&stayMonth=&dateUndecided=1&distCd=01&roomCrack=200000&screenId=UWW1402&yadNo=394820&callbackHistFlg=1,多治見インターすぐ！徒歩圏内にコンビニ、居酒屋、飲食店多数あり。低料金・長期割引が魅力です。全室ネット接続有、コインランドリーや電子レンジ等完備。24時間利用可能な共同浴場が好評♪詳細はHPで！,【アクセス】中央自動車道「多治見インター」すぐ。多治見駅より車で10分。,エリア ： 岐阜県 > 多治見・土岐・加茂・可児,2016-03-28 02:37:20,2016-03-28 02:37:20,"￥3,611〜","（￥1,805〜/人）",,,,,,,,,,,,,,,,,,,,,,,,,,,,,,,,,,,,,,,,,,,,,,,,,,,,,,,,,,,,,,,,,,,,,,,,,,,,
1028,料理旅館　中野屋,/yad308534/?stayCount=1&roomCount=1&adultNum=2&stayDay=&stayYear=&stayMonth=&dateUndecided=1&distCd=01&roomCrack=200000&screenId=UWW1402&yadNo=308534&callbackHistFlg=1,澄みきった空気、山の緑、川のせせらぎに心が癒される。地元素材にこだわり一品一品吟味した手作りの里山会席が好評。全室ネット無料接続　紅葉の美しい付知峡までお車で２５分。,【アクセス】美濃加茂ICより国道41号北上、県道62号東白川村役場へ,エリア ： 岐阜県 > 多治見・土岐・加茂・可児,2016-03-28 02:37:20,2016-03-28 02:37:20,"￥9,444〜","（￥4,722〜/人）",,,,,,,,,,,,,,,,,,,,,,,,,,,,,,,,,,,,,,,,,,,,,,,,,,,,,,,,,,,,,,,,,,,,,,,,,,,,
1029,ホテルベストイン大垣,/yad301812/?stayCount=1&roomCount=1&adultNum=2&stayDay=&stayYear=&stayMonth=&dateUndecided=1&distCd=01&roomCrack=200000&screenId=UWW1402&yadNo=301812&callbackHistFlg=1,２０１０年４月にオープンしたホテル！大垣駅北口から徒歩３分！！大型ショッピングセンターアクアウォーク大垣前。ホテル敷地内に５０台分の駐車スペース完備。ご朝食時間　６：３０〜８：３０,【アクセス】大垣駅北口から徒歩3分。名神高速道路・大垣IC→258号線で車で約10分,エリア ： 岐阜県 > 大垣・養老・揖斐,2016-03-28 02:37:20,2016-03-28 02:37:20,"￥6,296〜",（￥-/室）,,,,,,,,,,,,,,,,,,,,,,,,,,,,,,,,,,,,,,,,,,,,,,,,,,,,,,,,,,,,,,,,,,,,,,,,,,,,
1030,福旅館,/yad307320/?stayCount=1&roomCount=1&adultNum=2&stayDay=&stayYear=&stayMonth=&dateUndecided=1&distCd=01&roomCrack=200000&screenId=UWW1402&yadNo=307320&callbackHistFlg=1,羽島駅から車で10分。ビジネスに観光に便利な宿です。自慢の手料理でおくつろぎ下さい。,【アクセス】東海道新幹線『岐阜羽島駅』より車で10分／名神高速『羽島IC』より12分,エリア ： 岐阜県 > 大垣・養老・揖斐,2016-03-28 02:37:20,2016-03-28 02:37:20,"￥7,037〜","（￥3,518〜/人）",,,,,,,,,,,,,,,,,,,,,,,,,,,,,,,,,,,,,,,,,,,,,,,,,,,,,,,,,,,,,,,,,,,,,,,,,,,,
1031,千歳楼(せんざいろう),/yad318415/?stayCount=1&roomCount=1&adultNum=2&stayDay=&stayYear=&stayMonth=&dateUndecided=1&distCd=01&roomCrack=200000&screenId=UWW1402&yadNo=318415&callbackHistFlg=1,創業1764年、明治・大正浪漫漂う建物は落ち着きと癒しを感じさせます。窓からは山の情景、四季折々の美しさをお楽しみ頂けます。心をこめてお作りしたお料理と和みのひとときをお楽しみ下さい。,【アクセス】名神高速大垣ＩＣより、国道258号線南下、養老公園方面へ。（名古屋から車で約60分）,エリア ： 岐阜県 > 大垣・養老・揖斐,2016-03-28 02:37:20,2016-03-28 02:37:20,"￥31,111〜","（￥15,555〜/人）",,,,,,,,,,,,,,,,,,,,,,,,,,,,,,,,,,,,,,,,,,,,,,,,,,,,,,,,,,,,,,,,,,,,,,,,,,,,
1032,大垣フォーラムホテル,/yad321891/?stayCount=1&roomCount=1&adultNum=2&stayDay=&stayYear=&stayMonth=&dateUndecided=1&distCd=01&roomCrack=200000&screenId=UWW1402&yadNo=321891&callbackHistFlg=1,自然に恵まれた岐阜県・西濃地区に位置。玄関前には小川、ロビーラウンジに滝、中庭には自噴水を配し、水都大垣をイメージ。78の客室と洋・中2種のレストランがあり、ゆっくりと滞在できるのが魅力。,【アクセス】大垣駅より車で１０分、名神高速道路、大垣ＩＣより１５分、羽島ＩＣより２０分。駐車場完備。,エリア ： 岐阜県 > 大垣・養老・揖斐,2016-03-28 02:37:20,2016-03-28 02:37:20,"￥9,629〜","（￥4,814〜/人）",,,,,,,,,,,,,,,,,,,,,,,,,,,,,,,,,,,,,,,,,,,,,,,,,,,,,,,,,,,,,,,,,,,,,,,,,,,,
1033,スーパーホテル大垣駅前,/yad324813/?stayCount=1&roomCount=1&adultNum=2&stayDay=&stayYear=&stayMonth=&dateUndecided=1&distCd=01&roomCrack=200000&screenId=UWW1402&yadNo=324813&callbackHistFlg=1,★おかげさまで２つの顧客満足度調査で満足度NO．1ダブル受賞！！★ＪＲ・養老鉄道「大垣駅」南口より徒歩約５分★最寄のコンビニは大垣駅駅南口1階の「サークルＫ」さんです,【アクセス】JR「大垣駅」より徒歩約５分♪　養老鉄道「大垣駅」より徒歩約５分♪　大垣ＩＣよりお車で約１５分♪,エリア ： 岐阜県 > 大垣・養老・揖斐,2016-03-28 02:37:20,2016-03-28 02:37:20,"￥6,759〜","（￥3,379〜/人）",,,,,,,,,,,,,,,,,,,,,,,,,,,,,,,,,,,,,,,,,,,,,,,,,,,,,,,,,,,,,,,,,,,,,,,,,,,,
1034,養老温泉　ゆせんの里　ホテルなでしこ,/yad328884/?stayCount=1&roomCount=1&adultNum=2&stayDay=&stayYear=&stayMonth=&dateUndecided=1&distCd=01&roomCrack=200000&screenId=UWW1402&yadNo=328884&callbackHistFlg=1,天然温泉かけ流しの大浴場・水着で入る療法浴場「さらさ」人気の養老汗蒸幕・五色岩盤浴など温浴設備充実★本館「みのり乃湯」もご利用OK！エステ・カラオケあり♪気軽に利用できる日帰りも人気★,【アクセス】【お車】名神高速　大垣ICよりＲ258経由にて約15分／【電車】JR大垣駅・岐阜羽島よりシャトルバスあり,エリア ： 岐阜県 > 大垣・養老・揖斐,2016-03-28 02:37:20,2016-03-28 02:37:20,"￥13,333〜","（￥6,666〜/人）",,,,,,,,,,,,,,,,,,,,,,,,,,,,,,,,,,,,,,,,,,,,,,,,,,,,,,,,,,,,,,,,,,,,,,,,,,,,
1035,アパホテル＜大垣駅前＞,/yad333881/?stayCount=1&roomCount=1&adultNum=2&stayDay=&stayYear=&stayMonth=&dateUndecided=1&distCd=01&roomCrack=200000&screenId=UWW1402&yadNo=333881&callbackHistFlg=1,■大垣駅南口より徒歩1分■大浴場・露天風呂・サウナ無料■■岐阜まで電車で10分、名古屋までは30分■■全室Wi-Fi・有線LAN完備■ぶらり一人旅にも最適！■,【アクセス】ＪＲ大垣駅南口より右手方向、徒歩1分以内！大浴場・サウナ施設完備！すぐ隣提携駐車場100台有り！,エリア ： 岐阜県 > 大垣・養老・揖斐,2016-03-28 02:37:20,2016-03-28 02:37:20,"￥4,629〜","（￥2,314〜/人）",,,,,,,,,,,,,,,,,,,,,,,,,,,,,,,,,,,,,,,,,,,,,,,,,,,,,,,,,,,,,,,,,,,,,,,,,,,,
1036,ホテルルートイン大垣インター,/yad340380/?stayCount=1&roomCount=1&adultNum=2&stayDay=&stayYear=&stayMonth=&dateUndecided=1&distCd=01&roomCrack=200000&screenId=UWW1402&yadNo=340380&callbackHistFlg=1,無料駐車場完備でお仕事にも旅行にも大変便利♪ボリューム満点の朝食バイキングをサービス！Wi-Fi完備♪もちろん大浴場もお楽しみくださいませ♪ロビーにドールコーヒーの無料セルフカフェをご用意♪,【アクセス】名神高速大垣ＩＣより車で３分、JR大垣駅より車で10分,エリア ： 岐阜県 > 大垣・養老・揖斐,2016-03-28 02:37:20,2016-03-28 02:37:20,"￥9,583〜","（￥4,791〜/人）",,,,,,,,,,,,,,,,,,,,,,,,,,,,,,,,,,,,,,,,,,,,,,,,,,,,,,,,,,,,,,,,,,,,,,,,,,,,
1037,グリーンホテル小松家,/yad341272/?stayCount=1&roomCount=1&adultNum=2&stayDay=&stayYear=&stayMonth=&dateUndecided=1&distCd=01&roomCrack=200000&screenId=UWW1402&yadNo=341272&callbackHistFlg=1,根尾川沿いの閑静な環境にあり、岐阜市内まで車で30分、名神高速岐阜羽島ICまで車で30分という立地。アットホームな雰囲気の中ゆっくりとお休み下さい。,【アクセス】岐阜羽島ICより西に１０分、根尾川左岸を上流に20分、やぶかわ橋を左折、黒野交差点を右折します,エリア ： 岐阜県 > 大垣・養老・揖斐,2016-03-28 02:37:20,2016-03-28 02:37:20,"￥8,703〜","（￥4,351〜/人）",,,,,,,,,,,,,,,,,,,,,,,,,,,,,,,,,,,,,,,,,,,,,,,,,,,,,,,,,,,,,,,,,,,,,,,,,,,,
1038,海津温泉,/yad342359/?stayCount=1&roomCount=1&adultNum=2&stayDay=&stayYear=&stayMonth=&dateUndecided=1&distCd=01&roomCrack=200000&screenId=UWW1402&yadNo=342359&callbackHistFlg=1,鉄分と塩分を多く含んだ天然温泉。地下1300ｍより毎分1050リットルも湧き出す豊富な湯量で、源泉掛け流しの御影石、ひのき風呂をはじめとした25個のお風呂が御座います。,【アクセス】養老鉄道、石津駅より海津市営バスにて約10分,エリア ： 岐阜県 > 大垣・養老・揖斐,2016-03-28 02:37:20,2016-03-28 02:37:20,"￥9,518〜","（￥4,759〜/人）",,,,,,,,,,,,,,,,,,,,,,,,,,,,,,,,,,,,,,,,,,,,,,,,,,,,,,,,,,,,,,,,,,,,,,,,,,,,
1039,ロワジールホテル大垣,/yad343019/?stayCount=1&roomCount=1&adultNum=2&stayDay=&stayYear=&stayMonth=&dateUndecided=1&distCd=01&roomCrack=200000&screenId=UWW1402&yadNo=343019&callbackHistFlg=1,客室は全室WiFi完備致しました。また、ゆったりとしたつくりとなっており、客室アメニティーも新しくDHCスキンケアが追加になりました。お車でお越しの方は、大垣西ICより5分。大垣ICより20分。,【アクセス】JR・養老鉄道大垣駅より徒歩5分。名神高速道路、大垣ICより約15分。駐車場完備(敷地内10台１泊￥1000）,エリア ： 岐阜県 > 大垣・養老・揖斐,2016-03-28 02:37:20,2016-03-28 02:37:20,"￥6,083〜","（￥3,041〜/人）",,,,,,,,,,,,,,,,,,,,,,,,,,,,,,,,,,,,,,,,,,,,,,,,,,,,,,,,,,,,,,,,,,,,,,,,,,,,
