id,building_name,image_url,detail,access,address,created_at,updated_at,fee1,fee2,,,,,,,,,,,,,,,,,,,,,,,,,,,,,,,,,,,,,,,,,,,,,,,,,,,,,,,,,,,,,,,,,,,,,,,,,,,,
2781,かわちや旅館,/yad315574/?stayCount=1&roomCount=1&adultNum=2&stayDay=&stayYear=&stayMonth=&dateUndecided=1&distCd=01&roomCrack=200000&screenId=UWW1402&yadNo=315574&callbackHistFlg=1,南伊勢の海、大将が愛情かけて育てた「真鯛」を使った創作料理が美味しい！当館のイカダで釣りを楽しんだ後、釣った魚をその場で調理ＯＫ！実はカップルに人気なお宿です。,【アクセス】伊勢自動車道、勢和多気ＪＣより紀勢自動車道の紀勢大内山ＩＣより車で約2０分,エリア ： 三重県 > 南勢,2016-03-28 02:37:08,2016-03-28 02:37:08,"￥6,481〜","（￥3,240〜/人）",,,,,,,,,,,,,,,,,,,,,,,,,,,,,,,,,,,,,,,,,,,,,,,,,,,,,,,,,,,,,,,,,,,,,,,,,,,,
2782,五ヶ所湾一望の料理宿　とよや勘兵衛,/yad336448/?stayCount=1&roomCount=1&adultNum=2&stayDay=&stayYear=&stayMonth=&dateUndecided=1&distCd=01&roomCrack=200000&screenId=UWW1402&yadNo=336448&callbackHistFlg=1,五ヶ所湾を美しい入り江を望む全室オーシャンビューの客室！獲れたて新鮮海の幸・伊勢海老・鮑・舩越牡蠣等を使用した海鮮料理を堪能♪現在５ヶ月待ちのソマカツオの塩切りで有名！！,【アクセス】伊勢道玉城ＩＣより40分　最寄りの駅から三重交通バス　五ヶ所行き下車⇒相賀行き礫浦下車,エリア ： 三重県 > 南勢,2016-03-28 02:37:08,2016-03-28 02:37:08,"￥7,777〜","（￥3,888〜/人）",,,,,,,,,,,,,,,,,,,,,,,,,,,,,,,,,,,,,,,,,,,,,,,,,,,,,,,,,,,,,,,,,,,,,,,,,,,,
2783,旅館さざなみ,/yad373052/?stayCount=1&roomCount=1&adultNum=2&stayDay=&stayYear=&stayMonth=&dateUndecided=1&distCd=01&roomCrack=200000&screenId=UWW1402&yadNo=373052&callbackHistFlg=1,★ペット同伴OK！海景色・海の幸を心ゆくまで堪能★高台にある当館は全室オーシャンビュー！さらに五ヶ所湾を一望できる絶景浴を貸切風呂でご入浴♪（宿泊者単位で入替制）獲れたて海の幸の会席料理に舌鼓♪,【アクセス】伊勢道玉城ＩＣより40分・近鉄宇治山田駅／志摩磯部駅／三重交通バス五ケ所行き下車⇒相賀行き礫浦下車,エリア ： 三重県 > 南勢,2016-03-28 02:37:08,2016-03-28 02:37:08,"￥7,962〜","（￥3,981〜/人）",,,,,,,,,,,,,,,,,,,,,,,,,,,,,,,,,,,,,,,,,,,,,,,,,,,,,,,,,,,,,,,,,,,,,,,,,,,,
2784,ニューはまぐち屋旅館,/yad395652/?stayCount=1&roomCount=1&adultNum=2&stayDay=&stayYear=&stayMonth=&dateUndecided=1&distCd=01&roomCrack=200000&screenId=UWW1402&yadNo=395652&callbackHistFlg=1,客室からは水平線のはるかかなたまで広がるマリンブルーの海が一望！小型犬に限りますが、ワンちゃん歓迎♪宿泊料も無料です★当館自慢の逸品は“地魚の煮付け”お腹をすかしてお越しください♪,【アクセス】宇治山田駅より三交バス相賀行き、礫浦バス停下車（7名以上でバス停まで送迎有）/玉城ＩＣ下車後、１時間,エリア ： 三重県 > 南勢,2016-03-28 02:37:08,2016-03-28 02:37:08,"￥7,222〜","（￥3,611〜/人）",,,,,,,,,,,,,,,,,,,,,,,,,,,,,,,,,,,,,,,,,,,,,,,,,,,,,,,,,,,,,,,,,,,,,,,,,,,,
2785,民宿かんえい,/yad317490/?stayCount=1&roomCount=1&adultNum=2&stayDay=&stayYear=&stayMonth=&dateUndecided=1&distCd=01&roomCrack=200000&screenId=UWW1402&yadNo=317490&callbackHistFlg=1,2012年10月ちょっぴりリニューアルしたロビーでお出迎え♪海幸天国！目の前で炊き上げる磯ウニ釜飯やドド〜ンと盛られた豪華な舟盛、四季折々に旨い食材がずらりと並び満腹度も充実度も◎,【アクセス】伊勢自動車道伊勢西ICから伊勢二見鳥羽ラインへ約約30分。,エリア ： 三重県 > 南鳥羽,2016-03-28 02:37:08,2016-03-28 02:37:08,"￥20,703〜","（￥10,351〜/人）",,,,,,,,,,,,,,,,,,,,,,,,,,,,,,,,,,,,,,,,,,,,,,,,,,,,,,,,,,,,,,,,,,,,,,,,,,,,
2786,海女四代の宿　ささき,/yad341264/?stayCount=1&roomCount=1&adultNum=2&stayDay=&stayYear=&stayMonth=&dateUndecided=1&distCd=01&roomCrack=200000&screenId=UWW1402&yadNo=341264&callbackHistFlg=1,獲れたて、豪快海幸は当たり前。海を知り尽くす老舗宿の自慢は、隙間のない特大舟盛！漁港風景を臨む絶景の貸切露天風呂２種で最高のロケーションを。お伊勢参りの伊勢神宮まで車約３５分！とアクセス最高！,【アクセス】近鉄JR鳥羽駅下車バス30分。伊勢西ICから伊勢二見鳥羽ライン経由約40分。42号〜167〜県道47〜相差,エリア ： 三重県 > 南鳥羽,2016-03-28 02:37:08,2016-03-28 02:37:08,"￥16,666〜","（￥8,333〜/人）",,,,,,,,,,,,,,,,,,,,,,,,,,,,,,,,,,,,,,,,,,,,,,,,,,,,,,,,,,,,,,,,,,,,,,,,,,,,
2787,和気あいあいの宿　民宿旅館　 なか川,/yad395739/?stayCount=1&roomCount=1&adultNum=2&stayDay=&stayYear=&stayMonth=&dateUndecided=1&distCd=01&roomCrack=200000&screenId=UWW1402&yadNo=395739&callbackHistFlg=1,テレビ取材殺到！エリア唯一、親子3世代女子大生海女のいる旅館です。現役漁師の海幸新鮮は当たり前、ボリューム満点の懐石料理をご堪能。女性の願いを叶えるという『石神さん』まで車で3分で行けます！,【アクセス】近鉄・JR鳥羽駅下車送迎あり（要予約）伊勢自動車道伊勢西ICより伊勢二見鳥羽ラインR167経由約30分,エリア ： 三重県 > 南鳥羽,2016-03-28 02:37:08,2016-03-28 02:37:08,"￥21,600〜","（￥10,800〜/人）",,,,,,,,,,,,,,,,,,,,,,,,,,,,,,,,,,,,,,,,,,,,,,,,,,,,,,,,,,,,,,,,,,,,,,,,,,,,
2788,料理民宿釣船魚月（うおづき）,/yad300522/?stayCount=1&roomCount=1&adultNum=2&stayDay=&stayYear=&stayMonth=&dateUndecided=1&distCd=01&roomCrack=200000&screenId=UWW1402&yadNo=300522&callbackHistFlg=1,釣客相手の宿だから新鮮素材には自身有。素材は漁師の主人が海から直送、漁師や海女から仕入れる旬素材が食膳に並ぶ。米も自家製コシヒカリ。もちろん釣りもおまかせ！,【アクセス】近鉄鳥羽駅より車で２０分,エリア ： 三重県 > 南鳥羽,2016-03-28 02:37:08,2016-03-28 02:37:08,"￥20,000〜","（￥10,000〜/人）",,,,,,,,,,,,,,,,,,,,,,,,,,,,,,,,,,,,,,,,,,,,,,,,,,,,,,,,,,,,,,,,,,,,,,,,,,,,
2789,南鳥羽相差　港の宿　日乃出,/yad303558/?stayCount=1&roomCount=1&adultNum=2&stayDay=&stayYear=&stayMonth=&dateUndecided=1&distCd=01&roomCrack=200000&screenId=UWW1402&yadNo=303558&callbackHistFlg=1,漁港近くの料理自慢の宿。爽快に海を見渡せる貸切専用の露天風呂が好評！素材のよさが味の決め手になる舟盛りはもちろん看板料理の踊焼きも好評！ぐつぐつ、出来たてを召し上がれ♪,【アクセス】電車…ＪＲ・近鉄鳥羽駅よりバスで35分/お車…鳥羽より167号線経由,エリア ： 三重県 > 南鳥羽,2016-03-28 02:37:08,2016-03-28 02:37:08,"￥18,148〜","（￥9,074〜/人）",,,,,,,,,,,,,,,,,,,,,,,,,,,,,,,,,,,,,,,,,,,,,,,,,,,,,,,,,,,,,,,,,,,,,,,,,,,,
2790,星海幽月　夢遊華,/yad303654/?stayCount=1&roomCount=1&adultNum=2&stayDay=&stayYear=&stayMonth=&dateUndecided=1&distCd=01&roomCrack=200000&screenId=UWW1402&yadNo=303654&callbackHistFlg=1,海を見渡す絶景！広大な敷地に客室わずか8室、全ての客室が露天風呂付(全室内禁煙)。漁師の主人が長年の夢を実現させた宿だけあり料理も評判。料理内容は当日の水揚げ次第！季節の旬が堪能できる,【アクセス】伊勢道伊勢IC〜伊勢二見鳥羽ライン経由〜パールロード経由〜国崎下,エリア ： 三重県 > 南鳥羽,2016-03-28 02:37:08,2016-03-28 02:37:08,"￥48,000〜","（￥24,000〜/人）",,,,,,,,,,,,,,,,,,,,,,,,,,,,,,,,,,,,,,,,,,,,,,,,,,,,,,,,,,,,,,,,,,,,,,,,,,,,
2791,海女の宿 ひょうすけ,/yad306676/?stayCount=1&roomCount=1&adultNum=2&stayDay=&stayYear=&stayMonth=&dateUndecided=1&distCd=01&roomCrack=200000&screenId=UWW1402&yadNo=306676&callbackHistFlg=1,人気のパワースポット【石神さん】もすぐ♪女将と若女将が現役海女さんが獲ってくる魚介を豪快に蒸し焼きにした【大漁焼き】は当館名物料理！ぜひご賞味ください。２種類の貸切風呂は何度でも無料で利用OK！,【アクセス】近鉄・JR鳥羽駅より車20分(予約送迎有)。または伊勢ICより伊勢二見鳥羽ライン経由パールロードで相差へ,エリア ： 三重県 > 南鳥羽,2016-03-28 02:37:08,2016-03-28 02:37:08,"￥10,000〜","（￥5,000〜/人）",,,,,,,,,,,,,,,,,,,,,,,,,,,,,,,,,,,,,,,,,,,,,,,,,,,,,,,,,,,,,,,,,,,,,,,,,,,,
2792,漁師と海女の宿　じだい家,/yad308419/?stayCount=1&roomCount=1&adultNum=2&stayDay=&stayYear=&stayMonth=&dateUndecided=1&distCd=01&roomCrack=200000&screenId=UWW1402&yadNo=308419&callbackHistFlg=1,宿が仕掛ける定置網は季節によっていろんな魚が獲れる。例えばいわし、アジ、カマスなど。自家製のお米と獲れたての魚。海女の女将が採ってくるサザエ、アワビなどで豪華な食事を楽しめる。,【アクセス】近鉄鳥羽駅下車三交バス国崎行き長岡中学校前下車徒歩５分,エリア ： 三重県 > 南鳥羽,2016-03-28 02:37:08,2016-03-28 02:37:08,"￥17,592〜","（￥8,796〜/人）",,,,,,,,,,,,,,,,,,,,,,,,,,,,,,,,,,,,,,,,,,,,,,,,,,,,,,,,,,,,,,,,,,,,,,,,,,,,
2793,味な湯の宿　別館　すずき,/yad315768/?stayCount=1&roomCount=1&adultNum=2&stayDay=&stayYear=&stayMonth=&dateUndecided=1&distCd=01&roomCrack=200000&screenId=UWW1402&yadNo=315768&callbackHistFlg=1,TV雑誌の取材多数！貸切露天２種は空いていれば何度でも貸切無料。07年にリニューアルしご要望に答え絶景露天付き客室も新設。海幸三昧の夕食はお部屋か個室にご用意。大切な人とお越し下さいませ。,【アクセス】伊勢ICから伊勢二見鳥羽ライン経由。国道167号線またはパールロードを通り相差へ,エリア ： 三重県 > 南鳥羽,2016-03-28 02:37:08,2016-03-28 02:37:08,"￥27,600〜","（￥13,800〜/人）",,,,,,,,,,,,,,,,,,,,,,,,,,,,,,,,,,,,,,,,,,,,,,,,,,,,,,,,,,,,,,,,,,,,,,,,,,,,
2794,あそび心の宿のいち,/yad316471/?stayCount=1&roomCount=1&adultNum=2&stayDay=&stayYear=&stayMonth=&dateUndecided=1&distCd=01&roomCrack=200000&screenId=UWW1402&yadNo=316471&callbackHistFlg=1,石神さん参道沿いにあるちょっと可愛いお宿です。料理は新鮮な相差おかん料理、全部屋６室、トイレ、洗面所付の小さな民宿。,【アクセス】伊勢二見ラインから第２伊勢道路白木出口から１５分,エリア ： 三重県 > 南鳥羽,2016-03-28 02:37:08,2016-03-28 02:37:08,"￥18,518〜","（￥9,259〜/人）",,,,,,,,,,,,,,,,,,,,,,,,,,,,,,,,,,,,,,,,,,,,,,,,,,,,,,,,,,,,,,,,,,,,,,,,,,,,
2795,漁師の宿　まさみや,/yad316632/?stayCount=1&roomCount=1&adultNum=2&stayDay=&stayYear=&stayMonth=&dateUndecided=1&distCd=01&roomCrack=200000&screenId=UWW1402&yadNo=316632&callbackHistFlg=1,■運が良ければ徒歩3分の海から「富士山」が見えることがあります。特に10月〜4月は空気が澄んでさらにキレイに見えることがあります☆漁師町の潮風に当たりながら、日の出を拝むのもまたおススメです！★,【アクセス】名古屋より約２時間３０分、大阪より約３時間,エリア ： 三重県 > 南鳥羽,2016-03-28 02:37:08,2016-03-28 02:37:08,"￥17,240〜","（￥8,620〜/人）",,,,,,,,,,,,,,,,,,,,,,,,,,,,,,,,,,,,,,,,,,,,,,,,,,,,,,,,,,,,,,,,,,,,,,,,,,,,
2796,あわびと伊勢エビのお宿　たまや,/yad317293/?stayCount=1&roomCount=1&adultNum=2&stayDay=&stayYear=&stayMonth=&dateUndecided=1&distCd=01&roomCrack=200000&screenId=UWW1402&yadNo=317293&callbackHistFlg=1,国崎町は伊勢神宮献上二千年の歴史を誇る「熨斗あわび」発祥の地。その神様に献上するほどの伊勢海老、鮑、鯛など国崎でとれた素材を使い料理自慢の宿。海抜５０メートルの高台からのながめは最高！！,【アクセス】名古屋,エリア ： 三重県 > 南鳥羽,2016-03-28 02:37:08,2016-03-28 02:37:08,"￥26,000〜","（￥13,000〜/人）",,,,,,,,,,,,,,,,,,,,,,,,,,,,,,,,,,,,,,,,,,,,,,,,,,,,,,,,,,,,,,,,,,,,,,,,,,,,
2797,料理自慢の民宿　伊平屋荘,/yad317528/?stayCount=1&roomCount=1&adultNum=2&stayDay=&stayYear=&stayMonth=&dateUndecided=1&distCd=01&roomCrack=200000&screenId=UWW1402&yadNo=317528&callbackHistFlg=1,伊勢神宮まで車で約６０分。主人は「船頭」、女将は「郷土料理自慢」の宿。名物の「タコ飯」をはじめ主人が沖で釣ってきた新鮮な海の幸を振舞う。新鮮な旬の海鮮をリーズナブルに楽しめる穴場的宿です！,【アクセス】近鉄鳥羽駅より車約３０分,エリア ： 三重県 > 南鳥羽,2016-03-28 02:37:08,2016-03-28 02:37:08,"￥18,000〜","（￥9,000〜/人）",,,,,,,,,,,,,,,,,,,,,,,,,,,,,,,,,,,,,,,,,,,,,,,,,,,,,,,,,,,,,,,,,,,,,,,,,,,,
2798,浜辺のお宿　相差パシフィックホテル,/yad317864/?stayCount=1&roomCount=1&adultNum=2&stayDay=&stayYear=&stayMonth=&dateUndecided=1&distCd=01&roomCrack=200000&screenId=UWW1402&yadNo=317864&callbackHistFlg=1,海女の町★相差【千鳥ヶ浜】海一望の絶景！ゴールデンウィーク＆サミット期間中も宿泊できます！伊勢神宮・車で４０分★石神さん徒歩１０分★伊勢志摩サミット会場の賢島まで車で３０分と好立地,【アクセス】伊勢自動車道伊勢インターより車にて４０分近鉄鳥羽駅より車にて２５分。,エリア ： 三重県 > 南鳥羽,2016-03-28 02:37:08,2016-03-28 02:37:08,"￥5,555〜","（￥2,777〜/人）",,,,,,,,,,,,,,,,,,,,,,,,,,,,,,,,,,,,,,,,,,,,,,,,,,,,,,,,,,,,,,,,,,,,,,,,,,,,
2799,御宿　瀬乃崎,/yad319376/?stayCount=1&roomCount=1&adultNum=2&stayDay=&stayYear=&stayMonth=&dateUndecided=1&distCd=01&roomCrack=200000&screenId=UWW1402&yadNo=319376&callbackHistFlg=1,スペイン村へも便利な立地♪創業当時から守り続ける『元祖残酷・かまど焼き』や伊勢志摩ならではの海の幸を堪能できる大人気プランで地元の海女ちゃんとのふれあいが楽しめる海女小屋体験プランが人気の宿,【アクセス】伊勢道から鳥羽駅前通過、パールロード（無料）経由相差畔蛸ＩＣ下車、Ｔ字路左折８００ｍです,エリア ： 三重県 > 南鳥羽,2016-03-28 02:37:08,2016-03-28 02:37:08,"￥20,000〜","（￥10,000〜/人）",,,,,,,,,,,,,,,,,,,,,,,,,,,,,,,,,,,,,,,,,,,,,,,,,,,,,,,,,,,,,,,,,,,,,,,,,,,,
2800,海辺の宿　うえじ,/yad320175/?stayCount=1&roomCount=1&adultNum=2&stayDay=&stayYear=&stayMonth=&dateUndecided=1&distCd=01&roomCrack=200000&screenId=UWW1402&yadNo=320175&callbackHistFlg=1,日の出が見える小宿！相差白浜海岸まですぐ前！伊勢えび雑炊＆伊勢海老汁を堪能する“漁師のほっこり朝ごはん”が人気！リーズナブルな１泊朝食プランもある家族的おもてなしの宿。石神さんにも徒歩７分。,【アクセス】伊勢西IC→最短ルートは第二伊勢道路白木インター車で１５分。鳥羽駅→海沿いのパールロード経由で３０分。,エリア ： 三重県 > 南鳥羽,2016-03-28 02:37:08,2016-03-28 02:37:08,"￥9,259〜","（￥4,629〜/人）",,,,,,,,,,,,,,,,,,,,,,,,,,,,,,,,,,,,,,,,,,,,,,,,,,,,,,,,,,,,,,,,,,,,,,,,,,,,
2801,花の小宿　重兵衛,/yad320234/?stayCount=1&roomCount=1&adultNum=2&stayDay=&stayYear=&stayMonth=&dateUndecided=1&distCd=01&roomCrack=200000&screenId=UWW1402&yadNo=320234&callbackHistFlg=1,女性の願いを叶えてくれる『石神さん』に隣接する「花の小宿　重兵衛」が、2015年6月さらに皆様に愛されるお部屋へと３室リニューアル！こだわり野菜や米＆新鮮海幸にこだわるリニューアルプランも大好評♪,【アクセス】伊勢自動車道　伊勢二見鳥羽ライン経由　近鉄鳥羽駅より車２５分。バス国崎行相差下車徒歩５分。,エリア ： 三重県 > 南鳥羽,2016-03-28 02:37:08,2016-03-28 02:37:08,"￥16,000〜","（￥8,000〜/人）",,,,,,,,,,,,,,,,,,,,,,,,,,,,,,,,,,,,,,,,,,,,,,,,,,,,,,,,,,,,,,,,,,,,,,,,,,,,
2802,素朴なお宿　仁宝,/yad320400/?stayCount=1&roomCount=1&adultNum=2&stayDay=&stayYear=&stayMonth=&dateUndecided=1&distCd=01&roomCrack=200000&screenId=UWW1402&yadNo=320400&callbackHistFlg=1,女将が海女、主人も漁師。夫婦が漁に出て獲ってきた伊勢海老、鮑などの新鮮で旬の海の幸を味わって戴きます！野菜はもちろんお米も無農薬の自家製米。,【アクセス】名古屋より約２時間３０分、大阪より約３時間,エリア ： 三重県 > 南鳥羽,2016-03-28 02:37:08,2016-03-28 02:37:08,"￥18,000〜","（￥9,000〜/人）",,,,,,,,,,,,,,,,,,,,,,,,,,,,,,,,,,,,,,,,,,,,,,,,,,,,,,,,,,,,,,,,,,,,,,,,,,,,
2803,リゾートヒルズ豊浜　蒼空の風 〜ＳＯＲＡ ｎｏ  ＫＡＺＥ〜,/yad322275/?stayCount=1&roomCount=1&adultNum=2&stayDay=&stayYear=&stayMonth=&dateUndecided=1&distCd=01&roomCrack=200000&screenId=UWW1402&yadNo=322275&callbackHistFlg=1,全プラン舟盛り付！板長厳選の地元食材をふんだんに使用したお料理をお楽しみ下さい。ハンモックやフィッシュ足湯で笑顔いっぱいの思い出作りを♪榊原の美肌温泉を満喫できる海沿い高台のアットホームなお宿,【アクセス】伊勢自動車道、伊勢二見鳥羽ライン、第二伊勢道路を『志摩方面』へ『鳥羽南白木IC』より県道４７号を１２分,エリア ： 三重県 > 南鳥羽,2016-03-28 02:37:08,2016-03-28 02:37:08,"￥18,000〜","（￥9,000〜/人）",,,,,,,,,,,,,,,,,,,,,,,,,,,,,,,,,,,,,,,,,,,,,,,,,,,,,,,,,,,,,,,,,,,,,,,,,,,,
2804,浜辺のゆ宿 磯島,/yad324470/?stayCount=1&roomCount=1&adultNum=2&stayDay=&stayYear=&stayMonth=&dateUndecided=1&distCd=01&roomCrack=200000&screenId=UWW1402&yadNo=324470&callbackHistFlg=1,"地物の海の幸,旬を取り入れたボリューム満点のお夕食！そして「磯島名物・からだに優しい牡蠣雑炊」の朝ごはん。白山温泉を汲み入れた趣のある露天風呂もおもしろい♪【石神さん】にも徒歩１０分。",【アクセス】車：伊勢西IC→伊勢二見鳥羽ライン経由約40分。電車：近鉄・JR鳥羽駅より無料送迎も有（要予約）,エリア ： 三重県 > 南鳥羽,2016-03-28 02:37:08,2016-03-28 02:37:08,"￥9,074〜","（￥4,537〜/人）",,,,,,,,,,,,,,,,,,,,,,,,,,,,,,,,,,,,,,,,,,,,,,,,,,,,,,,,,,,,,,,,,,,,,,,,,,,,
2805,海幸の宿　なかよし,/yad326179/?stayCount=1&roomCount=1&adultNum=2&stayDay=&stayYear=&stayMonth=&dateUndecided=1&distCd=01&roomCrack=200000&screenId=UWW1402&yadNo=326179&callbackHistFlg=1,伊勢神宮車約30分・石神さん歩き6分、鳥羽水族館車25分、スペイン村15分とアクセス抜群！旬を迎える鮑・伊勢海老料理が目の前にズラリ♪「漁師町ならではの豪快料理」で大感激!,【アクセス】伊勢自動車道伊勢西ＩＣより伊勢二見鳥羽ロード経由30分,エリア ： 三重県 > 南鳥羽,2016-03-28 02:37:08,2016-03-28 02:37:08,"￥20,000〜","（￥10,000〜/人）",,,,,,,,,,,,,,,,,,,,,,,,,,,,,,,,,,,,,,,,,,,,,,,,,,,,,,,,,,,,,,,,,,,,,,,,,,,,
2806,くいしん坊の湯宿　望洋,/yad331117/?stayCount=1&roomCount=1&adultNum=2&stayDay=&stayYear=&stayMonth=&dateUndecided=1&distCd=01&roomCrack=200000&screenId=UWW1402&yadNo=331117&callbackHistFlg=1,伊勢志摩の海グルメプラン色々♪今なら全プラン貸切専用風呂１回利用無料！人気スポット『石神さん』近く♪年に一度は伊勢参り『伊勢神宮』へは車で35分♪伊勢志摩パワースポット巡りに最適！,【アクセス】車：伊勢西IC→伊勢二見鳥羽ライン経由約40分。電車：近鉄・JR鳥羽駅より無料送迎も有（要予約）,エリア ： 三重県 > 南鳥羽,2016-03-28 02:37:08,2016-03-28 02:37:08,"￥20,000〜","（￥10,000〜/人）",,,,,,,,,,,,,,,,,,,,,,,,,,,,,,,,,,,,,,,,,,,,,,,,,,,,,,,,,,,,,,,,,,,,,,,,,,,,
2807,料理民宿　潮風荘,/yad332275/?stayCount=1&roomCount=1&adultNum=2&stayDay=&stayYear=&stayMonth=&dateUndecided=1&distCd=01&roomCrack=200000&screenId=UWW1402&yadNo=332275&callbackHistFlg=1,女将が獲る鮑やサザエ、なまこなど伊勢志摩の海の幸満載の料理を板場経験もある主人が料理。豪華舟盛は料理宿ならでは。１日４組のお客様を民宿らしいあったかいおもてなしでお迎えします,【アクセス】近鉄又はＪＲ鳥羽駅下車、バス３０分,エリア ： 三重県 > 南鳥羽,2016-03-28 02:37:08,2016-03-28 02:37:08,"￥13,518〜","（￥6,759〜/人）",,,,,,,,,,,,,,,,,,,,,,,,,,,,,,,,,,,,,,,,,,,,,,,,,,,,,,,,,,,,,,,,,,,,,,,,,,,,
2808,芭新萃−はなしんすい−,/yad333284/?stayCount=1&roomCount=1&adultNum=2&stayDay=&stayYear=&stayMonth=&dateUndecided=1&distCd=01&roomCrack=200000&screenId=UWW1402&yadNo=333284&callbackHistFlg=1,美肌の湯！南勢桜山温泉を満喫【料理口コミ４．８】和食とフレンチのコラボ創作料理が人気♪朝食のご飯は釜で焚き、秋刀魚醤油鍋や天日干しの梅干しなど田舎和食を追求！桜の見頃は3月末〜4月１週目の予定,【アクセス】鳥羽駅からパールロード経由、車で約２５分。≪電車≫近鉄鳥羽駅下、無料送迎あります。（事前予約制）,エリア ： 三重県 > 南鳥羽,2016-03-28 02:37:08,2016-03-28 02:37:08,"￥24,074〜","（￥12,037〜/人）",,,,,,,,,,,,,,,,,,,,,,,,,,,,,,,,,,,,,,,,,,,,,,,,,,,,,,,,,,,,,,,,,,,,,,,,,,,,
2809,みち潮,/yad333318/?stayCount=1&roomCount=1&adultNum=2&stayDay=&stayYear=&stayMonth=&dateUndecided=1&distCd=01&roomCrack=200000&screenId=UWW1402&yadNo=333318&callbackHistFlg=1,海女と漁師の町の海幸料理を味わえる宿。カップルや家族グループからも支持されています。和風・洋風から選べる貸切風呂も人気♪伊勢神宮・おかげ横丁迄最短40分！スペイン村まで約15分！千鳥ヶ浜目の前！,【アクセス】車：パールロード相差より６分電車：鳥羽駅まで無料送迎あり（要予約・最終鳥羽駅発16：30）,エリア ： 三重県 > 南鳥羽,2016-03-28 02:37:08,2016-03-28 02:37:08,"￥8,000〜","（￥4,000〜/人）",,,,,,,,,,,,,,,,,,,,,,,,,,,,,,,,,,,,,,,,,,,,,,,,,,,,,,,,,,,,,,,,,,,,,,,,,,,,
2810,旨さ納得◎の宿　香潮,/yad336963/?stayCount=1&roomCount=1&adultNum=2&stayDay=&stayYear=&stayMonth=&dateUndecided=1&distCd=01&roomCrack=200000&screenId=UWW1402&yadNo=336963&callbackHistFlg=1,季節のとれたて新鮮食材をたっぷり食べるのに一押し宿。板前主人の腕前は調理師協会も認定の旨さ！民宿の豪快さと本物の板前こその美味会席にリピーターも続出。女性の祈願旅お薦め石神さんも徒歩3分♪,【アクセス】近鉄鳥羽駅より車で30分近鉄松尾駅より車で15分,エリア ： 三重県 > 南鳥羽,2016-03-28 02:37:08,2016-03-28 02:37:08,"￥16,296〜","（￥8,148〜/人）",,,,,,,,,,,,,,,,,,,,,,,,,,,,,,,,,,,,,,,,,,,,,,,,,,,,,,,,,,,,,,,,,,,,,,,,,,,,
2811,伊勢志摩随一の絶景　石鏡第一ホテル　神倶良,/yad337295/?stayCount=1&roomCount=1&adultNum=2&stayDay=&stayYear=&stayMonth=&dateUndecided=1&distCd=01&roomCrack=200000&screenId=UWW1402&yadNo=337295&callbackHistFlg=1,「4月、伊勢志摩サミットSALEプラン」発売中！露天風呂付客室「NABURA」も大好評。伊勢湾の島並みを見渡す壮大なパノラマ。アットホームなスタッフと鮮度にこだわった地産魚介の和会席でお腹も満腹の一夜♪,【アクセス】近鉄またはJR鳥羽駅より車で約３０分。無料送迎は１５時、１６時、１７時発（要予約）。,エリア ： 三重県 > 南鳥羽,2016-03-28 02:37:08,2016-03-28 02:37:08,"￥22,000〜","（￥11,000〜/人）",,,,,,,,,,,,,,,,,,,,,,,,,,,,,,,,,,,,,,,,,,,,,,,,,,,,,,,,,,,,,,,,,,,,,,,,,,,,
2812,あみ源,/yad338062/?stayCount=1&roomCount=1&adultNum=2&stayDay=&stayYear=&stayMonth=&dateUndecided=1&distCd=01&roomCrack=200000&screenId=UWW1402&yadNo=338062&callbackHistFlg=1,波穏やかな的矢湾。自然いっぱいの港町。自然の便りをそのままに、自然の恵みをそのままに。自然とふれあいお子様でも安心な魚つり。エサも竿も無料でご用意してます。,【アクセス】伊勢二見ラインより第2伊勢道路白木出口〜約10分,エリア ： 三重県 > 南鳥羽,2016-03-28 02:37:08,2016-03-28 02:37:08,"￥20,000〜","（￥10,000〜/人）",,,,,,,,,,,,,,,,,,,,,,,,,,,,,,,,,,,,,,,,,,,,,,,,,,,,,,,,,,,,,,,,,,,,,,,,,,,,
