id,building_name,image_url,detail,access,address,created_at,updated_at,fee1,fee2,,,,,,,,,,,,,,,,,,,,,,,,,,,,,,,,,,,,,,,,,,,,,,,,,,,,,,,,,,,,,,,,,,,,,,,,,,,,
9247,城崎温泉　西村屋本館,/yad386200/?stayCount=1&roomCount=1&adultNum=2&stayDay=&stayYear=&stayMonth=&dateUndecided=1&distCd=01&roomCrack=200000&screenId=UWW1402&yadNo=386200&callbackHistFlg=1,風格の中にも温かいおもてなしの心が息づく老舗旅館。見事な日本庭園と磨きぬかれたアンティークが、訪れる人を優雅に迎えます。お部屋でいただく季節感あふれる会席料理の数々は一箸ごとに心が躍ります。,【アクセス】JR城崎温泉駅下車　徒歩15分　北近畿豊岡自動車道和田山ICより約60分,エリア ： 兵庫県 > 城崎,2016-03-27 10:23:56,2016-03-27 10:23:56,"￥56,000〜","（￥28,000〜/人）",,,,,,,,,,,,,,,,,,,,,,,,,,,,,,,,,,,,,,,,,,,,,,,,,,,,,,,,,,,,,,,,,,,,,,,,,,,,
9248,泉都オータニホテル,/yad388904/?stayCount=1&roomCount=1&adultNum=2&stayDay=&stayYear=&stayMonth=&dateUndecided=1&distCd=01&roomCrack=200000&screenId=UWW1402&yadNo=388904&callbackHistFlg=1,全室の眺望が円山川に面した景色は、春夏秋冬で素晴らしい表情を見せてくれます。湯めぐりパス(別途購入）を使って気軽に城崎温泉を楽しむのに最適なホテル。無料駐車場完備・全室インターネット接続可能,【アクセス】JR城崎温泉駅より、徒歩5分圏内。,エリア ： 兵庫県 > 城崎,2016-03-27 10:23:56,2016-03-27 10:23:56,"￥8,148〜","（￥4,074〜/人）",,,,,,,,,,,,,,,,,,,,,,,,,,,,,,,,,,,,,,,,,,,,,,,,,,,,,,,,,,,,,,,,,,,,,,,,,,,,
9249,城崎温泉　旅館　水郷,/yad393285/?stayCount=1&roomCount=1&adultNum=2&stayDay=&stayYear=&stayMonth=&dateUndecided=1&distCd=01&roomCrack=200000&screenId=UWW1402&yadNo=393285&callbackHistFlg=1,庭園は草木や花々が四季折々に美しく、新鮮な海の幸、山の幸を使った料理と冬にはカニスキ料理が自慢のお宿。館内の内湯は、貸切風呂としても利用可能。,【アクセス】ＪＲ城崎温泉駅より徒歩７分。中国自動車道福崎ＩＣより播但連絡道路和田山ＩＣ城崎方面へ約１時間,エリア ： 兵庫県 > 城崎,2016-03-27 10:23:56,2016-03-27 10:23:56,"￥8,000〜","（￥4,000〜/人）",,,,,,,,,,,,,,,,,,,,,,,,,,,,,,,,,,,,,,,,,,,,,,,,,,,,,,,,,,,,,,,,,,,,,,,,,,,,
9250,ＨＯＴＥＬ　ＫＯＳＨＯ,/yad303017/?stayCount=1&roomCount=1&adultNum=2&stayDay=&stayYear=&stayMonth=&dateUndecided=1&distCd=01&roomCrack=200000&screenId=UWW1402&yadNo=303017&callbackHistFlg=1,本場但馬牛や旬のカニ料理、郷土料理など但馬のグルメをご堪能。ゆったり感を満喫大浴場、フットサルコート、カラオケラウンジ、漫画コーナー。全室ウォシュレット、地デジ対応液晶ＴＶ、ＬＡＮ環境を完備。,【アクセス】ＪＲ山陰線　江原駅よりタクシーで５分。播但連絡道路和田山ＩＣより国道３１２号線豊岡方面へ４０分。,エリア ： 兵庫県 > 神鍋・江原,2016-03-27 10:23:57,2016-03-27 10:23:57,"￥6,851〜","（￥3,425〜/人）",,,,,,,,,,,,,,,,,,,,,,,,,,,,,,,,,,,,,,,,,,,,,,,,,,,,,,,,,,,,,,,,,,,,,,,,,,,,
9251,ブルーリッジホテル,/yad345150/?stayCount=1&roomCount=1&adultNum=2&stayDay=&stayYear=&stayMonth=&dateUndecided=1&distCd=01&roomCrack=200000&screenId=UWW1402&yadNo=345150&callbackHistFlg=1,源泉100％の露天風呂は空気が綺麗で済んだ空に星が映える！自慢の料理人が織りなす四季折々の山海の幸と高原バカンスが楽しめる、自然いっぱいのリゾートホテル。パワスポ『竹田城跡』まで車で60分♪,【アクセス】車／中国道・吹田JCTから舞鶴道経由〜北近畿豊岡道・八鹿氷ノ山IC〜R312を江原方面〜R482を神鍋へ,エリア ： 兵庫県 > 神鍋・江原,2016-03-27 10:23:57,2016-03-27 10:23:57,"￥14,814〜","（￥7,407〜/人）",,,,,,,,,,,,,,,,,,,,,,,,,,,,,,,,,,,,,,,,,,,,,,,,,,,,,,,,,,,,,,,,,,,,,,,,,,,,
9252,西明石リンカーンホテル,/yad327060/?stayCount=1&roomCount=1&adultNum=2&stayDay=&stayYear=&stayMonth=&dateUndecided=1&distCd=01&roomCrack=200000&screenId=UWW1402&yadNo=327060&callbackHistFlg=1,「西明石駅」より徒歩３分！姫路、三宮へはＪＲ新快速利用でそれぞれ約２０分で到着！全室Ｗｉ−Ｈｉ利用ＯＫ・【朝・夕食無料】夕食は連泊にも嬉しい、選べる日替わり定食をご用意♪,【アクセス】JR「西明石駅」東口・西口（新幹線側）どちらから降りられても、徒歩3分の距離です。,エリア ： 兵庫県 > 須磨・舞子・明石,2016-03-27 10:23:56,2016-03-27 10:23:56,"￥8,287〜","（￥4,143〜/人）",,,,,,,,,,,,,,,,,,,,,,,,,,,,,,,,,,,,,,,,,,,,,,,,,,,,,,,,,,,,,,,,,,,,,,,,,,,,
9253,グリーンヒルホテル明石,/yad328399/?stayCount=1&roomCount=1&adultNum=2&stayDay=&stayYear=&stayMonth=&dateUndecided=1&distCd=01&roomCrack=200000&screenId=UWW1402&yadNo=328399&callbackHistFlg=1,子午線の通る城下町。神戸・三宮へもＪＲでわずか１５分。明石から須磨にかけての車窓の風景は一見の価値アリ。魚の棚商店街すぐそば、アウトレット・ポルトバザールへも車で１５分と便利。,【アクセス】駐車場のご利用は時間規定ではなく、宿泊一泊につき一回料金　￥1000円とさせていただきます。,エリア ： 兵庫県 > 須磨・舞子・明石,2016-03-27 10:23:56,2016-03-27 10:23:56,"￥6,203〜","（￥3,101〜/人）",,,,,,,,,,,,,,,,,,,,,,,,,,,,,,,,,,,,,,,,,,,,,,,,,,,,,,,,,,,,,,,,,,,,,,,,,,,,
9254,栄家旅館,/yad361338/?stayCount=1&roomCount=1&adultNum=2&stayDay=&stayYear=&stayMonth=&dateUndecided=1&distCd=01&roomCrack=200000&screenId=UWW1402&yadNo=361338&callbackHistFlg=1,JR明石歩5分。街中の閑静な宿。女性一人旅も安心。乳幼児の宿泊は不可。運転試験場・成人病ｾﾝﾀｰ等へも便利。,【アクセス】JR明石駅南東徒歩５分。淡路信用金庫から東へ２０ｍ（国道二号線と並行の南側の道）,エリア ： 兵庫県 > 須磨・舞子・明石,2016-03-27 10:23:56,2016-03-27 10:23:56,"￥7,407〜","（￥3,703〜/人）",,,,,,,,,,,,,,,,,,,,,,,,,,,,,,,,,,,,,,,,,,,,,,,,,,,,,,,,,,,,,,,,,,,,,,,,,,,,
9255,ホテルニュータカハマ,/yad376105/?stayCount=1&roomCount=1&adultNum=2&stayDay=&stayYear=&stayMonth=&dateUndecided=1&distCd=01&roomCrack=200000&screenId=UWW1402&yadNo=376105&callbackHistFlg=1,定宿にしたい手頃な価格と家庭的な雰囲気。JR・新幹線「西明石」駅すぐ、神戸・大阪・加古川・姫路へ交通至便。DVDプレイヤー無料貸。男性浴場24時間OK。禁煙ルームあり。,【アクセス】西明石駅より徒歩5分,エリア ： 兵庫県 > 須磨・舞子・明石,2016-03-27 10:23:56,2016-03-27 10:23:56,"￥7,777〜","（￥3,888〜/人）",,,,,,,,,,,,,,,,,,,,,,,,,,,,,,,,,,,,,,,,,,,,,,,,,,,,,,,,,,,,,,,,,,,,,,,,,,,,
9256,名田忠山荘,/yad301255/?stayCount=1&roomCount=1&adultNum=2&stayDay=&stayYear=&stayMonth=&dateUndecided=1&distCd=01&roomCrack=200000&screenId=UWW1402&yadNo=301255&callbackHistFlg=1,【平日限定・20名様〜貸し切りＯＫ】【女性に人気★本格お茶室アリ】同窓会・クラブ・社員研修にも是非ご利用下さい★展望風呂や客室からは瀬戸内海を眺望できます。珍しいキャビンタイプのお部屋が人気♪,【アクセス】ＪＲ山陽本線網干駅より車で１５分／国道２５０号線〜姫路より車で３０分,エリア ： 兵庫県 > 赤穂・相生・たつの,2016-03-27 10:23:56,2016-03-27 10:23:56,"￥12,037〜","（￥6,018〜/人）",,,,,,,,,,,,,,,,,,,,,,,,,,,,,,,,,,,,,,,,,,,,,,,,,,,,,,,,,,,,,,,,,,,,,,,,,,,,
9257,相生ステーションホテルアネックス,/yad301335/?stayCount=1&roomCount=1&adultNum=2&stayDay=&stayYear=&stayMonth=&dateUndecided=1&distCd=01&roomCrack=200000&screenId=UWW1402&yadNo=301335&callbackHistFlg=1,駅近でアクセス便利なﾋﾞｼﾞﾈｽホテル！全部屋にセミダブルﾍﾞｯﾄﾞ設置でゆったり快適♪全室ｲﾝﾀｰﾈｯﾄ完備、無料接続し放題☆朝、夕食もﾘｰｽﾞﾅﾌﾞﾙ！会席料理(予約制)もご用意可能♪,【アクセス】JR相生駅下車、南へ直進徒歩3分　山陽自動車道龍野西ICより西方向へ約15分,エリア ： 兵庫県 > 赤穂・相生・たつの,2016-03-27 10:23:56,2016-03-27 10:23:56,"￥6,481〜",（￥-/室）,,,,,,,,,,,,,,,,,,,,,,,,,,,,,,,,,,,,,,,,,,,,,,,,,,,,,,,,,,,,,,,,,,,,,,,,,,,,
9258,懐石宿　潮里,/yad307222/?stayCount=1&roomCount=1&adultNum=2&stayDay=&stayYear=&stayMonth=&dateUndecided=1&distCd=01&roomCrack=200000&screenId=UWW1402&yadNo=307222&callbackHistFlg=1,館内は古材の建具を利用し、アンティーク家具や間接照明で趣向を凝らす。男女とも選べる小紋の浴衣もお洒落。夕陽絶景の湯処もあるよ。地物の食材を中心に使う夕・朝食は、海の見える個室食事処で。,【アクセス】JR網干駅より車で１５分。山陽電車　網干駅より車で１０分。世界遺産姫路城から車で35分,エリア ： 兵庫県 > 赤穂・相生・たつの,2016-03-27 10:23:56,2016-03-27 10:23:56,"￥27,800〜","（￥13,900〜/人）",,,,,,,,,,,,,,,,,,,,,,,,,,,,,,,,,,,,,,,,,,,,,,,,,,,,,,,,,,,,,,,,,,,,,,,,,,,,
9259,たつの市　国民宿舎　赤とんぼ荘　,/yad308648/?stayCount=1&roomCount=1&adultNum=2&stayDay=&stayYear=&stayMonth=&dateUndecided=1&distCd=01&roomCrack=200000&screenId=UWW1402&yadNo=308648&callbackHistFlg=1,館内からはたつの市街や揖保川が一望でき美しい景色を眺めながらお寛ぎいただけます。リーズナブルな料金と和食か中華から選べる夕食が人気です。ご夕食はお部屋食！,【アクセス】ＪＲ姫新線本竜野駅よりタクシーで約５分。お車では、山陽自動車道龍野ＩＣより約１０分,エリア ： 兵庫県 > 赤穂・相生・たつの,2016-03-27 10:23:56,2016-03-27 10:23:56,"￥10,600〜","（￥5,300〜/人）",,,,,,,,,,,,,,,,,,,,,,,,,,,,,,,,,,,,,,,,,,,,,,,,,,,,,,,,,,,,,,,,,,,,,,,,,,,,
9260,対鴎舘,/yad310812/?stayCount=1&roomCount=1&adultNum=2&stayDay=&stayYear=&stayMonth=&dateUndecided=1&distCd=01&roomCrack=200000&screenId=UWW1402&yadNo=310812&callbackHistFlg=1,大阪より約２時間。明治創業の赤穂きっての老舗宿。ロビーや浴場、客室と至るところで瀬戸内の海を一望！夕食は瀬戸内の魚介をふんだんに使う会席をゆっくりお部屋で。露天風呂客室大好評！【ＷｉＦｉ可】,【アクセス】電車・・・JR播州赤穂駅より無料送迎バスで15分（要問合せ）　　お車・・・山陽自動車道　赤穂ICから約10分,エリア ： 兵庫県 > 赤穂・相生・たつの,2016-03-27 10:23:56,2016-03-27 10:23:56,"￥20,925〜","（￥10,462〜/人）",,,,,,,,,,,,,,,,,,,,,,,,,,,,,,,,,,,,,,,,,,,,,,,,,,,,,,,,,,,,,,,,,,,,,,,,,,,,
9261,潮彩きらら　祥吉,/yad311129/?stayCount=1&roomCount=1&adultNum=2&stayDay=&stayYear=&stayMonth=&dateUndecided=1&distCd=01&roomCrack=200000&screenId=UWW1402&yadNo=311129&callbackHistFlg=1,★☆2016年ミシュラン兵庫特別版に掲載されました☆★昨年大浴場を増設し、寛ぎの空間が倍増しました！ご好評いただいておりますサービスとお料理でご滞在が充実し、満足度も一段と増すことでしょう。。,【アクセス】JR播州赤穂駅より“保養センター”行きバス約15分。山陽自動車道：赤穂ICより約15分。,エリア ： 兵庫県 > 赤穂・相生・たつの,2016-03-27 10:23:56,2016-03-27 10:23:56,"￥30,000〜","（￥15,000〜/人）",,,,,,,,,,,,,,,,,,,,,,,,,,,,,,,,,,,,,,,,,,,,,,,,,,,,,,,,,,,,,,,,,,,,,,,,,,,,
9262,赤穂温泉　絶景露天風呂の宿　銀波荘,/yad313364/?stayCount=1&roomCount=1&adultNum=2&stayDay=&stayYear=&stayMonth=&dateUndecided=1&distCd=01&roomCrack=200000&screenId=UWW1402&yadNo=313364&callbackHistFlg=1,■世界遺産『姫路城』から一番近い絶景温泉宿♪■誰もが息を飲む、湯船から海へと零れ落ちる迫力の大パノラマ風呂♪■ＴＶ実績『雨上がりのAさんの話』『ちちんぷいぷい』『世界ふしぎ発見』等♪,【アクセス】◆電車・・・JR播州赤穂駅より無料送迎バスで15分　◆お車・・・山陽自動車道　赤穂ICから約10分,エリア ： 兵庫県 > 赤穂・相生・たつの,2016-03-27 10:23:56,2016-03-27 10:23:56,"￥26,000〜","（￥13,000〜/人）",,,,,,,,,,,,,,,,,,,,,,,,,,,,,,,,,,,,,,,,,,,,,,,,,,,,,,,,,,,,,,,,,,,,,,,,,,,,
9263,新舞子ガーデンホテル,/yad313379/?stayCount=1&roomCount=1&adultNum=2&stayDay=&stayYear=&stayMonth=&dateUndecided=1&distCd=01&roomCrack=200000&screenId=UWW1402&yadNo=313379&callbackHistFlg=1,平成27年12月、館内を改装しお部屋は機能的な洋室へ、レストランは播磨灘が一望できる全面ガラス張りへと生まれ変わりました。人気の展望大浴場もございます。JR・山陽電車網干駅までは無料送迎致します。,【アクセス】JR網干駅から車で20分　山陽電車網干駅から車で10分　要予約で両駅から無料送迎あり,エリア ： 兵庫県 > 赤穂・相生・たつの,2016-03-27 10:23:56,2016-03-27 10:23:56,"￥25,000〜","（￥12,500〜/人）",,,,,,,,,,,,,,,,,,,,,,,,,,,,,,,,,,,,,,,,,,,,,,,,,,,,,,,,,,,,,,,,,,,,,,,,,,,,
9264,ホテルニュー浦島,/yad314927/?stayCount=1&roomCount=1&adultNum=2&stayDay=&stayYear=&stayMonth=&dateUndecided=1&distCd=01&roomCrack=200000&screenId=UWW1402&yadNo=314927&callbackHistFlg=1,赤穂城近くでビジネス・観光に便利なビジネスホテルです,【アクセス】赤穂駅より徒歩12分　赤穂ICより車で5分,エリア ： 兵庫県 > 赤穂・相生・たつの,2016-03-27 10:23:56,2016-03-27 10:23:56,"￥6,203〜","（￥3,101〜/人）",,,,,,,,,,,,,,,,,,,,,,,,,,,,,,,,,,,,,,,,,,,,,,,,,,,,,,,,,,,,,,,,,,,,,,,,,,,,
9265,相生ステーションホテル,/yad315179/?stayCount=1&roomCount=1&adultNum=2&stayDay=&stayYear=&stayMonth=&dateUndecided=1&distCd=01&roomCrack=200000&screenId=UWW1402&yadNo=315179&callbackHistFlg=1,西播磨の玄関「相生駅」という絶好のフィールドポジション。瀬戸内の温暖な気候に恵まれ、ペーロンの町としても有名。ビジネスの利用にも大変便利で、夜22時までお食事が可能である。姫路駅より電車で20分！,【アクセス】竜野西ＩＣより国道２号線を車で西へ約５分、相生駅南へ約５分。ＪＲ相生駅南出口より東へ徒歩約１分。,エリア ： 兵庫県 > 赤穂・相生・たつの,2016-03-27 10:23:56,2016-03-27 10:23:56,"￥6,666〜",（￥-/室）,,,,,,,,,,,,,,,,,,,,,,,,,,,,,,,,,,,,,,,,,,,,,,,,,,,,,,,,,,,,,,,,,,,,,,,,,,,,
9266,鹿久居荘(かくいそう)　赤穂店,/yad317130/?stayCount=1&roomCount=1&adultNum=2&stayDay=&stayYear=&stayMonth=&dateUndecided=1&distCd=01&roomCrack=200000&screenId=UWW1402&yadNo=317130&callbackHistFlg=1,赤穂温泉　よみがえりの湯は塩分・ミネラルが豊富♪♪四季折々の海の幸を、存分にお楽しみ頂けます。割烹の水槽でご注文の魚を、お客様にすくって頂く事が出来るのも魅力です。,【アクセス】山陽自動車道赤穂Ｉ．Ｃより海浜公園方面へ約５ｋｍ　ＪＲ播州赤穂駅より車で８分,エリア ： 兵庫県 > 赤穂・相生・たつの,2016-03-27 10:23:56,2016-03-27 10:23:56,"￥11,000〜","（￥5,500〜/人）",,,,,,,,,,,,,,,,,,,,,,,,,,,,,,,,,,,,,,,,,,,,,,,,,,,,,,,,,,,,,,,,,,,,,,,,,,,,
9267,お宿かとれや,/yad319720/?stayCount=1&roomCount=1&adultNum=2&stayDay=&stayYear=&stayMonth=&dateUndecided=1&distCd=01&roomCrack=200000&screenId=UWW1402&yadNo=319720&callbackHistFlg=1,お部屋からもお食事部屋からもキラキラ輝く播磨灘・家島列島が望めます♪全10室ですので静かにお過ごし頂けるのも魅力のひとつ。のんびりと皆様だけの時間をお過し下さい。,【アクセス】電車の場合：ＪＲ網干駅下車、車で約15分、お車の場合：山陽自動車道　たつのＩＣより約30分,エリア ： 兵庫県 > 赤穂・相生・たつの,2016-03-27 10:23:56,2016-03-27 10:23:56,"￥17,809〜","（￥8,904〜/人）",,,,,,,,,,,,,,,,,,,,,,,,,,,,,,,,,,,,,,,,,,,,,,,,,,,,,,,,,,,,,,,,,,,,,,,,,,,,
9268,赤穂ロイヤルホテル,/yad325668/?stayCount=1&roomCount=1&adultNum=2&stayDay=&stayYear=&stayMonth=&dateUndecided=1&distCd=01&roomCrack=200000&screenId=UWW1402&yadNo=325668&callbackHistFlg=1,■お車で・・・■　姫路城まで約５０分。御津の綾部山梅林まで約４０分。播磨科学公園都市（スプリング８）まで約６０分。備前市の旧閉谷学校まで約４０分。日生（ひなせ）港（五味の市）まで約２５分。,【アクセス】JR赤穂線播州赤穂駅から徒歩約15分、タクシー又は路線バスで約5分。山陽道赤穂ICから約7分。,エリア ： 兵庫県 > 赤穂・相生・たつの,2016-03-27 10:23:56,2016-03-27 10:23:56,"￥7,200〜","（￥3,600〜/人）",,,,,,,,,,,,,,,,,,,,,,,,,,,,,,,,,,,,,,,,,,,,,,,,,,,,,,,,,,,,,,,,,,,,,,,,,,,,
9269,ホテル シーショア・リゾート（旧 シーショア御津岬）,/yad328206/?stayCount=1&roomCount=1&adultNum=2&stayDay=&stayYear=&stayMonth=&dateUndecided=1&distCd=01&roomCrack=200000&screenId=UWW1402&yadNo=328206&callbackHistFlg=1,2016年4月全客室リニューアル完了！グランドオープン♪DXツイン（バス海側）は「非日常的・最高の気分」と大好評♪夕食の良かった宿ランキング第３位！【近畿・北陸エリア】姫路城から車で約４０分。,【アクセス】JR山陽本線網干駅（姫路駅から3駅約10分）下車、車で20分（ホテルまで無料送迎有）,エリア ： 兵庫県 > 赤穂・相生・たつの,2016-03-27 10:23:56,2016-03-27 10:23:56,"￥17,407〜","（￥8,703〜/人）",,,,,,,,,,,,,,,,,,,,,,,,,,,,,,,,,,,,,,,,,,,,,,,,,,,,,,,,,,,,,,,,,,,,,,,,,,,,
9270,赤穂ハイツ,/yad328596/?stayCount=1&roomCount=1&adultNum=2&stayDay=&stayYear=&stayMonth=&dateUndecided=1&distCd=01&roomCrack=200000&screenId=UWW1402&yadNo=328596&callbackHistFlg=1,当館から見る景色は播磨灘を一望できる絶景！！特に展望テラスや大浴場から眺める朝日は感動ものです。赤穂はもちろん、姫路観光にもアクセス便利な当館で心休まるひと時をお過ごし下さい。,【アクセス】JR播州赤穂駅よりバス15分　東御崎バス停下車　徒歩10分／山陽自動車道赤穂ＩＣより車で１５分,エリア ： 兵庫県 > 赤穂・相生・たつの,2016-03-27 10:23:56,2016-03-27 10:23:56,"￥11,111〜","（￥5,555〜/人）",,,,,,,,,,,,,,,,,,,,,,,,,,,,,,,,,,,,,,,,,,,,,,,,,,,,,,,,,,,,,,,,,,,,,,,,,,,,
9271,東横イン相生駅新幹線口,/yad332481/?stayCount=1&roomCount=1&adultNum=2&stayDay=&stayYear=&stayMonth=&dateUndecided=1&distCd=01&roomCrack=200000&screenId=UWW1402&yadNo=332481&callbackHistFlg=1,新幹線で大阪まで５５分、岡山まで２０分、姫路まで２０分。ビジネス・観光に便利！充実した設備と心温まる笑顔でお出迎え。日頃の疲れも癒されます。,【アクセス】ＪＲ相生駅から徒歩1分。山陽自動車道竜野西インターから１０分。,エリア ： 兵庫県 > 赤穂・相生・たつの,2016-03-27 10:23:56,2016-03-27 10:23:56,"￥7,300〜","（￥3,650〜/人）",,,,,,,,,,,,,,,,,,,,,,,,,,,,,,,,,,,,,,,,,,,,,,,,,,,,,,,,,,,,,,,,,,,,,,,,,,,,
9272,ホテル山長（HOTEL YAMACHOU）,/yad334618/?stayCount=1&roomCount=1&adultNum=2&stayDay=&stayYear=&stayMonth=&dateUndecided=1&distCd=01&roomCrack=200000&screenId=UWW1402&yadNo=334618&callbackHistFlg=1,国史跡・赤穂城跡大手門手前のお城通りの中心地にある赤穂で唯一の『城下町風情のある和風都市ホテル』です。忠心蔵・義士討ち入り着模様の石畳、緑の松並木が続くこの平成の城下町が、いま赤穂の話題です。,【アクセス】JR播州赤穂駅下車、南へ徒歩7分。山陽自動車道赤穂ICから国道250を東へ約7分,エリア ： 兵庫県 > 赤穂・相生・たつの,2016-03-27 10:23:56,2016-03-27 10:23:56,"￥8,703〜","（￥4,351〜/人）",,,,,,,,,,,,,,,,,,,,,,,,,,,,,,,,,,,,,,,,,,,,,,,,,,,,,,,,,,,,,,,,,,,,,,,,,,,,
9273,料理・旅館　櫓,/yad338778/?stayCount=1&roomCount=1&adultNum=2&stayDay=&stayYear=&stayMonth=&dateUndecided=1&distCd=01&roomCrack=200000&screenId=UWW1402&yadNo=338778&callbackHistFlg=1,国道250号の通称「七曲がり」と呼ばれる海岸沿いに建つ宿。当館のすぐ下の岩見漁港で水揚げされる瀬戸内海の新鮮な魚介類を使った料理が自慢。旬の海の幸をリーズナブルにお楽しみいただけます。,【アクセス】JR山陽本線竜野駅下車タクシーで約10分／姫路より車で約40分（国道250号沿い）,エリア ： 兵庫県 > 赤穂・相生・たつの,2016-03-27 10:23:56,2016-03-27 10:23:56,"￥11,203〜","（￥5,601〜/人）",,,,,,,,,,,,,,,,,,,,,,,,,,,,,,,,,,,,,,,,,,,,,,,,,,,,,,,,,,,,,,,,,,,,,,,,,,,,
9274,あこうビジネスホテル　桜館,/yad338932/?stayCount=1&roomCount=1&adultNum=2&stayDay=&stayYear=&stayMonth=&dateUndecided=1&distCd=01&roomCrack=200000&screenId=UWW1402&yadNo=338932&callbackHistFlg=1,高速道路からのアクセスもよく、山陽自動車道　赤穂ICより２分に位置し周辺には、工業団地、市民総合体育館、武道館　城南緑地運動施設　等スポーツ施設があり、関西福祉大学等、点在する,【アクセス】JR赤穂線播州赤穂駅からタクシー6分。山陽道赤穂ICから2分。,エリア ： 兵庫県 > 赤穂・相生・たつの,2016-03-27 10:23:56,2016-03-27 10:23:56,"￥6,481〜",（￥-/室）,,,,,,,,,,,,,,,,,,,,,,,,,,,,,,,,,,,,,,,,,,,,,,,,,,,,,,,,,,,,,,,,,,,,,,,,,,,,
9275,片しぼ竹の宿・梅玉,/yad340448/?stayCount=1&roomCount=1&adultNum=2&stayDay=&stayYear=&stayMonth=&dateUndecided=1&distCd=01&roomCrack=200000&screenId=UWW1402&yadNo=340448&callbackHistFlg=1,城下町龍野の脇坂藩筆頭家老屋敷跡に建つ、創業約１００余年旅館です。龍野観光はもちろん、姫路観光の拠点にも最適です♪寅さんで有名な【男はつらいよ】の「寅次郎夕焼け小焼け」の舞台にもなりました★,【アクセス】ＪＲ姫新線　本竜野駅から車で３〜５分、徒歩で２０分,エリア ： 兵庫県 > 赤穂・相生・たつの,2016-03-27 10:23:56,2016-03-27 10:23:56,"￥12,101〜","（￥6,050〜/人）",,,,,,,,,,,,,,,,,,,,,,,,,,,,,,,,,,,,,,,,,,,,,,,,,,,,,,,,,,,,,,,,,,,,,,,,,,,,
9276,赤穂パークホテル,/yad344437/?stayCount=1&roomCount=1&adultNum=2&stayDay=&stayYear=&stayMonth=&dateUndecided=1&distCd=01&roomCrack=200000&screenId=UWW1402&yadNo=344437&callbackHistFlg=1,全室デュベタイプの羽毛布団を使用。天然温泉あり。ビジネスのご利用から、グループのご宴会を伴うご宿泊まで、幅広く対応いたします。3月末まで赤穂市坂越の名産、牡蠣を使用した会席コースを販売中です！,【アクセス】お車で：山陽自動車道赤穂ＩＣより約7分、ＪＲで：赤穂線播州赤穂駅よりタクシーで約7分,エリア ： 兵庫県 > 赤穂・相生・たつの,2016-03-27 10:23:56,2016-03-27 10:23:56,"￥8,148〜","（￥4,074〜/人）",,,,,,,,,,,,,,,,,,,,,,,,,,,,,,,,,,,,,,,,,,,,,,,,,,,,,,,,,,,,,,,,,,,,,,,,,,,,
9277,wad resort 千鳥亭,/yad370996/?stayCount=1&roomCount=1&adultNum=2&stayDay=&stayYear=&stayMonth=&dateUndecided=1&distCd=01&roomCrack=200000&screenId=UWW1402&yadNo=370996&callbackHistFlg=1,2015年12月にリニューアルしました。一日3室限定のお宿です。和モダンスタイルの鮮麗されたお部屋と丁寧な接客、ボリュームのあるお料理が大変好評です。隠れ家スタイルのお宿です。赤ちゃんご同伴歓迎です,【アクセス】ＪＲ網干駅より車で15分,エリア ： 兵庫県 > 赤穂・相生・たつの,2016-03-27 10:23:56,2016-03-27 10:23:56,"￥34,000〜","（￥17,000〜/人）",,,,,,,,,,,,,,,,,,,,,,,,,,,,,,,,,,,,,,,,,,,,,,,,,,,,,,,,,,,,,,,,,,,,,,,,,,,,
9278,かんぽの宿　赤穂,/yad375546/?stayCount=1&roomCount=1&adultNum=2&stayDay=&stayYear=&stayMonth=&dateUndecided=1&distCd=01&roomCrack=200000&screenId=UWW1402&yadNo=375546&callbackHistFlg=1,オーシャンビューの客室から眼下にきらめく海を見下ろし、四季折々の自然、旬の味わい、心うるおす天然温泉。露天風呂から望む瀬戸内海は圧観です。海の幸満載の逸品料理を義士のふるさと赤穂でどうぞ。,【アクセス】ＪＲ播州赤穂駅下車、神姫バスかんぽの宿赤穂行で終点下車。山陽自動車道赤穂Ｉ・Ｃから約８ｋｍ。,エリア ： 兵庫県 > 赤穂・相生・たつの,2016-03-27 10:23:56,2016-03-27 10:23:56,"￥11,851〜","（￥5,925〜/人）",,,,,,,,,,,,,,,,,,,,,,,,,,,,,,,,,,,,,,,,,,,,,,,,,,,,,,,,,,,,,,,,,,,,,,,,,,,,
