id,building_name,image_url,detail,access,address,created_at,updated_at,fee1,fee2,,,,,,,,,,,,,,,,,,,,,,,,,,,,,,,,,,,,,,,,,,,,,,,,,,,,,,,,,,,,,,,,,,,,,,,,,,,,
8051,えびす洞温泉　ホテル白い燈台,/yad301010/?stayCount=1&roomCount=1&adultNum=2&stayDay=&stayYear=&stayMonth=&dateUndecided=1&distCd=01&roomCrack=200000&screenId=UWW1402&yadNo=301010&callbackHistFlg=1,リクルートポイントプレゼントプラン多数ご用意しています♪海がめの産卵で有名な日和佐、大海原を見渡す展望露天風呂が自慢！客室は全て海に面しており、水平線から昇る朝日は最高です！,【アクセス】神戸淡路鳴門道鳴門ＩＣ下車国道５５を南へ９０分。ＪＲ牟岐線日和佐駅下車、車で５分。,エリア ： 徳島県 > 阿南・日和佐,2016-03-28 01:43:31,2016-03-28 01:43:31,"￥16,000〜","（￥8,000〜/人）",,,,,,,,,,,,,,,,,,,,,,,,,,,,,,,,,,,,,,,,,,,,,,,,,,,,,,,,,,,,,,,,,,,,,,,,,,,,
8052,ホテルサンオーシャン,/yad316964/?stayCount=1&roomCount=1&adultNum=2&stayDay=&stayYear=&stayMonth=&dateUndecided=1&distCd=01&roomCrack=200000&screenId=UWW1402&yadNo=316964&callbackHistFlg=1,なんといってもおよそ100台収容の無料駐車スペースを完備！お車でお越しの方も安心です。お部屋は全てひろくお取りしております。併設レストランでは、朝食から夕食までこだわりのお料理をお手軽に。,【アクセス】JR阿南駅下車、徒歩5分,エリア ： 徳島県 > 阿南・日和佐,2016-03-28 01:43:31,2016-03-28 01:43:31,"￥5,555〜","（￥2,777〜/人）",,,,,,,,,,,,,,,,,,,,,,,,,,,,,,,,,,,,,,,,,,,,,,,,,,,,,,,,,,,,,,,,,,,,,,,,,,,,
8053,うみがめ荘,/yad336074/?stayCount=1&roomCount=1&adultNum=2&stayDay=&stayYear=&stayMonth=&dateUndecided=1&distCd=01&roomCrack=200000&screenId=UWW1402&yadNo=336074&callbackHistFlg=1,23番札所薬王寺より車で5分JR､高速ﾊﾞｽなども便利夏はｳﾐｶﾞﾒの上陸､冬はﾀﾞﾙﾏ朝日が名物無線LAN内蔵のPCであればﾌﾛﾝﾄ周辺にてｲﾝﾀｰﾈｯﾄ接続可能｡,【アクセス】ＪＲ牟岐線日和佐駅より車で５分。徳島市より55km（車で約80分）,エリア ： 徳島県 > 阿南・日和佐,2016-03-28 01:43:31,2016-03-28 01:43:31,"￥6,481〜","（￥3,240〜/人）",,,,,,,,,,,,,,,,,,,,,,,,,,,,,,,,,,,,,,,,,,,,,,,,,,,,,,,,,,,,,,,,,,,,,,,,,,,,
8054,ロイヤルガーデンホテル,/yad355624/?stayCount=1&roomCount=1&adultNum=2&stayDay=&stayYear=&stayMonth=&dateUndecided=1&distCd=01&roomCrack=200000&screenId=UWW1402&yadNo=355624&callbackHistFlg=1,出張・レジャーでのご宿泊に！ご宿泊のお客様は隣接するスーパー銭湯「大和の郷」1回入浴無料。疲れを癒せると好評です。全室サータ社のベッドを導入。無料W-Fi完備でスマホやタブレットの操作も楽々OK！,【アクセス】JR阿南駅下車、徒歩10分、車で3分／徳島空港から車で70分,エリア ： 徳島県 > 阿南・日和佐,2016-03-28 01:43:31,2016-03-28 01:43:31,"￥11,111〜","（￥5,555〜/人）",,,,,,,,,,,,,,,,,,,,,,,,,,,,,,,,,,,,,,,,,,,,,,,,,,,,,,,,,,,,,,,,,,,,,,,,,,,,
8055,南阿波サンラインモビレージ,/yad374730/?stayCount=1&roomCount=1&adultNum=2&stayDay=&stayYear=&stayMonth=&dateUndecided=1&distCd=01&roomCrack=200000&screenId=UWW1402&yadNo=374730&callbackHistFlg=1,国定公園内の原生林と海に囲まれた静かな空間。各コテージにキッチンやお風呂もついているのでプチ別荘感覚で過ごして頂けます。ご家族や愛犬とご一緒に、海に山へゆったりとした時間をお楽しみ下さい。,【アクセス】JR日和佐駅下車、車で10分,エリア ： 徳島県 > 阿南・日和佐,2016-03-28 01:43:31,2016-03-28 01:43:31,"￥8,979〜","（￥4,489〜/人）",,,,,,,,,,,,,,,,,,,,,,,,,,,,,,,,,,,,,,,,,,,,,,,,,,,,,,,,,,,,,,,,,,,,,,,,,,,,
8056,薬王寺　温泉宿坊　薬師会館,/yad376556/?stayCount=1&roomCount=1&adultNum=2&stayDay=&stayYear=&stayMonth=&dateUndecided=1&distCd=01&roomCrack=200000&screenId=UWW1402&yadNo=376556&callbackHistFlg=1,7/10にリニューアルオープンいたしました!!ウミガメの産卵で有名な大浜海岸が近くにあり、サーフィン・ダイビング・釣りなどレジャーに最適!!お遍路さんも大歓迎です♪,【アクセス】神戸淡路鳴門自動車道　鳴門IC→国道１１号・５５号（約60,エリア ： 徳島県 > 阿南・日和佐,2016-03-28 01:43:31,2016-03-28 01:43:31,"￥10,148〜","（￥5,074〜/人）",,,,,,,,,,,,,,,,,,,,,,,,,,,,,,,,,,,,,,,,,,,,,,,,,,,,,,,,,,,,,,,,,,,,,,,,,,,,
8057,ペンションししくい,/yad325470/?stayCount=1&roomCount=1&adultNum=2&stayDay=&stayYear=&stayMonth=&dateUndecided=1&distCd=01&roomCrack=200000&screenId=UWW1402&yadNo=325470&callbackHistFlg=1,オーナー自作のログハウスを含めゆったりとした時間をお楽しみ下さい。料理は地元産の魚介類、野菜を使った手作り料理。生見、宍喰など有名なサーフスポットなども近く、幅広い年代に対応した宿。,【アクセス】徳島市内から国道５５号線を南へ車で２時間。高知方面からの場合は室戸岬から北へ車で45分。,エリア ： 徳島県 > 宍喰・海南・牟岐,2016-03-28 01:43:31,2016-03-28 01:43:31,"￥11,574〜","（￥5,787〜/人）",,,,,,,,,,,,,,,,,,,,,,,,,,,,,,,,,,,,,,,,,,,,,,,,,,,,,,,,,,,,,,,,,,,,,,,,,,,,
8058,民宿大砂,/yad371255/?stayCount=1&roomCount=1&adultNum=2&stayDay=&stayYear=&stayMonth=&dateUndecided=1&distCd=01&roomCrack=200000&screenId=UWW1402&yadNo=371255&callbackHistFlg=1,民宿大砂周辺には快水浴場百選の中でも特選に選ばれた大砂海水浴場、サーファーの集まる内妻海岸、イカ釣りのスポット、ダイビングサービスなど海を楽しめるポイントが数多く点在しています。,【アクセス】JR四国牟岐線鯖瀬駅より車で3分,エリア ： 徳島県 > 宍喰・海南・牟岐,2016-03-28 01:43:31,2016-03-28 01:43:31,"￥6,800〜","（￥3,400〜/人）",,,,,,,,,,,,,,,,,,,,,,,,,,,,,,,,,,,,,,,,,,,,,,,,,,,,,,,,,,,,,,,,,,,,,,,,,,,,
8059,ＨＯＴＥＬ　ＲＩＶＩＥＲＡ　ししくい,/yad392666/?stayCount=1&roomCount=1&adultNum=2&stayDay=&stayYear=&stayMonth=&dateUndecided=1&distCd=01&roomCrack=200000&screenId=UWW1402&yadNo=392666&callbackHistFlg=1,黒潮香る太平洋を眼下に感動のホテルリビエラししくい。そこはまさに南国、リゾート空間。心地よい潮風ときらめく太陽があなたをお迎えします。,【アクセス】【お車】徳島市内から約2時間。高知市内から約3時間。【電車】徳島駅から約2時間（特急は約1時間30分）,エリア ： 徳島県 > 宍喰・海南・牟岐,2016-03-28 01:43:31,2016-03-28 01:43:31,"￥15,229〜","（￥7,614〜/人）",,,,,,,,,,,,,,,,,,,,,,,,,,,,,,,,,,,,,,,,,,,,,,,,,,,,,,,,,,,,,,,,,,,,,,,,,,,,
8060,ふれあいの宿　遊遊ＮＡＳＡ,/yad397188/?stayCount=1&roomCount=1&adultNum=2&stayDay=&stayYear=&stayMonth=&dateUndecided=1&distCd=01&roomCrack=200000&screenId=UWW1402&yadNo=397188&callbackHistFlg=1,太平洋を眺めながら…潮騒の音に耳を傾けながら…黒潮の香りを楽しみながら…徳島県最南端の漁師町！山と海に囲まれ、自然の恵みあふれる海陽町。さわやかな潮風とまぶしい陽光が皆様をお迎えします。,【アクセス】お車で神戸市より約３時間半、徳島市より約２時間、高知市より約３時間,エリア ： 徳島県 > 宍喰・海南・牟岐,2016-03-28 01:43:31,2016-03-28 01:43:31,"￥17,600〜","（￥8,800〜/人）",,,,,,,,,,,,,,,,,,,,,,,,,,,,,,,,,,,,,,,,,,,,,,,,,,,,,,,,,,,,,,,,,,,,,,,,,,,,
8061,大歩危祖谷阿波温泉　あわの抄,/yad324364/?stayCount=1&roomCount=1&adultNum=2&stayDay=&stayYear=&stayMonth=&dateUndecided=1&distCd=01&roomCrack=200000&screenId=UWW1402&yadNo=324364&callbackHistFlg=1,大歩危祖谷の入口、井川池田ICやJR阿波池田駅から車10分。ぬめり気あるアルカリ温泉は美肌に◎。夜は阿波踊りを鑑賞できる（期間あり）。サクサクの天ぷらなど会席も,【アクセス】　,エリア ： 徳島県 > 大歩危・祖谷・池田,2016-03-28 01:43:31,2016-03-28 01:43:31,"￥7,777〜","（￥3,888〜/人）",,,,,,,,,,,,,,,,,,,,,,,,,,,,,,,,,,,,,,,,,,,,,,,,,,,,,,,,,,,,,,,,,,,,,,,,,,,,
8062,新祖谷温泉　ホテルかずら橋,/yad328584/?stayCount=1&roomCount=1&adultNum=2&stayDay=&stayYear=&stayMonth=&dateUndecided=1&distCd=01&roomCrack=200000&screenId=UWW1402&yadNo=328584&callbackHistFlg=1,日本三大秘境「祖谷渓谷」にある一軒宿。ケーブルカーで登る天空露天風呂からの絶景は圧巻。男女別･混浴露天風呂、貸切｢五右衛門風呂｣があり、お食事は囲炉裏を囲んで祖谷の郷土料理に舌鼓。,【アクセス】ＪＲ土讃線大歩危駅下車、タクシ-１５分,エリア ： 徳島県 > 大歩危・祖谷・池田,2016-03-28 01:43:31,2016-03-28 01:43:31,"￥30,000〜","（￥15,000〜/人）",,,,,,,,,,,,,,,,,,,,,,,,,,,,,,,,,,,,,,,,,,,,,,,,,,,,,,,,,,,,,,,,,,,,,,,,,,,,
8063,アネックス　みづほ,/yad394957/?stayCount=1&roomCount=1&adultNum=2&stayDay=&stayYear=&stayMonth=&dateUndecided=1&distCd=01&roomCrack=200000&screenId=UWW1402&yadNo=394957&callbackHistFlg=1,全室光ネット（LANケーブル）、ウォシュレット、冷暖房、冷蔵庫、空気清浄機設置。（ドライヤー、湯沸しポットは貸出し制）コンビニやスーパーも近くにあり便利。自転車の貸し出しもあり。(先着順）,【アクセス】JR徳島駅からタクシーで5分。JR阿波富田駅より徒歩約5分。国道11号線を県庁所在地より西へ車で約5分,エリア ： 徳島県 > 徳島,2016-03-28 01:43:31,2016-03-28 01:43:31,"￥6,851〜","（￥3,425〜/人）",,,,,,,,,,,,,,,,,,,,,,,,,,,,,,,,,,,,,,,,,,,,,,,,,,,,,,,,,,,,,,,,,,,,,,,,,,,,
8064,ホテル千秋閣,/yad318069/?stayCount=1&roomCount=1&adultNum=2&stayDay=&stayYear=&stayMonth=&dateUndecided=1&distCd=01&roomCrack=200000&screenId=UWW1402&yadNo=318069&callbackHistFlg=1,市の中心に位置し、官庁に近くビジネス・観光の拠点に最適。１０階レストランは、和食・洋食・中華の新鮮な素材を使った豊富なメニューが好評。阿波踊り期間中は、演舞場が隣接され存分に楽しめる。,【アクセス】JR徳島駅出てすぐ左へ徒歩7分/徳島自動車道・徳島IC〜15分/本州四国連絡道路・鳴門IC〜20分,エリア ： 徳島県 > 徳島,2016-03-28 01:43:31,2016-03-28 01:43:31,"￥6,666〜","（￥3,333〜/人）",,,,,,,,,,,,,,,,,,,,,,,,,,,,,,,,,,,,,,,,,,,,,,,,,,,,,,,,,,,,,,,,,,,,,,,,,,,,
8065,アパホテル＜徳島駅前＞,/yad334878/?stayCount=1&roomCount=1&adultNum=2&stayDay=&stayYear=&stayMonth=&dateUndecided=1&distCd=01&roomCrack=200000&screenId=UWW1402&yadNo=334878&callbackHistFlg=1,高速バス・空港行きバスの発着場のあるＪＲ徳島駅より徒歩３分の好立地。ビジネスに観光に便利に御利用頂けます。,【アクセス】ＪＲ徳島駅より徒歩３分。各高速バス乗り場より徒歩３分。徳島空港より車で２０分。,エリア ： 徳島県 > 徳島,2016-03-28 01:43:31,2016-03-28 01:43:31,"￥5,092〜","（￥2,546〜/人）",,,,,,,,,,,,,,,,,,,,,,,,,,,,,,,,,,,,,,,,,,,,,,,,,,,,,,,,,,,,,,,,,,,,,,,,,,,,
8066,ビジネスホテル　アバァンティ,/yad340914/?stayCount=1&roomCount=1&adultNum=2&stayDay=&stayYear=&stayMonth=&dateUndecided=1&distCd=01&roomCrack=200000&screenId=UWW1402&yadNo=340914&callbackHistFlg=1,"徳島駅より徒歩７分繁華街近阿波踊り会館に一番近いホテル。無線ラン可,wifisoftdocomoカ−ドは全プランに御利用できます車日曜祭日無料平日500円",【アクセス】　阿波踊り会館突き当たり左へ50メートル。,エリア ： 徳島県 > 徳島,2016-03-28 01:43:31,2016-03-28 01:43:31,"￥5,092〜","（￥2,546〜/人）",,,,,,,,,,,,,,,,,,,,,,,,,,,,,,,,,,,,,,,,,,,,,,,,,,,,,,,,,,,,,,,,,,,,,,,,,,,,
8067,旅館　朝日屋,/yad342467/?stayCount=1&roomCount=1&adultNum=2&stayDay=&stayYear=&stayMonth=&dateUndecided=1&distCd=01&roomCrack=200000&screenId=UWW1402&yadNo=342467&callbackHistFlg=1,観光の拠点として徳島市内・県南のおでかけに！ＪＲ阿波赤石駅徒歩３分・コンビニ徒歩1分。小松島市立体育館、あいさいスタジアム、あいさい球場にも近く各種合宿試合に便利。長期滞在にも対応！,【アクセス】鳴門ＩＣから車で約５０分　　JR徳島駅から牟岐線・阿波赤石駅まで約３０分下車徒歩３分,エリア ： 徳島県 > 徳島,2016-03-28 01:43:31,2016-03-28 01:43:31,"￥6,481〜","（￥3,240〜/人）",,,,,,,,,,,,,,,,,,,,,,,,,,,,,,,,,,,,,,,,,,,,,,,,,,,,,,,,,,,,,,,,,,,,,,,,,,,,
8068,ビジネスホテル　コスモス徳島,/yad342556/?stayCount=1&roomCount=1&adultNum=2&stayDay=&stayYear=&stayMonth=&dateUndecided=1&distCd=01&roomCrack=200000&screenId=UWW1402&yadNo=342556&callbackHistFlg=1,徳島市内中心部にあり、繁華街（秋田町）へは、徒歩約5分。80台駐車可能な平地の駐車場もあり、旅行・ビジネスに大変お得♪,【アクセス】JR徳島駅より南へタクシーで5分。JR富田駅（牟岐線）を西へ徒歩5分。徳島空港より南へタクシーで約25分,エリア ： 徳島県 > 徳島,2016-03-28 01:43:31,2016-03-28 01:43:31,"￥6,250〜","（￥3,125〜/人）",,,,,,,,,,,,,,,,,,,,,,,,,,,,,,,,,,,,,,,,,,,,,,,,,,,,,,,,,,,,,,,,,,,,,,,,,,,,
8069,ホテルサンシャイン徳島（本館・アネックス館）,/yad345634/?stayCount=1&roomCount=1&adultNum=2&stayDay=&stayYear=&stayMonth=&dateUndecided=1&distCd=01&roomCrack=200000&screenId=UWW1402&yadNo=345634&callbackHistFlg=1,ビジネスに最適！和室も人気の『本館』、広めの部屋やプチツインが好評の『アネックス館』無料平面駐車場７０台本館９階男性大浴場はミニサウナ付（夜のみ）女性大浴場は本館９階とアネックス館４階,【アクセス】JR徳島駅より徒歩8分。神戸淡路鳴門ICで下り、国道11号線を南へ25分。国道192号線に乗換え5分。,エリア ： 徳島県 > 徳島,2016-03-28 01:43:31,2016-03-28 01:43:31,"￥8,148〜","（￥4,074〜/人）",,,,,,,,,,,,,,,,,,,,,,,,,,,,,,,,,,,,,,,,,,,,,,,,,,,,,,,,,,,,,,,,,,,,,,,,,,,,
8070,東横イン徳島駅前,/yad375620/?stayCount=1&roomCount=1&adultNum=2&stayDay=&stayYear=&stayMonth=&dateUndecided=1&distCd=01&roomCrack=200000&screenId=UWW1402&yadNo=375620&callbackHistFlg=1,２０年１０月ｵｰﾌﾟﾝ♪「徳島ラーメン」のお店も多数あり★夜には新町川両岸がライトアップされデートコースにもお勧め。どうぞお気軽にお問い合わせください。,【アクセス】JR徳島駅　徒歩5分　＊駅を出て左斜めの道を真っすぐです。,エリア ： 徳島県 > 徳島,2016-03-28 01:43:31,2016-03-28 01:43:31,"￥7,300〜","（￥3,650〜/人）",,,,,,,,,,,,,,,,,,,,,,,,,,,,,,,,,,,,,,,,,,,,,,,,,,,,,,,,,,,,,,,,,,,,,,,,,,,,
8071,ハイパーイン　徳島東船場,/yad388734/?stayCount=1&roomCount=1&adultNum=2&stayDay=&stayYear=&stayMonth=&dateUndecided=1&distCd=01&roomCrack=200000&screenId=UWW1402&yadNo=388734&callbackHistFlg=1,徳島の中心、歓楽街の入り口に立地、水際公園に面した静かな環境。全室広々客室に落ちつきの和室がラインアップ。ビジネスだけでなく、観光の拠点にも最適。尚最終チェックインは２３時となります。,【アクセス】JR徳島駅下車、徒歩8分。徳島自動車道・徳島IC〜15分。本州四国連絡道路・鳴門IC〜20分,エリア ： 徳島県 > 徳島,2016-03-28 01:43:31,2016-03-28 01:43:31,"￥4,814〜","（￥2,407〜/人）",,,,,,,,,,,,,,,,,,,,,,,,,,,,,,,,,,,,,,,,,,,,,,,,,,,,,,,,,,,,,,,,,,,,,,,,,,,,
8072,はやし別館,/yad397624/?stayCount=1&roomCount=1&adultNum=2&stayDay=&stayYear=&stayMonth=&dateUndecided=1&distCd=01&roomCrack=200000&screenId=UWW1402&yadNo=397624&callbackHistFlg=1,JR徳島駅から徒歩5分。街中にありながら閑静な和風旅館、ご旅行、ビジネス、スポーツ団体、八十八ヶ所巡りなどのお泊りにおすすめのお宿です。ペット同宿可、専用室の為、事前に必ずお問い合わせ下さい。,【アクセス】JR徳島駅徒歩5分。阿波踊り空港から車で20分。高速鳴門から車で30分。徳島自動車道出口より車で20分,エリア ： 徳島県 > 徳島,2016-03-28 01:43:31,2016-03-28 01:43:31,"￥7,222〜","（￥3,611〜/人）",,,,,,,,,,,,,,,,,,,,,,,,,,,,,,,,,,,,,,,,,,,,,,,,,,,,,,,,,,,,,,,,,,,,,,,,,,,,
8073,イセヤＩＮＮ徳島,/yad300894/?stayCount=1&roomCount=1&adultNum=2&stayDay=&stayYear=&stayMonth=&dateUndecided=1&distCd=01&roomCrack=200000&screenId=UWW1402&yadNo=300894&callbackHistFlg=1,駐車場無料２５台★全室LAN完備★映画チャンネル(有料）★全室バス・トイレ（ウォシュレット）付★シングルルームはセミダブルベッド使用でゆったりとお休みいただけます。ぜひぜひご利用くださいませ！,【アクセス】徳島阿波おどり空港からお車で約3分/ＪＲ徳島駅より車で約20分/松茂高速バス乗り場から車で３分,エリア ： 徳島県 > 徳島,2016-03-28 01:43:31,2016-03-28 01:43:31,"￥7,000〜","（￥3,500〜/人）",,,,,,,,,,,,,,,,,,,,,,,,,,,,,,,,,,,,,,,,,,,,,,,,,,,,,,,,,,,,,,,,,,,,,,,,,,,,
8074,ハイパーイン　ホテル越久（エチヒサ）,/yad302193/?stayCount=1&roomCount=1&adultNum=2&stayDay=&stayYear=&stayMonth=&dateUndecided=1&distCd=01&roomCrack=200000&screenId=UWW1402&yadNo=302193&callbackHistFlg=1,繁華街の入り口、官庁街も徒歩圏内の好立地。全室高速LAN・無料パソコンコーナー等の最新設備を備えたビジネスを超えるくつろぎのホテルです。尚最終チェックインは23時となりますのでご注意下さい。,【アクセス】ＪＲ高徳線徳島駅下車徒歩１5分。神戸淡路鳴門道鳴門ＩＣ下車国道１１号線を県庁方面へ新町川西側。,エリア ： 徳島県 > 徳島,2016-03-28 01:43:31,2016-03-28 01:43:31,"￥5,000〜","（￥2,500〜/人）",,,,,,,,,,,,,,,,,,,,,,,,,,,,,,,,,,,,,,,,,,,,,,,,,,,,,,,,,,,,,,,,,,,,,,,,,,,,
8075,阿波観光ホテル,/yad302834/?stayCount=1&roomCount=1&adultNum=2&stayDay=&stayYear=&stayMonth=&dateUndecided=1&distCd=01&roomCrack=200000&screenId=UWW1402&yadNo=302834&callbackHistFlg=1,徳島駅から徒歩１分のところにある斬新なシティホテルです。中心街に位置し、ビジネスに観光に最適です。１階ロビーには他では見られないスキューバダイビングプールがございます。夕食「ぞめき」が好評！,【アクセス】ＪＲ徳島駅より徒歩1分,エリア ： 徳島県 > 徳島,2016-03-28 01:43:31,2016-03-28 01:43:31,"￥8,333〜","（￥4,166〜/人）",,,,,,,,,,,,,,,,,,,,,,,,,,,,,,,,,,,,,,,,,,,,,,,,,,,,,,,,,,,,,,,,,,,,,,,,,,,,
8076,アグネスホテルプラス,/yad306640/?stayCount=1&roomCount=1&adultNum=2&stayDay=&stayYear=&stayMonth=&dateUndecided=1&distCd=01&roomCrack=200000&screenId=UWW1402&yadNo=306640&callbackHistFlg=1,徳島駅より徒歩3分の好立地条件でお客様のお仕事でのご利用やレジャーでのご利用を強力にサポートします。全室高速インターネット通信完備。ホテル横にはコンビニもあります。近隣に無料駐車場完備。,【アクセス】徳島駅より徒歩３分以内。ビジネスや観光でのご利用に最適です,エリア ： 徳島県 > 徳島,2016-03-28 01:43:31,2016-03-28 01:43:31,"￥7,407〜","（￥3,703〜/人）",,,,,,,,,,,,,,,,,,,,,,,,,,,,,,,,,,,,,,,,,,,,,,,,,,,,,,,,,,,,,,,,,,,,,,,,,,,,
8077,かんぽの宿　徳島,/yad307009/?stayCount=1&roomCount=1&adultNum=2&stayDay=&stayYear=&stayMonth=&dateUndecided=1&distCd=01&roomCrack=200000&screenId=UWW1402&yadNo=307009&callbackHistFlg=1,徳島市のシンボルとも言える眉山山頂に位置し、眼下には吉野川や徳島の街並みが眺められ、四季折々の景観を楽しむことができる。特に夜景は絶景である。,【アクセス】徳島市内から車で１５分,エリア ： 徳島県 > 徳島,2016-03-28 01:43:31,2016-03-28 01:43:31,"￥10,000〜","（￥5,000〜/人）",,,,,,,,,,,,,,,,,,,,,,,,,,,,,,,,,,,,,,,,,,,,,,,,,,,,,,,,,,,,,,,,,,,,,,,,,,,,
8078,徳島東急ＲＥＩホテル,/yad307165/?stayCount=1&roomCount=1&adultNum=2&stayDay=&stayYear=&stayMonth=&dateUndecided=1&distCd=01&roomCrack=200000&screenId=UWW1402&yadNo=307165&callbackHistFlg=1,JR徳島駅より徒歩5分、徳島空港よりリムジンバスで徳島駅まで約30分、車で約30分とビジネス・観光に便利！買物はデパートに隣接しコンビニも近く。2015年4月に東急インから東急REIホテルにリブランド。,【アクセス】高速バス徳島駅下車徒歩５分。神戸淡路鳴門道鳴門ＩＣ〜国道１１号線をJR徳島駅方面へ。〓JR徳島駅前です〓,エリア ： 徳島県 > 徳島,2016-03-28 01:43:31,2016-03-28 01:43:31,"￥5,555〜","（￥2,777〜/人）",,,,,,,,,,,,,,,,,,,,,,,,,,,,,,,,,,,,,,,,,,,,,,,,,,,,,,,,,,,,,,,,,,,,,,,,,,,,
8079,ビジネスホテルパレス２１,/yad308070/?stayCount=1&roomCount=1&adultNum=2&stayDay=&stayYear=&stayMonth=&dateUndecided=1&distCd=01&roomCrack=200000&screenId=UWW1402&yadNo=308070&callbackHistFlg=1,無料光高速インターネット(無線LAN)が全室対応になりましたスマホも、OK。！交通便利な徳島市内の中心！徳島駅（徒歩２０分）県庁（徒歩５分）市役所（徒歩５分）徳島港（車で５分）徳島空港（車で１５分）,【アクセス】ＪＲ徳島駅より徒歩２０分。神戸淡路鳴門道鳴門ＩＣ下車１１号線を徳島市内方面へ。,エリア ： 徳島県 > 徳島,2016-03-28 01:43:31,2016-03-28 01:43:31,"￥7,592〜","（￥3,796〜/人）",,,,,,,,,,,,,,,,,,,,,,,,,,,,,,,,,,,,,,,,,,,,,,,,,,,,,,,,,,,,,,,,,,,,,,,,,,,,
8080,アグネスホテル徳島,/yad309505/?stayCount=1&roomCount=1&adultNum=2&stayDay=&stayYear=&stayMonth=&dateUndecided=1&distCd=01&roomCrack=200000&screenId=UWW1402&yadNo=309505&callbackHistFlg=1,徳島駅より徒歩3分。全室高速ブロードバンド対応でビジネスやレジャー利用を強力にサポート。ケーキショップもあり、お土産にの販売もしております。館内にはコインランドリーもあり長期滞在にも最適です。,【アクセス】徳島駅より徒歩３分　徳島空港より車にて２５分　各高速インターチェンジより車で２０分以内,エリア ： 徳島県 > 徳島,2016-03-28 01:43:31,2016-03-28 01:43:31,"￥6,851〜","（￥3,425〜/人）",,,,,,,,,,,,,,,,,,,,,,,,,,,,,,,,,,,,,,,,,,,,,,,,,,,,,,,,,,,,,,,,,,,,,,,,,,,,
8081,ホテルクレメント徳島,/yad312572/?stayCount=1&roomCount=1&adultNum=2&stayDay=&stayYear=&stayMonth=&dateUndecided=1&distCd=01&roomCrack=200000&screenId=UWW1402&yadNo=312572&callbackHistFlg=1,ＪＲ徳島駅直結で、ビジネス・観光に便利。各方面からの高速バス乗場も徒歩１分、駐車場無料、ショッピングセンターも併設、全室Wi-Fiとインターネット回線無料♪,【アクセス】神戸淡路鳴門自動車道鳴門ＩＣ下車国道１１号を徳島市方向へ３０分。ＪＲ徳島駅直結。,エリア ： 徳島県 > 徳島,2016-03-28 01:43:31,2016-03-28 01:43:31,"￥8,055〜","（￥4,027〜/人）",,,,,,,,,,,,,,,,,,,,,,,,,,,,,,,,,,,,,,,,,,,,,,,,,,,,,,,,,,,,,,,,,,,,,,,,,,,,
8082,東横イン徳島駅眉山口,/yad314764/?stayCount=1&roomCount=1&adultNum=2&stayDay=&stayYear=&stayMonth=&dateUndecided=1&distCd=01&roomCrack=200000&screenId=UWW1402&yadNo=314764&callbackHistFlg=1,ＪＲ徳島駅から徒歩９分の好立地。眉山や阿波踊り会館が徒歩圏内で、繁華街もすぐそこ。徳島の観光の拠点にとても便利,【アクセス】ＪＲ高徳線徳島駅下車、徒歩９分。徳島自動車道徳島ＩＣ下車、国道１１号線を徳島駅方面へ南下。,エリア ： 徳島県 > 徳島,2016-03-28 01:43:31,2016-03-28 01:43:31,"￥6,500〜","（￥3,250〜/人）",,,,,,,,,,,,,,,,,,,,,,,,,,,,,,,,,,,,,,,,,,,,,,,,,,,,,,,,,,,,,,,,,,,,,,,,,,,,
8083,徳島グリーンホテル,/yad321488/?stayCount=1&roomCount=1&adultNum=2&stayDay=&stayYear=&stayMonth=&dateUndecided=1&distCd=01&roomCrack=200000&screenId=UWW1402&yadNo=321488&callbackHistFlg=1,一部客室から吉野川に架かる野大橋を眺め、眉山もよく見えます。周辺には飲食店多数あり★コンビニ、コインランドリーも♪ロビーでコーヒー、緑茶を無料でお出ししております♪,【アクセス】JR徳島駅より車で５分、徒歩なら20分。バス停助住橋４丁目下車徒歩2分。,エリア ： 徳島県 > 徳島,2016-03-28 01:43:31,2016-03-28 01:43:31,"￥5,925〜","（￥2,962〜/人）",,,,,,,,,,,,,,,,,,,,,,,,,,,,,,,,,,,,,,,,,,,,,,,,,,,,,,,,,,,,,,,,,,,,,,,,,,,,
