id,building_name,image_url,detail,access,address,created_at,updated_at,fee1,fee2,,,,,,,,,,,,,,,,,,,,,,,,,,,,,,,,,,,,,,,,,,,,,,,,,,,,,,,,,,,,,,,,,,,,,,,,,,,,
6846,ホテル日興,/yad316604/?stayCount=1&roomCount=1&adultNum=2&stayDay=&stayYear=&stayMonth=&dateUndecided=1&distCd=01&roomCrack=200000&screenId=UWW1402&yadNo=316604&callbackHistFlg=1,官庁街やビジネス街への移動が便利な立地。屋外駐車場なので、車幅・高さの心配無し。全室無線LAN接続OK。元湯うるおい館（温泉施設）の割引チケットあり。時間外イン・アウトは要問い合わせ。,【アクセス】ＪＲ長野駅善光寺口より徒歩７分。上信越道長野ＩＣ、又は須坂長野東ＩＣより約２０分。駐車場は、屋外。,エリア ： 長野県 > 長野・飯綱・戸隠,2016-03-28 00:46:14,2016-03-28 00:46:14,"￥7,370〜","（￥3,685〜/人）",,,,,,,,,,,,,,,,,,,,,,,,,,,,,,,,,,,,,,,,,,,,,,,,,,,,,,,,,,,,,,,,,,,,,,,,,,,,
6847,戸隠高原休暇村　シャレー戸隠,/yad317481/?stayCount=1&roomCount=1&adultNum=2&stayDay=&stayYear=&stayMonth=&dateUndecided=1&distCd=01&roomCrack=200000&screenId=UWW1402&yadNo=317481&callbackHistFlg=1,野鳥観察、登山、ウィンタースポーツなど四季折々の戸隠を堪能。レストランから眺める戸隠連峰は特に絶景。様々な部屋タイプがあり、3000坪の高原の中のコテージも！夏には手ぶらでBBQもお勧めです♪,【アクセス】JR長野駅下車バス約1時間。上信越自動車道信濃町インターから約17km30分。(信濃信州新線)。,エリア ： 長野県 > 長野・飯綱・戸隠,2016-03-28 00:46:14,2016-03-28 00:46:14,"￥8,703〜","（￥4,351〜/人）",,,,,,,,,,,,,,,,,,,,,,,,,,,,,,,,,,,,,,,,,,,,,,,,,,,,,,,,,,,,,,,,,,,,,,,,,,,,
6848,長野セントラルホテル,/yad323757/?stayCount=1&roomCount=1&adultNum=2&stayDay=&stayYear=&stayMonth=&dateUndecided=1&distCd=01&roomCrack=200000&screenId=UWW1402&yadNo=323757&callbackHistFlg=1,長野駅善光寺口を出て徒歩約２分。全室ＬＡＮケーブルあります。(インターネット接続無料)夜遅いチェックインも大丈夫です。急なお出かけやお仕事にご利用ください。,【アクセス】JR長野善光寺口、善光寺参道徒歩2分。上信越道、長野ICより約9.5km、須坂長野東ICより約8.5km。,エリア ： 長野県 > 長野・飯綱・戸隠,2016-03-28 00:46:14,2016-03-28 00:46:14,"￥7,592〜","（￥3,796〜/人）",,,,,,,,,,,,,,,,,,,,,,,,,,,,,,,,,,,,,,,,,,,,,,,,,,,,,,,,,,,,,,,,,,,,,,,,,,,,
6849,ＤＩＮＥＲ＆ＧＵＥＳＴＨＯＵＳＥ−Ｐｉｓｅ,/yad324320/?stayCount=1&roomCount=1&adultNum=2&stayDay=&stayYear=&stayMonth=&dateUndecided=1&distCd=01&roomCrack=200000&screenId=UWW1402&yadNo=324320&callbackHistFlg=1,善光寺まで徒歩7分。表参道にオープンしたゲストハウス「ピセ」！旅行好きの店主が出会った世界中の料理が味わるレストラン・カフェ・バーも附設、食事をしながらトアラベラーズコミュニティが深まります。,【アクセス】長野駅善光寺口より徒歩１５分。【バス】長野駅善光寺口よりターミナル１より権堂入口前下車ですぐ。,エリア ： 長野県 > 長野・飯綱・戸隠,2016-03-28 00:46:14,2016-03-28 00:46:14,"￥6,481〜","（￥3,240〜/人）",,,,,,,,,,,,,,,,,,,,,,,,,,,,,,,,,,,,,,,,,,,,,,,,,,,,,,,,,,,,,,,,,,,,,,,,,,,,
6850,信州天空resort ARCADIA〜ふたつとない景色〜(アルカディア),/yad324425/?stayCount=1&roomCount=1&adultNum=2&stayDay=&stayYear=&stayMonth=&dateUndecided=1&distCd=01&roomCrack=200000&screenId=UWW1402&yadNo=324425&callbackHistFlg=1,燦々と煌く星空と善光寺平の夜景志賀高原から昇る朝日と雲海新鮮な高原野菜や信州食材を活かした自然食ビュッフェ信州の自然満喫癒しの旅に信州パワースポット巡りの旅に〜善光寺&戸隠神社〜,【アクセス】JR長野駅より車25分、上信越自動車道長野、須坂長野東ICより約40分。飯綱高原スキー場徒歩３分,エリア ： 長野県 > 長野・飯綱・戸隠,2016-03-28 00:46:14,2016-03-28 00:46:14,"￥10,000〜","（￥5,000〜/人）",,,,,,,,,,,,,,,,,,,,,,,,,,,,,,,,,,,,,,,,,,,,,,,,,,,,,,,,,,,,,,,,,,,,,,,,,,,,
6851,チサングランド長野,/yad324498/?stayCount=1&roomCount=1&adultNum=2&stayDay=&stayYear=&stayMonth=&dateUndecided=1&distCd=01&roomCrack=200000&screenId=UWW1402&yadNo=324498&callbackHistFlg=1,信州長野の食材をふんだんに使用した和食中心・手作り朝食！懐石板前の味をぜひ！客室はシングル20,,エリア ： 長野県 > 長野・飯綱・戸隠,2016-03-28 00:46:14,2016-03-28 00:46:14,"￥6,750〜","（￥3,375〜/人）",,,,,,,,,,,,,,,,,,,,,,,,,,,,,,,,,,,,,,,,,,,,,,,,,,,,,,,,,,,,,,,,,,,,,,,,,,,,
6852,いかほ別館,/yad326265/?stayCount=1&roomCount=1&adultNum=2&stayDay=&stayYear=&stayMonth=&dateUndecided=1&distCd=01&roomCrack=200000&screenId=UWW1402&yadNo=326265&callbackHistFlg=1,長野駅から、車で15分位。善光寺へは、車で3分位。長野駅、善光寺への無料送迎サービス。送迎をご希望のお客様は事前にご連絡ください。※都合により送迎が出来ない場合がございます。,【アクセス】長野駅より車で15分／善光寺より車で3分,エリア ： 長野県 > 長野・飯綱・戸隠,2016-03-28 00:46:14,2016-03-28 00:46:14,"￥7,407〜","（￥3,703〜/人）",,,,,,,,,,,,,,,,,,,,,,,,,,,,,,,,,,,,,,,,,,,,,,,,,,,,,,,,,,,,,,,,,,,,,,,,,,,,
6853,信州戸隠の宿坊　旧本坊　勧修院　久山館,/yad327449/?stayCount=1&roomCount=1&adultNum=2&stayDay=&stayYear=&stayMonth=&dateUndecided=1&distCd=01&roomCrack=200000&screenId=UWW1402&yadNo=327449&callbackHistFlg=1,平安時代より明治まで別当の職を継承してきた宿は、明治以降、現在も宿坊の形態を残し当主は神官の職を受け継ぐ。ご神前には、九頭龍弁財天様をお祀りしています。信州食材を豊富に、宿こだわりのメニュー。,【アクセス】長野駅よりバスで６０分、中社宮前下車にて５分。長野ICより車で６０分。,エリア ： 長野県 > 長野・飯綱・戸隠,2016-03-28 00:46:14,2016-03-28 00:46:14,"￥22,222〜","（￥11,111〜/人）",,,,,,,,,,,,,,,,,,,,,,,,,,,,,,,,,,,,,,,,,,,,,,,,,,,,,,,,,,,,,,,,,,,,,,,,,,,,
6854,福岡旅館,/yad329509/?stayCount=1&roomCount=1&adultNum=2&stayDay=&stayYear=&stayMonth=&dateUndecided=1&distCd=01&roomCrack=200000&screenId=UWW1402&yadNo=329509&callbackHistFlg=1,戸隠神社宝光社近く。戸隠そばと四季を感じるこだわりの信州産食材を使ったお料理を趣ある個室の食事処にて楽しむ、優しいおもてなしと、くつろぎのひと時を過ごせる宿。,【アクセス】ＪＲ長野駅前より戸隠高原行きバス又はタクシーで５０分。長野ＩＣ〜３０ｋｍ、信濃町ＩＣ〜２０ｋｍ,エリア ： 長野県 > 長野・飯綱・戸隠,2016-03-28 00:46:14,2016-03-28 00:46:14,"￥18,518〜","（￥9,259〜/人）",,,,,,,,,,,,,,,,,,,,,,,,,,,,,,,,,,,,,,,,,,,,,,,,,,,,,,,,,,,,,,,,,,,,,,,,,,,,
6855,森と水バックパッカーズ,/yad330728/?stayCount=1&roomCount=1&adultNum=2&stayDay=&stayYear=&stayMonth=&dateUndecided=1&distCd=01&roomCrack=200000&screenId=UWW1402&yadNo=330728&callbackHistFlg=1,長野駅すぐの好立地。歩いて善光寺に、バスで戸隠・白馬などの観光地や東京・名古屋・京都・大阪に。リビングでの一期一会の会話も、部屋でくつろぐのも自由。目の前は線路でいろんな電車が見えます。,【アクセス】長野駅・善光寺口から徒歩5分,エリア ： 長野県 > 長野・飯綱・戸隠,2016-03-28 00:46:14,2016-03-28 00:46:14,"￥6,111〜","（￥3,055〜/人）",,,,,,,,,,,,,,,,,,,,,,,,,,,,,,,,,,,,,,,,,,,,,,,,,,,,,,,,,,,,,,,,,,,,,,,,,,,,
6856,ぴあろっきー,/yad331730/?stayCount=1&roomCount=1&adultNum=2&stayDay=&stayYear=&stayMonth=&dateUndecided=1&distCd=01&roomCrack=200000&screenId=UWW1402&yadNo=331730&callbackHistFlg=1,日本百名山、高妻山の登山基地に、冬は戸隠スキー場へ徒歩5分の好立地。戸隠神社を始め歴史がある地をゆっくり歩くことも♪四季折々の食材でお客様に合わせたスローフード、アレルギー対応でご用意♪,【アクセス】長野道、信濃町ＩＣより車で25分。長野ＩＣより45分。ＪＲ長野駅よりバスで60分、中社宮前下車送迎,エリア ： 長野県 > 長野・飯綱・戸隠,2016-03-28 00:46:14,2016-03-28 00:46:14,"￥12,000〜","（￥6,000〜/人）",,,,,,,,,,,,,,,,,,,,,,,,,,,,,,,,,,,,,,,,,,,,,,,,,,,,,,,,,,,,,,,,,,,,,,,,,,,,
6857,ペンション ころぼっくす,/yad331940/?stayCount=1&roomCount=1&adultNum=2&stayDay=&stayYear=&stayMonth=&dateUndecided=1&distCd=01&roomCrack=200000&screenId=UWW1402&yadNo=331940&callbackHistFlg=1,四季を感じさせてくれる戸隠高原。新緑の春、野鳥や蛍に癒される夏、紅葉の秋、白銀の世界の冬。オーナー自慢の手料理や朝食の手作りパンが人気。あなただけの休日をどうぞ,【アクセス】ＪＲ長野駅下車、川中島バス戸隠行で４０分、大久保で下車。そこから徒歩１０分。送迎あり（要連絡）,エリア ： 長野県 > 長野・飯綱・戸隠,2016-03-28 00:46:14,2016-03-28 00:46:14,"￥12,592〜","（￥6,296〜/人）",,,,,,,,,,,,,,,,,,,,,,,,,,,,,,,,,,,,,,,,,,,,,,,,,,,,,,,,,,,,,,,,,,,,,,,,,,,,
6858,ペンションあぜりあ,/yad332185/?stayCount=1&roomCount=1&adultNum=2&stayDay=&stayYear=&stayMonth=&dateUndecided=1&distCd=01&roomCrack=200000&screenId=UWW1402&yadNo=332185&callbackHistFlg=1,四季折々の自然を楽しむ戸隠高原。戸隠神社、奥社、九頭龍社、鏡池…登山・ハイキング・バードウォッチング・花観察。冬には戸隠スキー場♪多彩に楽しんだ後には当宿で疲れを癒してください。,【アクセス】長野道、上信越道”信濃町IC”又は”長野IC”/長野新幹線『長野駅』下車,エリア ： 長野県 > 長野・飯綱・戸隠,2016-03-28 00:46:14,2016-03-28 00:46:14,"￥12,962〜","（￥6,481〜/人）",,,,,,,,,,,,,,,,,,,,,,,,,,,,,,,,,,,,,,,,,,,,,,,,,,,,,,,,,,,,,,,,,,,,,,,,,,,,
6859,山旅の宿　樅の木山荘,/yad333736/?stayCount=1&roomCount=1&adultNum=2&stayDay=&stayYear=&stayMonth=&dateUndecided=1&distCd=01&roomCrack=200000&screenId=UWW1402&yadNo=333736&callbackHistFlg=1,神秘の地、戸隠。日本有数のパワースポットに当宿はございます。自家製食材や、地元食材に拘った料理は大好評！グリーンシーズンはバードウォッチング、冬はスキー場や戸隠神社まで車で5分の超好立地！,【アクセス】長野駅から車で1時間。駅前から路線バス、タクシーが出ています。,エリア ： 長野県 > 長野・飯綱・戸隠,2016-03-28 00:46:14,2016-03-28 00:46:14,"￥13,650〜","（￥6,825〜/人）",,,,,,,,,,,,,,,,,,,,,,,,,,,,,,,,,,,,,,,,,,,,,,,,,,,,,,,,,,,,,,,,,,,,,,,,,,,,
6860,HOTEL NICE IN （ホテルナイスイン）,/yad339825/?stayCount=1&roomCount=1&adultNum=2&stayDay=&stayYear=&stayMonth=&dateUndecided=1&distCd=01&roomCrack=200000&screenId=UWW1402&yadNo=339825&callbackHistFlg=1,駐車無料！コンビニ徒歩1分！インター近くの国道沿い！フットワーク抜群！洋室、和室などの部屋タイプ色々。シーンに合わせてどうぞ！大浴場で疲れをリフレッシュしてください。大型車、バスもＯＫ。,【アクセス】更埴IC長野ICよりR18号線沿い8分。篠ノ井駅よりタクシー5分。送迎10名以上要予約可。【駐車場無料】,エリア ： 長野県 > 長野・飯綱・戸隠,2016-03-28 00:46:14,2016-03-28 00:46:14,"￥7,800〜","（￥3,900〜/人）",,,,,,,,,,,,,,,,,,,,,,,,,,,,,,,,,,,,,,,,,,,,,,,,,,,,,,,,,,,,,,,,,,,,,,,,,,,,
6861,ホテル　アタゴ,/yad342600/?stayCount=1&roomCount=1&adultNum=2&stayDay=&stayYear=&stayMonth=&dateUndecided=1&distCd=01&roomCrack=200000&screenId=UWW1402&yadNo=342600&callbackHistFlg=1,行き届いたホスピタリティー。館内はバリアフリーとなっており、ゆったりとした作りになっております。夕食は料理長による厳選素材の季節替りの懐石風料理をお楽しみ下さい。平面無料駐車場完備。,【アクセス】長野自動車道、須坂長野東ＩＣより約30分。ＪＲ長野新幹線、長野駅経由長野電鉄、本郷駅より徒歩10分。,エリア ： 長野県 > 長野・飯綱・戸隠,2016-03-28 00:46:14,2016-03-28 00:46:14,"￥11,111〜","（￥5,555〜/人）",,,,,,,,,,,,,,,,,,,,,,,,,,,,,,,,,,,,,,,,,,,,,,,,,,,,,,,,,,,,,,,,,,,,,,,,,,,,
6862,戸隠高原　森の宿めるへん,/yad344680/?stayCount=1&roomCount=1&adultNum=2&stayDay=&stayYear=&stayMonth=&dateUndecided=1&distCd=01&roomCrack=200000&screenId=UWW1402&yadNo=344680&callbackHistFlg=1,戸隠高原で標高が一番高い越水ヶ原にある森の中の一軒宿のロッジ。戸隠神社奥社や、植物園、戸隠スキー場すぐ近くの好立地。四季折々戸隠高原でスローライフを。季節の素材を生かした和洋中の料理が人気。,【アクセス】長野駅から戸隠行バス乗車、中社宮前または奥社下車。送迎車で4分。スキーシーズンは越水旅館街下車、歩2分,エリア ： 長野県 > 長野・飯綱・戸隠,2016-03-28 00:46:14,2016-03-28 00:46:14,"￥10,740〜","（￥5,370〜/人）",,,,,,,,,,,,,,,,,,,,,,,,,,,,,,,,,,,,,,,,,,,,,,,,,,,,,,,,,,,,,,,,,,,,,,,,,,,,
6863,和田山荘,/yad354527/?stayCount=1&roomCount=1&adultNum=2&stayDay=&stayYear=&stayMonth=&dateUndecided=1&distCd=01&roomCrack=200000&screenId=UWW1402&yadNo=354527&callbackHistFlg=1,冬はスキー場まで徒歩３分。春は野鳥観察、スケッチなどのお泊りに。夏は高妻、戸隠、飯綱の登山のお泊りに。秋は戸隠の紅葉や風景を楽しみに来た際のお泊りにご利用ください。※館内禁煙です。,【アクセス】長野IC又は信濃町ICより戸隠スキー場方面へ　バスは長野駅より戸隠スキー場行きをご利用ください。,エリア ： 長野県 > 長野・飯綱・戸隠,2016-03-28 00:46:14,2016-03-28 00:46:14,"￥10,185〜","（￥5,092〜/人）",,,,,,,,,,,,,,,,,,,,,,,,,,,,,,,,,,,,,,,,,,,,,,,,,,,,,,,,,,,,,,,,,,,,,,,,,,,,
6864,森の宿　林りん館,/yad358480/?stayCount=1&roomCount=1&adultNum=2&stayDay=&stayYear=&stayMonth=&dateUndecided=1&distCd=01&roomCrack=200000&screenId=UWW1402&yadNo=358480&callbackHistFlg=1,窓を開けると思わず「おッ」。全室から北アルプスの雄姿が望めます。にほんの里100選に選定され、日本で最も美しい村連合にも加盟する小川村。その山里の一軒家。温かさが売り物。先ずはご来館あれ。,【アクセス】JR長野駅下車、特急大町行き又は路線バス高府行き、小川新田下車。迎えあり。,エリア ： 長野県 > 長野・飯綱・戸隠,2016-03-28 00:46:14,2016-03-28 00:46:14,"￥9,259〜","（￥4,629〜/人）",,,,,,,,,,,,,,,,,,,,,,,,,,,,,,,,,,,,,,,,,,,,,,,,,,,,,,,,,,,,,,,,,,,,,,,,,,,,
6865,ロッジ山の音,/yad358654/?stayCount=1&roomCount=1&adultNum=2&stayDay=&stayYear=&stayMonth=&dateUndecided=1&distCd=01&roomCrack=200000&screenId=UWW1402&yadNo=358654&callbackHistFlg=1,四季折々の豊かな自然に癒されたり、ボート、登山、テニス、ゴルフ等のスポーツを心いくまで楽しめます。冬は飯綱高原スキー場ゲレンデが目の前なので、遊び疲れて帰ってきてもすぐ休めます。,【アクセス】長野駅よりバスで４０分,エリア ： 長野県 > 長野・飯綱・戸隠,2016-03-28 00:46:14,2016-03-28 00:46:14,"￥10,740〜","（￥5,370〜/人）",,,,,,,,,,,,,,,,,,,,,,,,,,,,,,,,,,,,,,,,,,,,,,,,,,,,,,,,,,,,,,,,,,,,,,,,,,,,
6866,ホテル戸隠,/yad359246/?stayCount=1&roomCount=1&adultNum=2&stayDay=&stayYear=&stayMonth=&dateUndecided=1&distCd=01&roomCrack=200000&screenId=UWW1402&yadNo=359246&callbackHistFlg=1,建物や設備は古く年季が入っておりますが、ボリューム満点の地産地消にこだわった素朴で温かな家庭料理＆光明石を使った準温泉で心身ぽかぽか♪和室やロフト付部屋もあり一人旅からグループ合宿まで大歓迎！,【アクセス】JR長野駅下車バス約1時間。長野ICから車で約１時間10分。上信越自動車道信濃町ICから車で約40分。,エリア ： 長野県 > 長野・飯綱・戸隠,2016-03-28 00:46:14,2016-03-28 00:46:14,"￥9,814〜","（￥4,907〜/人）",,,,,,,,,,,,,,,,,,,,,,,,,,,,,,,,,,,,,,,,,,,,,,,,,,,,,,,,,,,,,,,,,,,,,,,,,,,,
6867,松屋旅館,/yad359856/?stayCount=1&roomCount=1&adultNum=2&stayDay=&stayYear=&stayMonth=&dateUndecided=1&distCd=01&roomCrack=200000&screenId=UWW1402&yadNo=359856&callbackHistFlg=1,善光寺旧如来堂跡地に建つ善光寺ゆかりの宿。善光寺参拝に大変便利。四季折々の素材を生かした会席料理が自慢。,【アクセス】JR長野駅下車、バスまたはタクシーで約15分,エリア ： 長野県 > 長野・飯綱・戸隠,2016-03-28 00:46:14,2016-03-28 00:46:14,"￥15,000〜","（￥7,500〜/人）",,,,,,,,,,,,,,,,,,,,,,,,,,,,,,,,,,,,,,,,,,,,,,,,,,,,,,,,,,,,,,,,,,,,,,,,,,,,
6868,人と自然が静かに語り合う宿　山宿　戸隠小舎,/yad369162/?stayCount=1&roomCount=1&adultNum=2&stayDay=&stayYear=&stayMonth=&dateUndecided=1&distCd=01&roomCrack=200000&screenId=UWW1402&yadNo=369162&callbackHistFlg=1,登山家の創業者から代々家族で営むアットホームな宿。二代目主人：佐々木常念によるスキーレッスンや登山ガイドも大好評！オリジナルヒマラヤンカレーなど腕によりをかけた料理の数々をお楽しみください♪,【アクセス】信濃町ICからお車で約１時間／長野駅からバス又はタクシーで約1時間,エリア ： 長野県 > 長野・飯綱・戸隠,2016-03-28 00:46:14,2016-03-28 00:46:14,"￥12,000〜","（￥6,000〜/人）",,,,,,,,,,,,,,,,,,,,,,,,,,,,,,,,,,,,,,,,,,,,,,,,,,,,,,,,,,,,,,,,,,,,,,,,,,,,
6869,あずまの湯,/yad369725/?stayCount=1&roomCount=1&adultNum=2&stayDay=&stayYear=&stayMonth=&dateUndecided=1&distCd=01&roomCrack=200000&screenId=UWW1402&yadNo=369725&callbackHistFlg=1,昔ながらの銭湯を併設し、サウナ室・日替わり薬湯等をご堪能いただけます。善光寺やアクアウイング・ビッグハット・エムウエーブ等各種イベント・スポーツ施設にも近く、近隣観光地へのアクセスも良好です,【アクセス】ＪＲ長野駅より車で10分。上信越道長野ＩＣより２５分。須坂長野東ＩＣより２０分。（渋滞で、変わります）,エリア ： 長野県 > 長野・飯綱・戸隠,2016-03-28 00:46:14,2016-03-28 00:46:14,"￥4,259〜","（￥2,129〜/人）",,,,,,,,,,,,,,,,,,,,,,,,,,,,,,,,,,,,,,,,,,,,,,,,,,,,,,,,,,,,,,,,,,,,,,,,,,,,
6870,ほのぼのとゆかしさ薫るおもてなし　創業１６０年　高山坊,/yad372330/?stayCount=1&roomCount=1&adultNum=2&stayDay=&stayYear=&stayMonth=&dateUndecided=1&distCd=01&roomCrack=200000&screenId=UWW1402&yadNo=372330&callbackHistFlg=1,天岩戸が落ちてより…と伝説と修験道の聖地として知られた霊峰戸隠山のふところに、創業百六十年を数える古き良き伝統のたたずまい「高山坊」。戸隠の魅力を存分にお味わいいただけるようお迎えします。,【アクセス】長野駅から車で1時間。駅前から路線バス、タクシーが出ています。,エリア ： 長野県 > 長野・飯綱・戸隠,2016-03-28 00:46:14,2016-03-28 00:46:14,"￥11,111〜","（￥5,555〜/人）",,,,,,,,,,,,,,,,,,,,,,,,,,,,,,,,,,,,,,,,,,,,,,,,,,,,,,,,,,,,,,,,,,,,,,,,,,,,
6871,信州の隠れ宿　まほろば,/yad372784/?stayCount=1&roomCount=1&adultNum=2&stayDay=&stayYear=&stayMonth=&dateUndecided=1&distCd=01&roomCrack=200000&screenId=UWW1402&yadNo=372784&callbackHistFlg=1,信州の古民家を改装した純和風の民宿。１日2組限定　最大８名(２部屋）。地元で採れた山菜や野菜を使った田舎料理、岩魚の塩焼きを囲炉裏を囲んでのんびり楽しめる和風オーベルジュ。,【アクセス】JR長野駅より車で20分。長野道更埴ＩＣ、長野ＩＣより車で20分。,エリア ： 長野県 > 長野・飯綱・戸隠,2016-03-28 00:46:14,2016-03-28 00:46:14,"￥18,148〜","（￥9,074〜/人）",,,,,,,,,,,,,,,,,,,,,,,,,,,,,,,,,,,,,,,,,,,,,,,,,,,,,,,,,,,,,,,,,,,,,,,,,,,,
6872,宮本旅館,/yad374022/?stayCount=1&roomCount=1&adultNum=2&stayDay=&stayYear=&stayMonth=&dateUndecided=1&distCd=01&roomCrack=200000&screenId=UWW1402&yadNo=374022&callbackHistFlg=1,神話の神々を祀る霊山・戸隠高原に位置する歴史ある宿坊・旅館。家庭的なおもてなしでのお迎え。山菜・川魚料理・名物戸隠そばを中心に手作り料理がお楽しみ。自然と歴史に触れて見ませんか。,【アクセス】長野駅下車、川中島バスで60分、宝光社宮前下車3分。,エリア ： 長野県 > 長野・飯綱・戸隠,2016-03-28 00:46:14,2016-03-28 00:46:14,"￥20,000〜","（￥10,000〜/人）",,,,,,,,,,,,,,,,,,,,,,,,,,,,,,,,,,,,,,,,,,,,,,,,,,,,,,,,,,,,,,,,,,,,,,,,,,,,
6873,民宿　とがくし屋,/yad376838/?stayCount=1&roomCount=1&adultNum=2&stayDay=&stayYear=&stayMonth=&dateUndecided=1&distCd=01&roomCrack=200000&screenId=UWW1402&yadNo=376838&callbackHistFlg=1,冬はゲレンデまで1分、滑ったまま宿へ戻れる好立地。中社神社、チビッコ忍者村へは徒歩10分。神告げ温泉は徒歩3分。スピリチュアルスポットの鏡池や奥社、牧場への観光やハイキング、登山の基点に便利。,【アクセス】ＪＲ長野駅下車、川中島バス中社宮前下車、徒歩10分,エリア ： 長野県 > 長野・飯綱・戸隠,2016-03-28 00:46:14,2016-03-28 00:46:14,"￥6,666〜","（￥3,333〜/人）",,,,,,,,,,,,,,,,,,,,,,,,,,,,,,,,,,,,,,,,,,,,,,,,,,,,,,,,,,,,,,,,,,,,,,,,,,,,
6874,戸隠旅の宿　白樺荘,/yad378984/?stayCount=1&roomCount=1&adultNum=2&stayDay=&stayYear=&stayMonth=&dateUndecided=1&distCd=01&roomCrack=200000&screenId=UWW1402&yadNo=378984&callbackHistFlg=1,バードウォッチングの楽園「戸隠森林植物園」に1番近い宿！登山やスキー目的の方にも好立地♪自慢の庭には蛍・紅葉、そして3万本を越す水芭蕉園。地元食材を使った和洋折衷料理とお風呂でお寛ぎ下さい♪,【アクセス】信濃ICから30分／電車■長野駅からバス約60分⇒戸隠中社宮or戸隠森林植物園下車10分※冬は越水ヶ原下車1分,エリア ： 長野県 > 長野・飯綱・戸隠,2016-03-28 00:46:14,2016-03-28 00:46:14,"￥10,000〜","（￥5,000〜/人）",,,,,,,,,,,,,,,,,,,,,,,,,,,,,,,,,,,,,,,,,,,,,,,,,,,,,,,,,,,,,,,,,,,,,,,,,,,,
6875,ぺんしょん　遊山,/yad383671/?stayCount=1&roomCount=1&adultNum=2&stayDay=&stayYear=&stayMonth=&dateUndecided=1&distCd=01&roomCrack=200000&screenId=UWW1402&yadNo=383671&callbackHistFlg=1,標高1100ｍさわやかな高原でリフレッシュ。善光寺〜車で20分。チビッ子忍者村や話題のパワースポット戸隠神社まで車で15分。お食事や足を伸ばせる和室、無料お飲物コーナも好評。お風呂は貸切ＯＫ。持込無料,【アクセス】ＪＲ長野駅より車25分。上信越自動車道、長野IC・須坂長野東ICより約45分。,エリア ： 長野県 > 長野・飯綱・戸隠,2016-03-28 00:46:14,2016-03-28 00:46:14,"￥7,370〜","（￥3,685〜/人）",,,,,,,,,,,,,,,,,,,,,,,,,,,,,,,,,,,,,,,,,,,,,,,,,,,,,,,,,,,,,,,,,,,,,,,,,,,,
6876,長野第一ホテル,/yad386884/?stayCount=1&roomCount=1&adultNum=2&stayDay=&stayYear=&stayMonth=&dateUndecided=1&distCd=01&roomCrack=200000&screenId=UWW1402&yadNo=386884&callbackHistFlg=1,ビジネスに◎観光に◎　長野駅徒歩２分　男女別【展望風呂】有り　男性用【露天風呂】有り　無料朝食【信州そば＋いなり寿司２個】サービス　全室【Ｗｉ−Ｆｉ】接続可,【アクセス】JR長野駅善光寺口から徒歩２分,エリア ： 長野県 > 長野・飯綱・戸隠,2016-03-28 00:46:14,2016-03-28 00:46:14,"￥9,259〜","（￥4,629〜/人）",,,,,,,,,,,,,,,,,,,,,,,,,,,,,,,,,,,,,,,,,,,,,,,,,,,,,,,,,,,,,,,,,,,,,,,,,,,,
6877,山の神温泉,/yad391266/?stayCount=1&roomCount=1&adultNum=2&stayDay=&stayYear=&stayMonth=&dateUndecided=1&distCd=01&roomCrack=200000&screenId=UWW1402&yadNo=391266&callbackHistFlg=1,山の斜面に沿って建てられているのでどの部屋からも善光寺平を一望。国宝善光寺の上、車で3分。24時間利用可能な鉱泉の温泉で休み、地物を四季折々の食材で調理した夕食を。昔ながらの旅館です。,【アクセス】ＪＲ　長野駅より車で10分,エリア ： 長野県 > 長野・飯綱・戸隠,2016-03-28 00:46:14,2016-03-28 00:46:14,"￥8,000〜","（￥4,000〜/人）",,,,,,,,,,,,,,,,,,,,,,,,,,,,,,,,,,,,,,,,,,,,,,,,,,,,,,,,,,,,,,,,,,,,,,,,,,,,
