id,building_name,image_url,detail,access,address,created_at,updated_at,fee1,fee2,,,,,,,,,,,,,,,,,,,,,,,,,,,,,,,,,,,,,,,,,,,,,,,,,,,,,,,,,,,,,,,,,,,,,,,,,,,,
942,ホテルスポーツパルコ,/yad337152/?stayCount=1&roomCount=1&adultNum=2&stayDay=&stayYear=&stayMonth=&dateUndecided=1&distCd=01&roomCrack=200000&screenId=UWW1402&yadNo=337152&callbackHistFlg=1,JR岐阜駅から徒歩20分.繁華街柳ヶ瀬に徒歩5分の好立地。ビジネスホテルでありながら、温水プールに天然温泉直送の大浴場と、サウナ・ジャグジーでのんびりリフレッシュ。無線ＬＡＮ無料。,【アクセス】ＪＲ岐阜駅より車５分、名鉄岐阜駅より車３分,エリア ： 岐阜県 > 岐阜・羽島,2016-03-28 02:37:20,2016-03-28 02:37:20,"￥11,111〜","（￥5,555〜/人）",,,,,,,,,,,,,,,,,,,,,,,,,,,,,,,,,,,,,,,,,,,,,,,,,,,,,,,,,,,,,,,,,,,,,,,,,,,,
943,東横イン岐阜羽島駅新幹線南口,/yad340548/?stayCount=1&roomCount=1&adultNum=2&stayDay=&stayYear=&stayMonth=&dateUndecided=1&distCd=01&roomCrack=200000&screenId=UWW1402&yadNo=340548&callbackHistFlg=1,東海道新幹線岐阜羽島駅から徒歩３分、名神高速道路岐阜羽島ＩＣから車で３分の場所に位置し、西へ東へ飛騨高山方面へもラクラクです。無料駐車場には大型車のスペースもあり、　　団体宿泊も歓迎です。,【アクセス】東海道新幹線岐阜羽島駅、名鉄新羽島駅から徒歩３分　名神高速道路岐阜羽島ＩＣより車で３分,エリア ： 岐阜県 > 岐阜・羽島,2016-03-28 02:37:20,2016-03-28 02:37:20,"￥6,300〜","（￥3,150〜/人）",,,,,,,,,,,,,,,,,,,,,,,,,,,,,,,,,,,,,,,,,,,,,,,,,,,,,,,,,,,,,,,,,,,,,,,,,,,,
944,サンホテル岐阜羽島,/yad351486/?stayCount=1&roomCount=1&adultNum=2&stayDay=&stayYear=&stayMonth=&dateUndecided=1&distCd=01&roomCrack=200000&screenId=UWW1402&yadNo=351486&callbackHistFlg=1,『窓からは新幹線が良く見えます　お子様にとって新幹線は今も昔も特別なものですよね。。』◆名神高速道路：岐阜羽島ＩＣからのアクセスも最適◆駐車場４４台先着順無料◆朝食バイキングが人気,【アクセス】東海道新幹線岐阜羽島駅　北口ロータリー横徒歩1分,エリア ： 岐阜県 > 岐阜・羽島,2016-03-28 02:37:20,2016-03-28 02:37:20,"￥5,555〜","（￥2,777〜/人）",,,,,,,,,,,,,,,,,,,,,,,,,,,,,,,,,,,,,,,,,,,,,,,,,,,,,,,,,,,,,,,,,,,,,,,,,,,,
945,ビジネスホテル観月,/yad352591/?stayCount=1&roomCount=1&adultNum=2&stayDay=&stayYear=&stayMonth=&dateUndecided=1&distCd=01&roomCrack=200000&screenId=UWW1402&yadNo=352591&callbackHistFlg=1,各務原市役所の西隣に位置し、交通の便が良く、ビジネス拠点として最適。全室無料インターネット接続可能光ファイバー全室トイレウォッシュレット完備、液晶テレビ設置。冷蔵庫あり。大型バス可,【アクセス】名鉄各務原市役所前より徒歩5分、高山本線那加より徒歩10分、岐阜各務原ICより3キロ,エリア ： 岐阜県 > 岐阜・羽島,2016-03-28 02:37:20,2016-03-28 02:37:20,"￥8,333〜","（￥4,166〜/人）",,,,,,,,,,,,,,,,,,,,,,,,,,,,,,,,,,,,,,,,,,,,,,,,,,,,,,,,,,,,,,,,,,,,,,,,,,,,
946,ビジネスホテル　花月,/yad353253/?stayCount=1&roomCount=1&adultNum=2&stayDay=&stayYear=&stayMonth=&dateUndecided=1&distCd=01&roomCrack=200000&screenId=UWW1402&yadNo=353253&callbackHistFlg=1,旅のお疲れを癒し、快適なお泊りをお約束いたします。全室バス、トイレ付。お客様が安心しておやすみいただけるように、門限が設けてございます。（門限が午前0時30分になっております）,【アクセス】ＪＲ岐阜駅より車５分、名鉄岐阜駅より車３分,エリア ： 岐阜県 > 岐阜・羽島,2016-03-28 02:37:20,2016-03-28 02:37:20,"￥5,370〜",（￥-/室）,,,,,,,,,,,,,,,,,,,,,,,,,,,,,,,,,,,,,,,,,,,,,,,,,,,,,,,,,,,,,,,,,,,,,,,,,,,,
947,ウィークリー翔ホテル各務原,/yad356032/?stayCount=1&roomCount=1&adultNum=2&stayDay=&stayYear=&stayMonth=&dateUndecided=1&distCd=01&roomCrack=200000&screenId=UWW1402&yadNo=356032&callbackHistFlg=1,必要最小限のサービスでとことん低料金を目指すウィークリー翔が、各務原のビジネスホテルをリニューアルオープンさせます！東海北陸道「岐阜各務原IC」から8分、JRや名鉄線も目の前で交通も至便です,【アクセス】東海北陸自動車道「岐阜各務原IC」から8分、JR「那加駅」徒歩2分、名鉄「新那加駅」徒歩1分,エリア ： 岐阜県 > 岐阜・羽島,2016-03-28 02:37:20,2016-03-28 02:37:20,"￥9,074〜","（￥4,537〜/人）",,,,,,,,,,,,,,,,,,,,,,,,,,,,,,,,,,,,,,,,,,,,,,,,,,,,,,,,,,,,,,,,,,,,,,,,,,,,
948,かんぽの宿岐阜羽島,/yad357768/?stayCount=1&roomCount=1&adultNum=2&stayDay=&stayYear=&stayMonth=&dateUndecided=1&distCd=01&roomCrack=200000&screenId=UWW1402&yadNo=357768&callbackHistFlg=1,羽島温泉はカルシウム・ナトリウム塩化物温泉です！適応症は神経痛・皮膚病・慢性皮膚病など☆赤ちゃん歓迎の宿です☆新幹線羽島駅より車で約15分！名古屋駅まで車で約50分！,【アクセス】【車】名神岐阜羽島ICから南へ約１５分【鉄道】新幹線岐阜羽島駅南口から定期送迎用バスあり（要予約）,エリア ： 岐阜県 > 岐阜・羽島,2016-03-28 02:37:20,2016-03-28 02:37:20,"￥10,370〜","（￥5,185〜/人）",,,,,,,,,,,,,,,,,,,,,,,,,,,,,,,,,,,,,,,,,,,,,,,,,,,,,,,,,,,,,,,,,,,,,,,,,,,,
949,アンディアーモ　パルテンツァ　ホテル（旧フォロ・ロマーノ）,/yad358520/?stayCount=1&roomCount=1&adultNum=2&stayDay=&stayYear=&stayMonth=&dateUndecided=1&distCd=01&roomCrack=200000&screenId=UWW1402&yadNo=358520&callbackHistFlg=1,2011年9月リニューアルOPEN！レディースルームを導入し、女性にもオススメ。岐阜羽島ＩＣから車で3分のアクセスで駐車場は無料（大型車もＯＫ）結婚記念日や誕生日を祝うプランもあり、とっておきのstay,【アクセス】ＪＲ東海道線　岐阜羽島駅より徒歩5分、名神高速　岐阜羽島I.Cより5分,エリア ： 岐阜県 > 岐阜・羽島,2016-03-28 02:37:20,2016-03-28 02:37:20,"￥7,407〜","（￥3,703〜/人）",,,,,,,,,,,,,,,,,,,,,,,,,,,,,,,,,,,,,,,,,,,,,,,,,,,,,,,,,,,,,,,,,,,,,,,,,,,,
950,ウィークリー翔　岐阜駅南,/yad360357/?stayCount=1&roomCount=1&adultNum=2&stayDay=&stayYear=&stayMonth=&dateUndecided=1&distCd=01&roomCrack=200000&screenId=UWW1402&yadNo=360357&callbackHistFlg=1,必要最小限のサービスでとことん低料金を目指すウィークリー翔が、岐阜市にニューオープン!!共同浴場には天然温泉水を使用。2015年10月完成の出来たて、全館禁煙・土足禁止でとっても清潔・安心です♪,【アクセス】JR岐阜駅「中央南口」から徒歩8分、国道21号交差点「茜部中島3」から車4分,エリア ： 岐阜県 > 岐阜・羽島,2016-03-28 02:37:20,2016-03-28 02:37:20,"￥4,305〜","（￥2,152〜/人）",,,,,,,,,,,,,,,,,,,,,,,,,,,,,,,,,,,,,,,,,,,,,,,,,,,,,,,,,,,,,,,,,,,,,,,,,,,,
951,ホテルグランヴェール岐山,/yad362449/?stayCount=1&roomCount=1&adultNum=2&stayDay=&stayYear=&stayMonth=&dateUndecided=1&distCd=01&roomCrack=200000&screenId=UWW1402&yadNo=362449&callbackHistFlg=1,調度品に飛騨の家具を使用したシンプルで飾りすぎないデザインのホテル内。客室も清潔感と心地の良さで女性のお１人様利用にも快適＆安心！ビジネスや観光旅行の拠点にもどうぞ。ツイン客室もご予約OK！,【アクセス】ＪＲ岐阜駅・名鉄岐阜駅よりバス・または車で5分/岐阜各務原ICから国道２１号線約10km（約20分）,エリア ： 岐阜県 > 岐阜・羽島,2016-03-28 02:37:20,2016-03-28 02:37:20,"￥7,222〜","（￥3,611〜/人）",,,,,,,,,,,,,,,,,,,,,,,,,,,,,,,,,,,,,,,,,,,,,,,,,,,,,,,,,,,,,,,,,,,,,,,,,,,,
952,ニュー岐阜ホテルプラザ,/yad365132/?stayCount=1&roomCount=1&adultNum=2&stayDay=&stayYear=&stayMonth=&dateUndecided=1&distCd=01&roomCrack=200000&screenId=UWW1402&yadNo=365132&callbackHistFlg=1,ＪＲ岐阜駅から徒歩５分、名鉄岐阜駅から徒歩２分、バスターミナル徒歩２分と便利な場所に位置しています,【アクセス】ＪＲ岐阜駅から徒歩５分　名鉄岐阜駅から徒歩２分,エリア ： 岐阜県 > 岐阜・羽島,2016-03-28 02:37:20,2016-03-28 02:37:20,"￥5,092〜","（￥2,546〜/人）",,,,,,,,,,,,,,,,,,,,,,,,,,,,,,,,,,,,,,,,,,,,,,,,,,,,,,,,,,,,,,,,,,,,,,,,,,,,
953,岐阜グリーンホテル,/yad369096/?stayCount=1&roomCount=1&adultNum=2&stayDay=&stayYear=&stayMonth=&dateUndecided=1&distCd=01&roomCrack=200000&screenId=UWW1402&yadNo=369096&callbackHistFlg=1,市内随一の繁華街柳ヶ瀬地区に位置する好立地。真心を込めたアットホームなサービスでお客様をおもてなし致します♪大型車駐車可　有無線ラン、個別空調、衛星放送、シャワートイレ、ランドリールーム,"【アクセス】ＪＲ岐阜駅より800m、名鉄新岐阜駅より900m,高島屋、柳ヶ瀬徒歩２分",エリア ： 岐阜県 > 岐阜・羽島,2016-03-28 02:37:20,2016-03-28 02:37:20,"￥6,388〜","（￥3,194〜/人）",,,,,,,,,,,,,,,,,,,,,,,,,,,,,,,,,,,,,,,,,,,,,,,,,,,,,,,,,,,,,,,,,,,,,,,,,,,,
954,岐阜ワシントンホテルプラザ,/yad369290/?stayCount=1&roomCount=1&adultNum=2&stayDay=&stayYear=&stayMonth=&dateUndecided=1&distCd=01&roomCrack=200000&screenId=UWW1402&yadNo=369290&callbackHistFlg=1,■WiFi接続無料■ＪＲ・名鉄及びお車とあらゆる交通手段に恵まれた立地■朝食は、種類豊富な和洋バイキング,【アクセス】ＪＲ岐阜駅徒歩７分、名鉄岐阜駅徒歩４分,エリア ： 岐阜県 > 岐阜・羽島,2016-03-28 02:37:20,2016-03-28 02:37:20,"￥5,962〜","（￥2,981〜/人）",,,,,,,,,,,,,,,,,,,,,,,,,,,,,,,,,,,,,,,,,,,,,,,,,,,,,,,,,,,,,,,,,,,,,,,,,,,,
955,旅館　楽遊,/yad370909/?stayCount=1&roomCount=1&adultNum=2&stayDay=&stayYear=&stayMonth=&dateUndecided=1&distCd=01&roomCrack=200000&screenId=UWW1402&yadNo=370909&callbackHistFlg=1,自慢の料理でおもてなし木目調大浴場、全室和室の昔ながらの純和風旅館です。大型車駐車場有り,【アクセス】東海北陸自動車道　各務原インターより車で約10分、名鉄各務原線　田神駅より徒歩約５分,エリア ： 岐阜県 > 岐阜・羽島,2016-03-28 02:37:20,2016-03-28 02:37:20,"￥12,592〜","（￥6,296〜/人）",,,,,,,,,,,,,,,,,,,,,,,,,,,,,,,,,,,,,,,,,,,,,,,,,,,,,,,,,,,,,,,,,,,,,,,,,,,,
956,ホテルルートイン岐阜羽島駅前,/yad374376/?stayCount=1&roomCount=1&adultNum=2&stayDay=&stayYear=&stayMonth=&dateUndecided=1&distCd=01&roomCrack=200000&screenId=UWW1402&yadNo=374376&callbackHistFlg=1,新幹線・岐阜羽島駅前という抜群の立地。名神高速・岐阜羽島ＩＣからも車で３分！朝のバイキング朝食が大人気！人工温泉大浴場で温泉気分♪館内お食事処にて岐阜名物メニューあり！駐車場も先着順にて無料♪,【アクセス】新幹線・岐阜羽島駅…歩1分　名鉄線・新羽島駅…歩2分　名神高速道・岐阜羽島IC→車3分,エリア ： 岐阜県 > 岐阜・羽島,2016-03-28 02:37:20,2016-03-28 02:37:20,"￥9,027〜","（￥4,513〜/人）",,,,,,,,,,,,,,,,,,,,,,,,,,,,,,,,,,,,,,,,,,,,,,,,,,,,,,,,,,,,,,,,,,,,,,,,,,,,
957,ホテルイルクレド岐阜,/yad375921/?stayCount=1&roomCount=1&adultNum=2&stayDay=&stayYear=&stayMonth=&dateUndecided=1&distCd=01&roomCrack=200000&screenId=UWW1402&yadNo=375921&callbackHistFlg=1,岐阜初、ILHotels誕生　空間を味わう演出でリラックスをお届けします。鉄道・バスターミナル近くの便利なホテル。ビジネス・観光の拠点として最適。女性ひとり旅も安心。,【アクセス】ＪＲ岐阜駅長良口・名鉄岐阜駅中央改札口から徒歩３分,エリア ： 岐阜県 > 岐阜・羽島,2016-03-28 02:37:20,2016-03-28 02:37:20,"￥5,555〜","（￥2,777〜/人）",,,,,,,,,,,,,,,,,,,,,,,,,,,,,,,,,,,,,,,,,,,,,,,,,,,,,,,,,,,,,,,,,,,,,,,,,,,,
958,料理旅館　植東,/yad376966/?stayCount=1&roomCount=1&adultNum=2&stayDay=&stayYear=&stayMonth=&dateUndecided=1&distCd=01&roomCrack=200000&screenId=UWW1402&yadNo=376966&callbackHistFlg=1,植東が位置するこの梅林公園は、北の長良川畔の桜とともに市民の憩いの場として多くの方々に利用されています。植東名物のとうふ田楽を始め、季節に応じた日本料理をご用意して皆様をお待ち致しております。,【アクセス】JR岐阜駅･名鉄岐阜駅よりタクシーで約８分／名鉄岐阜ターミナル発、岐阜バス「梅林公園前」下車徒歩５分,エリア ： 岐阜県 > 岐阜・羽島,2016-03-28 02:37:20,2016-03-28 02:37:20,"￥12,037〜","（￥6,018〜/人）",,,,,,,,,,,,,,,,,,,,,,,,,,,,,,,,,,,,,,,,,,,,,,,,,,,,,,,,,,,,,,,,,,,,,,,,,,,,
959,ビジネスホテル　スワロー,/yad381982/?stayCount=1&roomCount=1&adultNum=2&stayDay=&stayYear=&stayMonth=&dateUndecided=1&distCd=01&roomCrack=200000&screenId=UWW1402&yadNo=381982&callbackHistFlg=1,各務原市役所の東隣　交通の便がよい　インターネット無料接続可　清潔第一朝食が人気です☆,【アクセス】名鉄各務原線各務原市役所前駅より徒歩５分／東海北陸自動車道各務原ＩＣより５分,エリア ： 岐阜県 > 岐阜・羽島,2016-03-28 02:37:20,2016-03-28 02:37:20,"￥8,333〜","（￥4,166〜/人）",,,,,,,,,,,,,,,,,,,,,,,,,,,,,,,,,,,,,,,,,,,,,,,,,,,,,,,,,,,,,,,,,,,,,,,,,,,,
960,ウィークリー翔　羽島,/yad384148/?stayCount=1&roomCount=1&adultNum=2&stayDay=&stayYear=&stayMonth=&dateUndecided=1&distCd=01&roomCrack=200000&screenId=UWW1402&yadNo=384148&callbackHistFlg=1,新幹線岐阜羽島駅から徒歩3分。ウィークリー翔は一般的なホテルとは異なる体系の宿泊施設です。システムの合理化やアメニティの見直しなどで、経費削減などを行い「宿泊料をより安く」を追求しています,【アクセス】ＪＲ岐阜羽島駅南出口より徒歩3分、名鉄新羽島駅徒歩5分、名神高速道路岐阜羽島インターより車で５分,エリア ： 岐阜県 > 岐阜・羽島,2016-03-28 02:37:20,2016-03-28 02:37:20,"￥3,518〜",（￥-/室）,,,,,,,,,,,,,,,,,,,,,,,,,,,,,,,,,,,,,,,,,,,,,,,,,,,,,,,,,,,,,,,,,,,,,,,,,,,,
961,天然温泉　金華の湯　ドーミーイン岐阜駅前,/yad384888/?stayCount=1&roomCount=1&adultNum=2&stayDay=&stayYear=&stayMonth=&dateUndecided=1&distCd=01&roomCrack=200000&screenId=UWW1402&yadNo=384888&callbackHistFlg=1,◆ホテルスペック2012年10月◆当館では、布団：羽毛　枕：グッスリー（標準）その他、パイプ・低反発炭パイプ・ポリエステル綿・マルコビーンズ・ユートピアの5種類数量限定貸出用ご準備しております。,【アクセス】ＪＲ岐阜駅「中央北口」より徒歩約5分。歩行者デッキを左手方向へお進み下さい。名鉄岐阜駅より徒歩約7分！,エリア ： 岐阜県 > 岐阜・羽島,2016-03-28 02:37:20,2016-03-28 02:37:20,"￥8,000〜","（￥4,000〜/人）",,,,,,,,,,,,,,,,,,,,,,,,,,,,,,,,,,,,,,,,,,,,,,,,,,,,,,,,,,,,,,,,,,,,,,,,,,,,
962,サンホテル岐阜,/yad392236/?stayCount=1&roomCount=1&adultNum=2&stayDay=&stayYear=&stayMonth=&dateUndecided=1&distCd=01&roomCrack=200000&screenId=UWW1402&yadNo=392236&callbackHistFlg=1,朝食無料サービス♪　【６：３０〜９：３０】☆ご飯・味噌汁・パン・お飲み物のおかわり自由です☆,【アクセス】名鉄岐阜駅より徒歩1分、JR岐阜駅より徒歩3分、各務原ＩＣよりお車で約15分,エリア ： 岐阜県 > 岐阜・羽島,2016-03-28 02:37:20,2016-03-28 02:37:20,"￥7,777〜",（￥-/室）,,,,,,,,,,,,,,,,,,,,,,,,,,,,,,,,,,,,,,,,,,,,,,,,,,,,,,,,,,,,,,,,,,,,,,,,,,,,
963,長良川観光ホテル石金,/yad398837/?stayCount=1&roomCount=1&adultNum=2&stayDay=&stayYear=&stayMonth=&dateUndecided=1&distCd=01&roomCrack=200000&screenId=UWW1402&yadNo=398837&callbackHistFlg=1,清流長良川河畔に位置し、対岸の金華山の頂上に岐阜城、夏はかがり火ゆれる長良川鵜飼も望めます。伝統的な会席料理をお部屋食で味わい、新温泉棟で茶褐色の掛け流し温泉を満喫してください！,【アクセス】東海北陸自動車道、各務原ICより30分。JR岐阜駅よりタクシー、路線バスにて10〜15分。鵜飼屋バス停より1分,エリア ： 岐阜県 > 岐阜・羽島,2016-03-28 02:37:20,2016-03-28 02:37:20,"￥10,000〜","（￥5,000〜/人）",,,,,,,,,,,,,,,,,,,,,,,,,,,,,,,,,,,,,,,,,,,,,,,,,,,,,,,,,,,,,,,,,,,,,,,,,,,,
964,ＬＣＢひるがの高原,/yad305473/?stayCount=1&roomCount=1&adultNum=2&stayDay=&stayYear=&stayMonth=&dateUndecided=1&distCd=01&roomCrack=200000&screenId=UWW1402&yadNo=305473&callbackHistFlg=1,1棟貸切で別荘気分友達・夫婦・家族で自然を大満喫！近隣にはゴルフ場や温泉。自然体験できるエリアも♪,【アクセス】名神豊中ＩＣ〜一宮ＪＣより東海北陸自動車道〜高鷲ＩＣ〜国道156号線白川方面へ北上、約15分,エリア ： 岐阜県 > 郡上八幡・白鳥・高鷲・明宝,2016-03-28 02:37:20,2016-03-28 02:37:20,"￥18,000〜",（￥-/室）,,,,,,,,,,,,,,,,,,,,,,,,,,,,,,,,,,,,,,,,,,,,,,,,,,,,,,,,,,,,,,,,,,,,,,,,,,,,
965,大日荘,/yad306635/?stayCount=1&roomCount=1&adultNum=2&stayDay=&stayYear=&stayMonth=&dateUndecided=1&distCd=01&roomCrack=200000&screenId=UWW1402&yadNo=306635&callbackHistFlg=1,大日荘は低価格で皆様のご旅行をサポートします！当館ならではの昭和レトロワールド、摩訶不思議空間が旅をより一層楽しくさせてくれます。お食事は自家製野菜を中心としたものをご提供します。,【アクセス】東海北陸自動車道　高鷲インターより10分,エリア ： 岐阜県 > 郡上八幡・白鳥・高鷲・明宝,2016-03-28 02:37:20,2016-03-28 02:37:20,"￥7,000〜","（￥3,500〜/人）",,,,,,,,,,,,,,,,,,,,,,,,,,,,,,,,,,,,,,,,,,,,,,,,,,,,,,,,,,,,,,,,,,,,,,,,,,,,
966,みはらや旅館,/yad329028/?stayCount=1&roomCount=1&adultNum=2&stayDay=&stayYear=&stayMonth=&dateUndecided=1&distCd=01&roomCrack=200000&screenId=UWW1402&yadNo=329028&callbackHistFlg=1,郡上八幡の町の中心を流れる吉田川沿いにあり、客室は川のせせらぎを眺めながらくつろげる癒しの空間。旧庁舎記念館や新橋からもすぐなので、町並み巡りや観光にも便利。家族で営業している小さな宿です。,【アクセス】長良川鉄道郡上八幡駅より車で約10分岐阜バス郡上八幡、城下町プラザ下車徒歩3分,エリア ： 岐阜県 > 郡上八幡・白鳥・高鷲・明宝,2016-03-28 02:37:20,2016-03-28 02:37:20,"￥12,407〜","（￥6,203〜/人）",,,,,,,,,,,,,,,,,,,,,,,,,,,,,,,,,,,,,,,,,,,,,,,,,,,,,,,,,,,,,,,,,,,,,,,,,,,,
967,民宿 憩荘,/yad330935/?stayCount=1&roomCount=1&adultNum=2&stayDay=&stayYear=&stayMonth=&dateUndecided=1&distCd=01&roomCrack=200000&screenId=UWW1402&yadNo=330935&callbackHistFlg=1,春は山菜、夏は盆踊り・魚釣り・山登り、秋は紅葉・ゴルフ、冬はスキー・ボード。食事はお鍋もあります。,【アクセス】長良川鉄道「美濃白鳥駅」より徒歩で１０分、車で３分,エリア ： 岐阜県 > 郡上八幡・白鳥・高鷲・明宝,2016-03-28 02:37:20,2016-03-28 02:37:20,"￥12,037〜","（￥6,018〜/人）",,,,,,,,,,,,,,,,,,,,,,,,,,,,,,,,,,,,,,,,,,,,,,,,,,,,,,,,,,,,,,,,,,,,,,,,,,,,
968,民宿　もろはし,/yad337612/?stayCount=1&roomCount=1&adultNum=2&stayDay=&stayYear=&stayMonth=&dateUndecided=1&distCd=01&roomCrack=200000&screenId=UWW1402&yadNo=337612&callbackHistFlg=1,春は新緑、秋は紅葉、冬はスキーと自然をいっぱいに楽しめる。めいほうスキー場まで車約１０分、明宝温泉まで車約５分の街道沿いで酒屋も併設。６〜８人で貸切もＯＫ！グループでも気楽にくつろげる。,【アクセス】東海北陸道郡上八幡インター下車国道４７２号線高山方面へ車で３０分,エリア ： 岐阜県 > 郡上八幡・白鳥・高鷲・明宝,2016-03-28 02:37:20,2016-03-28 02:37:20,"￥9,259〜","（￥4,629〜/人）",,,,,,,,,,,,,,,,,,,,,,,,,,,,,,,,,,,,,,,,,,,,,,,,,,,,,,,,,,,,,,,,,,,,,,,,,,,,
969,Ｎ．Ｅ．Ｗほっとほっと湯の平温泉コテージ,/yad350330/?stayCount=1&roomCount=1&adultNum=2&stayDay=&stayYear=&stayMonth=&dateUndecided=1&distCd=01&roomCrack=200000&screenId=UWW1402&yadNo=350330&callbackHistFlg=1,高鷲ＩＣから約5分！夏は川遊びや釣り、冬はウィンタースポーツに便利な立地！自然の中でマイナスイオンを浴びて心がホッと。山の温泉に浸かって体もホッと。【ほっとほっと】とお寛ぎ下さい♪,【アクセス】東海北陸自動車道「高鷲IC」より国道156号方面へ約5分／長良川鉄道越美南線「北濃駅」下車、車で10分,エリア ： 岐阜県 > 郡上八幡・白鳥・高鷲・明宝,2016-03-28 02:37:20,2016-03-28 02:37:20,"￥12,037〜","（￥6,018〜/人）",,,,,,,,,,,,,,,,,,,,,,,,,,,,,,,,,,,,,,,,,,,,,,,,,,,,,,,,,,,,,,,,,,,,,,,,,,,,
970,貸し別荘Ｎ．Ａ．Ｏ,/yad351744/?stayCount=1&roomCount=1&adultNum=2&stayDay=&stayYear=&stayMonth=&dateUndecided=1&distCd=01&roomCrack=200000&screenId=UWW1402&yadNo=351744&callbackHistFlg=1,貸別荘ＮＡＯはログコテージ１棟まるごと貸切宿泊できます。コテージにはキッチン、トイレ、バス、布団付き。夏はＢＢＱデッキ完備！場所もひるがの高原まで１５分！冬は鷲ヶ岳スキー場まで５分！,【アクセス】名神高速道路一ノ宮JCTから、東海北陸自動車道　高鷲IC下車。やまびこロード方面へ約5分,エリア ： 岐阜県 > 郡上八幡・白鳥・高鷲・明宝,2016-03-28 02:37:20,2016-03-28 02:37:20,"￥27,222〜",（￥-/室）,,,,,,,,,,,,,,,,,,,,,,,,,,,,,,,,,,,,,,,,,,,,,,,,,,,,,,,,,,,,,,,,,,,,,,,,,,,,
971,農家ペンション　リトルパイン,/yad361920/?stayCount=1&roomCount=1&adultNum=2&stayDay=&stayYear=&stayMonth=&dateUndecided=1&distCd=01&roomCrack=200000&screenId=UWW1402&yadNo=361920&callbackHistFlg=1,野菜や奥美濃古地鶏、アマゴ、岩魚、虹鱒を育てており自家製食材や地のものを使った手作り料理が自慢。フライフィッシング専用池くろやでは通年釣りが楽しめる。,【アクセス】東海北陸自動車道　白鳥IC下車　一つ目の信号を右折。しらおスキー場方面へ車で10分,エリア ： 岐阜県 > 郡上八幡・白鳥・高鷲・明宝,2016-03-28 02:37:20,2016-03-28 02:37:20,"￥9,259〜","（￥4,629〜/人）",,,,,,,,,,,,,,,,,,,,,,,,,,,,,,,,,,,,,,,,,,,,,,,,,,,,,,,,,,,,,,,,,,,,,,,,,,,,
972,民宿　さとう,/yad373719/?stayCount=1&roomCount=1&adultNum=2&stayDay=&stayYear=&stayMonth=&dateUndecided=1&distCd=01&roomCrack=200000&screenId=UWW1402&yadNo=373719&callbackHistFlg=1,清流長良川沿いの　食堂を兼ねた民宿です。自家製鶏ちゃんが人気でお持ち帰りも出来ます。夏季の鮎釣り　白鳥踊り、冬季のスキー　スノーボード、お仕事などお気軽にご利用ください。,【アクセス】東海北陸自動車道白鳥ICより車で５分、長良川鉄道美濃白鳥駅より徒歩１０分。,エリア ： 岐阜県 > 郡上八幡・白鳥・高鷲・明宝,2016-03-28 02:37:20,2016-03-28 02:37:20,"￥7,407〜","（￥3,703〜/人）",,,,,,,,,,,,,,,,,,,,,,,,,,,,,,,,,,,,,,,,,,,,,,,,,,,,,,,,,,,,,,,,,,,,,,,,,,,,
973,いとしろ藤屋民宿旅館,/yad374170/?stayCount=1&roomCount=1&adultNum=2&stayDay=&stayYear=&stayMonth=&dateUndecided=1&distCd=01&roomCrack=200000&screenId=UWW1402&yadNo=374170&callbackHistFlg=1,夏は渓流釣り、冬はウインタースポーツ。四季それぞれの自然を満喫。ゆったりした時間をお楽しみ下さい。山菜料理も楽しめます。,【アクセス】東海北陸自動車道、白鳥ICより車で30分,エリア ： 岐阜県 > 郡上八幡・白鳥・高鷲・明宝,2016-03-28 02:37:20,2016-03-28 02:37:20,"￥11,481〜","（￥5,740〜/人）",,,,,,,,,,,,,,,,,,,,,,,,,,,,,,,,,,,,,,,,,,,,,,,,,,,,,,,,,,,,,,,,,,,,,,,,,,,,
974,カルヴィラいとしろ,/yad376597/?stayCount=1&roomCount=1&adultNum=2&stayDay=&stayYear=&stayMonth=&dateUndecided=1&distCd=01&roomCrack=200000&screenId=UWW1402&yadNo=376597&callbackHistFlg=1,ようこそ、いとしろ。白山信仰の山の里。深い歴史を語りたくなる。ここは自然のドラマもいっぱい！四季の自然を満喫できるオアシス、いとしろ。無線LAN完備でロビーでインターネットができます。,【アクセス】東海北陸自動車道白鳥Ｉ．Ｃよりウィングｽｷｰ場方面へ25分。,エリア ： 岐阜県 > 郡上八幡・白鳥・高鷲・明宝,2016-03-28 02:37:20,2016-03-28 02:37:20,"￥10,000〜","（￥5,000〜/人）",,,,,,,,,,,,,,,,,,,,,,,,,,,,,,,,,,,,,,,,,,,,,,,,,,,,,,,,,,,,,,,,,,,,,,,,,,,,
