id,building_name,image_url,detail,access,address,created_at,updated_at,fee1,fee2,,,,,,,,,,,,,,,,,,,,,,,,,,,,,,,,,,,,,,,,,,,,,,,,,,,,,,,,,,,,,,,,,,,,,,,,,,,,
9086,ホテルクラウンパレス神戸（HMIホテルグループ）,/yad308959/?stayCount=1&roomCount=1&adultNum=2&stayDay=&stayYear=&stayMonth=&dateUndecided=1&distCd=01&roomCrack=200000&screenId=UWW1402&yadNo=308959&callbackHistFlg=1,ＪＲ神戸駅前の立地の良さはもちろん、神戸ハーバーランドの玄関口としてホテル内のスペースシアターから港まで様々な観光施設が続いています。みなと神戸を象徴するメリケンパークにも近く絶好の観光拠点,【アクセス】ＪＲ「神戸」駅より徒歩2分(駅直結),エリア ： 兵庫県 > ハーバーランド・神戸・新開地,2016-03-27 10:23:56,2016-03-27 10:23:56,"￥7,222〜","（￥3,611〜/人）",,,,,,,,,,,,,,,,,,,,,,,,,,,,,,,,,,,,,,,,,,,,,,,,,,,,,,,,,,,,,,,,,,,,,,,,,,,,
9087,神戸ハーバーランド温泉　万葉倶楽部,/yad340810/?stayCount=1&roomCount=1&adultNum=2&stayDay=&stayYear=&stayMonth=&dateUndecided=1&distCd=01&roomCrack=200000&screenId=UWW1402&yadNo=340810&callbackHistFlg=1,日常の喧騒を忘れ、心と身体をときほぐす＜上質な寛ぎ＞をご用意。JR神戸駅より地下街直結の徒歩5分。ようこそ…ここは都会の中の温泉郷。,【アクセス】JR神戸駅より徒歩5分／地下鉄海岸線ハーバーランド駅より徒歩3分,エリア ： 兵庫県 > ハーバーランド・神戸・新開地,2016-03-27 10:23:56,2016-03-27 10:23:56,"￥15,000〜",（￥-/室）,,,,,,,,,,,,,,,,,,,,,,,,,,,,,,,,,,,,,,,,,,,,,,,,,,,,,,,,,,,,,,,,,,,,,,,,,,,,
9088,ビジネスホテルてつや,/yad307885/?stayCount=1&roomCount=1&adultNum=2&stayDay=&stayYear=&stayMonth=&dateUndecided=1&distCd=01&roomCrack=200000&screenId=UWW1402&yadNo=307885&callbackHistFlg=1,JR和田山駅から徒歩３分。和田山インターから車で北へ１０分。市役所や県和田山庁舎は当館のすぐ裏。当館周辺には飲食店が点在し、飲み会にも便利です。また、今人気の竹田城跡観光の拠点にご利用ください。,【アクセス】JR和田山駅から駅前通りを東に１５０ｍ。,エリア ： 兵庫県 > ハチ高原・養父・和田山,2016-03-27 10:23:57,2016-03-27 10:23:57,"￥7,037〜","（￥3,518〜/人）",,,,,,,,,,,,,,,,,,,,,,,,,,,,,,,,,,,,,,,,,,,,,,,,,,,,,,,,,,,,,,,,,,,,,,,,,,,,
9089,旅館　古城,/yad321051/?stayCount=1&roomCount=1&adultNum=2&stayDay=&stayYear=&stayMonth=&dateUndecided=1&distCd=01&roomCrack=200000&screenId=UWW1402&yadNo=321051&callbackHistFlg=1,ほんのり口福、しっとり幸福。くつろぎの空間で、季節の旬の食材をふんだんにあしらった当館自慢の料理をお召し上がり下さい！中でも冬場のカニ料理は、特におすすめです！　昼食プランもやってます！！,【アクセス】北近畿豊岡道養父ＩＣから約5分。　ＪＲ八鹿駅から車で約10分。,エリア ： 兵庫県 > ハチ高原・養父・和田山,2016-03-27 10:23:57,2016-03-27 10:23:57,"￥15,000〜","（￥7,500〜/人）",,,,,,,,,,,,,,,,,,,,,,,,,,,,,,,,,,,,,,,,,,,,,,,,,,,,,,,,,,,,,,,,,,,,,,,,,,,,
9090,Hotel IKUE,/yad328320/?stayCount=1&roomCount=1&adultNum=2&stayDay=&stayYear=&stayMonth=&dateUndecided=1&distCd=01&roomCrack=200000&screenId=UWW1402&yadNo=328320&callbackHistFlg=1,■3月後半！ビジネスマン必見！シングルが￥5380！◆【4月】早期予約で￥4300〜！3/31まで！■春の竹田城はいかがですか？5/7まで延長！入山料無料プランはGWの旅行にも◎,【アクセス】中国自動車道（福崎I.C）から播但連絡道路を経て312号線で和田山へ。和田山より9号線を西へ。,エリア ： 兵庫県 > ハチ高原・養父・和田山,2016-03-27 10:23:57,2016-03-27 10:23:57,"￥7,392〜","（￥3,696〜/人）",,,,,,,,,,,,,,,,,,,,,,,,,,,,,,,,,,,,,,,,,,,,,,,,,,,,,,,,,,,,,,,,,,,,,,,,,,,,
9091,翠山荘,/yad341616/?stayCount=1&roomCount=1&adultNum=2&stayDay=&stayYear=&stayMonth=&dateUndecided=1&distCd=01&roomCrack=200000&screenId=UWW1402&yadNo=341616&callbackHistFlg=1,東ハチ伏高原の豊かな自然の中にあるロッジ。森林浴やハイキングなどアウトドアも楽しめる。農作業で大地とふれあったり♪心に残る発見と感動を体験しよう！！,【アクセス】和田山ＩＣから９号線を鳥取方面へ。関宮からハチ高原方面へ,エリア ： 兵庫県 > ハチ高原・養父・和田山,2016-03-27 10:23:57,2016-03-27 10:23:57,"￥8,000〜","（￥4,000〜/人）",,,,,,,,,,,,,,,,,,,,,,,,,,,,,,,,,,,,,,,,,,,,,,,,,,,,,,,,,,,,,,,,,,,,,,,,,,,,
9092,いずみ旅館,/yad346952/?stayCount=1&roomCount=1&adultNum=2&stayDay=&stayYear=&stayMonth=&dateUndecided=1&distCd=01&roomCrack=200000&screenId=UWW1402&yadNo=346952&callbackHistFlg=1,ビジネスに、長期滞在に、ご宴会、ご休憩に、安くてボリューム満点のお食事でお待ちしております又みんなでワイワイとくつろげるバストイレ付１８畳の和室で竹田城見学、ゴルフ、スキーはいかがですか,【アクセス】大阪から北近畿舞鶴道で１２０分、姫路から播但道で４５分、JR和田山駅より徒歩３分,エリア ： 兵庫県 > ハチ高原・養父・和田山,2016-03-27 10:23:57,2016-03-27 10:23:57,"￥8,425〜","（￥4,212〜/人）",,,,,,,,,,,,,,,,,,,,,,,,,,,,,,,,,,,,,,,,,,,,,,,,,,,,,,,,,,,,,,,,,,,,,,,,,,,,
9093,播磨ふれあいの家,/yad351450/?stayCount=1&roomCount=1&adultNum=2&stayDay=&stayYear=&stayMonth=&dateUndecided=1&distCd=01&roomCrack=200000&screenId=UWW1402&yadNo=351450&callbackHistFlg=1,兵庫県朝来市「あさご芸術の森」にある、豊かな自然に囲まれた公共の宿です。小鳥のさえずりや木々の木漏れ日、満点の星空が優しく癒してくれます。姫路城や竹田城などの人気スポットへもアクセス良好★,【アクセス】播但連絡道朝来ICより約１５分。多々良木信号右折し、あさご芸術の森美術館手前,エリア ： 兵庫県 > ハチ高原・養父・和田山,2016-03-27 10:23:57,2016-03-27 10:23:57,"￥9,722〜","（￥4,861〜/人）",,,,,,,,,,,,,,,,,,,,,,,,,,,,,,,,,,,,,,,,,,,,,,,,,,,,,,,,,,,,,,,,,,,,,,,,,,,,
9094,やぶ温泉　但馬楽座,/yad383570/?stayCount=1&roomCount=1&adultNum=2&stayDay=&stayYear=&stayMonth=&dateUndecided=1&distCd=01&roomCrack=200000&screenId=UWW1402&yadNo=383570&callbackHistFlg=1,但馬エリアの観光やビジネスの拠点に♪八鹿氷ノ山ICでアクセス楽々！★源泉100％の天然温泉！湯触りツルンッの美人の湯として好評です。★但馬牛の本場！冬のカニ！但馬のうまいもんが食べられます♪,【アクセス】JR山陰本線・八鹿駅下車、タクシーで10分,エリア ： 兵庫県 > ハチ高原・養父・和田山,2016-03-27 10:23:57,2016-03-27 10:23:57,"￥9,907〜","（￥4,953〜/人）",,,,,,,,,,,,,,,,,,,,,,,,,,,,,,,,,,,,,,,,,,,,,,,,,,,,,,,,,,,,,,,,,,,,,,,,,,,,
9095,ホテルサンルート和田山,/yad387920/?stayCount=1&roomCount=1&adultNum=2&stayDay=&stayYear=&stayMonth=&dateUndecided=1&distCd=01&roomCrack=200000&screenId=UWW1402&yadNo=387920&callbackHistFlg=1,播但道・北近畿豊岡道の和田山インターから車で５分。清潔感・ゆとりあるベッドが好評でリピータも多い。全室ＬＡＮ接続無料・お食事は最上階スカイレストラン虎屋にて姉妹施設の天然温泉まで徒歩５分,【アクセス】ＪＲ和田山駅から車で５分、和田山ＩＣから車で５分。竹田城跡車で１５分、ジュピターホール徒歩５分。,エリア ： 兵庫県 > ハチ高原・養父・和田山,2016-03-27 10:23:57,2016-03-27 10:23:57,"￥6,944〜","（￥3,472〜/人）",,,,,,,,,,,,,,,,,,,,,,,,,,,,,,,,,,,,,,,,,,,,,,,,,,,,,,,,,,,,,,,,,,,,,,,,,,,,
9096,ハチ北温泉　お宿　ひさ家,/yad317086/?stayCount=1&roomCount=1&adultNum=2&stayDay=&stayYear=&stayMonth=&dateUndecided=1&distCd=01&roomCrack=200000&screenId=UWW1402&yadNo=317086&callbackHistFlg=1,スキーシーズンは、ハチ北スキー場リフト乗り場の目の前でとても便利です。ハチ北で唯一の天然温泉露天風呂から眺める景色と風情は心癒されます。また、自慢の松葉ガニと但馬牛のお料理が大好評です。,【アクセス】北近畿道・播但道、和田山I.ＣからＲ９経由し、道の駅ハチ北左折約5ｋｍ。平成24年11月八鹿氷ノ山IC延長,エリア ： 兵庫県 > ハチ北高原・おじろ,2016-03-27 10:23:57,2016-03-27 10:23:57,"￥10,000〜","（￥5,000〜/人）",,,,,,,,,,,,,,,,,,,,,,,,,,,,,,,,,,,,,,,,,,,,,,,,,,,,,,,,,,,,,,,,,,,,,,,,,,,,
9097,オーベルジュ花郷里,/yad384756/?stayCount=1&roomCount=1&adultNum=2&stayDay=&stayYear=&stayMonth=&dateUndecided=1&distCd=01&roomCrack=200000&screenId=UWW1402&yadNo=384756&callbackHistFlg=1,敷地内外の農園で育てている有機野菜、天下に名高い良質の但馬牛、できるだけ農薬を使用せずに作るお米。そんな徹底した拘りを召し上がれ。【オーベルジュ花郷里】はお客様に至福のひと時をご提供致します。,【アクセス】JR八鹿駅から全但路線バス60分、梅田or三宮から全但高速バス又はお車が便利です。,エリア ： 兵庫県 > ハチ北高原・おじろ,2016-03-27 10:23:57,2016-03-27 10:23:57,"￥18,148〜","（￥9,074〜/人）",,,,,,,,,,,,,,,,,,,,,,,,,,,,,,,,,,,,,,,,,,,,,,,,,,,,,,,,,,,,,,,,,,,,,,,,,,,,
9098,神戸元町東急REIホテル（旧 ホテル東急ビズフォート 神戸元町）,/yad300728/?stayCount=1&roomCount=1&adultNum=2&stayDay=&stayYear=&stayMonth=&dateUndecided=1&distCd=01&roomCrack=200000&screenId=UWW1402&yadNo=300728&callbackHistFlg=1,神戸中華街に隣接し、スタイリッシュな空間でのこだわりの寛ぎをお約束。観光はもちろん、旧居留地の玄関口としてショッピングにも最適！キャリア女性の定宿としても大人気！,【アクセス】ＪＲ/阪神元町駅から徒歩３分、地下鉄海岸線「旧居留地・大丸前駅」,エリア ： 兵庫県 > 元町・メリケンパーク,2016-03-27 10:23:56,2016-03-27 10:23:56,"￥6,574〜","（￥3,287〜/人）",,,,,,,,,,,,,,,,,,,,,,,,,,,,,,,,,,,,,,,,,,,,,,,,,,,,,,,,,,,,,,,,,,,,,,,,,,,,
9099,神戸メリケンパークオリエンタルホテル,/yad302008/?stayCount=1&roomCount=1&adultNum=2&stayDay=&stayYear=&stayMonth=&dateUndecided=1&distCd=01&roomCrack=200000&screenId=UWW1402&yadNo=302008&callbackHistFlg=1,目の前に広がる海と空の眺望を楽しむ全室バルコニー付きのリゾートホテルです。神戸らしい上質なホスピタリティでリフレッシュを。何度でも立ち寄りたくなる時間がここにあります。,【アクセス】ホテル、JR三ノ宮間のシャトルバス毎日運行。新快速で大阪まで約20分、姫路まで約40分と観光アクセス良,エリア ： 兵庫県 > 元町・メリケンパーク,2016-03-27 10:23:56,2016-03-27 10:23:56,"￥10,833〜","（￥5,416〜/人）",,,,,,,,,,,,,,,,,,,,,,,,,,,,,,,,,,,,,,,,,,,,,,,,,,,,,,,,,,,,,,,,,,,,,,,,,,,,
9100,神戸ポートタワーホテル なごみの湯宿,/yad303498/?stayCount=1&roomCount=1&adultNum=2&stayDay=&stayYear=&stayMonth=&dateUndecided=1&distCd=01&roomCrack=200000&screenId=UWW1402&yadNo=303498&callbackHistFlg=1,魅力あふれる街「神戸」を存分に楽しめる観光スポット。心地よい海風を感じる事ができるホテルです。夜景を楽しみながらお食事ができるレストラン、温泉・サウナ・岩盤浴などリフレッシュ施設もあります。,【アクセス】JR・阪神「元町駅」徒歩8分、地下鉄海岸線「みなと元町駅」徒歩4分。JR三ノ宮から無料送迎シャトル便も運行,エリア ： 兵庫県 > 元町・メリケンパーク,2016-03-27 10:23:56,2016-03-27 10:23:56,"￥5,555〜","（￥2,777〜/人）",,,,,,,,,,,,,,,,,,,,,,,,,,,,,,,,,,,,,,,,,,,,,,,,,,,,,,,,,,,,,,,,,,,,,,,,,,,,
9101,神戸みなと温泉　蓮,/yad308671/?stayCount=1&roomCount=1&adultNum=2&stayDay=&stayYear=&stayMonth=&dateUndecided=1&distCd=01&roomCrack=200000&screenId=UWW1402&yadNo=308671&callbackHistFlg=1,270度海に囲まれた天然温泉旅館。全室50,,エリア ： 兵庫県 > 元町・メリケンパーク,2016-03-27 10:23:56,2016-03-27 10:23:56,"￥37,018〜","（￥18,509〜/人）",,,,,,,,,,,,,,,,,,,,,,,,,,,,,,,,,,,,,,,,,,,,,,,,,,,,,,,,,,,,,,,,,,,,,,,,,,,,
9102,ホテルオークラ神戸,/yad319763/?stayCount=1&roomCount=1&adultNum=2&stayDay=&stayYear=&stayMonth=&dateUndecided=1&distCd=01&roomCrack=200000&screenId=UWW1402&yadNo=319763&callbackHistFlg=1,レストラン、ヘルスクラブ、エステなど充実の設備と洗練されたホスピタリティ。館内は日本の伝統美に機能性を融合したハイグレードな空間。方角ごとにさまざまな魅力を見せる神戸の夜景とともに優雅な時を。,【アクセス】JR・阪神元町駅より徒歩10分、JR三ノ宮駅、阪急・阪神三宮駅よりタクシーで7分,エリア ： 兵庫県 > 元町・メリケンパーク,2016-03-27 10:23:56,2016-03-27 10:23:56,"￥10,185〜","（￥5,092〜/人）",,,,,,,,,,,,,,,,,,,,,,,,,,,,,,,,,,,,,,,,,,,,,,,,,,,,,,,,,,,,,,,,,,,,,,,,,,,,
9103,スマイルホテル神戸元町,/yad353544/?stayCount=1&roomCount=1&adultNum=2&stayDay=&stayYear=&stayMonth=&dateUndecided=1&distCd=01&roomCrack=200000&screenId=UWW1402&yadNo=353544&callbackHistFlg=1,JR・阪神元町駅西口より南へ徒歩2分の好立地。お洒落な旧居留地やメリケンパークは徒歩圏内（徒歩約10分）、コンビニも目の前なので、とても便利！！ビジネスや観光など幅広くご利用いただけます。,【アクセス】阪神元町駅から徒歩１分、ＪＲ元町駅「西改札口」から南へ徒歩２分です。,エリア ： 兵庫県 > 元町・メリケンパーク,2016-03-27 10:23:56,2016-03-27 10:23:56,"￥4,814〜","（￥2,407〜/人）",,,,,,,,,,,,,,,,,,,,,,,,,,,,,,,,,,,,,,,,,,,,,,,,,,,,,,,,,,,,,,,,,,,,,,,,,,,,
9104,料亭旅館　豊福,/yad359134/?stayCount=1&roomCount=1&adultNum=2&stayDay=&stayYear=&stayMonth=&dateUndecided=1&distCd=01&roomCrack=200000&screenId=UWW1402&yadNo=359134&callbackHistFlg=1,日本料理・寿司・鍋など、中央市場から仕入れた旬の新鮮素材をお客様のニーズに合わせご提供。素材の持味を生かし、繊細な包丁さばきで仕上げる。宴会（2〜50人）を予約された方には完全個室をご用意！,【アクセス】神戸高速鉄道（阪急）花隈駅より徒歩5分、元町駅より徒歩約10分,エリア ： 兵庫県 > 元町・メリケンパーク,2016-03-27 10:23:56,2016-03-27 10:23:56,"￥11,481〜","（￥5,740〜/人）",,,,,,,,,,,,,,,,,,,,,,,,,,,,,,,,,,,,,,,,,,,,,,,,,,,,,,,,,,,,,,,,,,,,,,,,,,,,
9105,静かな山間にたたずむ味わいの宿　よしはる荘,/yad310910/?stayCount=1&roomCount=1&adultNum=2&stayDay=&stayYear=&stayMonth=&dateUndecided=1&distCd=01&roomCrack=200000&screenId=UWW1402&yadNo=310910&callbackHistFlg=1,松葉ガニ食べおさめ！お得なプラン予約受付中です！香住ガニや当館人気の花籠ご膳など他にも様々な旬の新鮮な食材を愉しんで頂けます♪心をこめて、お迎え致します。どうぞ、よしはる荘へお越しください☆彡,【アクセス】山陰本線香住駅,エリア ： 兵庫県 > 香住,2016-03-27 10:23:56,2016-03-27 10:23:56,"￥7,000〜","（￥3,500〜/人）",,,,,,,,,,,,,,,,,,,,,,,,,,,,,,,,,,,,,,,,,,,,,,,,,,,,,,,,,,,,,,,,,,,,,,,,,,,,
9106,香住　カニといろりの宿　はまな,/yad315925/?stayCount=1&roomCount=1&adultNum=2&stayDay=&stayYear=&stayMonth=&dateUndecided=1&distCd=01&roomCrack=200000&screenId=UWW1402&yadNo=315925&callbackHistFlg=1,ズバリ・料理が自慢！『ボリューム・質・鮮度』にこだわるご主人！「お客さんの喜ぶ顔が見たいから」と現役漁師ならではの『豪快海鮮囲炉裏焼き』は大満足間違いなし！,【アクセス】車のお越しの際は、大阪から約３時間、京都、神戸から約２時間半！,エリア ： 兵庫県 > 香住,2016-03-27 10:23:56,2016-03-27 10:23:56,"￥22,000〜","（￥11,000〜/人）",,,,,,,,,,,,,,,,,,,,,,,,,,,,,,,,,,,,,,,,,,,,,,,,,,,,,,,,,,,,,,,,,,,,,,,,,,,,
9107,香住　いろりのある宿　旭屋,/yad319459/?stayCount=1&roomCount=1&adultNum=2&stayDay=&stayYear=&stayMonth=&dateUndecided=1&distCd=01&roomCrack=200000&screenId=UWW1402&yadNo=319459&callbackHistFlg=1,仲買人より直接仕入れる、厳選された新鮮魚介のお料理が、お手頃価格でたっぷり味わえる柴山港近くの良心宿。先着3組様は囲炉裏の個室でゆったりと香住蟹を堪能して頂けます。家族で入れる貸切風呂も人気,【アクセス】舞鶴若狭自動車道・春日ＩＣ〜北近畿豊岡自動車道・和田山ＩＣより８０分【山陰本線】ＪＲ柴山駅徒歩５分,エリア ： 兵庫県 > 香住,2016-03-27 10:23:56,2016-03-27 10:23:56,"￥20,370〜","（￥10,185〜/人）",,,,,,,,,,,,,,,,,,,,,,,,,,,,,,,,,,,,,,,,,,,,,,,,,,,,,,,,,,,,,,,,,,,,,,,,,,,,
9108,香住　網元かにの宿　やまや　,/yad319473/?stayCount=1&roomCount=1&adultNum=2&stayDay=&stayYear=&stayMonth=&dateUndecided=1&distCd=01&roomCrack=200000&screenId=UWW1402&yadNo=319473&callbackHistFlg=1,カニの町香住ならではの迫力あるカニ料理が自慢。松葉ガニだけではなく、直営船でとった香住ガニも網元ならではのボリューム・お値打ち価格にびっくり！ふるさとに訪れるつもりでゆっくり寛ぎたい海辺の宿。,【アクセス】播但連絡道・和田山ICから国道９号線で香住方面へ。香住駅より車で５分。,エリア ： 兵庫県 > 香住,2016-03-27 10:23:56,2016-03-27 10:23:56,"￥18,000〜","（￥9,000〜/人）",,,,,,,,,,,,,,,,,,,,,,,,,,,,,,,,,,,,,,,,,,,,,,,,,,,,,,,,,,,,,,,,,,,,,,,,,,,,
9109,香住　民宿みはら,/yad328969/?stayCount=1&roomCount=1&adultNum=2&stayDay=&stayYear=&stayMonth=&dateUndecided=1&distCd=01&roomCrack=200000&screenId=UWW1402&yadNo=328969&callbackHistFlg=1,夏は海水浴。冬は松葉かに。新鮮な海の幸・山の幸で気分ものんびりと。但馬牛・鮑などの別メニューもご用意しております。,【アクセス】播但自動車道和田山ICより90分（豊岡経由R178号線で佐津へ）。JR佐津駅より徒歩8分（送迎要予約）,エリア ： 兵庫県 > 香住,2016-03-27 10:23:56,2016-03-27 10:23:56,"￥8,000〜","（￥4,000〜/人）",,,,,,,,,,,,,,,,,,,,,,,,,,,,,,,,,,,,,,,,,,,,,,,,,,,,,,,,,,,,,,,,,,,,,,,,,,,,
9110,香住　柴山温泉　かめや,/yad330699/?stayCount=1&roomCount=1&adultNum=2&stayDay=&stayYear=&stayMonth=&dateUndecided=1&distCd=01&roomCrack=200000&screenId=UWW1402&yadNo=330699&callbackHistFlg=1,日本海・柴山ならではのカニや豊富な魚介類をよく吟味し気前よく食べさせてくれる、女将の身体に優しい手づくり料理の宿。良心的価格はご主人の人柄かな。　気取らず、ゆっくりのんびり過ごしたいお奨め宿。,【アクセス】京都や大阪からは車やJRで約3時間。　カニの本場、日本海は香住・柴山港が目の前の宿。駅までの送迎有り。,エリア ： 兵庫県 > 香住,2016-03-27 10:23:56,2016-03-27 10:23:56,"￥16,000〜","（￥8,000〜/人）",,,,,,,,,,,,,,,,,,,,,,,,,,,,,,,,,,,,,,,,,,,,,,,,,,,,,,,,,,,,,,,,,,,,,,,,,,,,
9111,香住　こころのお宿　庵月（あんづき）,/yad363708/?stayCount=1&roomCount=1&adultNum=2&stayDay=&stayYear=&stayMonth=&dateUndecided=1&distCd=01&roomCrack=200000&screenId=UWW1402&yadNo=363708&callbackHistFlg=1,それぞれに工夫を凝らした離れのお部屋は上質な趣きが漂い、心休まる空間と静かな時間がゆっくりと流れています。香住の海と山が育んだ旬の幸を堪能し心癒されるあたたかいおもてなしの宿,【アクセス】JR香住駅下車、車５分（送迎有）。播但自動車道和田山ＩＣから９０分。,エリア ： 兵庫県 > 香住,2016-03-27 10:23:56,2016-03-27 10:23:56,"￥30,000〜","（￥15,000〜/人）",,,,,,,,,,,,,,,,,,,,,,,,,,,,,,,,,,,,,,,,,,,,,,,,,,,,,,,,,,,,,,,,,,,,,,,,,,,,
9112,つね乃家,/yad378402/?stayCount=1&roomCount=1&adultNum=2&stayDay=&stayYear=&stayMonth=&dateUndecided=1&distCd=01&roomCrack=200000&screenId=UWW1402&yadNo=378402&callbackHistFlg=1,目の前に広がる日本海は美食の宝庫。夏は人気ののどぐろや牡蠣、さざえなどの旬の地魚、冬の目玉は何と言ってもセリで直接仕入れる松葉ガニ！さわやかな磯の香りを感じながら、旬の磯料理をご堪能ください。,【アクセス】JR香住駅より徒歩2分／播但連絡道路・和田山ICより国道312号線で豊岡経由、　国道178号線をご利用ください,エリア ： 兵庫県 > 香住,2016-03-27 10:23:56,2016-03-27 10:23:56,"￥7,962〜","（￥3,981〜/人）",,,,,,,,,,,,,,,,,,,,,,,,,,,,,,,,,,,,,,,,,,,,,,,,,,,,,,,,,,,,,,,,,,,,,,,,,,,,
9113,香住　貝殻荘（かいがらそう）,/yad381180/?stayCount=1&roomCount=1&adultNum=2&stayDay=&stayYear=&stayMonth=&dateUndecided=1&distCd=01&roomCrack=200000&screenId=UWW1402&yadNo=381180&callbackHistFlg=1,夏は海水浴で賑わい日本海が季節ごとに違った表情を見せ、漁火が旅情を誘う。海辺の宿ならではの近海で捕れた蟹や魚介を生かした料理を堪能◎　お米や野菜は自家栽培で旬野菜は体に優しい無農薬！,【アクセス】JR佐津駅より徒歩12分l（送迎要予約）,エリア ： 兵庫県 > 香住,2016-03-27 10:23:56,2016-03-27 10:23:56,"￥28,703〜","（￥14,351〜/人）",,,,,,,,,,,,,,,,,,,,,,,,,,,,,,,,,,,,,,,,,,,,,,,,,,,,,,,,,,,,,,,,,,,,,,,,,,,,
9114,民宿　つかさ,/yad304744/?stayCount=1&roomCount=1&adultNum=2&stayDay=&stayYear=&stayMonth=&dateUndecided=1&distCd=01&roomCrack=200000&screenId=UWW1402&yadNo=304744&callbackHistFlg=1,風情にふれ、人情にふれる。心あたたまる香住の民宿つかさ。心ゆくまでゆったり山陰旅情をご堪能下さい。地産地消をモットーに自家栽培野菜や港から直接仕入れる新鮮な海の幸の安心で美味しいお料理が自慢！,【アクセス】ＪＲ香住駅下車徒歩１５分。送迎あり。,エリア ： 兵庫県 > 香住,2016-03-27 10:23:56,2016-03-27 10:23:56,"￥8,796〜","（￥4,398〜/人）",,,,,,,,,,,,,,,,,,,,,,,,,,,,,,,,,,,,,,,,,,,,,,,,,,,,,,,,,,,,,,,,,,,,,,,,,,,,
9115,香住　大野屋,/yad307543/?stayCount=1&roomCount=1&adultNum=2&stayDay=&stayYear=&stayMonth=&dateUndecided=1&distCd=01&roomCrack=200000&screenId=UWW1402&yadNo=307543&callbackHistFlg=1,【かにシーズンのみ営業のカニにこだわる宿】目の前の柴山漁港で揚がる新鮮な素材を厳選し、素朴な味付けで素材の良さを味わって頂きます。天然温泉にのんびりと体を沈め旅の疲れを癒してください。,【アクセス】舞鶴若狭自動車道・春日ＩＣ〜北近畿豊岡自動車道・和田山ＩＣより８０分【山陰本線】ＪＲ柴山駅徒歩３分,エリア ： 兵庫県 > 香住,2016-03-27 10:23:56,2016-03-27 10:23:56,"￥23,148〜","（￥11,574〜/人）",,,,,,,,,,,,,,,,,,,,,,,,,,,,,,,,,,,,,,,,,,,,,,,,,,,,,,,,,,,,,,,,,,,,,,,,,,,,
9116,香住　臨海荘,/yad309684/?stayCount=1&roomCount=1&adultNum=2&stayDay=&stayYear=&stayMonth=&dateUndecided=1&distCd=01&roomCrack=200000&screenId=UWW1402&yadNo=309684&callbackHistFlg=1,　山陰本線国立公園に位置し、今子浦の高台に建っている宿。敷地からは、日本海に沈みゆく夕日や、イカ漁の時期には漁火を見ることができる。今子浦近辺は有数のダイビングスポットでもある。,【アクセス】JR香住駅から車で８分,エリア ： 兵庫県 > 香住,2016-03-27 10:23:56,2016-03-27 10:23:56,"￥9,259〜","（￥4,629〜/人）",,,,,,,,,,,,,,,,,,,,,,,,,,,,,,,,,,,,,,,,,,,,,,,,,,,,,,,,,,,,,,,,,,,,,,,,,,,,
9117,香住の旬を味わう宿　たきもと,/yad310197/?stayCount=1&roomCount=1&adultNum=2&stayDay=&stayYear=&stayMonth=&dateUndecided=1&distCd=01&roomCrack=200000&screenId=UWW1402&yadNo=310197&callbackHistFlg=1,心を穏やかにしてくれる美しい佐津海岸が目の前に広がる、女将が一人で営む温もりの宿。冬の豪快なカニ料理をはじめ、一年を通して香住で揚がる新鮮な海の幸料理をたっぷり満喫できます！,【アクセス】ＪＲ山陰本線　佐津駅より徒歩１０分,エリア ： 兵庫県 > 香住,2016-03-27 10:23:56,2016-03-27 10:23:56,"￥18,148〜","（￥9,074〜/人）",,,,,,,,,,,,,,,,,,,,,,,,,,,,,,,,,,,,,,,,,,,,,,,,,,,,,,,,,,,,,,,,,,,,,,,,,,,,
